linea,tipo,razon,texto_original,porcentaje_automatico,detalles_base,detalles_avanzados,texto_catalan,texto_chino
87957903,eliminacion_catalan,caracteres_problematicos: {'/'},69.- Alguns dels problemes amb què es troben les dones que han contret matrimoni mixt s'han resolt m...,,,,,
88028777,eliminacion_catalan,caracteres_problematicos: {'/'},"En la seva decisió 2009/250, de 30 de juliol de 2009, el Consell Econòmic i Social, prenent nota de ...",,,,,
88034657,eliminacion_catalan,caracteres_problematicos: {'·'},"3. Destaca la importància d'establir i mantenir sistemes de justícia penal imparcials i eficaces, co...",,,,,
88051286,eliminacion_catalan,caracteres_problematicos: {'·'},:: Projecte executat en col·laboració amb el Programa Mundial d'Aliments (PMA) per millorar la nutri...,,,,,
88113589,eliminacion_catalan,"caracteres_problematicos: {']', '['}","b) Cap funcionari podrà estar associat activament, de manera directa o indirecta, amb la gestió d'un...",,,,,
88122027,eliminacion_catalan,"caracteres_problematicos: {']', '[', '–', '/'}",A/66/224 Temes 134 i 143 del programa provisional – Projecte de pressupost per programes per al bien...,,,,,
88124631,eliminacion_catalan,"caracteres_problematicos: {']', '[', '/'}",Cooperació internacional per a la utilització de l'espai ultraterrestre amb finalitats pacífiques (A...,,,,,
88160966,eliminacion_catalan,caracteres_problematicos: {'·'},L'Observador Permanent de la Unió Africana davant les Nacions Unides va sol·licitar suport polític i...,,,,,
88181185,eliminacion_catalan,caracteres_problematicos: {'·'},"Contràriament a les resolucions pertinents de la Junta de Governadors i del Consell de Seguretat, l'...",,,,,
88230536,eliminacion_catalan,"caracteres_problematicos: {'°', '/'}","En 2010, el Consell d'Administració, en la seva decisió SS.XI/8, va acollir amb beneplàcit l'establi...",,,,,
88343091,eliminacion_catalan,caracteres_problematicos: {'·'},L'Oficina de Coordinació d'Assumptes Humanitaris i la Lliga dels Estats Àrabs van subscriure un memo...,,,,,
88521963,eliminacion_catalan,caracteres_problematicos: {'·'},L'orador no està segur que la Comissió pugui adoptar una decisió informada després de només un col·l...,,,,,
88533403,eliminacion_catalan,caracteres_problematicos: {'/'},91.Es fa referència a l'estudi de l'Alta Comissionada en el qual es documenten les lleis i pràctique...,,,,,
88560979,eliminacion_catalan,caracteres_problematicos: {'/'},"12. Segons ha observat el Relator Especial sobre els drets dels pobles indígenes, pot no ser estrict...",,,,,
88579891,eliminacion_catalan,caracteres_problematicos: {'·'},Bahrain està estudiant les sol·licituds del Relator Especial sobre el dret a la llibertat de reunió ...,,,,,
88733214,eliminacion_catalan,caracteres_problematicos: {'·'},La Comissió col·labora estretament amb el Consell de la Família: continua prestant serveis o executa...,,,,,
88752057,eliminacion_catalan,caracteres_problematicos: {'/'},"5. Els problemes que s'afronten en la reunió, difusió i anàlisi d'estadístiques de delinqüència van ...",,,,,
88992759,eliminacion_catalan,caracteres_problematicos: {'/'},L'Assemblea va examinar el tema en els seus períodes de sessions seixanta-cinquè i seixanta-sisè (re...,,,,,
88996513,eliminacion_catalan,caracteres_problematicos: {'/'},"En el seu 51è període de sessions, celebrat al febrer i març de 2012, el Comitè va aprovar dictàmens...",,,,,
88998042,eliminacion_catalan,caracteres_problematicos: {'·'},e) Sol·licita a més al Comitè Permanent que presenti un informe sobre la seva tasca al Comitè Execut...,,,,,
89002814,eliminacion_catalan,caracteres_problematicos: {'·'},"La indústria del Regne Unit és la major víctima de la ciberdelinqüència, inclosa l'estesa pràctica d...",,,,,
89039238,eliminacion_catalan,caracteres_problematicos: {'·'},"En una altra causa, el demandant, la demanda del qual s'anava a substanciar a Ginebra, va sol·licita...",,,,,
89041009,eliminacion_catalan,caracteres_problematicos: {'·'},En els compromisos internacionals es reconeixen les condicions especials dels països menys avançats ...,,,,,
89082145,eliminacion_catalan,caracteres_problematicos: {'/'},"En la 16a sessió, celebrada el 17 d'octubre, el representant de Mongòlia, en nom de l'Argentina, Bèl...",,,,,
89084681,eliminacion_catalan,caracteres_problematicos: {'/'},34) Es convida a l'Estat parteix al fet que presenti el seu document bàsic de conformitat amb els re...,,,,,
89176679,eliminacion_catalan,"caracteres_problematicos: {']', '['}",96. Creació d'una zona lliure d'armes nuclears a la regió de l'Orient Mitjà [P.95].,,,,,
89203387,eliminacion_catalan,caracteres_problematicos: {'·'},39. El Sr. Kim Yong Song (República Popular Democràtica de Corea) diu que recentment les Nacions Uni...,,,,,
89214853,eliminacion_catalan,caracteres_problematicos: {'·'},"Com se subratlla en el nou acord per a la Conferència sobre Un Nou Pacte per a Somàlia, celebrada a ...",,,,,
89302605,eliminacion_catalan,caracteres_problematicos: {'·'},"34. El Grup de Treball sol·licita, a més, que es garanteixi una reparació apropiada, d'acord amb l'o...",,,,,
89352375,eliminacion_catalan,caracteres_problematicos: {'·'},"Les lleis de treball (de la Federació de Bòsnia i Hercegovina, la República Srpska i el Districte de...",,,,,
89447051,eliminacion_catalan,caracteres_problematicos: {'·'},a) Apliquin els principis universals de millora dels barris marginals i prevenció de la seva prolife...,,,,,
89448686,eliminacion_catalan,caracteres_problematicos: {'%'},"La taxa de mortalitat neonatal s'ha reduït, encara que continua representant aproximadament el 70% d...",,,,,
89504324,eliminacion_catalan,caracteres_problematicos: {'·'},Anàlisi de casos cancel·lats el 2012,,,,,
89505790,eliminacion_catalan,caracteres_problematicos: {'/'},"f) Els criteris, inclosa l'aplicació de mètodes prudents, per a la definició, l'aprovació i l'ajust ...",,,,,
89512024,eliminacion_catalan,caracteres_problematicos: {'/'},"116. Antecedents. En la decisió 26/CP.18, la CP 18 va acceptar amb agraïment l'oferiment del Govern ...",,,,,
89551557,eliminacion_catalan,"caracteres_problematicos: {'”', '·', '“', '+'}","Debat en grup sobre el tema “Riu+20: Dels resultats a l'acció, associacions de col·laboració per a l...",,,,,
89555706,eliminacion_catalan,"caracteres_problematicos: {'̈', '”', '“', '/'}","Formulen declaracions els representants d'Egipte, Noruega, el Japó (qui presenta el projecte de reso...",,,,,
89578313,eliminacion_catalan,caracteres_problematicos: {'%'},"Encara que amb una lleugera disminució, els Estats membres de la Comunitat Econòmica i Monetària d'À...",,,,,
89667362,eliminacion_catalan,caracteres_problematicos: {'%'},La disminució de les necessitats va obeir principalment a una menor despesa en concepte de despeses ...,,,,,
89772225,eliminacion_catalan,caracteres_problematicos: {'·'},El personal de la Dependència de Gestió de Riscos va indicar que s'ha coordinat amb altres entitats ...,,,,,
89802741,eliminacion_catalan,"caracteres_problematicos: {'·', '/'}","Sol·licita al Secretari General que, en el seu setantè període de sessions, l'informi dels nous esde...",,,,,
89824732,eliminacion_catalan,caracteres_problematicos: {'%'},"Segons es mostra en el quadre IV.2, el total de quotes va passar de 7.257,9 milions de dòlars en l'e...",,,,,
89884878,eliminacion_catalan,caracteres_problematicos: {'·'},Egipte compta amb la seva sòlida associació de col·laboració amb ONU-Dones per contribuir a les inic...,,,,,
89886837,eliminacion_catalan,caracteres_problematicos: {'·'},El país espera amb interès una nova era de col·laboració amb els pobles indígenes als Estats Units.,,,,,
89990978,eliminacion_catalan,caracteres_problematicos: {'/'},"36.- L'APGXXIII va indicar que, segons la Llei No 356/92, alguns delictes es consideraven tan alarma...",,,,,
90028300,eliminacion_catalan,"caracteres_problematicos: {']', '['}","No obstant això, segons la seva declaració, [l'autora] va ballar aquest mateix dia amb [el Sr G], en...",,,,,
90033040,eliminacion_catalan,caracteres_problematicos: {'·'},"47. Segons l'Ordenança sobre la Discriminació per Raons de Sexe, és il·legal que els ocupadors de le...",,,,,
90073560,eliminacion_catalan,caracteres_problematicos: {'/'},"El Comitè va examinar l'informe inicial de Costa Rica (CRPD/C/CRI/1), en les seves sessions 127a i 1...",,,,,
90096924,eliminacion_catalan,caracteres_problematicos: {'/'},Exercint les funcions administratives i financeres que li va encomanar l'Assemblea General en la sev...,,,,,
90104968,eliminacion_catalan,"caracteres_problematicos: {'°', '/'}","Recordant a més que, en la seva resolució 67/184, de 20 de desembre de 2012, relativa al seguiment d...",,,,,
90174215,eliminacion_catalan,caracteres_problematicos: {'/'},"138.- El Ministeri Fiscal gaudeix d'estatut propi (Llei núm. 60/98, de 28 d'agost) i d'autonomia.",,,,,
90401350,eliminacion_catalan,caracteres_problematicos: {'/'},Els documents i les presentacions de totes les activitats d'aquest projecte poden consultar-se en el...,,,,,
90412261,eliminacion_catalan,caracteres_problematicos: {'/'},Es va aprovar el programa de la reunió (EC/55/SC/CRP.18).,,,,,
90441309,eliminacion_catalan,caracteres_problematicos: {'/'},Es necessitarien les següents modificacions del programa de treball enunciat en el projecte de press...,,,,,
90446547,eliminacion_catalan,"caracteres_problematicos: {'·', '—'}",Durant el període que abasta l'informe —en el context dels exàmens periòdics de les llistes de perso...,,,,,
90468265,eliminacion_catalan,"caracteres_problematicos: {'”', '—', '“'}","Avui més que mai, disposem dels mitjans necessaris —normatius, jurídics, institucionals i polítics— ...",,,,,
90512083,eliminacion_catalan,caracteres_problematicos: {'/'},En determinats països el UNFPA va utilitzar la prevenció del VIH/SIDA i la promoció de la salut repr...,,,,,
90559455,eliminacion_catalan,"caracteres_problematicos: {'”', '“'}","Segons el parer de les delegacions d'Itàlia, els Països Baixos i la República de Corea, aquesta fina...",,,,,
90688698,eliminacion_catalan,caracteres_problematicos: {'—'},"Els que neguen l'Holocaust —i, lamentablement, hi ha alguns que ho fan— no sols revelen ignorància, ...",,,,,
90698808,eliminacion_catalan,caracteres_problematicos: {'/'},"En la 22a sessió, el 28 de setembre de 2007, el representant de Bèlgica (en nom d'Armènia, Mèxic i e...",,,,,
90760443,eliminacion_catalan,caracteres_problematicos: {'/'},La Comissió ha assenyalat que és necessari determinar si els programes de capacitació compleixen els...,,,,,
90803119,eliminacion_catalan,caracteres_problematicos: {'/'},"420/2004, de 12 de febrer de 2004, conté les Instruccions complementàries del Reglament per al trans...",,,,,
90814602,eliminacion_catalan,caracteres_problematicos: {'·'},Es va considerar que els programes d'intercanvi i la iniciativa de centres d'excel·lència de la Nova...,,,,,
90831292,eliminacion_catalan,caracteres_problematicos: {'/'},"Els membres del Consell també tenen davant si el document S/2004/330, que conté el text d'un project...",,,,,
90845038,eliminacion_catalan,caracteres_problematicos: {'·'},Potser la resposta seria la mateixa si l'organització no hagués sol·licitat sinó només autoritzat el...,,,,,
90855935,eliminacion_catalan,caracteres_problematicos: {'·'},"Arran d'aquesta modificació, l'article 259 bis-1 del Codi Judicial disposa, en el paràgraf 1, que el...",,,,,
90878816,eliminacion_catalan,caracteres_problematicos: {'·'},Conscients de l'existència de greus problemes relacionats amb la proliferació d'armes de foc en la s...,,,,,
90891064,eliminacion_catalan,"caracteres_problematicos: {'/', '%'}","Els nivells d'arsènic s'han elevat del 0,1% p/p en 1994 al 0,3% p/p en 1999; Els nivells de plom s'h...",,,,,
90937353,eliminacion_catalan,"caracteres_problematicos: {'”', '“'}",Decideix incloure en el programa provisional del seu seixantè període de sessions el tema titulat “I...,,,,,
90953386,eliminacion_catalan,caracteres_problematicos: {'—'},"En aquest sentit, el sistema de les Nacions Unides precisa un marc efectiu —en el qual estiguin clar...",,,,,
90962336,eliminacion_catalan,"caracteres_problematicos: {'•', '/'}",• Programes d'identificació dels clients per als comerciants de futurs a comissió i els corredors qu...,,,,,
90971253,eliminacion_catalan,caracteres_problematicos: {'/'},"Reitera la seva fervorosa recomanació anterior que, de conformitat amb la resolució 50/157 de l'Asse...",,,,,
91002375,eliminacion_catalan,"caracteres_problematicos: {'”', '“'}",Es modifica l'assoliment c) perquè digui com segueix: “Augment de la capacitat dels Estats Membres p...,,,,,
91002492,eliminacion_catalan,caracteres_problematicos: {'/'},"La Comissió va examinar aquesta qüestió en les seves sessions 10a a 13a i 30a, celebrades els dies 2...",,,,,
91003799,eliminacion_catalan,"caracteres_problematicos: {'”', '“', '/'}",El PRESIDENT assenyala a l'atenció el primer projecte de resolució sobre el tema 12 que figura en el...,,,,,
91008261,eliminacion_catalan,caracteres_problematicos: {'—'},"Una sola dosi, que costa 4 dòlars —encara que també hi ha costos d'assajos i assessorament voluntari...",,,,,
91020276,eliminacion_catalan,"caracteres_problematicos: {'”', '“'}",El terme “traslladar” ha d'interpretar-se conformement a les disposicions pertinents del dret intern...,,,,,
91247447,eliminacion_catalan,caracteres_problematicos: {'°'},"En el seu 23° període de sessions, es presentarà un informe sobre la marxa dels treballs al Comitè d...",,,,,
91295004,eliminacion_catalan,"caracteres_problematicos: {'”', '“'}","En la 4146a sessió del Consell de Seguretat, celebrada el 23 de maig de 2000 en relació amb l'examen...",,,,,
91299918,eliminacion_catalan,caracteres_problematicos: {'/'},La Comissió Consultiva observa que l'Oficina de Gestió de Recursos Humans ha començat a crear el mag...,,,,,
91317575,eliminacion_catalan,caracteres_problematicos: {'·'},Es va observar la necessitat de vincular les activitats de desenvolupament alternatiu a les estratèg...,,,,,
91382378,eliminacion_catalan,"caracteres_problematicos: {'”', '“'}","A més, va a iniciar-se l'elaboració de la nostra pròpia “estratègia nacional per al diàleg intercult...",,,,,
91391899,eliminacion_catalan,caracteres_problematicos: {'/'},"En les seves sessions 499a i 500a, celebrades el 8 de setembre, el Comitè va examinar la secció de l...",,,,,
91395677,eliminacion_catalan,caracteres_problematicos: {'·'},La Junta va revisar el model per a l'avaluació preliminar de les sol·licituds i va aprovar una nova ...,,,,,
91397778,eliminacion_catalan,caracteres_problematicos: {'·'},"Pel que fa als treballadors expatriats, el Pakistan se sentia encoratjat per les respostes adequades...",,,,,
91415747,eliminacion_catalan,caracteres_problematicos: {'·'},"El 4 de desembre de 2008, 94 Estats van subscriure la Convenció, quatre Estats la van ratificar i va...",,,,,
91505134,eliminacion_catalan,caracteres_problematicos: {'·'},"5) L'apartat b) és una condició adequada, en alguns casos, perquè el primer Estat invoqui una circum...",,,,,
91577791,eliminacion_catalan,caracteres_problematicos: {'/'},"Es recordarà, a més, que el rebuig grecoxipriota de la declaració feta per vostè el 12 de setembre d...",,,,,
91621357,eliminacion_catalan,caracteres_problematicos: {'·'},Sol·licituds d'assistència dirigides a les Nacions Unides pels Estats membres,,,,,
91644266,eliminacion_catalan,caracteres_problematicos: {'°'},"El present informe, que és el séptimoa preparat en compliment del paràgraf 12 de la resolució 1284 (...",,,,,
91646945,eliminacion_catalan,caracteres_problematicos: {'/'},El Departament va proporcionar a la Conferència cobertura i suport en matèria de comunicacions i va ...,,,,,
91738686,eliminacion_catalan,"caracteres_problematicos: {'”', '“', '/'}",El President (parla en anglès): Com cap altra delegació desitja fer ús de la paraula en explicació d...,,,,,
91771231,eliminacion_catalan,caracteres_problematicos: {'·'},"Recordant la Declaració sobre les ciutats i altres assentaments humans en el nou mil·lenni, en parti...",,,,,
91848156,eliminacion_catalan,caracteres_problematicos: {'/'},"Llei 2/1969, sobre la institució de ministeris i altres òrgans centrals de l'Administració de l'Esta...",,,,,
91885723,eliminacion_catalan,caracteres_problematicos: {'/'},"10 (comentari: Lachmann, pàg. 8); BayOblGZ Núm. 52/2000; DIS -Base de dades en línia sobre dret d'ar...",,,,,
91896786,eliminacion_catalan,caracteres_problematicos: {'·'},L'oradora acull complaguda la informació que s'ha presentat sobre les mesures adoptades perquè es ti...,,,,,
91928352,eliminacion_catalan,caracteres_problematicos: {'·'},La CESPAP està treballant en estreta col·laboració amb el Centre Internacional de reducció del risc ...,,,,,
92002926,eliminacion_catalan,caracteres_problematicos: {'•'},"• Organització de les Nacions Unides per a l'Educació, la Ciència i la Cultura (UNESCO), París (Fran...",,,,,
92010826,eliminacion_catalan,caracteres_problematicos: {'·'},"La Cimera del Mil·lenni i la Cimera Mundial 2005, així com les posicions consensuades de l'Assemblea...",,,,,
92071625,eliminacion_catalan,caracteres_problematicos: {'%'},"Entre 2002 i 2004, el treball realitzat per nens de 5 a 9 anys va descendir un 60,9%, és a dir, desp...",,,,,
92087946,eliminacion_catalan,caracteres_problematicos: {'·'},"El 2005, el CAT va expressar la seva preocupació perquè només un cantó hagués establert mecanismes p...",,,,,
92124822,eliminacion_catalan,caracteres_problematicos: {'°'},La Comissió sobre el Desenvolupament Sostenible va celebrar el seu 16° període de sessions l'11 de m...,,,,,
92137328,eliminacion_catalan,"caracteres_problematicos: {'‘', '”', '“'}",El Mecanisme Mundial procurarà “proporcionar als països associats encarregats de l'aplicació de la C...,,,,,
92151950,eliminacion_catalan,caracteres_problematicos: {'•'},• En 23 causes es van sobreseure definitivament els procediments penals per a tots els encausats (27...,,,,,
92154873,eliminacion_catalan,caracteres_problematicos: {'%'},"Al Líban hi ha menys de 40.000 persones subscrites a Internet, la qual cosa representa aproximadamen...",,,,,
92172000,eliminacion_catalan,"caracteres_problematicos: {'”', '“'}",“Demana al Secretari General que asseguri un seguiment sistemàtic i orgànic de tots els aspectes de ...,,,,,
92175688,eliminacion_catalan,caracteres_problematicos: {'%'},S'ha concedit la màxima prioritat al sector sanitari i el Govern va assignar 7.555.431 rupies durant...,,,,,
92198579,eliminacion_catalan,caracteres_problematicos: {'/'},Informe estadístic de l'OSIA (DP/2006/40),,,,,
92203437,eliminacion_catalan,caracteres_problematicos: {'·'},"En col·laboració amb el Fons Internacional de les Nacions Unides per a la Infància (UNICEF), publica...",,,,,
92207730,eliminacion_catalan,caracteres_problematicos: {'%'},"Encara que en 2005 es va mantenir baixa la taxa de desocupació (2,1%), al novembre d'aquest any el G...",,,,,
92257144,eliminacion_catalan,caracteres_problematicos: {'/'},En el document A/HRC/4/25/Add.1 figura un resum de les denúncies transmeses a diversos governs i les...,,,,,
92261512,eliminacion_catalan,caracteres_problematicos: {'·'},a) Examen de qüestions relacionades amb les mesures de protecció i assistència als migrants objecte ...,,,,,
92284020,eliminacion_catalan,caracteres_problematicos: {'·'},"d) L'autor afirma que va accedir a seguir prenent el ""Largactil"" perquè li havien dit que li permetr...",,,,,
92297109,eliminacion_catalan,"caracteres_problematicos: {'”', '“', '%'}",Per “relació material” s'entén que correspongui a les Nacions Unides una suma que superi la menor de...,,,,,
92335328,eliminacion_catalan,"caracteres_problematicos: {'”', '“'}","Per exemple, el Reglament d'Arbitratge de la Cambra de Comerç Internacional (“el Reglament de la CCI...",,,,,
92342035,eliminacion_catalan,"caracteres_problematicos: {'”', '“'}","Des del Cim Mundial de 2005, el concepte de “ajuda per al comerç” ha cobrat un impuls impressionant ...",,,,,
92389382,eliminacion_catalan,"caracteres_problematicos: {'”', '·', '“'}","Sobre aquest tema, l'ítem b d'aquesta acta estableix “Recomanar reunions entre funcionaris dels Banc...",,,,,
92405044,eliminacion_catalan,caracteres_problematicos: {'·'},"El 12 de juliol de 1978, Shah va signar un contracte de serveis amb la Comissió Estatal de Carretere...",,,,,
92442387,eliminacion_catalan,caracteres_problematicos: {'%'},"En 1998, el 27% de les dignitats en el Poder Executiu estava representat per dones en el rang de Min...",,,,,
92451205,eliminacion_catalan,caracteres_problematicos: {'•'},• La Llei de protecció de la informació de 1982 (Llei No 84 de 1982);,,,,,
92475621,eliminacion_catalan,"caracteres_problematicos: {'”', '“'}",Què constitueix en efecte la “societat civil” en aquests països amb economies en transició?,,,,,
92535328,eliminacion_catalan,"caracteres_problematicos: {'”', '“', '/'}",L'Assemblea General també va aprovar la resolució 56/170 de 19 de desembre de 2001 sobre la protecci...,,,,,
92549330,eliminacion_catalan,caracteres_problematicos: {']'},"A més, el Grup de Treball tal vegada desitja estudiar els avantatges i desavantatges comparatius d'u...",,,,,
92551564,eliminacion_catalan,caracteres_problematicos: {'•'},"• Augment del suport estatal a la família, per tal de vetllar perquè els joves rebin una bona educac...",,,,,
92590135,eliminacion_catalan,"caracteres_problematicos: {']', '[', '/'}",A/57/532/Add.6 Tema 87 f) - Medi ambient i desenvolupament sostenible: execució ulterior del Program...,,,,,
92605905,eliminacion_catalan,"caracteres_problematicos: {'”', '·', '“'}","Com es llegeix, “en la falta de tractat o convenció, els béns, drets o valors confiscats o segrestat...",,,,,
92619268,eliminacion_catalan,caracteres_problematicos: {'”'},"Finalment, el resultat de les negociacions no té res d'inevitable, però a tots ens interessa fer una...",,,,,
92622079,eliminacion_catalan,caracteres_problematicos: {'·'},"El principi de la ""finestreta única"" ha quedat reforçat amb la modificació, en un intent per reduir ...",,,,,
92624307,eliminacion_catalan,"caracteres_problematicos: {']', '['}","5) El tribunal arbitral, de ser necessari per a garantir que una mesura cautelar sigui eficaç, pot d...",,,,,
92658574,eliminacion_catalan,"caracteres_problematicos: {'”', '“'}","En la seva resolució 976 (1995), de 8 de febrer de 1995, el Consell de Seguretat va autoritzar l'est...",,,,,
92661483,eliminacion_catalan,caracteres_problematicos: {'/'},"En el seu cinquantè període de sessions, l'Assemblea General va aprovar, en la resolució 50/157, el ...",,,,,
92687488,eliminacion_catalan,"caracteres_problematicos: {'”', '“'}","En la seva 40a sessió, celebrada el 25 de juliol, el Consell va aprovar el projecte de decisió 36 re...",,,,,
92694213,eliminacion_catalan,caracteres_problematicos: {'·'},"L'estudi va ser realitzat en col·laboració amb la Universitat de Damasc, l'Institut Central d'Estadí...",,,,,
92695374,eliminacion_catalan,caracteres_problematicos: {'°'},Demana al Departament d'Informació Pública que encoratgi a totes les entitats del sistema de les Nac...,,,,,
92709123,eliminacion_catalan,"caracteres_problematicos: {'”', '“'}","En ocasió del Dia Internacional de la Dona es va dictar un curs titulat “La dona i la salut”, en què...",,,,,
92712224,eliminacion_catalan,"caracteres_problematicos: {'”', '“'}",Consultes oficioses de participació oberta sobre un projecte de resolució titulat “Aplicació de la C...,,,,,
92749349,eliminacion_catalan,caracteres_problematicos: {'·'},Prenent nota del creixent nombre de sol·licituds d'assistència tècnica rebudes pel Centre per a la P...,,,,,
92860442,eliminacion_catalan,caracteres_problematicos: {'/'},"Després de la partida de la Missió Civil Internacional de Suport a Haití (MICAH) al febrer de 2001, ...",,,,,
92887737,eliminacion_catalan,caracteres_problematicos: {'$'},Des de$59,,,,,
92910633,eliminacion_catalan,caracteres_problematicos: {'/'},països / regions,,,,,
92971276,eliminacion_catalan,caracteres_problematicos: {'/'},Els adults / nens més grans poden allotjar-se per NOK 200 per persona i nit en un llit extra.,,,,,
93017095,eliminacion_catalan,caracteres_problematicos: {'·'},Us recomanem tenir-les en una habitació ben il·luminada però sense llum solar directa. Assegureu-vos...,,,,,
93048391,eliminacion_catalan,caracteres_problematicos: {'–'},– enduriment equilibrada i prolongada en el temps,,,,,
93062980,eliminacion_catalan,caracteres_problematicos: {'/'},"h) Php/cgi proxies estan estrictament prohibits, sense excepcions.",,,,,
93066361,eliminacion_catalan,caracteres_problematicos: {'©'},© 2019 www.webcamdevils.com - Tots els Drets Reservats! Ajuda Termes i Condicions Declaració de Dret...,,,,,
93112044,eliminacion_catalan,"caracteres_problematicos: {'”', '·', '“'}","Encara recordo quan vaig rebre el meu primer telèfon “intel·ligent,” o la primera vegada que vaig ut...",,,,,
93174456,eliminacion_catalan,"caracteres_problematicos: {'·', '/'}",Habitacions/Instal·lacions adaptades per a les persones de mobilitat reduïda (157),,,,,
93241374,eliminacion_catalan,caracteres_problematicos: {'·'},Amplada de paper 58 mil·límetres,,,,,
93249316,eliminacion_catalan,caracteres_problematicos: {'·'},"Per descomptat que sí! Tingues en compte que Kodi no està disponible a la botiga d'Amazon, encara qu...",,,,,
