linea,tipo,razon,texto_original,porcentaje_automatico,detalles_base,detalles_avanzados,texto_catalan,texto_chino
88107014,eliminacion_catalan,caracteres_problematicos: {'/'},"13. Tenint en compte les conclusions del procés d'examen científic per homòlegs, el conjunt provisio...",,,,,
88143406,eliminacion_catalan,caracteres_problematicos: {'·'},1. Col·laboració amb les Nacions Unides,,,,,
88149478,eliminacion_catalan,caracteres_problematicos: {'/'},"Al barri vell de Nicòsia, la UNFICYP va donar suport a un projecte finançat per la Unió Europea i di...",,,,,
88259305,eliminacion_catalan,caracteres_problematicos: {'·'},:: Tramitació d'un mínim de 50 sol·licituds de reemborsament de despeses de viatge i 30 pagaments a ...,,,,,
88287081,eliminacion_catalan,caracteres_problematicos: {'/'},Oficina de Serveis de Supervisió Interna/Divisió d'Investigacions/UNMIS,,,,,
88302103,eliminacion_catalan,caracteres_problematicos: {'/'},Hem d'esmentar que la convocació de la reunió de l'Assemblea General per a examinar l'informe del Co...,,,,,
88412612,eliminacion_catalan,caracteres_problematicos: {'/'},"D'altra banda, la Comissió també recorda la seva postura anterior que aquest tipus de contribució de...",,,,,
88419512,eliminacion_catalan,"caracteres_problematicos: {'“', '”'}",L'administració d'ONU-Dones ha reflectit les activitats del UNIFEM corresponents al període comprès ...,,,,,
88475700,eliminacion_catalan,caracteres_problematicos: {'·'},d) Sol·licita a més al Comitè Permanent que presenti un informe sobre la seva tasca al Comitè Execut...,,,,,
88521165,eliminacion_catalan,"caracteres_problematicos: {'[', ']'}",[Conceptes clau: procediment estranger principal; protecció dels creditors],,,,,
88558552,eliminacion_catalan,caracteres_problematicos: {'·'},Els pobles o comunitats indígenes particulars als quals ha de consultar-se són els titulars dels dre...,,,,,
88621173,eliminacion_catalan,caracteres_problematicos: {'·'},"a) Instaurar sistemes de control amplis, d'acord amb les més altes normes internacionals i les millo...",,,,,
88636759,eliminacion_catalan,caracteres_problematicos: {'·'},L'Estat part sosté que les al·legacions de l'autor no demostren que existeixi un risc que no sigui m...,,,,,
88747474,eliminacion_catalan,caracteres_problematicos: {'·'},L'organització va col·laborar amb la UNESCO com a associat oficial en el setè Fòrum de la Joventut d...,,,,,
88779990,eliminacion_catalan,caracteres_problematicos: {'/'},"A proposta de la Presidenta, la CP va aprovar la decisió 2/CP.17, titulada "" Resultat de la labor de...",,,,,
88822277,eliminacion_catalan,"caracteres_problematicos: {']', '[', '/', '–', '—'}","A/C.1/67/L.35/Rev.1 Tema 94 j) del programa — Desarmament general i complet: dones, desarmament, no ...",,,,,
89029140,eliminacion_catalan,caracteres_problematicos: {'/'},3. Que el Grup estarà obert a tots els Estats membres de la Conferència de Desarmament i als Estats ...,,,,,
89037709,eliminacion_catalan,caracteres_problematicos: {'%'},"La taxa d'aportació, que és fixa, és del 7,9% per als afiliats i el 15,8% per als ocupadors (vegeu l...",,,,,
89067229,eliminacion_catalan,caracteres_problematicos: {'/'},Dos països que aporten contingents triats per a un mandat de tres anys que comença el 10 de novembre...,,,,,
89086345,eliminacion_catalan,caracteres_problematicos: {'·'},L'Estat part assenyala que la decisió d'aïllament temporal d'un detingut pot ser recorreguda davant ...,,,,,
89101270,eliminacion_catalan,caracteres_problematicos: {'/'},"Reafirmant la resolució 8/4 del Consell de Drets Humans, de 18 de juny de 2008, i recordant totes le...",,,,,
89117747,eliminacion_catalan,caracteres_problematicos: {'/'},i) Nota del Secretari General per la qual es transmet l'informe de la Junta d'Auditors sobre l'aplic...,,,,,
89147133,eliminacion_catalan,caracteres_problematicos: {'·'},"Treballa en col·laboració amb altres oficines de la Secretaria, les comissions regionals, els organi...",,,,,
89223014,eliminacion_catalan,caracteres_problematicos: {'&'},"En el cas Massachusetts Elephant & Castle, el tribunal canadenc va tenir en compte tres factors prin...",,,,,
89232073,eliminacion_catalan,caracteres_problematicos: {'/'},c) El resum preparat pel ACNUDH de conformitat amb el paràgraf 15 c) (A/HRC/WG.6/12/TGO/3).,,,,,
89353538,eliminacion_catalan,caracteres_problematicos: {'/'},"Sens dubte, aquesta Llei constitueix un avanç fonamental per garantir els drets dels nens/es i prevé...",,,,,
89422707,eliminacion_catalan,caracteres_problematicos: {'%'},"Encara que la majoria dels projectes es va executar en el termini previst, tan sols un 60% dels recu...",,,,,
89424592,eliminacion_catalan,caracteres_problematicos: {'/'},"La Junta Executiva va acordar, en la decisió 2013/26, el següent calendari per als futurs períodes d...",,,,,
89443575,eliminacion_catalan,"caracteres_problematicos: {'/', '°'}",b) Subcomitè d'Experts en el Sistema Globalment Harmonitzat de Classificació i Etiquetatge de Produc...,,,,,
89451697,eliminacion_catalan,caracteres_problematicos: {'*'},"Alemanya (2015), Espanya (2015), Estats Units d'Amèrica* (2013), França (2015), Irlanda*a (2013), Ja...",,,,,
89512715,eliminacion_catalan,caracteres_problematicos: {'/'},"19. En la decisió 26/CP.18 es va observar que, d'acord amb el principi de rotació entre els grups re...",,,,,
89553343,eliminacion_catalan,"caracteres_problematicos: {'/', '–', '[', ']'}",A/68/L.5 Tema 21 e) del programa – Globalització i interdependència: migració internacional i desenv...,,,,,
89643451,eliminacion_catalan,caracteres_problematicos: {'/'},"En el document UNEP/GC.27/1/Add.1, en el paràgraf 31, que conté la llista de documents que són d'int...",,,,,
89694301,eliminacion_catalan,caracteres_problematicos: {'+'},"Fins avui, sis països del g7+ han emprès una avaluació de la fragilitat, i altres països membres ten...",,,,,
89750632,eliminacion_catalan,caracteres_problematicos: {'/'},"En el paràgraf 22 del seu informe anterior (A/68/273), el Comitè va manifestar que el preocupava que...",,,,,
89759171,eliminacion_catalan,caracteres_problematicos: {'%'},Al voltant del 27% del finançament per a les crisis de desplaçament es va assignar a l'assistència a...,,,,,
89802078,eliminacion_catalan,caracteres_problematicos: {'·'},Recordant a més el document final de l'acte especial de seguiment de la labor realitzada per a acons...,,,,,
89842578,eliminacion_catalan,"caracteres_problematicos: {'%', '·'}",Durant l'exercici el 19% de les sol·licituds van ser retornades a les missions,,,,,
89926510,eliminacion_catalan,caracteres_problematicos: {'·'},"Una de les parts havia sol·licitat que se suspenguessin les actuacions, invocant la clàusula comprom...",,,,,
89944301,eliminacion_catalan,caracteres_problematicos: {'%'},Jordània només havia rebut aproximadament entre el 30% i el 40% de l'ajuda financera que necessitava...,,,,,
89970578,eliminacion_catalan,caracteres_problematicos: {'/'},3. El Mecanisme d'Experts va dur a terme un estudi sobre l'accés a la justícia en la promoció i prot...,,,,,
90081673,eliminacion_catalan,"caracteres_problematicos: {'/', '·'}","L'article 2 de la Llei No 2/2004 de les Persones amb Necessitats Especials, per la seva banda, dispo...",,,,,
90109193,eliminacion_catalan,caracteres_problematicos: {'/'},"4/105. Integració d'informació geoespacial, estadística i d'altre tipus",,,,,
90169555,eliminacion_catalan,caracteres_problematicos: {'·'},La Comissió de Drets Humans està legalment facultada per a investigar les queixes sobre les infracci...,,,,,
90177737,eliminacion_catalan,caracteres_problematicos: {'/'},"En l'informe més recent (IDB.41/9, paràgraf 22) es van assenyalar els augments de l'eficiència previ...",,,,,
90325585,eliminacion_catalan,caracteres_problematicos: {'·'},"En tots els països on les Nacions Unides realitzen activitats de desenvolupament, els seus organisme...",,,,,
90342739,eliminacion_catalan,"caracteres_problematicos: {'“', '[', '”', ']'}",El Sr. AKIL (Pakistan) proposa que la part del paràgraf que comença per “amb la intenció d'adoptar [...,,,,,
90379289,eliminacion_catalan,caracteres_problematicos: {'·'},La segona qüestió -la seguretat col·lectiva de conformitat amb el Capítol VIII de la Carta de les Na...,,,,,
90469003,eliminacion_catalan,"caracteres_problematicos: {'%', '•'}","• Es paguen dietes a les taxes aplicables, més el 40%, només als membres dels òrgans principals i òr...",,,,,
90469569,eliminacion_catalan,"caracteres_problematicos: {'/', '°'}",Informe de la Comissió de Prevenció del Delicte i Justícia Penal sobre el seu 14° període de session...,,,,,
90493411,eliminacion_catalan,"caracteres_problematicos: {'“', '/', '”'}","En la seva 36a sessió, celebrada el 13 de desembre, la Comissió va tenir davant sí un projecte de re...",,,,,
90524312,eliminacion_catalan,caracteres_problematicos: {'/'},El mandat del Relator Especial sobre la situació dels drets humans a Belarús va ser establert per la...,,,,,
90525517,eliminacion_catalan,"caracteres_problematicos: {'/', '·'}","En total, els objectius de desenvolupament del Mil·lenni de Cambodja abasten nou esferes a llarg i c...",,,,,
90543724,eliminacion_catalan,"caracteres_problematicos: {'“', '”'}","El Comitè demana a l'Estat Part que segueixi difonent àmpliament, en particular entre les organitzac...",,,,,
90645862,eliminacion_catalan,"caracteres_problematicos: {'“', '”'}",Els principis del “menys que reciprocitat plena” i del “tracte especial i diferenciat” han de respec...,,,,,
90720327,eliminacion_catalan,"caracteres_problematicos: {'/', '*'}",*** El text íntegre de l'informe es publica únicament en anglès amb la signatura E/CONF.98/66/Add.1.,,,,,
90748038,eliminacion_catalan,"caracteres_problematicos: {'“', '·', '”'}","En aquest sentit, acollim amb beneplàcit el complet informe del Secretari General sobre els nens i e...",,,,,
90749806,eliminacion_catalan,caracteres_problematicos: {'/'},330/2003 de la Cort Suprema estava relacionada amb la contractació per al càrrec de director de teat...,,,,,
90792025,eliminacion_catalan,"caracteres_problematicos: {'“', '·', '”'}",Seguint instruccions del meu Govern i conformement a l'article 15 del reglament de l'Assemblea Gener...,,,,,
90854868,eliminacion_catalan,caracteres_problematicos: {'/'},"Recordant també la seva resolució 57/170, de 18 de desembre de 2002, relativa al seguiment dels plan...",,,,,
90866417,eliminacion_catalan,caracteres_problematicos: {'/'},"La situació en Côte d'Ivoire (vegin-se els documents S/2002/30/Add.50; S/2003/40/Add.5, 17, 19, 29, ...",,,,,
90969861,eliminacion_catalan,"caracteres_problematicos: {'“', '°', '”'}",Com a part dels preparatius per al 48° període de sessions de la Comissió de la Condició Jurídica i ...,,,,,
90997655,eliminacion_catalan,caracteres_problematicos: {'/'},La Comissió tindrà davant seu l'informe del Grup de Treball (E/CN.4/2004/3 i Add.1 i 2 i Add.2/Corr....,,,,,
91000984,eliminacion_catalan,"caracteres_problematicos: {'“', '/', '”'}",En relació amb la referència a la utilització dels “recursos disponibles” que es fa en el paràgraf 4...,,,,,
91008972,eliminacion_catalan,caracteres_problematicos: {'·'},L'article 164 del Codi d'Ucraïna d'Infraccions Administratives preveu la responsabilitat administrat...,,,,,
91074700,eliminacion_catalan,caracteres_problematicos: {'·'},Sr. Pamir (Turquia) (parla en anglès): Sr. President: Desitjo unir-me als meus col·legues per a expr...,,,,,
91083953,eliminacion_catalan,caracteres_problematicos: {'•'},• La major part dels països en desenvolupament necessitarien assistència tècnica per a poder prepara...,,,,,
91113731,eliminacion_catalan,"caracteres_problematicos: {'“', '”'}","Referent a les negociacions del Protocol de Kyoto, el principal objectiu de les delegacions de l'Ali...",,,,,
91151955,eliminacion_catalan,caracteres_problematicos: {'/'},"En la seva resolució 53/182, l'Assemblea General va demanar al Secretari General de les Nacions Unid...",,,,,
91186160,eliminacion_catalan,caracteres_problematicos: {'/'},El President de l'Assemblea General declara oberta la continuació del desè període extraordinari de ...,,,,,
91280755,eliminacion_catalan,caracteres_problematicos: {'%'},El factor de vacants per als llocs del quadre orgànic és de 10% i per als llocs de serveis generals ...,,,,,
91378013,eliminacion_catalan,caracteres_problematicos: {'·'},a) Informació de caràcter indicatiu; amb subjecció a la sol·licitud dels beneficiaris.,,,,,
91387841,eliminacion_catalan,"caracteres_problematicos: {'“', '”'}",15.D.1 “Equip lògic” (programari) dissenyat especialment o modificat per a la “utilització” dels equ...,,,,,
91424098,eliminacion_catalan,caracteres_problematicos: {'/'},"En el meu segon informe (A/CN.4/541), par. 1; i novament en els meus informes tercer (A/CN.4/553), p...",,,,,
91434207,eliminacion_catalan,"caracteres_problematicos: {'“', '”'}",f) “Tribunal”: autoritat judicial o d'una altra índole a la qual competeixi el control o la supervis...,,,,,
91449127,eliminacion_catalan,"caracteres_problematicos: {'“', '”'}","El 23 de setembre, sota la presidència del President de Burkina Faso, Sr. Blaise Compaoré, el Consel...",,,,,
91464189,eliminacion_catalan,"caracteres_problematicos: {'“', '”'}","A l'Assemblea General i al Consell de Seguretat de les Nacions Unides, l'Azerbaidjan ha fet distribu...",,,,,
91526048,eliminacion_catalan,caracteres_problematicos: {'/'},El Consell va celebrar un debat sobre els assentaments humans (tema 13 d)) en les seves sessions 41a...,,,,,
91557332,eliminacion_catalan,caracteres_problematicos: {'/'},Projecte de decisió relatiu a l'enfortiment de l'administració pública internacional (A/C.5/55/L.55),,,,,
91563151,eliminacion_catalan,caracteres_problematicos: {'·'},S'ha presentat a l'Assemblea Nacional un projecte de reforma de l'administració territorial que apro...,,,,,
91585119,eliminacion_catalan,caracteres_problematicos: {'·'},"A aquest respecte, l'Acord sobre Aspectes dels Drets de Propietat Intel·lectual relacionats amb el C...",,,,,
91588570,eliminacion_catalan,caracteres_problematicos: {'/'},La Comissió procedirà ara a prendre una decisió sobre aquest projecte de resolució A/C.1/56/L.25.,,,,,
91663581,eliminacion_catalan,caracteres_problematicos: {'·'},Un segon element del sistema d'instruments que mereix un esment especial és el Pla d'Acció Internaci...,,,,,
91669073,eliminacion_catalan,caracteres_problematicos: {'·'},"El Govern de la República de l'Iraq fa recaure sobre els Estats Units d'Amèrica i el Regne Unit, i s...",,,,,
91745346,eliminacion_catalan,"caracteres_problematicos: {'“', '”'}","Tocant a la definició de “discriminació indirecta”, l'orador diu que, si bé ni la Constitució ni el ...",,,,,
91749527,eliminacion_catalan,caracteres_problematicos: {'/'},c) A/CONF.192/PC/L.8: Projecte d'article 33 del reglament de la Conferència;.,,,,,
91777120,eliminacion_catalan,"caracteres_problematicos: {'“', '/', '”'}","En la 57a sessió, celebrada el 9 d'abril, el representant de l'Índia, coordinador de les consultes o...",,,,,
91792941,eliminacion_catalan,"caracteres_problematicos: {'%', '“', '”'}",El paràgraf 8.1 no inclou els “materials fibrosos o filamentosos” d'aramida que continguin una propo...,,,,,
91807274,eliminacion_catalan,"caracteres_problematicos: {'/', '·'}","Pren nota amb satisfacció de la Declaració de la Conferència ministerial sobre la seguretat, l'estab...",,,,,
91825364,eliminacion_catalan,"caracteres_problematicos: {'“', '”'}","El dijous 18 d'octubre de 2001, l'Administració Postal de les Nacions Unides (APNU) emetrà una sèrie...",,,,,
91902347,eliminacion_catalan,caracteres_problematicos: {'·'},d) Autonomia logística (Serveis mèdics): subministrament i reposició de fàrmacs i subministraments m...,,,,,
91913283,eliminacion_catalan,caracteres_problematicos: {'/'},"Recordant també la resolució 2008/33 del Consell Econòmic i Social, de 25 de juliol de 2008, sobre e...",,,,,
91980092,eliminacion_catalan,caracteres_problematicos: {'/'},En la decisió 11/COP.1 (sobre els procediments per a la comunicació d'informació i l'examen de l'apl...,,,,,
92038712,eliminacion_catalan,caracteres_problematicos: {'·'},"Insta als Estats membres que, si escau i de conformitat amb els seus respectius marcs jurídicos i ad...",,,,,
92040402,eliminacion_catalan,caracteres_problematicos: {'·'},"Quant a la subhasta electrònica inversa, tenint en compte la seva creixent utilització i dels object...",,,,,
92054614,eliminacion_catalan,caracteres_problematicos: {'/'},L'OSE va decidir examinar la situació de l'aplicació de les decisions 3/CP.7 i 30/CMP.1 en el seu 36...,,,,,
92109492,eliminacion_catalan,caracteres_problematicos: {'·'},Si bé les valuosíssimes contribucions voluntàries aportades pels països donants han possibilitat la ...,,,,,
92123035,eliminacion_catalan,"caracteres_problematicos: {'“', '·', '”'}","Tenint això present la Direcció General de Treball del Ministeri de Treball va proposar, en ocasió d...",,,,,
92157967,eliminacion_catalan,"caracteres_problematicos: {'“', '”'}","Pregunta 19. En l'informe s'assenyala que, encara que a Xipre la taxa de desocupació és baixa, les d...",,,,,
92202858,eliminacion_catalan,"caracteres_problematicos: {'[', ']'}","Si la notificació s'inscriu en un termini no inferior a [especifiqui's un breu període, de 20 o 30 d...",,,,,
92223021,eliminacion_catalan,caracteres_problematicos: {'/'},"Benedicto Fonseca Filho (el Brasil), Vicepresident de la Comissió, sobre la base de les consultes of...",,,,,
92281726,eliminacion_catalan,"caracteres_problematicos: {'“', '[', '”', ']'}",b) ter “En tot procés d'adjudicació en el qual s'utilitzi una subhasta electrònica inversa conforme ...,,,,,
92303111,eliminacion_catalan,caracteres_problematicos: {'/'},"Voldria anunciar que, des de l'aprovació del projecte de resolució, els següents països s'han sumat ...",,,,,
92305829,eliminacion_catalan,caracteres_problematicos: {'·'},La Conferència de les Parts podria servir de fòrum per a intercanviar opinions sobre la manera de do...,,,,,
92321668,eliminacion_catalan,"caracteres_problematicos: {'“', '”'}",Es va establir un grup directiu especial encarregat de supervisar la “avaluació de les avaluacions” ...,,,,,
92364006,eliminacion_catalan,"caracteres_problematicos: {'/', '·'}","També es va recalcar en el Document Final de la Cimera Mundial que tots coneixem i, més recentment, ...",,,,,
92376355,eliminacion_catalan,caracteres_problematicos: {'•'},"• Deu la comunitat estadística internacional donar més prioritat, i assignar més recursos, a les est...",,,,,
92427428,eliminacion_catalan,"caracteres_problematicos: {'“', '”'}",El President interí (parla en anglès): El projecte de resolució IV es titula “Educació en matèria de...,,,,,
92440291,eliminacion_catalan,"caracteres_problematicos: {'“', '·', '”'}","En la seva 40a sessió, celebrada el 24 de juliol, el Consell va aprovar el projecte de resolució III...",,,,,
92490844,eliminacion_catalan,"caracteres_problematicos: {'/', '[', ']'}",[56/230 Centre Subregional pels Drets Humans i la Democràcia a l'Àfrica Central],,,,,
92493957,eliminacion_catalan,caracteres_problematicos: {'['},"[Fet en anglès, francès i espanyol, sent l'anglesa la versió original.",,,,,
92495707,eliminacion_catalan,caracteres_problematicos: {'“'},“Els materials i la informació que se li havien presentat no permetien establir cap relació de sobir...,,,,,
92551579,eliminacion_catalan,caracteres_problematicos: {'·'},"Conveni per a la repressió de l'apoderament il·lícit d'aeronaus, signat a la Haia el 16 de desembre ...",,,,,
92559129,eliminacion_catalan,caracteres_problematicos: {'/'},"Vegeu el text en el capítol II, secció A, resolució 2002/87.",,,,,
92588272,eliminacion_catalan,"caracteres_problematicos: {'%', '/'}",Més del 60% d'aquestes dones pateixen de VIH/SIDA.,,,,,
92590979,eliminacion_catalan,caracteres_problematicos: {'/'},"En la seva 445a sessió, celebrada l'11 de setembre de 2002, el Comitè de Conferències va examinar l'...",,,,,
92637050,eliminacion_catalan,caracteres_problematicos: {'/'},"El President recorda que, de conformitat amb la decisió 34/401 de l'Assemblea General, el nombre d'i...",,,,,
92649896,eliminacion_catalan,"caracteres_problematicos: {'“', '”'}",Es va convenir que el projecte de guia recomanés que el nou règim legal de les operacions garantides...,,,,,
92658018,eliminacion_catalan,caracteres_problematicos: {'°'},Projecte de pressupost per al període comprès entre l'1° de juliol de 2003 i el 30 de juny de 2004,,,,,
92699218,eliminacion_catalan,caracteres_problematicos: {'/'},2003/Els drets humans i la ciència forense,,,,,
92721381,eliminacion_catalan,"caracteres_problematicos: {'“', '”'}","El Secretari de Relacions Exteriors de Mèxic, Luis Ernesto Derbez, va presidir la sessió pública del...",,,,,
92724803,eliminacion_catalan,"caracteres_problematicos: {'“', '”'}","El 5 de desembre, en la resolució 1447 (2002), el Consell de Seguretat va mantenir en vigor el progr...",,,,,
92768216,eliminacion_catalan,caracteres_problematicos: {'”'},"Però cal fer una distinció entre una infracció directa dels drets dels accionistes, i les dificultat...",,,,,
92802817,eliminacion_catalan,"caracteres_problematicos: {'“', '”'}",El Director General de la Caixa Comuna de Pensions del Personal de les Nacions Unides ha examinat aq...,,,,,
92843338,eliminacion_catalan,caracteres_problematicos: {'/'},"De conformitat amb les disposicions pertinents de la resolució 18/1 del Consell d'Administració, de ...",,,,,
92950842,eliminacion_catalan,caracteres_problematicos: {'&'},"Tipus de llits 1 llit doble gran, 1 llitera & 1 sofà llit",,,,,
92968409,eliminacion_catalan,caracteres_problematicos: {'%'},Gaudeixi d'un descompte instantani de -12%,,,,,
93074400,eliminacion_catalan,"caracteres_problematicos: {'“', '”'}","Números algú Prompt de fil per al brodat “QUALSEVOL Sempre Yoey”,No m'agrada per recollir mogupo fot...",,,,,
93133670,eliminacion_catalan,caracteres_problematicos: {'·'},L'atracció sense fi de la Natura és una instal·lació d'art temporal que està transformant l'estadi d...,,,,,
93169753,eliminacion_catalan,caracteres_problematicos: {'·'},La nostra col·lecció de trofeus de caça de Camp consisteixen en un clàssic d'Àfrica Oriental de cinc...,,,,,
93173402,eliminacion_catalan,caracteres_problematicos: {'/'},"Allotjament a Eslovènia, Apartaments Tubej (2x 2 / 4 persones, 2x 4 / 6 max 8 persones)",,,,,
93174583,eliminacion_catalan,"caracteres_problematicos: {'“', '«', '»', '”'}",«Preparem moltes targetes i un missatge clar perquè la persona amb qui parlem s'emporti “something” ...,,,,,
93278362,eliminacion_catalan,caracteres_problematicos: {'/'},Super 8 Memphis/Airport/East és un hotel clàssic de 2 estrelles situat a 9 km de Graceland i a 7 km ...,,,,,
93285073,eliminacion_catalan,caracteres_problematicos: {'·'},Espia a iMessages _ Rastreig de Cel·lulars _ FlexiSPY,,,,,
93296250,eliminacion_catalan,"caracteres_problematicos: {'“', '/'}",A l'arxiu config.config que estava editant abans es necessita per entrar al 3 bits d'informació des ...,,,,,
93322063,eliminacion_catalan,"caracteres_problematicos: {'“', '·', '”'}","7. El 2005, Lumet va rebre un premi de l'Acadèmia per a l'assoliment de tota la vida per la seva “se...",,,,,
93337402,eliminacion_catalan,caracteres_problematicos: {'@'},Si vols que es deixin de processar les teves dades d'acord amb el que s'estipula als propòsits C-F i...,,,,,
93418761,eliminacion_catalan,caracteres_problematicos: {'©'},"Copyright © 1995-2018, Digi-Key Electronics. Tots els drets reservats.",,,,,
93472034,eliminacion_catalan,"caracteres_problematicos: {'“', '@', '·', '”'}",Tens dret a revisar les dades personals que conservem de tu. Pots sol·licitar un resum de les teves ...,,,,,
93527340,eliminacion_catalan,caracteres_problematicos: {'“'},"Feu clic al “Afegeix “opció i seleccioneu els arxius que hi ha al teu PC, que vulguis tenir com a to...",,,,,
93532759,eliminacion_catalan,"caracteres_problematicos: {'/', '*'}",febre* o sensació febril/calfreds;,,,,,
93535511,eliminacion_catalan,caracteres_problematicos: {'–'},Gundam 00: Despertar de la Trailblazer – The Dubti Només Negre a l'Univers,,,,,
93567229,eliminacion_catalan,"caracteres_problematicos: {'“', '”'}","Per acabar el joc, has de respondre a totes les preguntes. Per finalitzar el joc prematurament, pres...",,,,,
93671626,eliminacion_catalan,caracteres_problematicos: {'/'},Aquest treball es coordina amb l'equip de disseny estàtic/de canonades.,,,,,
93671702,eliminacion_catalan,caracteres_problematicos: {'/'},Costat / Selimiye - Vida Antalya - Guia de viatges d'Antalya,,,,,
93724233,eliminacion_catalan,caracteres_problematicos: {'*'},* Aquesta gràfica mostra la dinàmica del tipus de canvi mitjà Neteller USD a Payeer USD conversió du...,,,,,
93746853,eliminacion_catalan,caracteres_problematicos: {'%'},"El 2011, SC Johnson va llançar una prova pilot de recanvi de farciment concentrat amb Windex Mini, u...",,,,,
93759516,eliminacion_catalan,"caracteres_problematicos: {'»', '·'}",Conference Partner » Investigadors » Col·laboradors,,,,,
93771892,eliminacion_catalan,caracteres_problematicos: {'·'},"Instal·lacions de l'habitació : Aire condicionat, Alarm clock, Assecador, Bany, Caixa forta, Calefac...",,,,,
93877876,eliminacion_catalan,caracteres_problematicos: {'/'},"Si us plau, tingues en compte que www.ckxgirl.xxx es reserva el dret d'arrodonir pagaments a abonar ...",,,,,
