linea,tipo,razon,texto_original,porcentaje_automatico,detalles_base,detalles_avanzados,texto_catalan,texto_chino
87530516,eliminacion_catalan,caracteres_problematicos: {'/'},El Moviment dels Països No Alineats concedeix gran importància a l'assoliment de resultats concrets ...,,,,,
87595960,eliminacion_catalan,"caracteres_problematicos: {'°', '[', ']', '/'}","Consell de Drets Humans, Grup de Treball sobre l'Examen Periòdic Universal, 14° període de sessions ...",,,,,
87596022,eliminacion_catalan,"caracteres_problematicos: {'[', ']'}","Comissió de Límits de la Plataforma Continental, 30è període de sessions [paràgraf 5 de l'article 2 ...",,,,,
87600513,eliminacion_catalan,caracteres_problematicos: {'·'},Diversos dels seminaris especialitzats de capacitació es van organitzar en col·laboració amb associa...,,,,,
87610601,eliminacion_catalan,caracteres_problematicos: {'/'},VII. Reunió de dades i investigació/supervisió del Decenni,,,,,
87684430,eliminacion_catalan,caracteres_problematicos: {'·'},"A més, l'horari molt limitat dels punts d'encreuament israelians, combinat amb una infraestructura i...",,,,,
87689863,eliminacion_catalan,caracteres_problematicos: {'/'},IV.66 Com es va indicar en els incisos i) i ii) de l'apartat b) del paràgraf 15.15 del projecte de p...,,,,,
88046396,eliminacion_catalan,caracteres_problematicos: {'·'},L'organització ha contribuït en particular a un dels components de la meta 7A dels Objectius de Dese...,,,,,
88056624,eliminacion_catalan,caracteres_problematicos: {'·'},f) Demanar als col·legis d'advocats o les associacions jurídiques i altres institucions afins que co...,,,,,
88162843,eliminacion_catalan,caracteres_problematicos: {'%'},Els informes independents segueixen assenyalant que la insurgència ocasiona més del 80% de les baixe...,,,,,
88190783,eliminacion_catalan,caracteres_problematicos: {'·'},Al gener es va llançar una crida humanitària urgent per a Libèria pel qual se sol·licitaven 55 milio...,,,,,
88234604,eliminacion_catalan,"caracteres_problematicos: {'~', '%', '/'}",La contribució total dels HPMP de l'etapa I equivaldrà a una reducció de ~60 tones mètriques de CO2 ...,,,,,
88334103,eliminacion_catalan,caracteres_problematicos: {'/'},"En la seva 11a sessió, celebrada el 22 de juny, després d'una declaració del President, el Comitè Es...",,,,,
88392024,eliminacion_catalan,caracteres_problematicos: {'·'},Sol·licita al Secretari General que en el seu seixantè vuitè període de sessions li presenti un info...,,,,,
88395580,eliminacion_catalan,caracteres_problematicos: {'·'},El Comitè va prendre nota també de les al·legacions de l'autor referides a la seva detenció i tortur...,,,,,
88468646,eliminacion_catalan,caracteres_problematicos: {'%'},El nombre d'aturats va créixer de 6.510 persones al setembre de 2009 a 9.970 persones al març de 201...,,,,,
88606661,eliminacion_catalan,"caracteres_problematicos: {'[', ']'}","Entre juliol de 2009 i febrer de 2011, no es va informar al Sr Abu Haikal de les acusacions que se l...",,,,,
88675430,eliminacion_catalan,caracteres_problematicos: {'·'},"Entre aquestes organitzacions hi ha la Confederació de Dones, treballadors, joves, estudiants, comer...",,,,,
88701439,eliminacion_catalan,caracteres_problematicos: {'/'},"En la majoria dels casos, la OAI va qualificar de "" satisfactòria "" la qualitat general, així com el...",,,,,
88732858,eliminacion_catalan,caracteres_problematicos: {'%'},"En 2009 hi havia 238.184 estudiants estrangers a la Xina, procedents de 190 països i regions, la qua...",,,,,
88821707,eliminacion_catalan,"caracteres_problematicos: {'[', '—', ']', '/'}",A/C.2/67/L.9 Tema 23 a) del programa — Grups de països en situacions especials: seguiment de la Quar...,,,,,
88974028,eliminacion_catalan,caracteres_problematicos: {'/'},En el context del seu informe sobre les operacions de les Nacions Unides per al manteniment de la pa...,,,,,
89052819,eliminacion_catalan,caracteres_problematicos: {'·'},Els efectes de l'empresonament en la salut física de les dones sol ser conseqüència directa de les m...,,,,,
89099230,eliminacion_catalan,caracteres_problematicos: {'/'},e) Aprovar recursos addicionals per valor de 2.273.100 dòlars amb càrrec al compte de suport per a o...,,,,,
89139020,eliminacion_catalan,caracteres_problematicos: {'%'},"Estimació 2012-2013: 2,5%",,,,,
89207795,eliminacion_catalan,"caracteres_problematicos: {'%', '/'}",Si bé és positiu que s'hagi arribat a formular un projecte de pressupost equilibrat de la MINUSTAH p...,,,,,
89259413,eliminacion_catalan,caracteres_problematicos: {'·'},Una activitat important durant el període que s'examina va ser la instal·lació de finestres a l'edif...,,,,,
89501532,eliminacion_catalan,caracteres_problematicos: {'*'},"El Director Executiu del Centre de Dret i Política Espacial (Centre for Spatial Law and Policy), Kev...",,,,,
89549809,eliminacion_catalan,caracteres_problematicos: {'·'},"Recordant que, conformement al paràgraf 6 a) de la secció 1 de l'annex de l'Acord relatiu a l'aplica...",,,,,
89552156,eliminacion_catalan,"caracteres_problematicos: {']', '@'}",Els qui desitgin més informació poden comunicar-se amb el Sr. Jan Kantorczyk (adreça electrònica: wi...,,,,,
89566187,eliminacion_catalan,caracteres_problematicos: {'·'},"En el paràgraf 17, el Consell va reiterar la seva crida a la República Democràtica del Congo i als E...",,,,,
89574301,eliminacion_catalan,caracteres_problematicos: {'·'},Un portaveu de les Forces Armades del Sudan va al·legar que les forces del Moviment per l'Alliberame...,,,,,
89616977,eliminacion_catalan,caracteres_problematicos: {'/'},"Els operadors (exportadors) que vulguin utilitzar l'autorització general d'exportació comunitària, p...",,,,,
89632561,eliminacion_catalan,caracteres_problematicos: {'·'},La funció de la Agricultural Society consistia a facilitar les consultes entre els agricultors i els...,,,,,
89648774,eliminacion_catalan,caracteres_problematicos: {'/'},La Conferència de les Parts tal vegada desitja prendre nota de la informació facilitada en les notes...,,,,,
89705307,eliminacion_catalan,caracteres_problematicos: {'/'},"Per tant, l'informe del Secretari General sobre el dret al desenvolupament presentat a l'Assemblea d...",,,,,
89706850,eliminacion_catalan,caracteres_problematicos: {'·'},"Al principi, el seu programa se centrava en l'enviament de professionals de la salut a Baltimore per...",,,,,
89799124,eliminacion_catalan,caracteres_problematicos: {'·'},Totes les al·legacions presentades per l'autor davant el tribunal de segona instància van ser examin...,,,,,
89810240,eliminacion_catalan,caracteres_problematicos: {'/'},Havent realitzat l'examen del Senegal el 21 d'octubre de 2013 de conformitat amb totes les disposici...,,,,,
89817376,eliminacion_catalan,caracteres_problematicos: {'·'},Suport i manteniment d'una xarxa de satèl·lit consistent en 1 estació terrestre central i 5 terminal...,,,,,
89841879,eliminacion_catalan,caracteres_problematicos: {'/'},"4 heliports (per a Shangil Tobaya, Tina, Korma i Buram) inicialment proposats per a 2013/14 s'arross...",,,,,
89860047,eliminacion_catalan,caracteres_problematicos: {'·'},17. Sol·licita al Secretari General que adopti les mesures necessàries perquè es respectin plenament...,,,,,
89896088,eliminacion_catalan,caracteres_problematicos: {'/'},Tema 106 del programa: Fiscalització internacional de drogues (continuació) (A/69/111 i A/69/87-E/20...,,,,,
89904147,eliminacion_catalan,caracteres_problematicos: {'/'},"Conformement a la resolució 2104 (2013) del Consell de Seguretat, el pressupost revisat per a 2013/1...",,,,,
89907757,eliminacion_catalan,caracteres_problematicos: {'/'},El Sr. Guazo (Director de la Divisió de Comptadoria General) presenta el setè informe del Secretari ...,,,,,
89933600,eliminacion_catalan,caracteres_problematicos: {'·'},"És necessària una acció col·lectiva més seriosa, entre altres pel Consell de Seguretat, amb la final...",,,,,
90084213,eliminacion_catalan,caracteres_problematicos: {'%'},22. El fet que la proporció de nens (menors de 15 anys) pel que fa a la població total hagi disminuï...,,,,,
90089739,eliminacion_catalan,caracteres_problematicos: {'%'},"58. D'aquests 1.120 milions de dòlars, les contribucions dels governs dels països on es van executar...",,,,,
90106379,eliminacion_catalan,caracteres_problematicos: {'·'},"En la mateixa resolució, l'Assemblea General va sol·licitar al Comitè que fes un seguiment dels prog...",,,,,
90113907,eliminacion_catalan,caracteres_problematicos: {'%'},Aquest nivell de despesa és un 128% superior al de 2006 i constitueix una càrrega considerable per a...,,,,,
90169960,eliminacion_catalan,caracteres_problematicos: {'%'},33% (estimació) de llars encapçalades per dones (font: Cens de població de 2008),,,,,
90204895,eliminacion_catalan,caracteres_problematicos: {'·'},"Els terminis intermedis incloïen dates per destruir equip de producció i de mescla i càrrega, munici...",,,,,
90261743,eliminacion_catalan,caracteres_problematicos: {'‒'},"Tots els fons de la Secretaria, excepte l'ajuda que es rep del Fons per al Medi Ambient per al lloc ...",,,,,
90284397,eliminacion_catalan,caracteres_problematicos: {'%'},"En el procediment en forn horitzontal, els residus que contenen plom i concentrats de minerals es ca...",,,,,
90371331,eliminacion_catalan,"caracteres_problematicos: {'”', '“'}",La Comissió Consultiva observa la indicació que figura en el paràgraf 18 de l'exposició del Secretar...,,,,,
90388774,eliminacion_catalan,caracteres_problematicos: {'”'},La conclusió d'un instrument internacional en què es preveiessin aquestes disposicions enfortiria la...,,,,,
90392290,eliminacion_catalan,caracteres_problematicos: {'•'},"• Estabilitzar durant els dos propers anys, i després augmentar, el nombre de persones aborígens i i...",,,,,
90399868,eliminacion_catalan,"caracteres_problematicos: {'”', '“'}","De la mateixa manera, Aust va comentar en la seva recent obra sobre els tractats que de per si la se...",,,,,
90421486,eliminacion_catalan,caracteres_problematicos: {'/'},"Assenyalant el paper del sistema per a la normalització dels informes sobre despeses militars, insti...",,,,,
90430111,eliminacion_catalan,"caracteres_problematicos: {'”', '“'}",Pren nota dels principis rectors que figuren en els paràgrafs 31 i 32 del document temàtic titulat “...,,,,,
90430805,eliminacion_catalan,caracteres_problematicos: {'/'},Respecte a les principals conclusions del setè estudi quinquennal sobre la pena capital i l'aplicaci...,,,,,
90433035,eliminacion_catalan,"caracteres_problematicos: {'°', '/'}","2.2 El present butlletí deixa sense efecte al butlletí del Secretari General ST/SGB/2004/3, de 1° de...",,,,,
90469558,eliminacion_catalan,"caracteres_problematicos: {'°', '/'}",Informe del Consell d'Administració del Programa de les Nacions Unides per al Medi Ambient/Fòrum Amb...,,,,,
90499720,eliminacion_catalan,caracteres_problematicos: {'/'},"De conformitat amb l'article 22 del reglament (esmenat per la decisió 20/COP.2), es triarà a nou Vic...",,,,,
90552185,eliminacion_catalan,"caracteres_problematicos: {'”', '“', '/'}",Mwaala (Namíbia) (parla en anglès): A Namíbia li complau patrocinar el projecte de resolució A/62/L....,,,,,
90605284,eliminacion_catalan,"caracteres_problematicos: {'·', '/'}","En la seva resolució 61/111, l'Assemblea General va observar amb reconeixement que s'havia establert...",,,,,
90634747,eliminacion_catalan,"caracteres_problematicos: {'”', '“'}",La comunitat internacional també ha d'efectuar el seguiment dels compromisos per a adaptar el suport...,,,,,
90648833,eliminacion_catalan,caracteres_problematicos: {'•'},"• Conveni sobre la protecció de la maternitat, de 1919 (No 3);",,,,,
90653728,eliminacion_catalan,caracteres_problematicos: {'%'},El percentatge de bancs de països en desenvolupament en el total de bancs estrangers establerts als ...,,,,,
90710254,eliminacion_catalan,caracteres_problematicos: {'·'},El Grup d'Estats No Alineats Parts en el Tractat lamenta que no s'hagin aconseguit progressos pel qu...,,,,,
90763702,eliminacion_catalan,"caracteres_problematicos: {'”', '“'}","Fa més de 50 anys, els països que van aprovar la Declaració Universal de Drets Humans van proclamar ...",,,,,
90770564,eliminacion_catalan,caracteres_problematicos: {'/'},"El text de la resolució aprovada figura en el capítol II, secció B, decisió 2004/111.",,,,,
90776954,eliminacion_catalan,caracteres_problematicos: {'·'},3) Igual que els articles 4 a 11 sobre la responsabilitat de l'Estat per un fet internacionalment il...,,,,,
90943689,eliminacion_catalan,caracteres_problematicos: {'/'},"Aquesta variant, que es basa en el paràgraf 3 de l'article 10 de la Directiva 2000/31/CE de la Unió ...",,,,,
91005118,eliminacion_catalan,caracteres_problematicos: {'•'},• Gestió ineficaç en diferents nivells i ineficiència de les institucions nacionals pel que fa a les...,,,,,
91069055,eliminacion_catalan,"caracteres_problematicos: {'°', '/'}",L'informe del Comitè Especial encarregat d'elaborar una convenció de les Nacions Unides contra la de...,,,,,
91072423,eliminacion_catalan,caracteres_problematicos: {'/'},"Per al text de la resolució aprovada, vegeu el capítol II, secció A, resolució 2000/3.",,,,,
91128554,eliminacion_catalan,"caracteres_problematicos: {'”', '“'}","ii) Davant de “L'aplicació més efectiva”, afegeixi's “Prestar assistència, a petició dels Estats mem...",,,,,
91299941,eliminacion_catalan,caracteres_problematicos: {'/'},També observa que l'estructura proposada i la reorganització dels recursos reflecteixen la tendència...,,,,,
91322883,eliminacion_catalan,caracteres_problematicos: {'%'},"Els costos indirectes registren una disminució de 158.755 euros, però el percentatge del total dels ...",,,,,
91386989,eliminacion_catalan,"caracteres_problematicos: {'”', '“'}","Estan sorgint pràctiques promissòries com la “pressupostació popular” i les “auditories socials”, pe...",,,,,
91398793,eliminacion_catalan,caracteres_problematicos: {'/'},"El Secretari General, en el seu informe davant la nostra consideració (S/2009/277), esbossa un rumb ...",,,,,
91413577,eliminacion_catalan,"caracteres_problematicos: {'[', ']'}",[Original: anglès] [18 de març de 2009],,,,,
91458997,eliminacion_catalan,caracteres_problematicos: {'/'},"En la seva 43a sessió, el Comitè Especial va decidir recomanar que la Sisena Comissió, en el seixant...",,,,,
91491305,eliminacion_catalan,caracteres_problematicos: {'·'},"El 26 de desembre de 2000, el vaixell de ròssec de pesca Grand Prince, que enarborava el pavelló de ...",,,,,
91519818,eliminacion_catalan,caracteres_problematicos: {'•'},"Nacions Unides • Nova York, 2001",,,,,
91538857,eliminacion_catalan,caracteres_problematicos: {'/'},Des de 1983 fins a novembre de l'any passat s'han diagnosticat un total de 3.679 pacients infectats ...,,,,,
91569721,eliminacion_catalan,caracteres_problematicos: {'“'},“1. La present Convenció serà aplicable:,,,,,
91572880,eliminacion_catalan,"caracteres_problematicos: {'”', '·', '“'}","En col·laboració amb la Universitat Tècnica de Viena, el Rand Drug Policy Research Center i l'Observ...",,,,,
91635567,eliminacion_catalan,"caracteres_problematicos: {'·', '/'}",Es projecta realitzar al juliol de 2001 un curs pràctic per a avaluar la capacitació proporcionada d...,,,,,
91638037,eliminacion_catalan,caracteres_problematicos: {'·'},"Fomenten també una major autonomia local, la participació en el procés d'adopció de decisions i la r...",,,,,
91654945,eliminacion_catalan,caracteres_problematicos: {'/'},Malàisia considera que la resolució que s'acaba d'adoptar hauria de reflectir degudament els progres...,,,,,
91681935,eliminacion_catalan,caracteres_problematicos: {'/'},Si bé en el projecte de resolució A/C.1/56/L.21 s'evita utilitzar la redacció polèmica que s'usava f...,,,,,
91708469,eliminacion_catalan,caracteres_problematicos: {'·'},"Toala, la Sra. Toala i Eka van apel·lar separadament contra aquestes ordres davant la Direcció de Re...",,,,,
91708897,eliminacion_catalan,caracteres_problematicos: {'['},"[Aprovat en espanyol, francès i anglès, sent l'anglesa la versió original.",,,,,
91712069,eliminacion_catalan,"caracteres_problematicos: {'”', '“'}","Fernando de la Rúa, va destacar l'estreta relació existent entre el desenvolupament i la pau, quan v...",,,,,
91736492,eliminacion_catalan,caracteres_problematicos: {'/'},"Resolucions 50/70 D, 51/45 H, 52/38 R, 53/77 V, 53/77 S i 54/54 O.",,,,,
91766325,eliminacion_catalan,caracteres_problematicos: {'·'},"D'acord amb una altra definició, la restitució és l'establiment o restabliment de la situació que ha...",,,,,
91874901,eliminacion_catalan,"caracteres_problematicos: {'”', '“'}",El projecte de resolució es titula “Informe sobre les activitats del Fons de Desenvolupament de les ...,,,,,
91887972,eliminacion_catalan,caracteres_problematicos: {'/'},"Šimonić (Croàcia) lamenta no haver pogut patrocinar el projecte de resolució, malgrat haver-se sumat...",,,,,
91891669,eliminacion_catalan,caracteres_problematicos: {'“'},“Les autoritats iraquianes han presentat a les autoritats kuwaitianes totes les proves relacionades ...,,,,,
91925610,eliminacion_catalan,caracteres_problematicos: {'·'},"Ens preocupa el persistent reclutament il·legal de nens en zones de conflicte, molts dels quals són ...",,,,,
91949232,eliminacion_catalan,caracteres_problematicos: {'·'},La República Popular Democràtica de Corea va assenyalar els progressos que s'havien obtingut en la p...,,,,,
91969000,eliminacion_catalan,caracteres_problematicos: {'/'},"Programa provisional, anotacions, llista de documents i pla de treball (DP/2008/L.2)",,,,,
91990129,eliminacion_catalan,caracteres_problematicos: {'/'},La Subcomissió va fer seves les recomanacions del Grup de Treball Plenari sobre aquest tema (A/AC.10...,,,,,
92009565,eliminacion_catalan,caracteres_problematicos: {'/'},"Carta Africana sobre els Drets i el Benestar de l'Infant, document CAB / LEG / 24.9 / 49 de l'Organi...",,,,,
92059150,eliminacion_catalan,"caracteres_problematicos: {'”', '“'}","La Comissió Estatal d'Assumptes de la Família, la Dona i la Infància va preparar un projecte de “Lle...",,,,,
92154324,eliminacion_catalan,"caracteres_problematicos: {'”', '“'}",Amics de la Terra va informar sobre el seu projecte “Good Water Neighbors” i va formular recomanacio...,,,,,
92231479,eliminacion_catalan,"caracteres_problematicos: {'—', '/'}",La repressió jurídica del tràfic d'éssers humans ha quedat afectada per dues esmenes primordials del...,,,,,
92258680,eliminacion_catalan,"caracteres_problematicos: {'§', '·'}",Estat. § 363.03 (1992). A Massachusetts és il·legal negar-se a contractar o a acomiadar a algú de la...,,,,,
92434245,eliminacion_catalan,caracteres_problematicos: {'•'},• Augmentant la consciència als països sobre l'entorn de polítiques en pro de les estadístiques i de...,,,,,
92489667,eliminacion_catalan,"caracteres_problematicos: {'”', '“'}",Alguns contractes poden considerar-se com a “contractes de transport” per als quals no és necessari ...,,,,,
92509030,eliminacion_catalan,"caracteres_problematicos: {'”', '“'}","(Al seu parer, la paraula “conseqüències” era supèrflua.",,,,,
92572308,eliminacion_catalan,caracteres_problematicos: {'/'},"En la seva resolució 1996/12, la Subcomissió va decidir continuar estudiant el possible nomenament d...",,,,,
92671266,eliminacion_catalan,caracteres_problematicos: {'·'},Exhorta a la comunitat internacional i als Estats membres al fet que promoguin un entorn econòmic fa...,,,,,
92673070,eliminacion_catalan,caracteres_problematicos: {'·'},Profundament preocupada per la seguretat del personal de l'Organisme i pels danys causats a les seve...,,,,,
92723528,eliminacion_catalan,"caracteres_problematicos: {'”', '“'}",Observant amb reconeixement la labor de la Comissió entre els períodes de sessions de 2001 a 2003 so...,,,,,
92738092,eliminacion_catalan,"caracteres_problematicos: {'”', '“', '/'}","Respecte al paràgraf 5.26, es va indicar que podrien suprimir-se les dues primeres oracions i també ...",,,,,
92742585,eliminacion_catalan,caracteres_problematicos: {'•'},• Una exposició succinta de les recomanacions relatives a la supressió del finançament del terrorism...,,,,,
92760934,eliminacion_catalan,caracteres_problematicos: {'/'},"A més, s'havia convidat al Grup de Treball al fet que estudiés la possibilitat de regular no sols el...",,,,,
92768555,eliminacion_catalan,"caracteres_problematicos: {'”', '“'}",El Grup de concordança va proposar que el Comitè Especial considerés la possibilitat de substituir l...,,,,,
92796610,eliminacion_catalan,"caracteres_problematicos: {'”', '“'}",La Representant Especial utilitza l'expressió “legislació relativa a la seguretat” en un sentit ampl...,,,,,
92843619,eliminacion_catalan,"caracteres_problematicos: {'”', '“'}","La diferència que existeix entre tots dos règims jurídics radica en el seu fonament, ja que per al r...",,,,,
92851331,eliminacion_catalan,caracteres_problematicos: {'·'},"Als països africans i altres països en desenvolupament, on una gran proporció de la població viu en ...",,,,,
92863183,eliminacion_catalan,caracteres_problematicos: {'/'},Es comunica a l'Assemblea General que amb posterioritat s'adoptaran mesures en relació amb el projec...,,,,,
92956912,eliminacion_catalan,caracteres_problematicos: {'/'},Els adults/nens més grans s'allotgen per EUR 19.30 per persona i nit en un llit supletori.,,,,,
93095628,eliminacion_catalan,caracteres_problematicos: {'/'},L'aeroport Berlin-Tegel / Otto Lilienthal és a 15 minuts amb cotxe de la propietat.,,,,,
93107111,eliminacion_catalan,caracteres_problematicos: {'·'},"i cèl·lules. Aquesta barreja pot separar causar la inflamació,",,,,,
93111291,eliminacion_catalan,caracteres_problematicos: {'/'},Casa / Amèrica / Estats Units d'Amèrica / Washington DC,,,,,
93236336,eliminacion_catalan,caracteres_problematicos: {'@'},Si en el teu cas vols que es deixin de fer servir Cookies amb les finalitzats que es descriuen aquí ...,,,,,
93252270,eliminacion_catalan,caracteres_problematicos: {'%'},5.8750% impost a la ciutat de Nova York,,,,,
93253829,eliminacion_catalan,caracteres_problematicos: {'·'},Es pot utilitzar Alexa per controlar el termòstat intel·ligent Nest. Fotografia: Samuel Gibbs per a ...,,,,,
93276319,eliminacion_catalan,caracteres_problematicos: {'@'},Si vols que es deixin de processar les teves dades d'acord amb el que s'estipula als propòsits C-F i...,,,,,
93287024,eliminacion_catalan,caracteres_problematicos: {'·'},S'ofereixen tals instal·lacions com una caixa forta i aparcament a l'hotel.,,,,,
93296509,eliminacion_catalan,caracteres_problematicos: {'·'},S'apliquen els nostres termes de cancel·lació predeterminats,,,,,
93298797,eliminacion_catalan,caracteres_problematicos: {'·'},"Descarregar instal·lador MSI 32-bit, vx",,,,,
93318267,eliminacion_catalan,caracteres_problematicos: {'@'},Si vols que es deixin de processar les teves dades d'acord amb el que s'estipula als propòsits C-F i...,,,,,
93321215,eliminacion_catalan,"caracteres_problematicos: {'$', '*'}",Transferiu diners en línia a qualsevol MasterCard o compte bancari regular* a Finlàndia per només $2,,,,,
93324367,eliminacion_catalan,caracteres_problematicos: {'–'},Blue Ocean Estudios – Veure el tema – phpMyAdmin entorn,,,,,
93341861,eliminacion_catalan,caracteres_problematicos: {'–'},"La Fundació Zinsou, amb el suport de Christian Langlois-Meurinne i de l'IDI, llança l'aplicació WAKP...",,,,,
93396344,eliminacion_catalan,"caracteres_problematicos: {'$', '/'}",Afegir dies per no bussejadors (sense programa): $135.00/persona,,,,,
93428821,eliminacion_catalan,caracteres_problematicos: {'·'},"Aquest establiment superior compta amb una llar de foc, servei de planxa, una taula de treball, un m...",,,,,
93434781,eliminacion_catalan,caracteres_problematicos: {'·'},Vil·les a Ginebra (3),,,,,
93471956,eliminacion_catalan,caracteres_problematicos: {'·'},Foodies trobar restaurants de tot el complex que fixaran les seves papil·les gustatives filat.,,,,,
93494773,eliminacion_catalan,caracteres_problematicos: {'/'},Vídeo de ciclisme indoor / Ajuda car més probable de la història. la primera 04 02,,,,,
93496007,eliminacion_catalan,caracteres_problematicos: {'+'},HungaryInstantBooking Camp de golf: Hungary Instant Booking Pàgina principal _ Suport _ Suggerir un ...,,,,,
93528124,eliminacion_catalan,caracteres_problematicos: {'·'},Aquesta és una versió amigable per a Mac de la plataforma Metatrader4 molt popular. Aquesta versió d...,,,,,
93563747,eliminacion_catalan,caracteres_problematicos: {'·'},El seu motor de reserves és totalment personalitzable i personalitzat per al seu lloc web. Fins i to...,,,,,
93636338,eliminacion_catalan,caracteres_problematicos: {'·'},"El Milton Bed And Breakfast té minibar, TV per cable amb pel·lícules a la carta, TV de pagament, cai...",,,,,
93648593,eliminacion_catalan,"caracteres_problematicos: {'°', '/'}","Val la pena recordar,l'estació també està accessible en la posició 13° E (transponder núm. 121 a una...",,,,,
93743270,eliminacion_catalan,caracteres_problematicos: {'°'},Les càmeres de xarxa ull de peix V6050 de Verint amb resolució de 5 megapíxels i vista panoràmica de...,,,,,
93776973,eliminacion_catalan,caracteres_problematicos: {'·'},Com publiques a Instagram? Passos ràpids per a una publicació excel·lent,,,,,
93782926,eliminacion_catalan,caracteres_problematicos: {'©'},"Drets d'autor © Dades Recuperació programari, Tots els drets reservats - Totes les altres marques re...",,,,,
