linea,tipo,razon,texto_original,porcentaje_automatico,detalles_base,detalles_avanzados,texto_catalan,texto_chino
87731576,eliminacion_catalan,caracteres_problematicos: {'/'},Sra. Cabello de Daboin (República Bolivariana de Veneçuela): La delegació de la República Bolivarian...,,,,,
87798268,eliminacion_catalan,caracteres_problematicos: {'/'},"121. Després de recordar les deliberacions mantingudes en l'últim període de sessions (A/CN.9/716, p...",,,,,
87809805,eliminacion_catalan,caracteres_problematicos: {'·'},"21. Aquestes dues persones van anar voluntàriament a l'oficina de la Fiscalia de Tòquio, van present...",,,,,
88013304,eliminacion_catalan,caracteres_problematicos: {'/'},"El Consell va demanar als fons i programes que, per conducte de les seves juntes executives, inclogu...",,,,,
88016101,eliminacion_catalan,"caracteres_problematicos: {'/', '%'}","L'any 1998, quan inicia la Revolució Bolivariana, el nombre d'escoles tècniques al país ascendia a 1...",,,,,
88058759,eliminacion_catalan,caracteres_problematicos: {'·'},e) Col·laborar en activitats de recerca i desenvolupament per crear sistemes que no produeixin deixa...,,,,,
88081946,eliminacion_catalan,caracteres_problematicos: {'·'},"Finalment, tres Parts, que són Estats membres de la Unió Europea, van transferir 18.982 URE als comp...",,,,,
88099727,eliminacion_catalan,"caracteres_problematicos: {']', '['}",La Junta va recomanar que ONU-Hàbitat considerés opcions per reduir al mínim el procés manual necess...,,,,,
88116939,eliminacion_catalan,caracteres_problematicos: {'·'},"De conformitat amb el procediment acordat, al març de 2008 el Secretari General va nomenar un grup a...",,,,,
88123083,eliminacion_catalan,"caracteres_problematicos: {'/', '–', ']', '['}","A/66/366–S/2011/584 Temes 35, 39 i 67 del programa – Els conflictes prolongats en la zona del Grup G...",,,,,
88128226,eliminacion_catalan,"caracteres_problematicos: {'/', '“', '”'}","Consultes oficioses oficioses sobre el projecte de resolució A/C.2/66/L.45, titulat “Informe del Con...",,,,,
88132673,eliminacion_catalan,caracteres_problematicos: {'/'},(resolució 66/222) Aprovat,,,,,
88324953,eliminacion_catalan,caracteres_problematicos: {'·'},"Al novembre de 2011, la Junta d'Estabilitat Financera, en col·laboració amb el Comitè de Basilea, va...",,,,,
88331836,eliminacion_catalan,caracteres_problematicos: {'/'},Observant que l'informe de l'Alta Comissionada de les Nacions Unides per als Drets Humans sobre l'en...,,,,,
88343209,eliminacion_catalan,caracteres_problematicos: {'/'},La present secció es pot llegir conjuntament amb l'informe anterior del Secretari General relatiu a ...,,,,,
88354760,eliminacion_catalan,caracteres_problematicos: {'·'},"El programa d'acció mundial ofereix una estratègia per a la participació dels governs, el sector pri...",,,,,
88380521,eliminacion_catalan,"caracteres_problematicos: {'°', '/'}","i En la seva desena sessió, celebrada el 26 d'abril de 2012, el Consell va triar als 15 Estats Membr...",,,,,
88384463,eliminacion_catalan,caracteres_problematicos: {'·'},El 21 de febrer de 2008 el Tribunal d'Apel·lació encarregat de les qüestions relatives a la migració...,,,,,
88399875,eliminacion_catalan,caracteres_problematicos: {'/'},Comunicació núm. 444/2010: Abdussamatov i altres c. Kazakhstan,,,,,
88528230,eliminacion_catalan,caracteres_problematicos: {'/'},17/14. El dret de tota persona a gaudir del més alt nivell possible de salut física i mental en el c...,,,,,
88549761,eliminacion_catalan,caracteres_problematicos: {'/'},"39. Singapur va prendre nota dels esforços realitzats per Algèria per a aconseguir els ODM, i en par...",,,,,
88810579,eliminacion_catalan,caracteres_problematicos: {'·'},"La reunió especial va concloure amb les observacions formulades pel Sr. Raymond Wolfe, Representant ...",,,,,
88878093,eliminacion_catalan,caracteres_problematicos: {'·'},"En coordinació amb els Estats de la regió, especialment el Iemen, les Forces Marítimes Combinades ha...",,,,,
88895778,eliminacion_catalan,caracteres_problematicos: {'·'},"20. Sol·licita als Estats, a l'Oficina de les Nacions Unides contra la Droga i el Delicte i a les or...",,,,,
88948799,eliminacion_catalan,caracteres_problematicos: {'/'},6. Decisions adoptades sobre la base dels informes de la Cinquena Comisión67/551. Règim comú de les ...,,,,,
88954704,eliminacion_catalan,caracteres_problematicos: {'/'},"Per executar el pla descrit, en 2013/14 la missió necessitarà 28 llocs i places nous (3 internaciona...",,,,,
88980906,eliminacion_catalan,"caracteres_problematicos: {'/', '·'}","La Comissió també sol·licita que es proporcioni a l'Assemblea General, quan examini les propostes de...",,,,,
88983483,eliminacion_catalan,caracteres_problematicos: {'·'},"A partir de juny de 1994, les Forces Col·lectives de Manteniment de la Pau de la Comunitat d'Estats ...",,,,,
88989721,eliminacion_catalan,caracteres_problematicos: {'·'},"A la llum de l'aquí exposat, ho insto que adopti totes les mesures necessàries que tingui a la seva ...",,,,,
89137580,eliminacion_catalan,caracteres_problematicos: {'·'},"Atenent a les sol·licituds dels Estats membres, es presta assistència tècnica en forma de: a) servei...",,,,,
89145633,eliminacion_catalan,"caracteres_problematicos: {'%', '·'}",2010-2011: 80% dels comentaris indiquen un acompliment de bo a excel·lent,,,,,
89155360,eliminacion_catalan,caracteres_problematicos: {'·'},"I.85 També es va informar la Comissió Consultiva que, si bé el compliment d'aquestes normes no seria...",,,,,
89315748,eliminacion_catalan,caracteres_problematicos: {'/'},68/19 Informes financers i estats financers comprovats i informes de la Junta d'Auditors,,,,,
89322462,eliminacion_catalan,caracteres_problematicos: {'·'},Entre aquests criteris estarien el tipus d'informació requerida (si es referia a la recerca o a l'en...,,,,,
89487222,eliminacion_catalan,caracteres_problematicos: {'·'},"a) Intensifiquin amb urgència les seves activitats, en col·laboració amb tots els interessats, per a...",,,,,
89532852,eliminacion_catalan,caracteres_problematicos: {'·'},"A més, les Parts van indicar que hi havia hagut demores en la recepció dels fons sol·licitats.",,,,,
89557031,eliminacion_catalan,"caracteres_problematicos: {'/', ']', '['}",Aplicació i seguiment integrats i coordinats dels resultats de les grans conferències i cims de les ...,,,,,
89641670,eliminacion_catalan,caracteres_problematicos: {'/'},"En el cas dels polvoritzadors muntats en tractors, es va prendre una taxa de treball de 10 ha/dia i ...",,,,,
89646368,eliminacion_catalan,caracteres_problematicos: {'·'},"No obstant això, en la seva 49a reunió, el Comitè havia sol·licitat que la informació del present in...",,,,,
89646512,eliminacion_catalan,"caracteres_problematicos: {'/', '·'}","Recordant també la recomanació 48/9, en la qual s'havia sol·licitat a Moçambic que presentés informa...",,,,,
89647253,eliminacion_catalan,caracteres_problematicos: {'+'},La Dependència Comuna d'Inspecció del sistema de les Nacions Unides va emprendre l'examen de la gove...,,,,,
89650515,eliminacion_catalan,caracteres_problematicos: {'/'},UNEP/POPS/COP.6/32 Projecte de memoràndum d'entesa entre el Programa de les Nacions Unides per al Me...,,,,,
89734754,eliminacion_catalan,caracteres_problematicos: {'·'},"L'Oficina d'Administració de Justícia, en col·laboració amb l'Oficina de Tecnologia de la Informació...",,,,,
89816588,eliminacion_catalan,caracteres_problematicos: {'·'},Totes les sol·licituds d'existències per al desplegament estratègic es van emetre i enviar en un ter...,,,,,
89887998,eliminacion_catalan,caracteres_problematicos: {'%'},42. La diversitat geogràfica de l'Oficina ha vingut millorant a pas ferm des de la introducció de me...,,,,,
89920166,eliminacion_catalan,caracteres_problematicos: {'·'},63. El Grup de Treball va advertir que l'article 110 es basava en la recomanació 247 del Suplement r...,,,,,
90057113,eliminacion_catalan,caracteres_problematicos: {'%'},En comparar la remuneració mitjana en tot el mercat laboral en 2012 es va posar de manifest que les ...,,,,,
90072849,eliminacion_catalan,caracteres_problematicos: {'·'},245. En són exemples notables l'execució del projecte Ciutats Accessibles i Drets Humans (Projeto Ci...,,,,,
90085394,eliminacion_catalan,caracteres_problematicos: {'·'},"46. Han d'emprendre's, potenciar-se i secundar-se iniciatives de caràcter bilateral, multilateral i ...",,,,,
90104264,eliminacion_catalan,caracteres_problematicos: {'·'},"Recordant que, en el seu informe corresponent a 2011, la Junta Internacional de Fiscalització d'Estu...",,,,,
90125862,eliminacion_catalan,"caracteres_problematicos: {'+', '·'}","6. Durant la reunió paral·lela de les ONG sobre l'educació mediambiental de Rio+20, celebrada del 13...",,,,,
90161090,eliminacion_catalan,"caracteres_problematicos: {'/', '*'}",Decisió 15/CP.19*,,,,,
90188477,eliminacion_catalan,caracteres_problematicos: {'/'},"a) Promoció i protecció dels drets de l'infant (A/69/165, A/69/166, A/69/212, A/69/260, A/69/262, A/...",,,,,
90216133,eliminacion_catalan,caracteres_problematicos: {'/'},74. Carta de data 5 d'octubre de 2003 dirigida al President del Consell de Seguretat pel Representan...,,,,,
90226763,eliminacion_catalan,caracteres_problematicos: {'·'},La FPNUL va recomanar que les Forces de Defensa d'Israel portessin a terme un examen de totes les in...,,,,,
90323158,eliminacion_catalan,caracteres_problematicos: {'—'},"La seva reafirmació d'aquesta històrica resolució, aprovada, com saben els membres, fa cinc anys, de...",,,,,
90405312,eliminacion_catalan,caracteres_problematicos: {'/'},"Ibíd., 2000, Suplement núm. 2 i correcció (E/2000/22 i Corr. 1), annex V, par. 4.",,,,,
90438653,eliminacion_catalan,"caracteres_problematicos: {'“', '”'}",Una de les llumeneres del grup Units pel consens també va afirmar que la proposta de la Unió African...,,,,,
90486278,eliminacion_catalan,caracteres_problematicos: {'/'},2005/223 Documents examinats pel Consell Econòmic i Social en relació amb la qüestió de l'assistènci...,,,,,
90488660,eliminacion_catalan,caracteres_problematicos: {'·'},"Mentre parlem aquí, es continuen destruint més habitatges, fàbriques, infraestructura pública i terr...",,,,,
90495225,eliminacion_catalan,"caracteres_problematicos: {'“', '”'}","Tret que s'indiqui una altra cosa, amb el terme “dòlars” es fa referència als dòlars dels Estats Uni...",,,,,
90561198,eliminacion_catalan,caracteres_problematicos: {'·'},També es va assenyalar que l'informe abordava els principals problemes al fet que havia de fer front...,,,,,
90562354,eliminacion_catalan,caracteres_problematicos: {'·'},Austràlia s'enorgulleix de presidir aquest important seminari conjuntament amb els nostres col·legue...,,,,,
90564105,eliminacion_catalan,caracteres_problematicos: {'·'},"L'UNICEF aplica en la programació enfocaments basats en els drets humans, i col·labora amb la UNESCO...",,,,,
90589864,eliminacion_catalan,caracteres_problematicos: {'/'},Informe anual de la Directora Executiva del Fons de les Nacions Unides per a la Infància (resolucion...,,,,,
90598333,eliminacion_catalan,"caracteres_problematicos: {'“', '”'}","10 Lord Denning en Goodman v. Eban Q.B.D. 550 at 56: “En l'ús anglès modern, quan es requereix que u...",,,,,
90613194,eliminacion_catalan,caracteres_problematicos: {'·'},"Per a concloure, voldríem encoratjar al Ministre Nqakula, en la seva condició de Facilitador, al fet...",,,,,
90619788,eliminacion_catalan,"caracteres_problematicos: {'%', '—'}","El Desafiament de Micronèsia —un compromís liderat per la República de Palau, els Estats Federats de...",,,,,
90635579,eliminacion_catalan,caracteres_problematicos: {'·'},"L'objectiu primordial d'aquest mandat, que es va establir amb l'aprovació del Conjunt de Principis i...",,,,,
90637440,eliminacion_catalan,caracteres_problematicos: {'/'},Les prescripcions d'aquest capítol són aplicables als embalatges/envasos destinats al transport de s...,,,,,
90710429,eliminacion_catalan,caracteres_problematicos: {'·'},"Finalment, el Relator Especial formula algunes recomanacions al Fòrum mundial sobre la migració i el...",,,,,
90720531,eliminacion_catalan,caracteres_problematicos: {'·'},"La Unió Europea està desenvolupant una col·laboració activa, valuosa i eficaç en la lluita contra el...",,,,,
90731740,eliminacion_catalan,caracteres_problematicos: {'/'},"173, projecte de resolució VIII).Després de ser aprovat el projecte de resolució, el representant de...",,,,,
90803157,eliminacion_catalan,"caracteres_problematicos: {'“', '”'}",Publicat en el “Diari Oficial de la Unió” el 16 de novembre de 2001.,,,,,
90812549,eliminacion_catalan,caracteres_problematicos: {'·'},Ajudar els pobles indígenes a estudiar possibles disposicions legislatives sui generis per protegir ...,,,,,
90814492,eliminacion_catalan,caracteres_problematicos: {'/'},Subscriu les conclusions i recomanacions acordades que el Grup de Treball sobre el Dret al Desenvolu...,,,,,
90837518,eliminacion_catalan,caracteres_problematicos: {'·'},"En les sessions 693a i 696a, celebrades els dies 29 i 30 de març, el President va informar la Subcom...",,,,,
90843503,eliminacion_catalan,caracteres_problematicos: {'·'},"Com ja es va indicar en el nostre anterior informe al Comitè contra el Terrorisme, de 29 de maig de ...",,,,,
90861128,eliminacion_catalan,caracteres_problematicos: {'%'},"El demandant tindrà dret a demanar el pagament d'interès per concepte de la indemnització, el qual e...",,,,,
90936182,eliminacion_catalan,caracteres_problematicos: {'/'},"A causa d'aquest error administratiu i de càlcul, el Grup va recomanar una indemnització de 55.657 d...",,,,,
90968971,eliminacion_catalan,"caracteres_problematicos: {'“', '”'}","El 6 de maig del 2004, el President George W. Bush va aprovar íntegrament l'Informe de l'anomenada “...",,,,,
90987022,eliminacion_catalan,"caracteres_problematicos: {'“', '”'}",S'estan realitzant activitats per a evitar la “feminització de la pobresa” a Geòrgia.,,,,,
90993415,eliminacion_catalan,caracteres_problematicos: {'·'},"Segons les primeres conclusions d'aquest estudi, cal comptar amb un sistema de drets de propietat in...",,,,,
91057060,eliminacion_catalan,caracteres_problematicos: {'/'},El Comitè acull amb beneplàcit la presentació de l'informe inicial de l'Estat Part i pren nota de le...,,,,,
91097090,eliminacion_catalan,"caracteres_problematicos: {'“', '”'}","A més, el criteri adoptat pel Relator Especial pel que fa als “actes unilaterals” defineix el tema e...",,,,,
91142802,eliminacion_catalan,"caracteres_problematicos: {'“', ']', '”', '['}",També es va suggerir que s'utilitzessin paraules com les següents: “qualsevol forma de comunicació q...,,,,,
91290118,eliminacion_catalan,caracteres_problematicos: {'“'},"“Pel que fa al procediment d'acord mutu en general, el Comitè va recomanar el següent:",,,,,
91306824,eliminacion_catalan,"caracteres_problematicos: {'·', '•'}",• Encoratjarà als grups d'Estats que afrontin problemes similars en la presentació d'informes o l'ap...,,,,,
91320500,eliminacion_catalan,caracteres_problematicos: {'·'},Els recursos addicionals que se sol·liciten per a tecnologia de la informació obeeixen a la necessit...,,,,,
91324875,eliminacion_catalan,"caracteres_problematicos: {'“', '”'}",Això exigirà formular minuciosament diversos criteris de mesurament dels resultats i dels processos ...,,,,,
91441114,eliminacion_catalan,caracteres_problematicos: {'·'},Preocupa al Comitè l'antiga pràctica consistent a col·locar als nens romanís en escoles especials re...,,,,,
91445916,eliminacion_catalan,caracteres_problematicos: {'/'},"En la mateixa sessió plenària, la Reunió de les Altes Parts Contractants va adoptar el seu informe, ...",,,,,
91471789,eliminacion_catalan,"caracteres_problematicos: {'“', '”'}",Per “portador” s'entendrà la persona que celebri un contracte de transport amb un carregador.,,,,,
91472892,eliminacion_catalan,caracteres_problematicos: {'·'},"Encara que el deute il·legítim continua sent una qüestió controvertida, pocs posen en dubte els crit...",,,,,
91506762,eliminacion_catalan,"caracteres_problematicos: {']', '['}",Després de l'examen previst en l'article 8 i de la resolució de les qüestions d'aplicació relatives ...,,,,,
91558226,eliminacion_catalan,caracteres_problematicos: {'/'},"11/96 i 75/99 del Butlletí Oficial) no regula de manera directa la repressió del terrorisme i, per t...",,,,,
91664842,eliminacion_catalan,caracteres_problematicos: {'%'},No es disposa de xifres que puguin indicar quin percentatge de la mà d'obra té més d'un treball a te...,,,,,
91675561,eliminacion_catalan,"caracteres_problematicos: {'“', '”'}",e) Per “Oficina de Sanitat Animal” s'entendrà l'oficina en el si de la Divisió encarregada de contro...,,,,,
91714228,eliminacion_catalan,"caracteres_problematicos: {'“', '”'}","El Sr. WIWEN-NILSSON (Observador de Suècia) diu que, en proposar una esmena en la sessió precedent e...",,,,,
91736705,eliminacion_catalan,caracteres_problematicos: {'/'},Queda aprovat el projecte de resolució A/C.5/55/L.82.,,,,,
91827038,eliminacion_catalan,"caracteres_problematicos: {']', '['}",[30 de maig de 2001] [Original: anglès],,,,,
91885007,eliminacion_catalan,caracteres_problematicos: {'·'},La Comissió Consultiva observa que l'augment de les necessitats relacionades amb el personal de cont...,,,,,
91892848,eliminacion_catalan,caracteres_problematicos: {'/'},Queda aprovat el projecte de resolució V (resolució 56/129).,,,,,
91908195,eliminacion_catalan,"caracteres_problematicos: {'“', '”', '/'}",La Comissió va tenir davant sí un document titulat “Projecte del marc estratègic per al període 2010...,,,,,
91928567,eliminacion_catalan,caracteres_problematicos: {'/'},"b) Que durant el 47o període de sessions de la Subcomissió, el Grup de Treball, en ocupar-se de l'es...",,,,,
91932041,eliminacion_catalan,"caracteres_problematicos: {']', '['}",4) Després de la profunda modificació dels projectes d'article relatius a l'acceptació i l'objecció ...,,,,,
91998425,eliminacion_catalan,"caracteres_problematicos: {'/', '*'}","Comunicació Núm. 1426/2005, Dingiri Banda c. Sri Lanka* (Dictamen aprovat el 26 d'octubre de 2007, 9...",,,,,
92064343,eliminacion_catalan,caracteres_problematicos: {'•'},• La segona situació es refereix als assumptes que sí que afecten l'opinió dels auditors.,,,,,
92086015,eliminacion_catalan,"caracteres_problematicos: {'“', '”'}","Per exemple, s'ha suggerit que en el concepte de “trasllat per força” poden incloure's, entre altres...",,,,,
92111033,eliminacion_catalan,caracteres_problematicos: {'·'},La designació de les aigües meridionals de Sud-àfrica com a zona especial conforme a l'annex I també...,,,,,
92114706,eliminacion_catalan,"caracteres_problematicos: {'/', '“', '”'}",A/C.1/63/L.21 - Projecte de resolució titulat “Observancia de las normas ambientales en la elaboraci...,,,,,
92128199,eliminacion_catalan,"caracteres_problematicos: {'“', '”', '/'}","En la 253a sessió plenària del Comitè Especial, celebrada el 27 de febrer de 2008, el representant d...",,,,,
92141718,eliminacion_catalan,caracteres_problematicos: {'·'},"Insta novament als òrgans intergovernamentals a no escatimar esforços, en l'etapa de planificació, p...",,,,,
92217315,eliminacion_catalan,"caracteres_problematicos: {'“', '”'}","Un orador va dir que, de no ser així, l'etiqueta de “ingressos mitjans” amb què es qualificava als p...",,,,,
92234642,eliminacion_catalan,"caracteres_problematicos: {'“', '•', '”'}","• Subprograma 4, Comerç i inversió, “Indicadors de progrés a) ii)”: suprimeixin-se les paraules que ...",,,,,
92311110,eliminacion_catalan,"caracteres_problematicos: {'“', '”'}","Pel que fa al compromís 3, titulat “Foment de la capacitat dels recursos humans i de les institucion...",,,,,
92331926,eliminacion_catalan,caracteres_problematicos: {'/'},L'estructura de l'informe es basa en l'orientació impartida per la Conferència de les Parts en la se...,,,,,
92335679,eliminacion_catalan,caracteres_problematicos: {'•'},"• A més dels tribunals, altres institucions s'encarreguen de la supervisió dels drets humans a Finlà...",,,,,
92373828,eliminacion_catalan,caracteres_problematicos: {'/'},"Decideix examinar, en la continuació del seu cinquantè vuitè període de sessions, els llocs existent...",,,,,
92423828,eliminacion_catalan,"caracteres_problematicos: {']', '['}","En la seva resposta a la notificació feta conformement a l'article 34, el reclamant va manifestar qu...",,,,,
92439850,eliminacion_catalan,caracteres_problematicos: {'/'},El Grup de Treball tornarà a tenir a la vista la nota de la Secretaria esmentada en el paràgraf 5 (A...,,,,,
92458350,eliminacion_catalan,caracteres_problematicos: {'%'},"En 2000, el producte intern brut (PIB) va disminuir fins a arribar a un 2,8%, i es van registrar des...",,,,,
92499710,eliminacion_catalan,caracteres_problematicos: {'·'},Una resolució aprovada pel Consell sobre aquest tema hauria d'instar a tots els interessats a prendr...,,,,,
92512972,eliminacion_catalan,caracteres_problematicos: {'•'},• Interrogatori als passatgers;,,,,,
92582682,eliminacion_catalan,caracteres_problematicos: {'/'},"Els membres recordaran a més que l'Assemblea General, en la seva resolució 56/12 del 28 de novembre ...",,,,,
92668962,eliminacion_catalan,caracteres_problematicos: {'·'},"Existeixen lleis o procediments que prohibeixin donar asil als terroristes, per exemple, lleis que t...",,,,,
92679407,eliminacion_catalan,caracteres_problematicos: {'/'},Presentació del projecte de resolució A/C.2/58/L.12,,,,,
92691110,eliminacion_catalan,"caracteres_problematicos: {'“', '”'}",Es va expressar així mateix l'opinió que la clonació amb finalitats “terapèutics” o “experimentals” ...,,,,,
92720361,eliminacion_catalan,"caracteres_problematicos: {'“', '”'}",Això permetrà que els participants en el mercat puguin atorgar crèdit en funció de les seves “posici...,,,,,
92763728,eliminacion_catalan,caracteres_problematicos: {'/'},"En la seva desena sessió plenària, celebrada el 7 de febrer, el Consell/Fòrum va aprovar el projecte...",,,,,
92764106,eliminacion_catalan,caracteres_problematicos: {'/'},Pren nota amb satisfacció de l'informe del Director Executiu sobre el préstec amb càrrec a la reserv...,,,,,
92766620,eliminacion_catalan,caracteres_problematicos: {'/'},"Informe final presentat per J. Oloka-Onyango i Deepika Udagama, de conformitat amb la decisió 2000/1...",,,,,
92769274,eliminacion_catalan,"caracteres_problematicos: {'“', '”'}",La nova Llei concedeix el dret de plena ciutadania britànica a tots els habitants dels territoris d'...,,,,,
92806248,eliminacion_catalan,"caracteres_problematicos: {'“', '·', '”'}","Dissertació sobre “La biodiversitat, la salut humana i els objectius de desenvolupament del Mil·lenn...",,,,,
92851063,eliminacion_catalan,caracteres_problematicos: {'/'},"Va contribuir decisivament a l'informe (WT/GC/62-G/AG/13), publicat el 28 de juny de 2002, i va prop...",,,,,
92932997,eliminacion_catalan,caracteres_problematicos: {'€'},"€ 10,00 per a nens de fins a 8 anys",,,,,
93081888,eliminacion_catalan,"caracteres_problematicos: {'»', '«'}","Va dir: «No! Llenceu vosaltres!» I vet aquí que li va semblar que, per efecte de la seva màgia, les ...",,,,,
93101099,eliminacion_catalan,caracteres_problematicos: {'/'},"El Motel 6 Ashland, Oh és a 70 minuts amb cotxe de l'aeroport regional d'Akron/Canton.",,,,,
93112789,eliminacion_catalan,caracteres_problematicos: {'/'},La velocitat màxima als carrers principals de la ciutat és a 40 km / h,,,,,
93201895,eliminacion_catalan,caracteres_problematicos: {'@'},Si en el teu cas vols que es deixin de fer servir Cookies amb les finalitzats que es descriuen aquí ...,,,,,
93238659,eliminacion_catalan,caracteres_problematicos: {'@'},Si en el teu cas vols que es deixin de fer servir Cookies amb les finalitzats que es descriuen aquí ...,,,,,
93265510,eliminacion_catalan,caracteres_problematicos: {'#'},Esperem haver respost a la seva pregunta el #8217; Què és Avakin Life!,,,,,
93290435,eliminacion_catalan,caracteres_problematicos: {'·'},Història anterior OpenPLi 4.0 wetekplay beta 20160225 instal·lar de sdcard,,,,,
93315838,eliminacion_catalan,caracteres_problematicos: {'>'},Ruta: Datasheet PDF > Enllaç directe > 8326,,,,,
93388057,eliminacion_catalan,caracteres_problematicos: {'@'},Si vols que es deixin de processar les teves dades d'acord amb el que s'estipula als propòsits C-F i...,,,,,
93631535,eliminacion_catalan,"caracteres_problematicos: {'/', '%', '$'}",Entrar a l'espectacle 100% exclusiu ($2.57 / Min),,,,,
93678308,eliminacion_catalan,"caracteres_problematicos: {'+', '–'}","+ Custom RGB – Ús ""RGB"" per afinar el filtre Natural de lectura de nit de llum.""R"" - vermell,""G"" - v...",,,,,
93694784,eliminacion_catalan,caracteres_problematicos: {'/'},KickSoccerCoin integra característiques inspirades en la tecnologia pionera de consens de comptabili...,,,,,
93734660,eliminacion_catalan,"caracteres_problematicos: {'/', '<', '>'}","Motorsport TV d'alta definició, Motorsport SD TV va aparèixer en 12533 El 44.950 / DVB-S2, OTKP<unk>...",,,,,
93743441,eliminacion_catalan,caracteres_problematicos: {'/'},Alguns exchanges proporcionen trading pairs addicionals a més de NRG / BTC.,,,,,
93934956,eliminacion_catalan,"caracteres_problematicos: {'·', '*'}","Sí, Sonix transcriu automàticament àudio arxius amb una. Extensió d'arxiu MPGA. Sonix és un converti...",,,,,
