linea,tipo,razon,texto_original,porcentaje_automatico,detalles_base,detalles_avanzados,texto_catalan,texto_chino
86610452,eliminacion_catalan,caracteres_problematicos: {'/'},"Entre ells cal assenyalar el doble assassinat de Parteix/Parteix, casos en què es van produir ferits...",,,,,
86611610,eliminacion_catalan,caracteres_problematicos: {'/'},La UNMIT va redoblar els seus esforços per prevenir i investigar les faltes de conducta en aplicació...,,,,,
86668840,eliminacion_catalan,caracteres_problematicos: {'/'},"10 El paràgraf 6 de la decisió XX/7 de la vintena Reunió de les Parts assenyala específicament que ""...",,,,,
86674867,eliminacion_catalan,caracteres_problematicos: {'/'},"La llista d'òrgans i organismes nacionals i internacionals, governamentals i no governamentals que f...",,,,,
86681540,eliminacion_catalan,caracteres_problematicos: {'·'},a) Considerar la pròrroga del mandat dels magistrats permanents del Tribunal Internacional que són m...,,,,,
86709599,eliminacion_catalan,caracteres_problematicos: {'·'},"Pel que fa a la plaça de Director d'Operacions i Administració, la complexitat de les condicions en ...",,,,,
86991239,eliminacion_catalan,caracteres_problematicos: {'·'},"19. L'orador recomana, entre altres coses, que es posi immediatament en marxa un procés de descoloni...",,,,,
87057913,eliminacion_catalan,caracteres_problematicos: {'·'},"A més, amb la finalitat d'assegurar l'aplicació judicial dels instruments internacionals ratificats,...",,,,,
87125411,eliminacion_catalan,caracteres_problematicos: {'·'},Aquests principis han permès disposar d'un programa de treball efectiu fins ara -- que incorpora coh...,,,,,
87126670,eliminacion_catalan,caracteres_problematicos: {'·'},135. Destaca la importància de l'existència d'un marc sòlid de gestió del projecte per al pla estrat...,,,,,
87131323,eliminacion_catalan,caracteres_problematicos: {'/'},La Secretaria va demanar a tots els Estats part en la Convenció contra la Corrupció i als Estats sig...,,,,,
87163805,eliminacion_catalan,caracteres_problematicos: {'$'},Durant el 2005 va invertir la suma de $700.000 en el programa de violència. (Font: Comitè d'Expertes...,,,,,
87230194,eliminacion_catalan,caracteres_problematicos: {'°'},El 33° període de sessions de la CEPAL es va celebrar a Brasília els dies 30 de maig a 1 de juny de ...,,,,,
87266224,eliminacion_catalan,caracteres_problematicos: {'%'},"En 2006 hi havia 75 institucions extraescolars, en les quals participaven 48.396 persones, és a dir,...",,,,,
87302158,eliminacion_catalan,caracteres_problematicos: {'·'},La secretaria del Consorci PARÍS 21 centra la seva labor a ajudar els països en desenvolupament a fo...,,,,,
87305444,eliminacion_catalan,caracteres_problematicos: {'·'},Les recerques sobre la reducció de la pobresa fetes per l'Institut van ser represes en diversos proc...,,,,,
87306277,eliminacion_catalan,"caracteres_problematicos: {'/', '%'}","Es calcula que a l'Àfrica subsahariana, prop del 52% de les morts de dones en edat reproductiva es d...",,,,,
87322289,eliminacion_catalan,caracteres_problematicos: {'['},"d) [Ajudar a promoure iniciatives públiques i privades de recerca i desenvolupament, foment de la ca...",,,,,
87375266,eliminacion_catalan,caracteres_problematicos: {'·'},"Quant a la lluita contra el tràfic il·lícit de materials nuclears, el Centre Comú de Recerca dóna su...",,,,,
87437427,eliminacion_catalan,"caracteres_problematicos: {'/', '·'}",Va continuar la seva estreta col·laboració amb les organitzacions de dins i fora del sistema de les ...,,,,,
87498348,eliminacion_catalan,caracteres_problematicos: {'/'},Les observacions de la Comissió Consultiva sobre la informació relativa a determinats objectes de de...,,,,,
87518155,eliminacion_catalan,caracteres_problematicos: {'·'},"Els Ministres van fer una crida a tots els organismes, agències, fons i programes pertinents de les ...",,,,,
87665173,eliminacion_catalan,caracteres_problematicos: {'·'},"Subprograma 1. Lluita contra la delinqüència transnacional organitzada i el tràfic il·lícit, inclòs ...",,,,,
87759637,eliminacion_catalan,caracteres_problematicos: {'/'},74. La Presidenta diu que entén que la Comissió desitja prescindir de la regla de les 24 hores que f...,,,,,
87851526,eliminacion_catalan,"caracteres_problematicos: {'/', '·'}","33. En la seva resolució 15/22, el Consell de Drets Humans va sol·licitar al Relator Especial sobre ...",,,,,
87866848,eliminacion_catalan,"caracteres_problematicos: {'[', ']'}","El Comitè va afirmar a més que, al seu judici, ""la incapacitat mental verificada [podia] ser motiu p...",,,,,
87884215,eliminacion_catalan,caracteres_problematicos: {'·'},30. El CRC va expressar preocupació per l'aplicació del sistema de Nens que ja no estan sota l'autor...,,,,,
87893446,eliminacion_catalan,caracteres_problematicos: {'·'},Al Comitè el preocupava la falta en el Codi Penal de disposicions per les quals es disposés la nul·l...,,,,,
88181364,eliminacion_catalan,"caracteres_problematicos: {'/', '·'}",Voldria informar els membres del Consell de Seguretat que les activitats empreses per a complir el m...,,,,,
88193264,eliminacion_catalan,caracteres_problematicos: {'/'},El límit quantitatiu pertinent per a l'embalatge/envàs interior o objecte s'especifica per a cada su...,,,,,
88225359,eliminacion_catalan,caracteres_problematicos: {'·'},28. Alguns programes de reglamentació de nous productes químics industrials estipulen que l'entitat ...,,,,,
88254629,eliminacion_catalan,caracteres_problematicos: {'/'},Els crèdits per a altres activitats de la BLNU van ser autoritzats per l'Assemblea General en la sev...,,,,,
88261035,eliminacion_catalan,"caracteres_problematicos: {'/', '·'}",Resum de les mesures adoptades per complir les decisions i sol·licituds formulades per l'Assemblea G...,,,,,
88267591,eliminacion_catalan,caracteres_problematicos: {'·'},"Es va indicar a més que la Secció de Desarmament, Desmobilització i Reintegració havia determinat qu...",,,,,
88336900,eliminacion_catalan,caracteres_problematicos: {'/'},"En el seu informe titulat "" En nom de la justícia: un programa d'acció per a reforçar l'estat de dre...",,,,,
88385338,eliminacion_catalan,caracteres_problematicos: {'·'},"Finalment, el Comitè pren nota de l'al·legació de les autores que el procés es va retardar de manera...",,,,,
88403409,eliminacion_catalan,caracteres_problematicos: {'·'},24. Insta l'Oficina de les Nacions Unides contra la Droga i el Delicte al fet que estrenyi la col·la...,,,,,
88477837,eliminacion_catalan,caracteres_problematicos: {'·'},La promoció de la cultura podria complir una funció clau en l'assoliment dels Objectius de Desenvolu...,,,,,
88495865,eliminacion_catalan,caracteres_problematicos: {'·'},A la zona fronterera amb Colòmbia s'han destruït 45 pistes no autoritzades i 17 laboratoris de proce...,,,,,
88501590,eliminacion_catalan,caracteres_problematicos: {'·'},"Un cop s'instal·li la nova infraestructura mecànica, elèctrica i de fontaneria, la major part de les...",,,,,
88507767,eliminacion_catalan,"caracteres_problematicos: {'/', '·'}","Segons el marc jurídic establert per la decisió 49/426 de l'Assemblea, només les organitzacions inte...",,,,,
88518914,eliminacion_catalan,caracteres_problematicos: {'·'},Presentacions de tercers i sol·licituds d'accés a documents per tercers,,,,,
88522636,eliminacion_catalan,caracteres_problematicos: {'·'},b) Cooperar amb el sistema de les Nacions Unides amb la intenció de l'enfortiment de l'emmagatzematg...,,,,,
88567880,eliminacion_catalan,caracteres_problematicos: {'·'},127.108 Introduir mesures permanents de benestar social i de protecció amb la finalitat de mantenir ...,,,,,
88577412,eliminacion_catalan,caracteres_problematicos: {'/'},"54. En la seva resolució 16/22, el Consell de Drets Humans va prendre nota dels debats celebrats pel...",,,,,
88616316,eliminacion_catalan,caracteres_problematicos: {'/'},66/152. Enfortiment de la cooperació internacional en l'esfera dels drets humans,,,,,
88882285,eliminacion_catalan,caracteres_problematicos: {'·'},"En el període que s'examina, la Fiscalia es va dedicar a assegurar el ràpid avanç de les quatre caus...",,,,,
88886209,eliminacion_catalan,caracteres_problematicos: {'·'},44. Insta encaridament als Estats membres que apliquin els elements de la nota interpretativa del Gr...,,,,,
88924219,eliminacion_catalan,caracteres_problematicos: {']'},Situació especial dels països en desenvolupament],,,,,
88937871,eliminacion_catalan,caracteres_problematicos: {'%'},"En 1999, més del 90% dels solvents que són substàncies que esgoten l'ozó havia estat eliminat mitjan...",,,,,
88954709,eliminacion_catalan,caracteres_problematicos: {'/'},"En la seva resolució 64/269, l'Assemblea General va aprovar l'establiment d'un Centre Regional de Se...",,,,,
88976650,eliminacion_catalan,caracteres_problematicos: {'/'},La Comissió assenyala que en l'informe del Secretari General sobre la sinopsi del finançament de les...,,,,,
89043091,eliminacion_catalan,caracteres_problematicos: {'/'},Les funcions descrites en els apartats b) i g) del paràgraf 85 del document final de la Conferència ...,,,,,
89045736,eliminacion_catalan,caracteres_problematicos: {'·'},"Per la seva banda, la Dependència de qüestions relacionades amb el gènere centrarà la seva activitat...",,,,,
89055618,eliminacion_catalan,caracteres_problematicos: {'·'},Les organitzacions continuen col·laborant a través del Grup de Treball sobre Normes de Comptabilitat...,,,,,
89079969,eliminacion_catalan,caracteres_problematicos: {'‘'},Reafirmant el document final de la Conferència de les Nacions Unides sobre el Desenvolupament Sosten...,,,,,
89104594,eliminacion_catalan,caracteres_problematicos: {'%'},"La Comissió Consultiva observa que 30 departaments van presentar els seus documents a temps, mentre ...",,,,,
89295492,eliminacion_catalan,caracteres_problematicos: {'·'},El diàleg constructiu que s'entaula durant el procés de l'examen periòdic universal és una oportunit...,,,,,
89309443,eliminacion_catalan,caracteres_problematicos: {'·'},"6. Sol·licita al sistema de les Nacions Unides que faciliti assistència tècnica, dins dels límits de...",,,,,
89378000,eliminacion_catalan,"caracteres_problematicos: {'”', '“'}",El Plenipotenciari també va posar en marxa iniciatives organitzades en l'àmbit de la campanya “16 di...,,,,,
89387689,eliminacion_catalan,caracteres_problematicos: {'·'},12. El compromís de l'Estat veneçolà en matèria de drets humans i específicament en matèria de no di...,,,,,
89400801,eliminacion_catalan,caracteres_problematicos: {'·'},"iii) Defensar i garantir a la pràctica el dret de vot a les persones amb discapacitat, en igualtat d...",,,,,
89499316,eliminacion_catalan,caracteres_problematicos: {'%'},"27. A Mèxic, la confiscació d'herba de cànnabis va disminuir en un 39%, de 1.799 t el 2011 a 1.297 t...",,,,,
89555234,eliminacion_catalan,caracteres_problematicos: {'/'},Tema 134 del programa (Projecte de pressupost per programes per al bienni 2014-2015: Condicions de s...,,,,,
89565156,eliminacion_catalan,caracteres_problematicos: {'·'},"El Grup de Viena secunda fermament aquesta iniciativa encaminada a millorar el procés d'examen, ja q...",,,,,
89598358,eliminacion_catalan,caracteres_problematicos: {'·'},Posant en relleu el paper de les organitzacions regionals en el procés d'estabilització i reconstruc...,,,,,
89652755,eliminacion_catalan,caracteres_problematicos: {'/'},El USEPA RED (1998) cita un estudi acceptable del cicle de vida de la carpita cabezona en el qual es...,,,,,
89678457,eliminacion_catalan,caracteres_problematicos: {'/'},En els paràgrafs 292 a 294 del pressupost del compte de suport per a les operacions de manteniment d...,,,,,
89758899,eliminacion_catalan,caracteres_problematicos: {'·'},"Amb subjecció al que es disposa en el paràgraf 6 del Mandat Revisat, qualsevol Estat Membre de les N...",,,,,
89796979,eliminacion_catalan,caracteres_problematicos: {'·'},El propòsit de la reunió era aclarir les seves condicions de reclusió i la possible aplicació en con...,,,,,
89803489,eliminacion_catalan,caracteres_problematicos: {'·'},"8. Observa amb preocupació la gran quantitat de nens pertanyents a minories nacionals, ètniques, rel...",,,,,
89906657,eliminacion_catalan,caracteres_problematicos: {'·'},131. Recorda el paràgraf 27 de l'informe de la Comissió Consultiva en Assumptes Administratius i de ...,,,,,
90012307,eliminacion_catalan,caracteres_problematicos: {'/'},Guia per als debats temàtics relatius a l'article 52 (Prevenció i detecció de transferències del pro...,,,,,
90014833,eliminacion_catalan,caracteres_problematicos: {'·'},"Si un presumpte delinqüent o un acusat sol·liciten un defensor mentre estan detinguts, el tribunal p...",,,,,
90036191,eliminacion_catalan,caracteres_problematicos: {'/'},S'assenyala que el Ministeri d'Educació preparava una estratègia de comunicació encaminada a millora...,,,,,
90093417,eliminacion_catalan,caracteres_problematicos: {'%'},Un examen recent de 56 informes presentats pels Estats per a l'examen periòdic universal va indicar ...,,,,,
90113718,eliminacion_catalan,caracteres_problematicos: {'%'},"El percentatge de parts atesos per personal mèdic degudament capacitat a Kuwait va ascendir al 99,89...",,,,,
90158683,eliminacion_catalan,caracteres_problematicos: {'·'},"El 2013 l'UNICEF va col·laborar amb Save the Children, Plan International, World Vision, The Concern...",,,,,
90158831,eliminacion_catalan,caracteres_problematicos: {'·'},Com que els resultats a nivell d'efectes reflecteixen l'acció col·lectiva dels Estats amb el suport ...,,,,,
90183193,eliminacion_catalan,caracteres_problematicos: {'·'},"En una carta de data 8 de febrer de 2013, el sol·licitant va fer referència a la reglamentació nacio...",,,,,
90189000,eliminacion_catalan,caracteres_problematicos: {'/'},Tema 136 del programa (Escala de quotes per al prorrateig de les despeses de les Nacions Unides (A/6...,,,,,
90230305,eliminacion_catalan,caracteres_problematicos: {'·'},El nombre d'organitzacions no governamentals nacionals autoritzades a col·laborar segueix sent de 85...,,,,,
90254680,eliminacion_catalan,caracteres_problematicos: {'%'},"Les massacres es van saldar amb 393 morts, inclosos 93 nens i 48 dones, és a dir, el 36% de les víct...",,,,,
90315311,eliminacion_catalan,"caracteres_problematicos: {'”', '“'}","“la creació d'una organització mundial que realment funcioni, i que sigui l'escenari d'un progrés or...",,,,,
90339771,eliminacion_catalan,caracteres_problematicos: {'·'},Recordant també la Convenció de les Nacions Unides contra el tràfic il·lícit d'estupefaents i substà...,,,,,
90363120,eliminacion_catalan,"caracteres_problematicos: {'”', '“'}","Tema 7 del programa, “Serveis tècnics i qüestions financeres relacionats amb les reunions de les sub...",,,,,
90397167,eliminacion_catalan,"caracteres_problematicos: {'”', '“'}",Presentació del llibre titulat “Democracy Rising -- Assessing Global Challenges” (organitzada per la...,,,,,
90399264,eliminacion_catalan,"caracteres_problematicos: {'”', '“'}",Cooperació en matèria de tecnologies de la informació i les comunicacions en pro del desenvolupament...,,,,,
90423889,eliminacion_catalan,caracteres_problematicos: {'/'},En l'Observació general N.o 15 (2002) sobre el dret a l'aigua (I/C.12/2002/11) aprovada pel Comitè d...,,,,,
90487537,eliminacion_catalan,"caracteres_problematicos: {'”', '“'}","11.6 Malgrat aquestes disposicions, en la Secció E4 del Codi Laboral de Santa Lucía de 2001 s'identi...",,,,,
90556616,eliminacion_catalan,caracteres_problematicos: {'·'},"S'ha de condemnar i detenir la construcció d'aquest nou assentament il·legal, que està previst que c...",,,,,
90579158,eliminacion_catalan,caracteres_problematicos: {'/'},Atorgament de la condició d'observador en l'Assemblea General a l'Institut Ítalo-Llatinoamericà (A/6...,,,,,
90641810,eliminacion_catalan,caracteres_problematicos: {'·'},Les al·legacions formulades contra els militars de Myanmar procedeixen d'aquests grups associats amb...,,,,,
90690021,eliminacion_catalan,caracteres_problematicos: {'·'},Els recordem a totes les parts que tenen l'obligació de respectar la Línia Blava i d'abstenir-se de ...,,,,,
90726320,eliminacion_catalan,"caracteres_problematicos: {'”', '“'}",Es va suggerir que es modifiqués el projecte d'article 3 de manera que digués “L'Estat de la naciona...,,,,,
90761855,eliminacion_catalan,caracteres_problematicos: {'/'},La secretaria de la UNCTAD va preparar un informe del Secretari General sobre els efectes de les nov...,,,,,
90809272,eliminacion_catalan,"caracteres_problematicos: {'”', '“'}","Ara assenyalo a l'atenció de l'Assemblea el tema 140 del programa, titulat “Estat dels Protocols add...",,,,,
90893679,eliminacion_catalan,caracteres_problematicos: {'/'},Els documents de la reunió poden obtenir-se en http://www.uneca.org/panafcon/index.htm.,,,,,
90919299,eliminacion_catalan,"caracteres_problematicos: {'[', ']'}",Grups de països en situacions especials [D.90]:,,,,,
90975051,eliminacion_catalan,caracteres_problematicos: {'·'},La informació sobre la identificació de zones sota la seva jurisdicció o control en què se sap o se ...,,,,,
90977662,eliminacion_catalan,caracteres_problematicos: {'/'},Els membres del Consell tenen davant si una carta de data 24 de maig de 2004 dirigida al Secretari G...,,,,,
91100472,eliminacion_catalan,caracteres_problematicos: {'·'},"En sol·licitar asil, va ser entrevistat en el Departament de Policia d'Asker i Baerum els dies 3 i 2...",,,,,
91111506,eliminacion_catalan,caracteres_problematicos: {'·'},"El Sr. AKAM AKAM (Camerun) comparteix la preocupació del representant d'Alemanya, en particular pel ...",,,,,
91128260,eliminacion_catalan,"caracteres_problematicos: {'[', ']'}",[[Decideix [establir el] [la ràpida posada en marxa del] mecanisme per a un desenvolupament net [amb...,,,,,
91174578,eliminacion_catalan,caracteres_problematicos: {'·'},"Aquest Pacte representa l'esforç col·lectiu de la Unió Europea, el Grup de 8 països (G-8), els païso...",,,,,
91197521,eliminacion_catalan,caracteres_problematicos: {'/'},"El mandat principal d'aquest subprograma figura en la secció II.B del ""Pla d'Acció"" (TD/386), que s'...",,,,,
91215127,eliminacion_catalan,"caracteres_problematicos: {'/', '”', '“'}",c) Nota d'antecedents de la secretaria de la UNCTAD titulada “Avaluació del comerç de serveis dels p...,,,,,
91228556,eliminacion_catalan,caracteres_problematicos: {'/'},Alternativa proposada per la delegació de Mèxic (A/AC.254/5/Add.1).,,,,,
91236516,eliminacion_catalan,caracteres_problematicos: {'/'},"Vegeu Documents Oficials del Consell Econòmic i Social, 1992, Suplement No 2 (I/1999/22), cap. II, s...",,,,,
91284196,eliminacion_catalan,caracteres_problematicos: {'·'},"Avui, en lloc d'iniciar el nou mil·lenni amb la promesa de pau a l'Orient Mitjà, som testimonis una ...",,,,,
91335256,eliminacion_catalan,caracteres_problematicos: {'%'},"Entre les mesures adoptades per a aplicar els programes sanitaris, el Govern es va comprometre a amp...",,,,,
91407923,eliminacion_catalan,caracteres_problematicos: {'/'},"57) i el Reglament (CE) núm. 389/2009 de la Comissió, de 12 de maig de 2009 (Diari Oficial de la Uni...",,,,,
91484597,eliminacion_catalan,caracteres_problematicos: {'/'},Informe del Director Executiu sobre les activitats del Programa de les Nacions Unides per a la Fisca...,,,,,
91487132,eliminacion_catalan,caracteres_problematicos: {'—'},Ha d'assegurar-se l'èxit de la missió d'interposició del Grup de Verificació (ECOMOG) de la Comunita...,,,,,
91504542,eliminacion_catalan,caracteres_problematicos: {'·'},"Juntament amb l'UNICEF, el CICR i les organitzacions no governamentals especialitzades, com el Comit...",,,,,
91511370,eliminacion_catalan,"caracteres_problematicos: {'”', '“'}",- Disseny i producció del Programa radiofònic “Contigo Mujer” que es transmet setmanalment a la ràdi...,,,,,
91564927,eliminacion_catalan,caracteres_problematicos: {'%'},Són els més pobres dels pobres i majoritàriament (dos terços dels adults analfabets i el 60% dels ne...,,,,,
91581030,eliminacion_catalan,"caracteres_problematicos: {'”', '“'}",Programes i mesures utilitzats per a ajudar als “estudiants en situació de risc”,,,,,
91655218,eliminacion_catalan,caracteres_problematicos: {'·'},"A nivell polític i social, el cost de tals conductes il·legals posa en perill la representativitat i...",,,,,
91687184,eliminacion_catalan,caracteres_problematicos: {'·'},La Comissió també va observar amb satisfacció que estava previst que al novembre de 2001 comencessin...,,,,,
91832886,eliminacion_catalan,caracteres_problematicos: {'·'},Per a donar suport a aquesta funció se sol·liciten dos llocs addicionals (1 P-4 i 1 P-3) d'oficials ...,,,,,
91854887,eliminacion_catalan,caracteres_problematicos: {'·'},"El projecte s'executa amb la participació de la companyia suïssa Wisekey, la qual aporta tecnologies...",,,,,
92043294,eliminacion_catalan,"caracteres_problematicos: {'/', '”', '“'}",Durant l'històric període extraordinari de sessions de l'Assemblea General dedicat a la infància i c...,,,,,
92082589,eliminacion_catalan,caracteres_problematicos: {'/'},"Antecedents. En el paràgraf 1 b) de la decisió 10/CP.2, es demana a la secretaria que faciliti al OS...",,,,,
92147626,eliminacion_catalan,"caracteres_problematicos: {'”', '“'}","L'article 2 disposa, entre altres coses, el següent: “La inclusió dels principis i normes anteriorme...",,,,,
92194537,eliminacion_catalan,caracteres_problematicos: {'/'},"Per les raons exposades, la delegació d'Israel va participar en les consultes oficioses sobre els do...",,,,,
92201688,eliminacion_catalan,"caracteres_problematicos: {'[', ']'}","21a sessió, 24 d'agost de 2006. [Aprovada sense votació. Vegeu cap.]",,,,,
92203530,eliminacion_catalan,caracteres_problematicos: {'·'},Objectiu 2 dels objectius de desenvolupament del Mil·lenni,,,,,
92252850,eliminacion_catalan,caracteres_problematicos: {'%'},"Aquest material és el següent: l'urani molt enriquit, és a dir, l'urani enriquit al 20% o més en l'i...",,,,,
92297644,eliminacion_catalan,caracteres_problematicos: {'·'},Un cru exemple de la indiferència de la Potència ocupant al dret dels nens palestins a la vida és la...,,,,,
92318102,eliminacion_catalan,caracteres_problematicos: {'/'},"Els membres del Consell tenen davant si el document S/2006/770, que conté l'informe del Secretari Ge...",,,,,
92331366,eliminacion_catalan,"caracteres_problematicos: {'”', '“'}","Pel que fa a la prevenció, el Departament d'Assumptes Polítics i el Programa de les Nacions Unides p...",,,,,
92376462,eliminacion_catalan,caracteres_problematicos: {'/'},"La Junta va aprovar el seu projecte de reglament en la seva segona reunió i, de conformitat amb l'ap...",,,,,
92398435,eliminacion_catalan,"caracteres_problematicos: {'”', '“'}","En aquest sentit, em refereixo concretament a conceptes, com ara “canvi de règim”, i “atac preventiu...",,,,,
92402345,eliminacion_catalan,"caracteres_problematicos: {'”', '“'}",En el document final del vint-i-tresè període extraordinari de sessions de l'Assemblea General es va...,,,,,
92441609,eliminacion_catalan,caracteres_problematicos: {'·'},"Aquestes activitats estan dirigides per diferents governs, pel sector privat i per membres de la soc...",,,,,
92463146,eliminacion_catalan,caracteres_problematicos: {'/'},"En la seva resolució 2001/36, de 26 de juliol de 2001, el Consell Econòmic i Social va decidir remet...",,,,,
92475113,eliminacion_catalan,caracteres_problematicos: {'·'},El President provisional convida als membres de la Comissió al fet que examinin el treball realitzat...,,,,,
92522948,eliminacion_catalan,caracteres_problematicos: {'·'},Davant la gran amenaça a la pau i la seguretat internacionals que suposa la situació en els territor...,,,,,
92533990,eliminacion_catalan,caracteres_problematicos: {'%'},Únicament el 23% de la població té accés a l'aigua potable i només el 12% a uns serveis sanitaris ad...,,,,,
92595837,eliminacion_catalan,"caracteres_problematicos: {'/', '·'}","El Grup de Treball va convenir en la necessitat de vetllar, en col·laboració amb el Grup de Treball ...",,,,,
92624603,eliminacion_catalan,caracteres_problematicos: {'°'},"Quant a l'incís b) del paràgraf 12 supra, el Comitè va demanar al Secretari General que encomanés a ...",,,,,
92684557,eliminacion_catalan,"caracteres_problematicos: {'”', '·', '“'}",Un avanç significatiu a nivell internacional va ser l'acord aconseguit amb la finalitat d'intensific...,,,,,
92748661,eliminacion_catalan,"caracteres_problematicos: {'[', '/', ']'}",A/58/361-S/2003/877 Tema 158 del programa provisional - Mesures per a eliminar el terrorisme interna...,,,,,
92776641,eliminacion_catalan,caracteres_problematicos: {'/'},La metodologia utilitzada per a calcular la quantia dels reemborsaments s'explica breument en el par...,,,,,
92778637,eliminacion_catalan,caracteres_problematicos: {'·'},"El Comitè va observar a més que: ""el Tribunal Administratiu d'Apel·lació, la decisió va ser confirma...",,,,,
92794859,eliminacion_catalan,caracteres_problematicos: {'—'},"Especialment a causa de la seva condició informal, alguna cosa que és poc comuna en matèria de relac...",,,,,
92845810,eliminacion_catalan,"caracteres_problematicos: {'”', '“'}","L'any 2002 va ser molt fructífer per a l'UNICEF i el seu personal pot sentir-se orgullós d'això, esp...",,,,,
92850447,eliminacion_catalan,caracteres_problematicos: {'%'},"Les taxes d'analfabetisme dels adults, especialment entre les dones, són relativament altes en diver...",,,,,
