linea,tipo,razon,texto_original,porcentaje_automatico,detalles_base,detalles_avanzados,texto_catalan,texto_chino
87319887,eliminacion_catalan,"caracteres_problematicos: {']', '['}",[Assenyalant que el desenvolupament sostenible resulta essencial en l'adopció de mesures de lluita c...,,,,,
87341012,eliminacion_catalan,caracteres_problematicos: {'/'},a) La contribució als objectius estratègics de l'Estratègia (decisió 3/COP.8);,,,,,
87361083,eliminacion_catalan,"caracteres_problematicos: {'”', '/', '“'}","Consultes oficioses “oficioses” sobre el projecte de resolució A/C.2/65/L.18, titulat “Execució del ...",,,,,
87379521,eliminacion_catalan,caracteres_problematicos: {'/'},De conformitat amb l'article 11 del reglament provisional del Consell de Seguretat i la nota de la P...,,,,,
87384150,eliminacion_catalan,caracteres_problematicos: {'·'},És també un fet àmpliament reconegut que el desenvolupament clandestí i la possessió il·lícita d'arm...,,,,,
87416882,eliminacion_catalan,caracteres_problematicos: {'·'},El Consell va incloure a més en el mandat del Grup la sol·licitud que avalués en quina mesura els re...,,,,,
87435679,eliminacion_catalan,caracteres_problematicos: {'%'},Això representa més del 80% del PIB generat pel territori palestí ocupat el 2008.,,,,,
87449204,eliminacion_catalan,caracteres_problematicos: {'/'},d) Major dependència de les importacions (inputs industrials bàsics) i/o exportacions (per al creixe...,,,,,
87465008,eliminacion_catalan,caracteres_problematicos: {'/'},XXII/8: Usos de substàncies controlades com a agents de processos,,,,,
87488455,eliminacion_catalan,caracteres_problematicos: {'/'},"El 28 de setembre de 2010, durant el procés d'aprovació del document d'examen (PBC/4/SLE/3), la conf...",,,,,
87513599,eliminacion_catalan,caracteres_problematicos: {'/'},:: Informe de la Comissió Consultiva en Assumptes Administratius i de Pressupost sobre la reforma de...,,,,,
87542232,eliminacion_catalan,"caracteres_problematicos: {'”', '“'}","1) El present article troba el seu equivalent en l'article 19, segons el qual el capítol relatiu a l...",,,,,
87612530,eliminacion_catalan,caracteres_problematicos: {'/'},"e) Amèrica Llatina i el Carib: situació i perspectives econòmiques, 2010-2011 (E/2011/19);",,,,,
87613132,eliminacion_catalan,caracteres_problematicos: {'/'},"m Escollits en la desena sessió, celebrada el 27 d'abril de 2011, per a un mandat que començaria en ...",,,,,
87641987,eliminacion_catalan,caracteres_problematicos: {'·'},10. Encoratja a tots els Governs al fet que continuïn responent favorablement a les sol·licituds de ...,,,,,
87812767,eliminacion_catalan,caracteres_problematicos: {'/'},Fins avui no s'han establert normes sobre la producció de documents oficials per a les persones amb ...,,,,,
87914493,eliminacion_catalan,caracteres_problematicos: {'·'},"Preveure penes més rigoroses per l'acte de rebre un suborn que pel de pagar-lo, a fi de descoratjar ...",,,,,
87974366,eliminacion_catalan,caracteres_problematicos: {'·'},"No obstant això, si el cònjuge estranger no compleix els requisits per obtenir la residència permane...",,,,,
87986358,eliminacion_catalan,caracteres_problematicos: {'·'},"h) Recorregui, segons escaigui, als instruments d'assistència tècnica elaborats pel Grup Interinstit...",,,,,
88019624,eliminacion_catalan,caracteres_problematicos: {'%'},"Durant 2008, el 82% de les exportacions dels 17 membres de la Unió Europea (els 15 membres anteriors...",,,,,
88080186,eliminacion_catalan,caracteres_problematicos: {'/'},2. Es recorda a les Parts que el programa anotat del període de sessions porta la signatura FCCC/KP/...,,,,,
88173617,eliminacion_catalan,caracteres_problematicos: {'·'},"a) Krall Metall Congo va prendre el control del jaciment el 8 d'octubre de 2010, després que el Sots...",,,,,
88241088,eliminacion_catalan,caracteres_problematicos: {'/'},"41. En les seves resolucions 63/262, de 24 de desembre de 2008, i 63/269, de 7 d'abril de 2009, l'As...",,,,,
88241783,eliminacion_catalan,caracteres_problematicos: {'·'},"2 places del Servei Mòbil, 1 de contractació local i 1 de Voluntari de les Nacions Unides a la Secci...",,,,,
88252626,eliminacion_catalan,caracteres_problematicos: {'·'},També se subratllaven els elements respecte dels quals el Comitè considerava que no s'havien aplicat...,,,,,
88326644,eliminacion_catalan,caracteres_problematicos: {'·'},El Comitè observa a més que l'11 de setembre de 2007 el Tribunal de Districte de Naestved va desesti...,,,,,
88340470,eliminacion_catalan,caracteres_problematicos: {'·'},"Els Objectius de Desenvolupament del Mil·lenni mai van ser concebuts com a objectius nacionals, enca...",,,,,
88365524,eliminacion_catalan,caracteres_problematicos: {'·'},La col·laboració amb la comunitat internacional es facilita principalment a través del Grup de Conta...,,,,,
88373116,eliminacion_catalan,caracteres_problematicos: {'·'},L'UNICEF ha col·laborat estretament amb l'Organització Mundial de la Salut (OMS) i el Fons de Poblac...,,,,,
88491281,eliminacion_catalan,caracteres_problematicos: {'·'},Eritrea és un dels tres països de l'Àfrica subsahariana que van camí de complir el quart Objectiu de...,,,,,
88500964,eliminacion_catalan,"caracteres_problematicos: {'/', '·'}",La Secretaria ha respost a la sol·licitud dels Estats membres que s'examinin els arranjaments de fin...,,,,,
88530181,eliminacion_catalan,caracteres_problematicos: {'/'},"741. En la 32a sessió, el 16 juny de 2011, l'Alta Comissionada Adjunta per als Drets Humans va prese...",,,,,
88590792,eliminacion_catalan,caracteres_problematicos: {'·'},Els sol·licitants que es trobin en situacions difícils rebran assistència jurídica gratuïta o per un...,,,,,
88636710,eliminacion_catalan,caracteres_problematicos: {'·'},L'Estat part sosté que la sol·licitud de protecció com a refugiat presentada per l'autor va ser exam...,,,,,
88703170,eliminacion_catalan,caracteres_problematicos: {'%'},"En el decenni de 1980, l'assistència multilateral havia augmentat fins a un 30% de la AOD; des de ll...",,,,,
88794306,eliminacion_catalan,caracteres_problematicos: {'·'},La jurisdicció civil del tribunal de comtat abasta gairebé tots els tipus d'accions i no sol estar l...,,,,,
88839534,eliminacion_catalan,"caracteres_problematicos: {'”', '“'}","d) L'article 9 del Codi Penal, segons el qual: “El present Codi s'aplicarà als delictes definits en ...",,,,,
88878906,eliminacion_catalan,caracteres_problematicos: {'·'},"El 16 de maig, el Parlament de la Federació va aprovar una Declaració de no acceptació del terme de ...",,,,,
88881336,eliminacion_catalan,caracteres_problematicos: {'·'},"Alguns funcionaris ugandesos, un funcionari de fronteres ugandès, un dirigent comunitari ugandès, me...",,,,,
88888694,eliminacion_catalan,caracteres_problematicos: {'·'},D. Reunions regionals amb serveis d'intel·ligència i seguretat,,,,,
88892346,eliminacion_catalan,caracteres_problematicos: {'/'},"13. L'OCDE va crear un portal en la web sobre productes químics perfluorats (www.oecd.org/ehs/pfc), ...",,,,,
88999234,eliminacion_catalan,caracteres_problematicos: {'·'},"En resposta a les sol·licituds d'assistència, el Centre Regional, en col·laboració amb el Govern de ...",,,,,
89064709,eliminacion_catalan,caracteres_problematicos: {'/'},El Grup de Treball va examinar i aprovar tres projectes de recomanació d'inadmissibilitat que va rem...,,,,,
89106202,eliminacion_catalan,caracteres_problematicos: {'·'},Suport tècnic i manteniment per a una xarxa de comunicacions per satèl·lit formada per 2 estacions t...,,,,,
89144407,eliminacion_catalan,caracteres_problematicos: {'·'},És evident que el mercat no pot resoldre per si sol aquests problemes si no es recolza en polítiques...,,,,,
89148082,eliminacion_catalan,caracteres_problematicos: {'·'},"En aquest context, l'Oficina de l'Alt Representant per als Països Menys Avançats, els Països en Dese...",,,,,
89160294,eliminacion_catalan,caracteres_problematicos: {'/'},Recordant el compromís de llarga data del Programa de les Nacions Unides per als Assentaments Humans...,,,,,
89165818,eliminacion_catalan,caracteres_problematicos: {'·'},Entre els temes tractats figuraven les aplicacions de teleobservación per a la gestió de riscos de d...,,,,,
89182151,eliminacion_catalan,caracteres_problematicos: {'·'},Sol·licitem a l'Oficina de l'Alt Representant que continuï mobilitzant i coordinant el suport i els ...,,,,,
89233232,eliminacion_catalan,caracteres_problematicos: {'·'},"11. Reconeix la necessitat de continuar treballant i debatent sobre la qüestió i, a aquest respecte,...",,,,,
89376564,eliminacion_catalan,"caracteres_problematicos: {'”', '“'}","L'article 6 de la Llei fonamental disposa que “els ciutadans són iguals davant la llei”, la qual cos...",,,,,
89419829,eliminacion_catalan,caracteres_problematicos: {'·'},"Com ho va indicar l'avaluació independent, els països on es van realitzar experiències pilot van aco...",,,,,
89491769,eliminacion_catalan,caracteres_problematicos: {'·'},"Al setembre de 2000, en la Cimera del Mil·lenni de les Nacions Unides, un total de 189 governs van a...",,,,,
89504535,eliminacion_catalan,caracteres_problematicos: {'·'},"11. Sol·licita al Secretari General que en el seu període de sessions substantiu de 2014, li present...",,,,,
89519859,eliminacion_catalan,caracteres_problematicos: {'/'},44. S'observa una tendència a l'augment de les persones infectades amb el VIH/SIDA (quadre 14).,,,,,
89595886,eliminacion_catalan,caracteres_problematicos: {'·'},El Govern de la República Àrab Siriana sol·licita al Secretari General de les Nacions Unides i al Pr...,,,,,
89688420,eliminacion_catalan,caracteres_problematicos: {'/'},Divisió d'Àfrica II/Equip de Coordinació i Planificació per a Somàlia: redistribució de l'Equip de C...,,,,,
89734588,eliminacion_catalan,caracteres_problematicos: {'·'},b Inclòs el nombre total de decisions definitives pendents davant el Tribunal Contenciós Administrat...,,,,,
89760658,eliminacion_catalan,caracteres_problematicos: {'/'},III. Aplicació de la resolució 68/83 de l'Assemblea General,,,,,
89843057,eliminacion_catalan,caracteres_problematicos: {'·'},A més de realitzar la planificació operacional de les activitats en curs i futures en els emplaçamen...,,,,,
89907577,eliminacion_catalan,caracteres_problematicos: {'/'},El CPC també ha destacat la importància d'utilitzar informes sobre l'execució dels programes com a i...,,,,,
89981007,eliminacion_catalan,"caracteres_problematicos: {'%', '/'}",8. Etiòpia ha experimentat un elevat creixement econòmic durant els últims deu anys consecutius (200...,,,,,
90005991,eliminacion_catalan,caracteres_problematicos: {'/'},"70. L'examen va ser presidit pel Sr. Paulus Noa (Namíbia), Vicepresident de la Conferència, qui en l...",,,,,
90020990,eliminacion_catalan,"caracteres_problematicos: {'”', '“'}",Una de les preguntes principals és la següent: “és l'acusat culpable?” No es pregunta al jurat si es...,,,,,
90041695,eliminacion_catalan,caracteres_problematicos: {'·'},"No obstant això, el percentatge de dones en institucions d'ensenyament superior, inclosos els col·le...",,,,,
90060476,eliminacion_catalan,caracteres_problematicos: {'/'},"En primer lloc, tant en Tanzània Continental com a Zanzíbar, les persones que viuen amb el VIH/SIDA ...",,,,,
90092596,eliminacion_catalan,caracteres_problematicos: {'%'},En 2013 els ingressos del UNFPA per concepte de contribucions corresponents a recursos ordinaris i d...,,,,,
90126163,eliminacion_catalan,caracteres_problematicos: {'·'},Està col·laborant amb l'American Veterans Co-Op per donar suport al finançament i la posada en marxa...,,,,,
90144159,eliminacion_catalan,caracteres_problematicos: {'·'},"En altres països es presten ara diferents serveis especials, com a serveis jurídics culturalment acc...",,,,,
90165398,eliminacion_catalan,caracteres_problematicos: {'/'},b) Situació financera de l'ONUDI (GC.15/14; GC.15/CRP.1),,,,,
90237654,eliminacion_catalan,caracteres_problematicos: {'·'},"Al febrer de 2012, l'Iran va desestimar les preocupacions de l'Organisme, en gran manera perquè va c...",,,,,
90255460,eliminacion_catalan,caracteres_problematicos: {'/'},"A més, el Comitè va considerar que la llista d'articles, materials, equips, béns i tecnologia relaci...",,,,,
90340002,eliminacion_catalan,caracteres_problematicos: {'•'},• Un pla model relatiu a la qüestió dels atemptats terroristes contra els mitjans de transport (2002...,,,,,
90368219,eliminacion_catalan,caracteres_problematicos: {'·'},"La CESPAO executarà el projecte en col·laboració amb el Departament d'Assumptes Econòmics i Socials,...",,,,,
90373957,eliminacion_catalan,"caracteres_problematicos: {'”', '“'}",La Llei de protecció de la democràcia constitucional contra el terrorisme i activitats connexes (200...,,,,,
90394105,eliminacion_catalan,caracteres_problematicos: {'·'},Aquestes diferències entre les autoritats competents en qüestions d'immigració es va donar repetidam...,,,,,
90410314,eliminacion_catalan,"caracteres_problematicos: {'”', '“'}","Desitjo felicitar el Secretari General per la seva visió, admirablement plasmada en el seu informe s...",,,,,
90421893,eliminacion_catalan,"caracteres_problematicos: {'”', '“'}",S'assenyala a l'atenció de l'Assemblea General el projecte de resolució titulat “Enfortiment de la c...,,,,,
90444864,eliminacion_catalan,"caracteres_problematicos: {'”', '“'}",Els participants consideraven que la religió estava vinculada sovint amb la història de grups ètnics...,,,,,
90495576,eliminacion_catalan,caracteres_problematicos: {'/'},"El OSACT va recordar la decisió 12/CP.8, en la qual s'encoratjava a les Parts al fet que prosseguiss...",,,,,
90563558,eliminacion_catalan,"caracteres_problematicos: {'”', '“'}",És tan sols un delicte menor si els serveis sexuals es proporcionen en una zona “de tolerància”.,,,,,
90612029,eliminacion_catalan,caracteres_problematicos: {'/'},"En cas d'establiments en més d'un Estat, es farà referència a l'Estat en el qual l'atorgant tingui l...",,,,,
90616137,eliminacion_catalan,caracteres_problematicos: {'”'},En les últimes dues dècades s'han verificat certs progressos a favor de la dona en la Legislació i e...,,,,,
90638252,eliminacion_catalan,caracteres_problematicos: {'/'},El Sr. KOLAROV (Secretari General de la Conferència) assenyala a l'atenció de les despeses estimades...,,,,,
90651268,eliminacion_catalan,"caracteres_problematicos: {'”', '“'}","Respecte del primer joc d'opcions, el Grup de Treball va convenir que el tribunal arbitral haurà d'a...",,,,,
90661922,eliminacion_catalan,caracteres_problematicos: {'/'},"El CEP, en la seva qualitat de secretaria de Nacions Unides-Aigua/Àfrica, i la UNESCO continuaran do...",,,,,
90694165,eliminacion_catalan,caracteres_problematicos: {'/'},El Relator Especial sobre un habitatge adequat com a part del dret a un nivell de vida adequat va in...,,,,,
90697571,eliminacion_catalan,caracteres_problematicos: {'/'},El Consell va examinar la qüestió de l'aplicació i el seguiment de les decisions adoptades en les pr...,,,,,
90737919,eliminacion_catalan,"caracteres_problematicos: {'”', '“'}",- “Avaluació de les dosis de radiació dels habitants de la província de Bryansk sobre la base del me...,,,,,
90757897,eliminacion_catalan,caracteres_problematicos: {'·'},"En el paràgraf 83, el UNFPA va estar d'acord amb la recomanació de la Junta de redoblar els seus esf...",,,,,
90773277,eliminacion_catalan,caracteres_problematicos: {'•'},• Experiència acadèmica professional i administrativa,,,,,
90815071,eliminacion_catalan,caracteres_problematicos: {'•'},• Considerant la Declaració de la societat civil sobre una societat de la informació que respongui a...,,,,,
90890131,eliminacion_catalan,caracteres_problematicos: {'·'},"L'Ambaixador Vot-Bernales desitja, pel meu intermedi, expressar la seva alta estima per la col·labor...",,,,,
90915240,eliminacion_catalan,caracteres_problematicos: {'/'},Informe especial i recomanacions del Grup de Comissionats D1 en relació amb les 30 reclamacions pres...,,,,,
90928668,eliminacion_catalan,caracteres_problematicos: {'·'},En 2001 es va comunicar un total de 406 accidents greus en el treball i 6 accidents col·lectius desc...,,,,,
90993853,eliminacion_catalan,"caracteres_problematicos: {'”', ']', '[', '“'}","Tal vegada no hagi de sorprendre aquesta actitud, vist el to laudatori que ha emprat en anteriors in...",,,,,
90997364,eliminacion_catalan,caracteres_problematicos: {'/'},"També va facilitar els textos dels articles 48, 52 a 54, 93, 95, 131, 132, 134, 149, 200 i 201 del C...",,,,,
91150190,eliminacion_catalan,caracteres_problematicos: {'·'},"Com han proposat diversos organismes, també podria definir-se una categoria a part d'indústries conc...",,,,,
91196280,eliminacion_catalan,"caracteres_problematicos: {'”', '“'}","Havent considerat les qüestions d'Anguila, les Bermudes, Guam, les Illes Caiman, les Illes Turks i C...",,,,,
91212231,eliminacion_catalan,caracteres_problematicos: {'·'},En aquest període de sessions i en el sisè període de sessions de la Conferència de les Parts la sec...,,,,,
91251970,eliminacion_catalan,"caracteres_problematicos: {'/', '·'}",Pel que respecta a la sol·licitud formulada per l'Assemblea General en el paràgraf 29 de la resoluci...,,,,,
91256346,eliminacion_catalan,"caracteres_problematicos: {'”', '“'}","En segon lloc, el tema 79 del programa, “El risc de la proliferació nuclear a l'Orient Mitjà”, és un...",,,,,
91336319,eliminacion_catalan,caracteres_problematicos: {'%'},"El 90,6% dels hospitals de districte i dels centres bàsics de salut (que representen el primer nivel...",,,,,
91365693,eliminacion_catalan,caracteres_problematicos: {'·'},"Per a reduir l'alta taxa de violència contra les dones autòctones, el Govern del Canadà, en col·labo...",,,,,
91396041,eliminacion_catalan,caracteres_problematicos: {'/'},"Resolucions 60/30, par. 100; 61/222, par. 121; 62/215, par. 138, i 63/111, par.",,,,,
91397870,eliminacion_catalan,caracteres_problematicos: {'/'},Va encoratjar a Israel al fet que harmonitzés la seva legislació amb les normes internacionals de co...,,,,,
91447205,eliminacion_catalan,caracteres_problematicos: {'·'},Els Estats membres van reconèixer les noves exigències i pressions de què era objecte la UNODC perqu...,,,,,
91473592,eliminacion_catalan,"caracteres_problematicos: {']', '['}",[Un grup tècnic sobre la comparabilitat [establert en el marc de la CP] [facilitarà] [realitzarà] un...,,,,,
91512022,eliminacion_catalan,"caracteres_problematicos: {'”', '“'}",S'espera que la conferència aprovi una “Llei àrab sobre discapacitat”.,,,,,
91541770,eliminacion_catalan,caracteres_problematicos: {'/'},2001/... Situació dels drets humans a Rwanda,,,,,
91662426,eliminacion_catalan,caracteres_problematicos: {'/'},Queda aprovat el projecte de decisió A/C.5/ 55/L.55.,,,,,
91733550,eliminacion_catalan,"caracteres_problematicos: {'”', '“'}",- Article 254 (“Associació amb el propòsit de cometre delictes previstos en la Llei Federal”).,,,,,
91874370,eliminacion_catalan,"caracteres_problematicos: {'”', '“'}","Per als subtemes g) a i), vegeu “sessions plenàries”, article 17.",,,,,
91880125,eliminacion_catalan,"caracteres_problematicos: {']', '['}",Aquest Grup va exigir dels reclamants que demanaven indemnització per pèrdues d'aquesta naturalesa q...,,,,,
91947397,eliminacion_catalan,caracteres_problematicos: {'/'},"Article 6 de la Llei No 2004/42 d'activitat d'investigació científica, promulgada en virtut del regl...",,,,,
91950860,eliminacion_catalan,"caracteres_problematicos: {'”', '“'}",Per “bombarder” s'entén tot aeroplà projectat o reconvertit per transportar bombes o míssils d'aire ...,,,,,
91959773,eliminacion_catalan,caracteres_problematicos: {'/'},"L'Assemblea General de l'OEA, en la seva resolució AG/RES.2416 (XXXVIII-O/08), va instar als Estats ...",,,,,
92051487,eliminacion_catalan,"caracteres_problematicos: {'”', '“'}","L'exposició “18 segons”, realitzada per l'Institut de la Dona, 18 dones procedents del món de la cul...",,,,,
92083982,eliminacion_catalan,"caracteres_problematicos: {'”', '“'}","Hauria d'ajudar a evitar la “igualació cap avall” pel que fa als incentius a la inversió, incloses l...",,,,,
92092420,eliminacion_catalan,"caracteres_problematicos: {'”', '/', '“'}",En el transcurs de les recerques dutes a terme sobre els subministraments a Côte d'Ivoire per via aè...,,,,,
92116966,eliminacion_catalan,"caracteres_problematicos: {']', '['}","També es van plantejar altres opcions: ""Augment del número dels països afectats que basen els seus i...",,,,,
92216057,eliminacion_catalan,caracteres_problematicos: {'/'},Gestió mundial integrada/resultats dels treballs dels grups de tasques,,,,,
92238844,eliminacion_catalan,caracteres_problematicos: {'/'},"Examen del funcionament i estat de la Convenció (APLC/CONF/2004/5, segona part), par. 117.",,,,,
92246192,eliminacion_catalan,caracteres_problematicos: {'/'},"En la mateixa sessió, la Comissió va aprovar per consens el seu projecte d'informe (CCW/CONF.III/CC/...",,,,,
92249776,eliminacion_catalan,caracteres_problematicos: {'”'},"En el marc jurídic actual, la negociabilidad és inseparable de la possessió física del document de p...",,,,,
92256047,eliminacion_catalan,caracteres_problematicos: {'/'},"A més, no han d'utilitzar-se, com succeeix amb aquestes últimes, en futurs processos de contractació...",,,,,
92291248,eliminacion_catalan,caracteres_problematicos: {'·'},Aquesta capacitat col·lectiva de recuperació ha demostrat que el poble libanès veritablement ha avan...,,,,,
92296785,eliminacion_catalan,"caracteres_problematicos: {'”', '“'}","Dins de la sèrie L'ONU en acció, el Departament va produir un reportatge televisiu sobre les armes p...",,,,,
92325074,eliminacion_catalan,"caracteres_problematicos: {'—', '·'}",Es va establir un grup de treball —un comitè de seguiment— per a preparar la celebració de la segona...,,,,,
92383473,eliminacion_catalan,caracteres_problematicos: {'•'},"• Que estableixi com més aviat millor el Tribunal de Comptes, a fi d'impedir els casos de corrupció,...",,,,,
92446006,eliminacion_catalan,"caracteres_problematicos: {'”', '“'}",La funció i l'abast de la norma de la lex specialis i la qüestió dels “règims autònoms” es troben en...,,,,,
92474337,eliminacion_catalan,caracteres_problematicos: {'/'},Notificació feta pel Secretari General en virtut del paràgraf 2 de l'Article 12 de la Carta de les N...,,,,,
92480354,eliminacion_catalan,caracteres_problematicos: {'/'},"En la seva 46a sessió plenària celebrada el 30 de juliol de 1998 i per la seva decisió 1998/269, el ...",,,,,
92487080,eliminacion_catalan,"caracteres_problematicos: {'”', '“'}","El seu títol, “El desarmament, la no proliferació i la pau i la seguretat internacionals”, és massa ...",,,,,
92539227,eliminacion_catalan,"caracteres_problematicos: {'”', '“'}",Es va manifestar que no s'havia de limitar l'abast de l'article 1 a les activitats “no prohibides pe...,,,,,
92620293,eliminacion_catalan,caracteres_problematicos: {'·'},"Segons l'Iran, els contaminants transportats per l'aire procedents dels incendis de pous petroli es ...",,,,,
92671209,eliminacion_catalan,caracteres_problematicos: {'/'},Examen de l'aplicació de la Declaració sobre l'enfortiment de la seguretat internacional (decisió 56...,,,,,
92676838,eliminacion_catalan,caracteres_problematicos: {'%'},"b) Creació d'una nova modalitat per a la ""habitatge bàsic"", sota la forma de subsidi, que permet als...",,,,,
92726436,eliminacion_catalan,caracteres_problematicos: {'·'},"El propòsit autèntic d'aquest mur és l'expansió, l'establiment de nous assentaments i la instal·laci...",,,,,
92728292,eliminacion_catalan,"caracteres_problematicos: {'”', '/', '“'}","En la seva 34a sessió, celebrada el 12 de novembre, el representant del Marroc, en nom dels Estats m...",,,,,
92738923,eliminacion_catalan,caracteres_problematicos: {'·'},Senyora Presidenta: Ens ajustarem a la seva sol·licitud i no farem una declaració.,,,,,
92741290,eliminacion_catalan,caracteres_problematicos: {'·'},Recordant en particular les resolucions de les Nacions Unides en què s'afirma que els assentaments i...,,,,,
92753768,eliminacion_catalan,caracteres_problematicos: {'·'},El Conveni de Mont-real de 1971 per a la repressió d'actes il·lícits contra la seguretat de l'aviaci...,,,,,
92793027,eliminacion_catalan,"caracteres_problematicos: {'”', '/', '“'}","“Encoratja els Estats Membres a celebrar consultes i a cooperar en el marc de les Nacions Unides, el...",,,,,
92803522,eliminacion_catalan,caracteres_problematicos: {'/'},Decideix examinar novament en el seu cinquantè vuitè període de sessions la qüestió de l'administrac...,,,,,
92822293,eliminacion_catalan,caracteres_problematicos: {'°'},Pren nota de l'informe del Secretari General d'execució financera de la Força corresponent al períod...,,,,,
92840282,eliminacion_catalan,caracteres_problematicos: {'%'},"Els serveis més generalitzats són l'assistència i l'ajuda domiciliària a les persones d'edat, que s'...",,,,,
92979971,eliminacion_catalan,caracteres_problematicos: {'%'},08:00 Fa mesos 0%,,,,,
92988751,eliminacion_catalan,caracteres_problematicos: {'+'},"17,600+ termes de treball en 60+ països amb 6,300+ organitzacions",,,,,
92995448,eliminacion_catalan,caracteres_problematicos: {'~'},Nombre de treballadors: 200~300,,,,,
93017858,eliminacion_catalan,caracteres_problematicos: {'%'},1GRAMO 1W 0L _ 100% Ràtio de victòries,,,,,
