linea,tipo,razon,texto_original,porcentaje_automatico,detalles_base,detalles_avanzados,texto_catalan,texto_chino
51428,eliminacion_catalan,caracteres_problematicos: {'—'},"Durant més d'un segle, la nostra facultat ha estat definint —i redefinint— la manera com el món fa n...",,,,,
64919,eliminacion_catalan,caracteres_problematicos: {'“'},“Els extremistes tenen por dels llibres i els bolígrafs.,,,,,
134439,eliminacion_catalan,caracteres_problematicos: {'“'},"“No és una feina curta, però estan treballant el més ràpid possible.",,,,,
321175,eliminacion_catalan,caracteres_problematicos: {'“'},"“Hi ha homes que ens serveixen, com el cònsol de Trollesund.",,,,,
457315,eliminacion_catalan,"caracteres_problematicos: {'”', '“'}","“No”, va dir l'àngel.",,,,,
518043,eliminacion_catalan,"caracteres_problematicos: {'”', '“'}",“Ningú vol veure iPhones aconseguir aixafat als careers de les principals ciutats xineses.”.,,,,,
649665,eliminacion_catalan,caracteres_problematicos: {'·'},"""Aquest assaig il·lustra que necessitem desenvolupar eines més precises si volem salvar la vida dels...",,,,,
688838,eliminacion_catalan,"caracteres_problematicos: {'”', '“', '–'}","“El canvi és com el cel: Tothom vol anar-hi, però ningú vol morir” – Carly Fiorina",,,,,
702228,eliminacion_catalan,"caracteres_problematicos: {'”', '“'}","En aquest sentit, hi ha moltes veus a la Xina que destaquen que “la Xina ha fet prou o fins i tot ma...",,,,,
719307,eliminacion_catalan,caracteres_problematicos: {'“'},"“Tothom està preparat, esperant a veure quin és el llenguatge d'aquesta versió de la prohibició musu...",,,,,
720969,eliminacion_catalan,caracteres_problematicos: {'“'},"“Al contrari, l'evidència mostra clarament que va compartir informació amb els seus superiors segons...",,,,,
824001,eliminacion_catalan,caracteres_problematicos: {'·'},"Estàvem treballant en la postproducció d'aquesta pel·lícula, i ens vam mudar a Los Angeles el desemb...",,,,,
891835,eliminacion_catalan,caracteres_problematicos: {'·'},I prohibirem que els reguladors dels serveis financers exerceixin pressió sobre els seus antics col·...,,,,,
917396,eliminacion_catalan,"caracteres_problematicos: {'●', '%'}",● El 74% dels metges creuen que s'han produït miracles.,,,,,
1037563,eliminacion_catalan,caracteres_problematicos: {'“'},"“Als meus joves amics: la vida pot ser genial, però no quan no la veus.",,,,,
1143282,eliminacion_catalan,caracteres_problematicos: {'·'},"Com ha dit, ja tenim una excel·lent cooperació entre el Regne Unit i Nigèria, que inclou l'educació,...",,,,,
1218551,eliminacion_catalan,caracteres_problematicos: {'–'},Vostè –amb tota raó– té por d'equivocar-se a l'hora d'exercir els seus nous poders.,,,,,
1259533,eliminacion_catalan,"caracteres_problematicos: {'“', '·'}",“Vaig tenir una situació en què un paio em va dir que col·leccionava i pintava cavalls en miniatura.,,,,,
1289474,eliminacion_catalan,caracteres_problematicos: {'“'},"Sempre que Napoles visitava, “estava acompanyada d'un seguici.",,,,,
1397418,eliminacion_catalan,caracteres_problematicos: {'»'},"Després d'aquesta reunió, pot donar-me una llista de presos polítics i, si tenim a aquests presos po...",,,,,
1442753,eliminacion_catalan,caracteres_problematicos: {'/'},"Juntament amb l'augment de l'estandardització, la ISO/TS 16949 pretén crear nous nivells de valor af...",,,,,
1514534,eliminacion_catalan,caracteres_problematicos: {'“'},“Estic orgullós d'anunciar que Wrights ja no podrà estafar els inversors amb els seus diners duramen...,,,,,
1830321,eliminacion_catalan,caracteres_problematicos: {'—'},"Les ""icones de riquesa"" convencionals — diamants, or — són precioses perquè són rares.",,,,,
1908439,eliminacion_catalan,"caracteres_problematicos: {'”', '“'}",He escoltat (mossegar-me la llengua) les dones explicar com “accidentalment” s'han quedat embarassad...,,,,,
2044803,eliminacion_catalan,caracteres_problematicos: {'%'},Riscos: El sector bancari romanès és propietat en un 75% dels bancs europeus i s'enfronta a riscos d...,,,,,
2177931,eliminacion_catalan,caracteres_problematicos: {'='},"Per example, tal com s'ha descrit anteriorment apareixeria a x = log(1), y = log(69971).",,,,,
2280804,eliminacion_catalan,caracteres_problematicos: {'“'},"“Prometem-nos avui a renovar i enfortir els nostres compromisos polítics, humanitaris i financers.",,,,,
2295678,eliminacion_catalan,caracteres_problematicos: {'·'},"La major part d'aquesta nova capacitat solar, segons l'informe, s'instal·larà a Nigèria, Ghana i Cos...",,,,,
2388828,eliminacion_catalan,"caracteres_problematicos: {'”', '“'}","Per example, considerem que dues persones són diferents, independentment dels “atributs” que posseei...",,,,,
2393875,eliminacion_catalan,"caracteres_problematicos: {'°', '/'}",Tots els costats d'aquestes figures tenen la mateixa longitud; i tots els seus angles són múltiples ...,,,,,
2414143,eliminacion_catalan,"caracteres_problematicos: {'”', '%', '“'}","Com vaig escriure el 2016, tots els models electorals basats en els fonaments, com el model “pa i pa...",,,,,
2454681,eliminacion_catalan,caracteres_problematicos: {'·'},"Croàcia:Els nacionals de Croàcia, el membre més recent de la Unió Europea, poden des de l'1 de julio...",,,,,
2631434,eliminacion_catalan,caracteres_problematicos: {'·'},No hi ha proves directes que Coprudu Muhammad Pasha hagi participat en la conspiració per posar fi a...,,,,,
2665198,eliminacion_catalan,caracteres_problematicos: {'·'},"""L'aplicació d'aquesta tecnologia en dispositius domèstics actuals és un important pas endavant que ...",,,,,
2775900,eliminacion_catalan,caracteres_problematicos: {'·'},Diversos dels meus col·legues es van queixar que Dave complicava massa les coses.,,,,,
2849233,eliminacion_catalan,caracteres_problematicos: {'/'},Truther Watch: Jeremy Corbyn diu que 9/11 va ser 'manipulat' (al Daily Telegraph),,,,,
2850955,eliminacion_catalan,"caracteres_problematicos: {'”', '/', '“'}","A més, en un altre moment estrany, l'ambaixador/mare de la víctima mostra el nom d'un videoclip de l...",,,,,
2895075,eliminacion_catalan,caracteres_problematicos: {'“'},“Arreglarem que el president s'oblidi de trucar.,,,,,
2937764,eliminacion_catalan,"caracteres_problematicos: {'“', '·'}","“Tothom ha sentit a parlar de conceptes com els cotxes autònoms, les llars intel·ligents, la IA i la...",,,,,
3112275,eliminacion_catalan,caracteres_problematicos: {'·'},"Per contra, en una llar veritablement intel·ligent, els mateixos electrodomèstics són capaços d'apre...",,,,,
3120059,eliminacion_catalan,caracteres_problematicos: {'·'},"Tot i això, l'ètica no és l'única àrea que involucra la intel·ligència artificial i les qüestions de...",,,,,
3170793,eliminacion_catalan,caracteres_problematicos: {'”'},Potser resoldre la crisi dels elefants significa tractar-la com una qüestió de drets humans i justíc...,,,,,
3194286,eliminacion_catalan,caracteres_problematicos: {'·'},Han vist germans mil·lenaris més grans ofegar-se en deutes estudiantils.,,,,,
3371930,eliminacion_catalan,caracteres_problematicos: {'&'},AT&T i WorldCom volen que regalem quota de mercat.,,,,,
3416682,eliminacion_catalan,caracteres_problematicos: {'·'},"Convidem a artistes que no coneixem a l'estudi, els ensenyem els nostres 20 anys combinats d'experiè...",,,,,
3461708,eliminacion_catalan,caracteres_problematicos: {'%'},"Diversos funcionaris de la Fed havien suggerit recentment eliminar el llindar del 6,5% i, en lloc d'...",,,,,
3487352,eliminacion_catalan,"caracteres_problematicos: {'·', '«'}",«El Senyor desitja que tota ànima que pretengui creure en la veritat tingui un coneixement intel·lig...,,,,,
3490351,eliminacion_catalan,caracteres_problematicos: {'”'},Així que queda't a la ciutat fins que et vesteixis de poder des de les altures.”.,,,,,
3492900,eliminacion_catalan,caracteres_problematicos: {'·'},"Anatoly: Per tant, si s'executa com un validador, estem utilitzant GPU per a tota la verificació de ...",,,,,
3494647,eliminacion_catalan,caracteres_problematicos: {'”'},"11 Fills meus, no us deixeu enganyar, perquè el Senyor us ha escollit perquè estigueu davant d'ell, ...",,,,,
3542406,eliminacion_catalan,caracteres_problematicos: {'*'},* L'anàlisi competitiva lliure de qualsevol dels actors del mercat.,,,,,
3569677,eliminacion_catalan,caracteres_problematicos: {'·'},"LFS mostra la seva feina a més de 200 festivals de cinema de tot el món cada any, i recolza la venda...",,,,,
3605179,eliminacion_catalan,"caracteres_problematicos: {'”', '“'}",Hi ha cap dubte que aquesta és la raó per la qual tantes cançons d'amor tenen la paraula “bebè”?,,,,,
3632733,eliminacion_catalan,caracteres_problematicos: {'·'},"Ara, però, noves dades de científics de la Universitat de Connecticut, en col·laboració amb col·legu...",,,,,
3648689,eliminacion_catalan,caracteres_problematicos: {'·'},Tots van conduir al mateix resultat: una disminució en el nombre de cèl·lules immunitàries destructi...,,,,,
3696385,eliminacion_catalan,"caracteres_problematicos: {'”', '“'}",L'origen de l'Islam: les “Escriptures Anteriors”,,,,,
3701771,eliminacion_catalan,caracteres_problematicos: {'—'},"Que som lliures, fora de perill de la persecució, i a càrrec de nosaltres mateixos — aquestes coses ...",,,,,
3801937,eliminacion_catalan,caracteres_problematicos: {'»'},Ja hem contractat 1.290 funcionaris de presons addicionals durant l'any passat.».,,,,,
3910761,eliminacion_catalan,caracteres_problematicos: {'»'},"Fins ara, això no era possible perquè totes aquestes inversions s'administrarien per separat.».",,,,,
4003478,eliminacion_catalan,caracteres_problematicos: {'&'},"Quan s'enfronta a un problema d'aquest tipus, la implementació d'un provador automàtic de final de l...",,,,,
4085240,eliminacion_catalan,caracteres_problematicos: {'×'},"Per tant, si voleu construir la vostra pròpia xarxa IPv6, el més probable és que el vostre proveïdor...",,,,,
4174815,eliminacion_catalan,caracteres_problematicos: {'·'},Viljakainen va dir que el Ministeri de Treball investigaria per determinar la causa del col·lapse.,,,,,
4209737,eliminacion_catalan,caracteres_problematicos: {'·'},"Els científics van pensar una vegada que les neurones, o possiblement les cèl·lules del cor, eren le...",,,,,
4262896,eliminacion_catalan,"caracteres_problematicos: {'”', '“'}","“Airswap”, és aquell que està rebent cada vegada més atenció, tot i que encara no és funcional.",,,,,
4268666,eliminacion_catalan,caracteres_problematicos: {'%'},"A més, el 70,3% dels cubans tenien entre 15 i 64 anys, mentre que el 10,6% de la població cubana el ...",,,,,
4281866,eliminacion_catalan,caracteres_problematicos: {'·'},Lien'A compta amb tres instal·lacions de producció al Vietnam per satisfer la creixent demanda nacio...,,,,,
4315265,eliminacion_catalan,"caracteres_problematicos: {']', '['}","Va ocupar aquest càrrec fins al maig de 1945, quan va ser arrestat per les Forces Armades americanes...",,,,,
4350478,eliminacion_catalan,caracteres_problematicos: {'·'},"Encara que Tasmània no disposa de presons privades, la legislació vigent permet que les presons gove...",,,,,
4400842,eliminacion_catalan,"caracteres_problematicos: {'”', '“', '·'}","Però com que no podem posar fi al “festival” a curt termini, el govern local hauria de promoure alme...",,,,,
4426681,eliminacion_catalan,"caracteres_problematicos: {'”', '“'}","Busqueu la icona de la pàgina al costat d'ells, a més d'un títol en anglès senzill com ara “Posicion...",,,,,
4465884,eliminacion_catalan,caracteres_problematicos: {'·'},IBM va participar al programa Apol·lo des del principi.,,,,,
4491911,eliminacion_catalan,caracteres_problematicos: {'@'},Una xarxa internacional sense ànim de lucre va utilitzar G@ per enquestar els ciutadans de 24 països...,,,,,
4631481,eliminacion_catalan,caracteres_problematicos: {'—'},"I el progrés en l'agricultura més que res — la patata, per example, que va ser introduït entre nosal...",,,,,
4637072,eliminacion_catalan,caracteres_problematicos: {'”'},"És per això que estem feliços de rebre'l de nou al nostre equip, per començar junts una temporada d'...",,,,,
4866169,eliminacion_catalan,caracteres_problematicos: {'“'},“Volem que la gent continuï descobrint i coneixent nous productes i serveis a través dels anuncis de...,,,,,
4996869,eliminacion_catalan,caracteres_problematicos: {'—'},"En el seu favor jugat preus baixos, un ampli ventall de possibilitats d'activitats d'oci i proximita...",,,,,
4997205,eliminacion_catalan,caracteres_problematicos: {'•'},• Bust Mida preu és molt més barat que els serveis de cirurgia plàstica.,,,,,
5117690,eliminacion_catalan,caracteres_problematicos: {'/'},Podem / Hem d'interpretar la Bíblia literalment?,,,,,
5142883,eliminacion_catalan,caracteres_problematicos: {'/'},"Un grapat d'altres països, inclosos els Estats Units, tenen electricitat de 110 volts/60 hertz, que ...",,,,,
5213340,eliminacion_catalan,caracteres_problematicos: {'“'},"“Tinc una mica de diners, però no gaire.",,,,,
5220182,eliminacion_catalan,caracteres_problematicos: {'·'},"Alhora, els Estats Units suggerien que la seva protecció de la propietat intel·lectual era suprema.",,,,,
5239975,eliminacion_catalan,"caracteres_problematicos: {'”', '“'}","“Deixeu-nos!”, va dir el follet, “Gabriel Grub ens deixarà.",,,,,
5284476,eliminacion_catalan,caracteres_problematicos: {'“'},"“S'està matisant més, segur, s'està complicant.",,,,,
5307087,eliminacion_catalan,"caracteres_problematicos: {'#', '—'}",Entrada anteriorAnterior La següent 100 Coses que vostè necessita saber sobre la gent: #117 — Per qu...,,,,,
5362782,eliminacion_catalan,"caracteres_problematicos: {'+', '£', '%'}","Per example, si vostè guanya 350.000 £ llavors la taxa serà RPI + 1,5%.",,,,,
5427811,eliminacion_catalan,caracteres_problematicos: {'·'},"Tot i això, els investigadors afirmen que les seves troballes simplement serveixen per il·lustrar la...",,,,,
5516973,eliminacion_catalan,caracteres_problematicos: {'%'},Un altre 39% va ser consumit per la indústria química.,,,,,
5767289,eliminacion_catalan,caracteres_problematicos: {'”'},"A més, com que els minoristes generalment reben els seus diamants dels majoristes en consignació, i ...",,,,,
5873118,eliminacion_catalan,"caracteres_problematicos: {'”', '“'}","Un nou estudi conclou que els treballadors són més productius que mai, però aquests guanys no aparei...",,,,,
5909126,eliminacion_catalan,caracteres_problematicos: {'/'},"Recordeu, 0,36 g / lliura és una mitjana.",,,,,
5965884,eliminacion_catalan,caracteres_problematicos: {'·'},"Newtec (www.newtec.eu) està especialitzada en el disseny, desenvolupament i fabricació d'equips i te...",,,,,
6012707,eliminacion_catalan,caracteres_problematicos: {'”'},Els estudiants han de reflexionar on es podria utilitzar i qui se'n pot beneficiar i això significa ...,,,,,
6017814,eliminacion_catalan,caracteres_problematicos: {'·'},"Mentre reconstruïm les nostres maneres de dormir i tinguem prou somni, les nostres cèl·lules cerebra...",,,,,
6101677,eliminacion_catalan,"caracteres_problematicos: {'”', '“', '$'}","Aquest problema va portar a un míting exuberant a finals de 2017, quan totes les monedes per sota d'...",,,,,
6127055,eliminacion_catalan,caracteres_problematicos: {'·'},"L'oli de gira-sol és una altra excel·lent opció, ja que aporta més de 5 mg de la vitamina, i es pot ...",,,,,
6131949,eliminacion_catalan,caracteres_problematicos: {'·'},Grup d'Explicació 2: Les civilitzacions intel·ligents de tipus II i III són allà fora; i hi ha raons...,,,,,
6157994,eliminacion_catalan,caracteres_problematicos: {'“'},"“(Els nord-americans) van prendre la medalla d'or olímpica, però no lliurarem la Copa del Món.",,,,,
6238477,eliminacion_catalan,"caracteres_problematicos: {'”', '“'}",“Quan el cor mor” de “A la terra de la sang i la mel”,,,,,
6361760,eliminacion_catalan,caracteres_problematicos: {'·'},"Molt més tard, el llançament al mercat del primer telèfon intel·ligent IBM Simon el 1994 va establir...",,,,,
6493321,eliminacion_catalan,caracteres_problematicos: {'%'},"Alguns diuen que la introducció de regulacions clares sobre el comerç de marges és urgent, ja que el...",,,,,
6531578,eliminacion_catalan,"caracteres_problematicos: {'”', '“'}","La majoria de fures “treballadores” s'utilitzen per erradicar ferides, però tenen altres finalitats ...",,,,,
6561077,eliminacion_catalan,caracteres_problematicos: {'#'},Cada rostit és d'aproximadament 3#.,,,,,
6638559,eliminacion_catalan,caracteres_problematicos: {'/'},"En alguns llenguatges informàtics (per example, C i PL/I) hi ha una fase de traducció coneguda com a...",,,,,
6650512,eliminacion_catalan,caracteres_problematicos: {'%'},"A nivell mundial, el 85% dels enquestats va dir que necessita habilitats digitals a la feina, però e...",,,,,
6661529,eliminacion_catalan,caracteres_problematicos: {'%'},Una llevadora amb els coneixements i la formació adequats pot proporcionar el 87% de l'atenció sanit...,,,,,
6712890,eliminacion_catalan,"caracteres_problematicos: {'”', ']', '“', '['}","“Aquest esforç, si Déu vol, animarà els grups islàmics a abandonar el seu partidisme i també anuncia...",,,,,
6732440,eliminacion_catalan,"caracteres_problematicos: {'”', '“'}","Just en el moment en què trontollava a la recerca de l'enfocament correcte, un petit miracle va caur...",,,,,
6755749,eliminacion_catalan,"caracteres_problematicos: {'”', '“'}",Associem tant el pas del temps amb el progrés que utilitzem el terme “el futur” per referir-nos a un...,,,,,
6774837,eliminacion_catalan,caracteres_problematicos: {'·'},Ara Montazami i els seus col·legues han desenvolupat una bateria transitòria que pot alimentar una c...,,,,,
6793209,eliminacion_catalan,caracteres_problematicos: {'“'},"Lluites pel teu amic, per mantenir-lo viu, i ell lluita per tu, i tot sobre l'exèrcit es construeix ...",,,,,
6842250,eliminacion_catalan,"caracteres_problematicos: {'”', '“'}","McDonald's també s'enfronta a un cas històric a la Junta Nacional de Relacions Laborals, on, per pri...",,,,,
6922230,eliminacion_catalan,caracteres_problematicos: {'%'},Investigadors canadencs anteriors van descobrir que només el 57% dels nadons romanen adormits durant...,,,,,
6984700,eliminacion_catalan,caracteres_problematicos: {'/'},Podeu trobar enllaços a la llista de treballs finalitzats cada setmana a mw:VisualEditor/Weekly Tria...,,,,,
7046529,eliminacion_catalan,caracteres_problematicos: {'·'},Els immunòlegs saben des de fa temps que els limfòcits B i els limfòcits T poden emmagatzemar la mem...,,,,,
7053647,eliminacion_catalan,"caracteres_problematicos: {'‘', '–'}",I la nostra àvia ens va dir que en el dialecte s'anomenaven mentides – ‘són com mentides: semblen gr...,,,,,
7157420,eliminacion_catalan,caracteres_problematicos: {'='},15 no és semidivisible perquè és un múltiple de lps(15) = 3 i ups(15) = 5.,,,,,
7225725,eliminacion_catalan,caracteres_problematicos: {'·'},Cox va qualificar la sentència d'injusta i excessiva i va dir que planeja apel·lar la decisió.,,,,,
7279915,eliminacion_catalan,caracteres_problematicos: {'”'},"És aquesta idea d'exploració”, va dir el fundador i CEO de Niantic, John Hanke, durant una xerrada a...",,,,,
7331126,eliminacion_catalan,caracteres_problematicos: {'“'},"“Quan ell ja no hi era, vaig obrir el meu despatx, em vaig assegurar que el meu tresor estigués fora...",,,,,
7356985,eliminacion_catalan,caracteres_problematicos: {'”'},"Però quan puc, vull triar la vida i el sentit.”.",,,,,
7432890,eliminacion_catalan,caracteres_problematicos: {'·'},"Em van sol·licitar el passaport, es va fer una trucada telefònica.",,,,,
7453007,eliminacion_catalan,caracteres_problematicos: {'·'},El director del Districte 9 planifica 'Una altra pel·lícula en aquest món,,,,,
7473337,eliminacion_catalan,"caracteres_problematicos: {'”', '“'}","“Amb un n'hi ha prou, crec.”.",,,,,
7480658,eliminacion_catalan,caracteres_problematicos: {'“'},"“Hi ha moltes coses que em connecten personalment amb la universitat: els meus pares, la meva dona, ...",,,,,
7487624,eliminacion_catalan,caracteres_problematicos: {'·'},"Segons els informes, la primera i més profunda investigació en aquest àmbit a Rússia ha desenvolupat...",,,,,
7491654,eliminacion_catalan,caracteres_problematicos: {'·'},Els sol·licitants de la borsa de l'any passat van representar més de 125 programes per a la primera ...,,,,,
7498842,eliminacion_catalan,caracteres_problematicos: {'“'},"“Però una vegada tens aquesta peça, no hi ha res en la literatura periodística que he vist, ni en la...",,,,,
7549958,eliminacion_catalan,caracteres_problematicos: {'·'},· SMART Investment i Expo Internacional de la Propietat,,,,,
7555721,eliminacion_catalan,caracteres_problematicos: {'€'},"20,00 € per persona, ordinari i estudiants",,,,,
7633339,eliminacion_catalan,caracteres_problematicos: {'@'},Tenen la seu al Centre Mèdic MEDIPLEX @ Subang Jaya.,,,,,
7705202,eliminacion_catalan,caracteres_problematicos: {'·'},"La gent sovint la fantasia és robots intel·ligents, ciutat submarina i cotxes voladors i així succes...",,,,,
7750741,eliminacion_catalan,caracteres_problematicos: {'—'},"—Ah, doncs, farem un pas endavant —va dir el coronel reposant fredament per tornar a esmorzar.",,,,,
7752346,eliminacion_catalan,caracteres_problematicos: {'·'},David Hubel i Torsten Wiesel van aclarir com funciona aquest procés durant la dècada de 1960: A l'es...,,,,,
7770068,eliminacion_catalan,caracteres_problematicos: {'·'},"A l'última entrada del bloc d'aquesta sèrie, parlem d'una nova corba el·líptica per als zk-SNARK ano...",,,,,
7819200,eliminacion_catalan,"caracteres_problematicos: {'%', '/'}","Recordeu la regla del 80/20, i sàpiga quina és la clau del 20%.",,,,,
7829045,eliminacion_catalan,caracteres_problematicos: {'—'},"Ara bé, el que diu el verset 14 —i aquest és un dels esdeveniments més importants de la història— és...",,,,,
7844611,eliminacion_catalan,caracteres_problematicos: {'·'},"A les pel·lícules, Steve Rogers és un soldat de l'exèrcit nord-americà de la Segona Guerra Mundial q...",,,,,
7888414,eliminacion_catalan,caracteres_problematicos: {'·'},"Molt ràpidament va netejar els tobogans i els va tornar a col·locar, va aclarir el seu lloc al banc,...",,,,,
7970193,eliminacion_catalan,caracteres_problematicos: {'·'},"Les investigacions demostren que si s'eliminen les cèl·lules mare, el cor no es pot reparar després ...",,,,,
7991917,eliminacion_catalan,caracteres_problematicos: {'“'},“No poden permetre que continuï creixent.,,,,,
8085269,eliminacion_catalan,"caracteres_problematicos: {'”', '“'}",“Com funciona la màquina econòmica.”.,,,,,
8096894,eliminacion_catalan,"caracteres_problematicos: {'#', '—', '@'}",Em sap greu decebre — @realDonaldTrump és fantàstic. #DealWithIt.,,,,,
8101826,eliminacion_catalan,"caracteres_problematicos: {'”', '“'}","“No tothom pot presentar les dades amb claredat, ni tan sols algunes persones que treballen activame...",,,,,
8115700,eliminacion_catalan,caracteres_problematicos: {'%'},"L'anàlisi mostra que Modbus és el protocol industrial més utilitzat (58%), seguit d'Ethernet IP (28%...",,,,,
8125158,eliminacion_catalan,caracteres_problematicos: {'%'},El 62% dels pares indiquen que el pediatre dels seus fills no ha destacat la importància de les vacu...,,,,,
8157039,eliminacion_catalan,caracteres_problematicos: {'“'},"“Un cop més, reiterem el que el General d'Exèrcit Raúl Castro Ruz, President dels Consells d'Estat i...",,,,,
8229803,eliminacion_catalan,"caracteres_problematicos: {'”', '“'}","Ho faràs, entre altres coses, treballant per projectes en “assignacions de la vida real” de la indús...",,,,,
8313554,eliminacion_catalan,caracteres_problematicos: {'·'},"En aquest context, els sistemes d'il·luminació tenen un paper important tant del conductor com d'alt...",,,,,
8317685,eliminacion_catalan,caracteres_problematicos: {'“'},“La meva família va emigrar de Costa d'Ivori a França el 1995 i solia explicar-me com era de difícil...,,,,,
8342865,eliminacion_catalan,"caracteres_problematicos: {'”', '“'}","En un article publicat recentment, conceptualitzem el capital pacient com una inversió en una “relac...",,,,,
8344906,eliminacion_catalan,"caracteres_problematicos: {'”', '“'}",Ho diria d'aquesta manera: “Quan aprofites el moment amb Déu a través de la pregària i per la fe amb...,,,,,
8346135,eliminacion_catalan,caracteres_problematicos: {'·'},Les sentències de diumenge encara poden ser apel·lades.,,,,,
8379952,eliminacion_catalan,"caracteres_problematicos: {'”', '“'}","Però, diu DeCarlo, quan van arribar, després de viatjar més de quatre hores en cotxe i quatre hores ...",,,,,
8469869,eliminacion_catalan,caracteres_problematicos: {'–'},2011 – Preus dels aliments – de la crisi a l'estabilitat,,,,,
8525331,eliminacion_catalan,caracteres_problematicos: {'&'},"Ha publicat quatre llibres, entre ells A Mother's Gift, i ha publicat set DVD, incloent-hi la seva s...",,,,,
8602261,eliminacion_catalan,caracteres_problematicos: {'%'},D'acord amb l'esquema de disseny del 3%.,,,,,
8617910,eliminacion_catalan,caracteres_problematicos: {'%'},"El febrer del 2012, el Banc del Japó va tornar a augmentar les compres d'actius en 10 bilions de ien...",,,,,
8723158,eliminacion_catalan,caracteres_problematicos: {'·'},"Un assassinat en massa en nom d'una idea, una doctrina, una teoria, una religió: això és tot el que ...",,,,,
