linea,tipo,razon,texto_original,porcentaje_automatico,detalles_base,detalles_avanzados,texto_catalan,texto_chino
86469648,eliminacion_catalan,caracteres_problematicos: {'%'},"En els últims temps, el Govern ha destinat un 10% més per a cada nen, a més de l'ajuda que reben de ...",,,,,
86480550,eliminacion_catalan,caracteres_problematicos: {'·'},El recent Ministeri de Drets Humans exerceix la seva activitat en col·laboració amb un òrgan consult...,,,,,
86503440,eliminacion_catalan,caracteres_problematicos: {'·'},També han participat o participen actualment en el Grup de Washington les següents organitzacions in...,,,,,
86567660,eliminacion_catalan,caracteres_problematicos: {'/'},El Conveni de les Nacions Unides sobre el contracte de transport internacional de mercaderies total ...,,,,,
86571341,eliminacion_catalan,"caracteres_problematicos: {'“', '”'}",Consultes oficioses sobre el projecte de resolució titulat “Modalitats per al quart Diàleg d'alt niv...,,,,,
86591838,eliminacion_catalan,caracteres_problematicos: {'/'},"En aquesta etapa, l'enfocament més creïble consistiria probablement a establir una petita presència ...",,,,,
86615209,eliminacion_catalan,"caracteres_problematicos: {'“', '”', '·'}","El terme “assassinat” ha d'entendre's en el seu sentit consuetudinari, a saber: matar a un ésser hum...",,,,,
86637210,eliminacion_catalan,caracteres_problematicos: {'·'},Al maig de 2006 es van publicar directrius per a presentar sol·licituds al fons fiduciari del Progra...,,,,,
86680016,eliminacion_catalan,"caracteres_problematicos: {'°', '·'}",19. A sol·licitud de la Comissió Consultiva se li va informar que de la suma total de 6.710.100 dòla...,,,,,
86700756,eliminacion_catalan,caracteres_problematicos: {'·'},:: Suport i manteniment d'una xarxa de comunicacions integrada per 1 estació terrestre de comunicaci...,,,,,
86736588,eliminacion_catalan,caracteres_problematicos: {'/'},"Shin Boonam (República de Corea) (parla en anglès): En primer lloc, la meva delegació dóna les gràci...",,,,,
86828988,eliminacion_catalan,caracteres_problematicos: {'/'},Van formular també declaracions els observadors de la Campanya Erlassjahr/Jubilee (societat civil) i...,,,,,
86979921,eliminacion_catalan,caracteres_problematicos: {'/'},Projecte de resolució A/C.3/64/L.9/Rev.1: Aplicació dels resultats del Cim Mundial sobre Desenvolupa...,,,,,
87015795,eliminacion_catalan,caracteres_problematicos: {'”'},El tribunal hauria d'especificar l'abast de la coordinació processal decretada.”,,,,,
87019396,eliminacion_catalan,"caracteres_problematicos: {'“', '”'}","vii) Projecte d'article 15, “Represa del procediment”.",,,,,
87031433,eliminacion_catalan,caracteres_problematicos: {'·'},c) Hauria d'encoratjar-se a la UNODC al fet que continuï prestant assistència tècnica per a la refor...,,,,,
87100608,eliminacion_catalan,caracteres_problematicos: {'·'},IV. Observacions finals i sol·licituds d'assistència tècnica 111 - 113 24,,,,,
87168395,eliminacion_catalan,caracteres_problematicos: {'/'},"89. El Govern ha augmentat el nombre d'institucions d'ensenyament superior (vegeu E/C.12/ETH/1-4, pa...",,,,,
87176188,eliminacion_catalan,caracteres_problematicos: {'·'},297. A cada instal·lació penitenciària del Servei de Presons d'Israel hi ha una clínica a càrrec d'u...,,,,,
87220120,eliminacion_catalan,caracteres_problematicos: {'%'},El 28% dels voluntaris en les missions de les Nacions Unides són dones.,,,,,
87227350,eliminacion_catalan,caracteres_problematicos: {'/'},Informe del Secretari General sobre la revisió triennal àmplia de la política relativa a les activit...,,,,,
87326268,eliminacion_catalan,caracteres_problematicos: {'/'},43. El CSAC va prendre nota de la informació sobre les entitats d'enllaç designades i de les directr...,,,,,
87344168,eliminacion_catalan,caracteres_problematicos: {'·'},"31. De conformitat amb un acord administratiu entre la ONUDI i la Federació de Rússia, la Federació ...",,,,,
87422514,eliminacion_catalan,caracteres_problematicos: {'/'},Per obtenir més detalls i informes d'avanç es pot consultar el lloc http://www.ind.homeoffice.gov.uk...,,,,,
87435435,eliminacion_catalan,caracteres_problematicos: {'%'},La suma dels participants en el SGPC constitueix un important mercat: els seus 43 participants repre...,,,,,
87451816,eliminacion_catalan,caracteres_problematicos: {'['},"[Regla 4, Apèndix 1 i 2",,,,,
87464703,eliminacion_catalan,caracteres_problematicos: {'·'},El representant de Kazakhstan va presentar un document de sessió que contenia un projecte de decisió...,,,,,
87520697,eliminacion_catalan,caracteres_problematicos: {'+'},D + 1 any + 60 dies,,,,,
87677379,eliminacion_catalan,caracteres_problematicos: {'/'},"3.112 De conformitat amb el que es disposa en la resolució 63/310 de l'Assemblea General, a principi...",,,,,
87688034,eliminacion_catalan,caracteres_problematicos: {'·'},"El Secretari General també sol·licita que es mantingui per un altre any, fins a desembre de 2012, la...",,,,,
87763887,eliminacion_catalan,caracteres_problematicos: {'%'},És així com un Estat pot haver superat amb escreix el mínim de 50% sense que el quintil més pobre ti...,,,,,
87774107,eliminacion_catalan,caracteres_problematicos: {'·'},"En consultes oficioses, el Grup sol·licitarà més informació sobre les mesures que adoptarà el Comitè...",,,,,
87904461,eliminacion_catalan,"caracteres_problematicos: {'“', '”'}",Recordant també l'informe del Secretari General titulat “Enfortiment de la coordinació de l'assistèn...,,,,,
87911005,eliminacion_catalan,caracteres_problematicos: {'·'},"Si no s'ha declarat cap instal·lació BSL4 en el formulari A, part 1 i), indiqueu quin és el major ni...",,,,,
87958263,eliminacion_catalan,caracteres_problematicos: {'%'},"Quan apareixen desglossats, s'observa un nombre significativament més elevat d'homes que de dones am...",,,,,
88025364,eliminacion_catalan,caracteres_problematicos: {'·'},"En una declaració general, el representant de Turquia va explicar que la seva delegació havia votat ...",,,,,
88045544,eliminacion_catalan,caracteres_problematicos: {'·'},"L'organització col·labora amb el UNFPA, la CESPAP, la OIT i l'OMS.",,,,,
88127403,eliminacion_catalan,"caracteres_problematicos: {'[', ']'}","12.00 hores Reunió informativa per a la premsa a càrrec del Portaveu [Invitada: Sra. Hilde Johnson, ...",,,,,
88163657,eliminacion_catalan,caracteres_problematicos: {'·'},16. sol·licita al Consell de Seguretat de les Nacions Unides que examini contribucions i actualitzac...,,,,,
88168140,eliminacion_catalan,caracteres_problematicos: {'/'},"Recordant les seves resolucions anteriors 1373 (2001), 1526 (2004), 1540 (2004), 1970 (2011), 1973 (...",,,,,
88219251,eliminacion_catalan,"caracteres_problematicos: {'[', ']'}",[5. Tota Part podrà presentar una proposta per a incloure i registrar un procés de fabricació en el ...,,,,,
88227023,eliminacion_catalan,caracteres_problematicos: {'·'},"Algunes d'aquestes tècniques alternatives plantegen problemes, com el major pes dels productes final...",,,,,
88357010,eliminacion_catalan,caracteres_problematicos: {'/'},"No obstant això, de conformitat amb el paràgraf 16 de la resolució 65/243 A, se subministrarà inform...",,,,,
88411511,eliminacion_catalan,caracteres_problematicos: {'/'},"Recordant també les resolucions de la Comissió de Drets Humans 1991/42, de 5 de març de 1991, i 1997...",,,,,
88528921,eliminacion_catalan,caracteres_problematicos: {'/'},"En la mateixa sessió, va quedar aprovat el projecte de resolució, en la seva forma oralment revisada...",,,,,
88625093,eliminacion_catalan,"caracteres_problematicos: {'·', '/'}","En l'actualitat, la Dependència de Lluita contra el Blanqueig de Diners/Unitat d'Intel·ligència Fina...",,,,,
88650309,eliminacion_catalan,"caracteres_problematicos: {'“', '”'}",Un dels mòduls està dedicat a “El gènere i els drets sexuals i reproductius de les adolescents i les...,,,,,
88734706,eliminacion_catalan,caracteres_problematicos: {'/'},13.33 Les tarifes per als programes de primer grau i superiors en les institucions financeres finanç...,,,,,
88771756,eliminacion_catalan,caracteres_problematicos: {'·'},Acollint amb beneplàcit les conclusions de la 22a Reunió de Caps dels Organismes Nacionals Encarrega...,,,,,
88820424,eliminacion_catalan,"caracteres_problematicos: {']', '[', '/', '—'}",S/2012/751 Carta de data 9 d'octubre de 2012 dirigida al Secretari General pel President del Consell...,,,,,
88824527,eliminacion_catalan,caracteres_problematicos: {'/'},Presentació del projecte de resolució A/C.3/67/L.14/Rev.2,,,,,
88832291,eliminacion_catalan,caracteres_problematicos: {'/'},L'orador diu que considera que els membres de la configuració encarregada de Burundi desitgen adopta...,,,,,
88852736,eliminacion_catalan,caracteres_problematicos: {'·'},L'acusació va al·legar que havia planejat les massacres de tutsis ocorregudes a l'església de Nyange...,,,,,
88905999,eliminacion_catalan,caracteres_problematicos: {'·'},"El Centre dóna suport a una àmplia xarxa de centres d'excel·lència a la Xina, el que els permet ofer...",,,,,
88947577,eliminacion_catalan,caracteres_problematicos: {'/'},:: Informe d'investigació sobre explotació i abusos sexuals comesos contra una persona menor d'edat ...,,,,,
88953380,eliminacion_catalan,caracteres_problematicos: {'·'},"L'estratègia d'execució de les activitats es basa en el reconeixement que la ciència, tecnologia i i...",,,,,
88988822,eliminacion_catalan,caracteres_problematicos: {'/'},"66/294, par. 19",,,,,
89088450,eliminacion_catalan,caracteres_problematicos: {'·'},"Els terroristes, que voldrien venjar-se de l'autor suposadament per haver revelat el seu pla del rob...",,,,,
89129418,eliminacion_catalan,caracteres_problematicos: {'/'},"Més recentment, la part turcoxipriota ha demostrat una vegada més la seva bona voluntat, en autoritz...",,,,,
89155889,eliminacion_catalan,"caracteres_problematicos: {'“', '”', '%'}","A més, en el quadre 9.20, la mesura de l'execució de l'indicador c) i), “Major quantitat de personal...",,,,,
89166759,eliminacion_catalan,caracteres_problematicos: {'·'},"Respecte de la qüestió de quina estratègia era millor, hi havia qui pensava que era preferible treur...",,,,,
89218261,eliminacion_catalan,"caracteres_problematicos: {'[', ']'}","És de destacar primer de tot que, en distingir entre "" tot acord ulterior "" (article 31 3) a) de la ...",,,,,
89270642,eliminacion_catalan,"caracteres_problematicos: {'“', '”'}","No obstant això, és evident que les religions i les creences poden servir de poderosos demarcadors d...",,,,,
89273574,eliminacion_catalan,caracteres_problematicos: {'·'},"Grups d'interessats: Actes paral·lels organitzats pels Estats, les empreses, les institucions nacion...",,,,,
89310667,eliminacion_catalan,caracteres_problematicos: {'·'},"Observant que, si bé alguns països en desenvolupament han estat els principals agents del creixement...",,,,,
89311752,eliminacion_catalan,"caracteres_problematicos: {'·', '/'}",39.Recorda que en els paràgrafs 30 i 31 de la seva resolució 63/253 va decidir que les condicions de...,,,,,
89336552,eliminacion_catalan,caracteres_problematicos: {'·'},La devolució dels sol·licitants d'asil somalis i afganesos: la regulació hongaresa de les diligèncie...,,,,,
89346086,eliminacion_catalan,caracteres_problematicos: {'·'},Abans de convidar a la senyora Secretària General a dirigir-se a la Conferència voldria permetre al ...,,,,,
89358744,eliminacion_catalan,"caracteres_problematicos: {'“', '”'}",Projecte per a l'Adequació Institucional de les Dones Víctimes: l'objectiu del Projecte és “millorar...,,,,,
89363723,eliminacion_catalan,caracteres_problematicos: {'%'},d) Pel que fa a les persones beneficiàries de les prestacions per desocupació en el seu nivell contr...,,,,,
89365215,eliminacion_catalan,caracteres_problematicos: {'/'},"A més, la Llei sobre la condició i els drets dels pacients (785/1992, article 5) estableix el dret d...",,,,,
89459994,eliminacion_catalan,caracteres_problematicos: {'%'},Els europeus (en la seva majoria francesos) constitueixen el 12% de la població i altres grups ètnic...,,,,,
89486237,eliminacion_catalan,caracteres_problematicos: {'%'},"L'índex de masculinitat és de 906 dones per 1.000 homes, la taxa d'alfabetització és del 56%, la mor...",,,,,
89487484,eliminacion_catalan,caracteres_problematicos: {'·'},"No obstant això, cap de les mesures recomanades pel Diàleg es refereix a la igualtat entre els gèner...",,,,,
89552043,eliminacion_catalan,caracteres_problematicos: {'/'},"La Mesa decideix recomanar l'assignació de temes proposada en el document A/BUR/68/1, tenint en comp...",,,,,
89693353,eliminacion_catalan,caracteres_problematicos: {'·'},4. Reconeixem que per contrarestar el tràfic il·lícit d'armes petites i lleugeres i les seves munici...,,,,,
89702407,eliminacion_catalan,caracteres_problematicos: {'/'},b) Fons Central per a l'Acció en Casos d'Emergència (resolució 68/102).,,,,,
89718230,eliminacion_catalan,caracteres_problematicos: {'°'},"L'examen va tenir en compte els diversos compromisos internacionals relacionats amb la governança, a...",,,,,
89767065,eliminacion_catalan,caracteres_problematicos: {'·'},f) La col·laboració amb associats nacionals i internacionals per promoure i mantenir la seguretat hu...,,,,,
89799080,eliminacion_catalan,caracteres_problematicos: {'·'},"4.3 L'Estat parteix al·lega a més que, en 2010, l'autor va mantenir correspondència amb el Tribunal ...",,,,,
89803749,eliminacion_catalan,caracteres_problematicos: {'/'},Informe del President del Grup de Treball d'Experts sobre els Afrodescendents (A/69/318),,,,,
89807665,eliminacion_catalan,caracteres_problematicos: {'·'},La noció de reparació col·lectiva recentment ha despertat interès i suport.,,,,,
89829664,eliminacion_catalan,caracteres_problematicos: {'/'},"En els paràgrafs 9 i 10 de la resolució S-22/1, el Consell:",,,,,
89856789,eliminacion_catalan,caracteres_problematicos: {'%'},Els models van indicar que si la Caixa obtenia una xifra inferior a la taxa real de rendiment hipotè...,,,,,
89930969,eliminacion_catalan,caracteres_problematicos: {'·'},Les cambres col·laboraven amb els governs tant en el disseny com en l'aplicació de les polítiques go...,,,,,
90144368,eliminacion_catalan,caracteres_problematicos: {'·'},"És necessari tenir en compte les qüestions de gènere en la planificació, programació i execució, des...",,,,,
90178142,eliminacion_catalan,caracteres_problematicos: {'·'},"Si es decideix seguir endavant amb l'avaluació, el Grup multidisciplinari d'experts sol·licitarà als...",,,,,
90201554,eliminacion_catalan,caracteres_problematicos: {'·'},"A més, en la seva resolució 2039 (2012), el Consell de Seguretat em va sol·licitar que, per conducte...",,,,,
90207141,eliminacion_catalan,caracteres_problematicos: {'·'},"Dos dies més tard, el 21 de desembre, va assenyalar a més a la premsa que ara estava en oberta rebel...",,,,,
90265919,eliminacion_catalan,caracteres_problematicos: {'·'},El crèdit que se sol·licita té per objecte sufragar les despeses relatives a la preparació i publica...,,,,,
90328647,eliminacion_catalan,caracteres_problematicos: {'/'},Examen de l'informe del Grup de Treball (A/C.6/60/L.6),,,,,
90328728,eliminacion_catalan,"caracteres_problematicos: {'“', '”', '•'}",• Substitueixi's “Ministeri Federal d'Assumptes Econòmics i Treball” en la matriu per “Ministeri Fed...,,,,,
90390703,eliminacion_catalan,"caracteres_problematicos: {'“', '”'}","Per tant, encomiem la iniciativa de la Cort d'establir l'anomenada “matriu de casos” que, entre altr...",,,,,
90392690,eliminacion_catalan,caracteres_problematicos: {'·'},Participació de les entitats de les Nacions Unides en la Carta de cooperació per a aconseguir la uti...,,,,,
90399671,eliminacion_catalan,"caracteres_problematicos: {'“', '”'}","Starke s'hi mostra d'acord, afirmant que “en principi, a falta de qualsevol manifestació clara d'int...",,,,,
90405948,eliminacion_catalan,caracteres_problematicos: {'—'},Diversos associats bilaterals i multilaterals —penso particularment en les institucions financeres i...,,,,,
90408521,eliminacion_catalan,"caracteres_problematicos: {'·', '/'}","A més, la Comissió va prendre nota de les recomanacions pertinents que figuraven en la Declaració de...",,,,,
90438630,eliminacion_catalan,"caracteres_problematicos: {'—', '/'}","El grup dels quatre països —el Brasil, Alemanya, l'Índia i el Japó— recolzat per molts altres patroc...",,,,,
90483041,eliminacion_catalan,caracteres_problematicos: {'/'},"Així, a partir de 2001, el Govern de Cap Verd, per conducte del Ministeri de Salut, va llançar una f...",,,,,
90500121,eliminacion_catalan,"caracteres_problematicos: {'“', '”', '·'}",“Reafirmant la resolució relativa a l'Orient Mitjà aprovada l'11 de maig de 1995 per la Conferència ...,,,,,
90592274,eliminacion_catalan,"caracteres_problematicos: {'`', '”'}",b) Decideix també incloure en el programa del seixantè segon període de sessions de l'Assemblea Gene...,,,,,
90612687,eliminacion_catalan,"caracteres_problematicos: {'“', '”'}","No obstant això, segons l'actual sistema d'estadístiques sobre la delinqüència, les dades relatives ...",,,,,
90635761,eliminacion_catalan,"caracteres_problematicos: {'“', '”'}",El projecte de recerca pluriennal de l'UNIDIR titulat “El desarmament com a activitat humanitària: a...,,,,,
90704354,eliminacion_catalan,"caracteres_problematicos: {'”', '%'}","Ha arrasat amb milers d'hectàrees de terrenys i pous d'aigua a Cisjordània, la qual cosa significarà...",,,,,
90732590,eliminacion_catalan,caracteres_problematicos: {'/'},El Comitè convida a l'Estat Part al fet que presenti juntament amb el següent informe periòdic un do...,,,,,
90756404,eliminacion_catalan,caracteres_problematicos: {'·'},Col·laboració en matèria de seguretat entre les Nacions Unides i les organitzacions no governamental...,,,,,
90775825,eliminacion_catalan,"caracteres_problematicos: {'“', '”'}",En la transformació agroalimentària: Segons un estudi sobre els resultats de les mesures adoptades p...,,,,,
90852820,eliminacion_catalan,"caracteres_problematicos: {'“', '”'}","b) En l'apartat b) del paràgraf 2 de la part dispositiva, les paraules “de candidates adequades, enf...",,,,,
90856087,eliminacion_catalan,"caracteres_problematicos: {'[', ']'}",Quant a l'argument dels autors que la reserva d'Àustria només es refereix a la Comissió Europea i no...,,,,,
90941284,eliminacion_catalan,"caracteres_problematicos: {'“', '”'}","En la primera oració afegeixi's la paraula “equitatiu”, després de “desenvolupament global,”.",,,,,
90959711,eliminacion_catalan,caracteres_problematicos: {'•'},"• Així mateix, vehicles i sistemes de comunicació especialitzats permeten el transport segur i prote...",,,,,
91039673,eliminacion_catalan,"caracteres_problematicos: {'“', '”'}",Una “entitat única” procura suprimir sovint la llum penetrant de la societat civil i una premsa acti...,,,,,
91050429,eliminacion_catalan,caracteres_problematicos: {'·'},Encoratja als països participants en el Procés de Kimberley al fet que considerin el possible augmen...,,,,,
91067566,eliminacion_catalan,caracteres_problematicos: {'%'},"Com es mostra en el quadre 4 de l'informe, les necessitats de recursos per a les Sales, l'any 2001, ...",,,,,
91095365,eliminacion_catalan,caracteres_problematicos: {'/'},Els membres del Consell tenen davant sí l'informe de la Missió del Consell de Seguretat a Timor-Lest...,,,,,
91099675,eliminacion_catalan,caracteres_problematicos: {'/'},"En la seva 28a sessió, celebrada el 18 d'agost de 2000, la Subcomissió de Promoció i Protecció dels ...",,,,,
91134331,eliminacion_catalan,caracteres_problematicos: {'/'},"En el seu 51è període de sessions, la Subcomissió, en la seva resolució 1999/9, va demanar una vegad...",,,,,
91161290,eliminacion_catalan,"caracteres_problematicos: {'/', ']'}",] La participació d'entitats del sector privat i/o del sector públic en activitats de projectes del ...,,,,,
91168894,eliminacion_catalan,caracteres_problematicos: {'/'},"És necessari assenyalar, no obstant això, que d'acord amb el paràgraf 4 de la resolució 40/243 de l'...",,,,,
91175710,eliminacion_catalan,caracteres_problematicos: {'·'},"En atenció a aquesta sol·licitud, el 20 de maig de 1999 l'Oficina de l'Alt Comissionat per als Drets...",,,,,
91226334,eliminacion_catalan,"caracteres_problematicos: {']', '[', '/'}",El propòsit de l'examen de la informació sobre les quantitats atribuïdes és assegurar que [la CP/RP ...,,,,,
91441522,eliminacion_catalan,caracteres_problematicos: {'·'},Agressió armada israeliana contra les instal·lacions nuclears iraquianes i les seves greus conseqüèn...,,,,,
91471428,eliminacion_catalan,"caracteres_problematicos: {'·', '/'}",Els membres del Consell tenen davant si l'informe del Secretari General sobre la sol·licitud de Nepa...,,,,,
91553783,eliminacion_catalan,caracteres_problematicos: {'%'},La Subcomissió va assenyalar la importància dels serveis basats en l'espai per donar una alarma prim...,,,,,
91655698,eliminacion_catalan,"caracteres_problematicos: {'“', '”'}",h) Hauria d'haver-hi disposicions que permetessin a tots els detinguts impugnar la legalitat de la d...,,,,,
91657445,eliminacion_catalan,caracteres_problematicos: {'/'},"A aquest respecte, la Comissió Consultiva observa que per a 2000 s'havien calculat 465 dies i els di...",,,,,
91795778,eliminacion_catalan,caracteres_problematicos: {'·'},L'annex IV conté informació sobre les qualificacions i altres condicions que cal complir per ser mem...,,,,,
91915508,eliminacion_catalan,caracteres_problematicos: {'/'},"L'altre problema té a veure amb la proliferació del nombre d'interlocutors de la societat civil, en ...",,,,,
91950918,eliminacion_catalan,"caracteres_problematicos: {'“', '”'}",La Conferència dels Estats part (en endavant “la Conferència”) estarà integrada per tots els membres...,,,,,
91956332,eliminacion_catalan,"caracteres_problematicos: {'“', '”'}","Aquests programes existeixen en gairebé tots els països, per exemple el Programa conjunt de Madagasc...",,,,,
91993261,eliminacion_catalan,caracteres_problematicos: {'·'},Si bé les resolucions en virtut de les quals es va crear la Comissió de Consolidació de la Pau han d...,,,,,
92046371,eliminacion_catalan,"caracteres_problematicos: {'“', '”'}","“El creditor garantit haurà de retornar tot ben gravat que estigui en la seva possessió quan, no ten...",,,,,
92053047,eliminacion_catalan,caracteres_problematicos: {'“'},“1. Pren nota de l'informe del Grup Intergovernamental d'Experts encarregat d'examinar l'experiència...,,,,,
92056370,eliminacion_catalan,"caracteres_problematicos: {'“', '”'}","No obstant això, en aquests compromisos polítics està en bona part absent l'ús del terme “educació” ...",,,,,
92069786,eliminacion_catalan,caracteres_problematicos: {'·'},Es van demanar aclariments sobre com preparava l'ACNUR la planificació per a situacions imprevistes ...,,,,,
92082759,eliminacion_catalan,"caracteres_problematicos: {'%', '·'}","La Sra. Sung (Regne Unit) diu que, a Irlanda del Nord, només un 29% de les sol·licituds per a nomena...",,,,,
92087667,eliminacion_catalan,"caracteres_problematicos: {'“', '”'}",La iniciativa del “sistema únic de les Nacions Unides” demostra el compromís de l'Organització d'enf...,,,,,
92091780,eliminacion_catalan,caracteres_problematicos: {'·'},"Com s'assenyala en l'excel·lent nota preparada pel President, la responsabilitat primordial de conso...",,,,,
92096001,eliminacion_catalan,"caracteres_problematicos: {'·', '/'}",Se sol·liciten altres tres llocs del quadre de serveis generals (altres categories) per a donar supo...,,,,,
92114490,eliminacion_catalan,caracteres_problematicos: {'·'},El 16 de juliol de 2006 la Relatora Especial sobre la llibertat de religió i el Relator Especial sob...,,,,,
92125372,eliminacion_catalan,caracteres_problematicos: {'•'},• Vetllar perquè les normes internacionals relatives als drets dels pobles indígenes s'incorporin en...,,,,,
92138522,eliminacion_catalan,caracteres_problematicos: {'·'},La política de la Comissió de la Comunitat francesa en matèria d'assistència social s'articula al vo...,,,,,
92146710,eliminacion_catalan,caracteres_problematicos: {'/'},"Comunicació núm. 97/1997, par. 6.6 i 7.",,,,,
92166384,eliminacion_catalan,"caracteres_problematicos: {'“', '”'}","S'ha notificat a Turquia que, de resultes de l'anomenat referèndum i de conformitat amb la “Constitu...",,,,,
92171596,eliminacion_catalan,caracteres_problematicos: {'/'},8 Vegeu la Revisió triennal àmplia de la política relativa a les activitats operacionals per al dese...,,,,,
92182281,eliminacion_catalan,caracteres_problematicos: {'—'},També hi ha programes conjunts destinats a la protecció dels nens —com el projecte per a enfortir la...,,,,,
92205719,eliminacion_catalan,caracteres_problematicos: {'/'},Antecedents. Vegeu el programa provisional i anotacions de l'OSE 25 (FCCC/SBI/2006/12).,,,,,
92216298,eliminacion_catalan,"caracteres_problematicos: {'“', '”'}",Es defineix la “estabilitat” com la desviació típica (1 sigma) de la variació d'un paràmetre particu...,,,,,
92222131,eliminacion_catalan,"caracteres_problematicos: {'“', '”'}",El Comitè recomana a l'Estat Part que en els seus plans i programes utilitzi sistemàticament el term...,,,,,
92232790,eliminacion_catalan,caracteres_problematicos: {'•'},• Problemes de transport i comunicació,,,,,
