linea,tipo,razon,texto_original,porcentaje_automatico,detalles_base,detalles_avanzados,texto_catalan,texto_chino
87034543,eliminacion_catalan,caracteres_problematicos: {'·'},Les víctimes apàtrides del tràfic de persones o el tràfic il·lícit són cada vegada més nombroses.,,,,,
87113802,eliminacion_catalan,caracteres_problematicos: {'%'},En el grup d'edat de 15 a 24 anys aquesta taxa era del 96% en 1994 i del 97% en 2000.,,,,,
87165018,eliminacion_catalan,caracteres_problematicos: {'%'},Actualment el càncer aporta més del 20% de totes les defuncions.,,,,,
87190926,eliminacion_catalan,caracteres_problematicos: {'·'},La capacitació dels funcionaris posa en relleu aquesta missió i anima a tots ells a ser proactius en...,,,,,
87221155,eliminacion_catalan,caracteres_problematicos: {'·'},Diverses delegacions van acollir amb satisfacció i van recolzar les observacions sobre la sol·licitu...,,,,,
87228542,eliminacion_catalan,"caracteres_problematicos: {'/', '°'}",2009/237. Informe de la Comissió d'Estadística sobre el seu 40è període de sessions i programa provi...,,,,,
87246078,eliminacion_catalan,caracteres_problematicos: {'·'},"La Iniciativa sobre les Ciutats i el Canvi Climàtic, posada en marxa en 2009, col·labora amb una gra...",,,,,
87283581,eliminacion_catalan,caracteres_problematicos: {'·'},Entre 2006 i 2009 l'ONG va realitzar les activitats següents: a) amb el Servei de les Nacions Unides...,,,,,
87334617,eliminacion_catalan,caracteres_problematicos: {'·'},"La ONUDI serà més eficaç, fort i respondrà millor a la demanda si concentra la seva labor en àmbits ...",,,,,
87359791,eliminacion_catalan,"caracteres_problematicos: {'”', '“'}","Reunió informativa sobre el tema “Cimera de Seguretat Nuclear: resultats, avanços i pròximes mesures...",,,,,
87399420,eliminacion_catalan,caracteres_problematicos: {'·'},"El 8 de juliol, el Primer Ministre al-Maliki va visitar Beirut per a retre homenatge al difunt Gran ...",,,,,
87447934,eliminacion_catalan,caracteres_problematicos: {'/'},C. Llibre Blau sobre les millors pràctiques en la promoció i facilitació de la inversió a Zàmbia - G...,,,,,
87590309,eliminacion_catalan,caracteres_problematicos: {'·'},Nova Zelanda va realitzar patrulles aèries en l'Oceà Pacífic i l'Oceà Glacial Àrtic i va proporciona...,,,,,
87687482,eliminacion_catalan,caracteres_problematicos: {'/'},En l'informe del Comitè Mixt s'indica que es proposa un total de 62.532.100 dòlars en la partida de ...,,,,,
87800054,eliminacion_catalan,caracteres_problematicos: {'/'},"49. Quant a l'article 11 3), demana que es mantingui la conjunció "" i "", que li sembla millor que "" ...",,,,,
87834641,eliminacion_catalan,caracteres_problematicos: {'/'},a) Un informe nacional/exposició per escrit de conformitat amb el paràgraf 15 a) (A/HRC/WG.6/10/NAM/...,,,,,
87902166,eliminacion_catalan,"caracteres_problematicos: {'/', '·'}","28. Exhorta a l'Alta Comissionada de les Nacions Unides per als Drets Humans al fet que, de conformi...",,,,,
87944895,eliminacion_catalan,caracteres_problematicos: {'%'},"211. Segons dades obtingudes de l'Institut Pedagògic de la República, de la República Srpska, en 50 ...",,,,,
88015046,eliminacion_catalan,caracteres_problematicos: {'/'},"d) Concloure l'avaluació independent de la iniciativa "" Units en l'acció "" per a 2011/12",,,,,
88129955,eliminacion_catalan,caracteres_problematicos: {'/'},La Comissió accepta la proposta del President de suspendre l'aplicació de l'article 120 del reglamen...,,,,,
88271880,eliminacion_catalan,"caracteres_problematicos: {'%', '/', '·'}",3.3 Tramitació en el dia de totes les sol·licituds d'evacuació mèdica de les missions i de les sol·l...,,,,,
88323624,eliminacion_catalan,caracteres_problematicos: {'·'},La FAO va treballar en estreta col·laboració amb la OIT en l'àmbit de l'ocupació rural decent; la se...,,,,,
88327336,eliminacion_catalan,"caracteres_problematicos: {'/', '+'}","En 2012, ONU-Dones es va convertir en el membre més recent de la Iniciativa Salut 4+, sumant-se al U...",,,,,
88363862,eliminacion_catalan,caracteres_problematicos: {'%'},Les despeses imputades a un compromís ja establert i certificat no requeriran una certificació addic...,,,,,
88412551,eliminacion_catalan,caracteres_problematicos: {'/'},"La Comissió també recorda la seva recomanació anterior que es prenguin mesures, segons sigui necessa...",,,,,
88419621,eliminacion_catalan,caracteres_problematicos: {'%'},"La despesa total realitzada per mitjà dels associats nacionals en l'execució en 2011 va ser de 58,6 ...",,,,,
88476639,eliminacion_catalan,caracteres_problematicos: {'/'},"El primer, que figura en el document A/C.1/66/L.1, es titula "" Creació d'una zona lliure d'armes nuc...",,,,,
88505609,eliminacion_catalan,caracteres_problematicos: {'·'},:: Membre de la delegació en la reunió plenària d'alt nivell de l'Assemblea General sobre els Object...,,,,,
88506910,eliminacion_catalan,caracteres_problematicos: {'/'},En el paràgraf 16 de la secció II de la seva resolució 66/233 l'Assemblea General va demanar al Secr...,,,,,
88559791,eliminacion_catalan,caracteres_problematicos: {'/'},13. No es va assenyalar a l'atenció del Comitè de Coordinació cap denúncia per suposada conducta imp...,,,,,
88574834,eliminacion_catalan,caracteres_problematicos: {'·'},"75. De manera paral·lela a les obligacions de caràcter jurídic, la recerca demostra que abordar la q...",,,,,
88713820,eliminacion_catalan,caracteres_problematicos: {'%'},"La taxa de creixement de 2011 va ser equivalent a un augment del 3,1% del producte per capita.",,,,,
88785335,eliminacion_catalan,caracteres_problematicos: {'/'},"255. L'OSE, en el seu 36è període de sessions, va decidir recomanar a la CP un projecte de decisió p...",,,,,
88786070,eliminacion_catalan,caracteres_problematicos: {'/'},"70. En la seva decisió 5/CMP.7, la CP/RP va prendre coneixement de la decisió 8/CP.17, per la qual e...",,,,,
88811176,eliminacion_catalan,caracteres_problematicos: {'·'},"En vista d'aquesta experiència, és molt probable que es rebin noves sol·licituds durant el pròxim ex...",,,,,
88865352,eliminacion_catalan,caracteres_problematicos: {'·'},"37. Igual que al Centre Juvenil Musulmà de Kenya, la direcció del Centre Juvenil Musulmà Ansaar mant...",,,,,
88943731,eliminacion_catalan,"caracteres_problematicos: {'*', '/'}",Els Principis també inclouen disposicions sobre la necessitat de respectar la confidencialitat de la...,,,,,
89089848,eliminacion_catalan,caracteres_problematicos: {'/'},"Abans de la votació, van formular declaracions els representants de la República Àrab Síria, Bahrain...",,,,,
89126377,eliminacion_catalan,caracteres_problematicos: {'·'},"Les empreses basades en Internet, com Google i Facebook, s'han convertit en importants passarel·les ...",,,,,
89182821,eliminacion_catalan,caracteres_problematicos: {'%'},Per segon exercici econòmic consecutiu Botswana s'ha vist obligada a destinar un 10% del seu pressup...,,,,,
89207485,eliminacion_catalan,caracteres_problematicos: {'/'},Tema 140 del programa: Informe sobre les activitats de l'Oficina de Serveis de Supervisió Interna (c...,,,,,
89281368,eliminacion_catalan,caracteres_problematicos: {'%'},En l'informe sobre una visita conjunta sobre el terreny realitzada al març de 2012 per sis organitza...,,,,,
89307352,eliminacion_catalan,"caracteres_problematicos: {']', '['}","48. De conformitat amb la "" Directiva dels Estats parteixes sobre la Dependència de Suport a l'Aplic...",,,,,
89454728,eliminacion_catalan,caracteres_problematicos: {'·'},En relació amb els indicadors de qualitat de vida recollits en els Objectius de Desenvolupament del ...,,,,,
89508324,eliminacion_catalan,caracteres_problematicos: {'/'},"El President del CSAC va declarar que l'aplicació conjunta es trobava en un moment decisiu, en què e...",,,,,
89559483,eliminacion_catalan,"caracteres_problematicos: {'/', ']', '['}",2. Efectes de les radiacions atòmiques: informe de la Comissió Política Especial i de Descolonitzaci...,,,,,
89621561,eliminacion_catalan,"caracteres_problematicos: {'”', '“'}","No obstant això, es van produir despeses en excés de les consignacions en les partides pressupostàri...",,,,,
89659374,eliminacion_catalan,caracteres_problematicos: {'·'},"La Dependència durà a terme diverses activitats preparatòries al llarg de 2014, entre les quals cal ...",,,,,
89695819,eliminacion_catalan,caracteres_problematicos: {'/'},"Des que es va aprovar la resolució 58/316, la Mesa s'ha reunit durant cada període de sessions de l'...",,,,,
89698376,eliminacion_catalan,caracteres_problematicos: {'·'},"Les pràctiques corruptes, que inclouen la falta d'una governança corporativa sòlida a nivell interna...",,,,,
89713724,eliminacion_catalan,"caracteres_problematicos: {'/', '·'}","Els Països Baixos van votar a favor de la resolució 67/36 de l'Assemblea General, en la qual es va s...",,,,,
89784632,eliminacion_catalan,caracteres_problematicos: {'·'},Els sol·licitants d'asil que entren il·legalment en el territori d'un Estat parteix podran ser detin...,,,,,
89948099,eliminacion_catalan,caracteres_problematicos: {'/'},"51. En la seva resolució 17/4, el Consell de Drets Humans va decidir crear un fòrum sobre les empres...",,,,,
90036303,eliminacion_catalan,caracteres_problematicos: {'*'},Observacions finals sobre el setè informe periòdic de Finlàndia*,,,,,
90051270,eliminacion_catalan,caracteres_problematicos: {'·'},"Anima a l'Estat parteix a col·laborar amb tots els actors interessats, com ara associacions d'empres...",,,,,
90060256,eliminacion_catalan,caracteres_problematicos: {'%'},"També ha augmentat el nombre d'alumnes en els àmbits relacionats amb les arts, que ha passat de 27.9...",,,,,
90065440,eliminacion_catalan,caracteres_problematicos: {'/'},"1. El Comitè va examinar els informes periòdics 14è a 17è de Luxemburg, presentats en un sol documen...",,,,,
90070012,eliminacion_catalan,caracteres_problematicos: {'·'},e) Sol·liciti l'assistència financera i tècnica de l'UNICEF i l'Organització Mundial de la Salut (OM...,,,,,
90075834,eliminacion_catalan,"caracteres_problematicos: {']', '['}","Els paràgrafs 10 i 11 de la Constitució reforcen aquest compromís en precisar que ""[t]odo gabonés té...",,,,,
90098207,eliminacion_catalan,caracteres_problematicos: {'/'},2013/210.Responsabilitats especials de la Mesa del Consell Econòmic i Social per al període de sessi...,,,,,
90098388,eliminacion_catalan,caracteres_problematicos: {'/'},2013/250. Informe de la Junta Internacional de Fiscalització d'Estupefaents,,,,,
90314423,eliminacion_catalan,caracteres_problematicos: {'/'},"e) Declaració presentada per la World Population Foundation, organització no governamental reconegud...",,,,,
90342575,eliminacion_catalan,caracteres_problematicos: {'·'},c) Col·loqui relatiu a la reforma del dret sobre les operacions garantides - el projecte de guia leg...,,,,,
90370882,eliminacion_catalan,"caracteres_problematicos: {'/', '”', '“'}","Així mateix, el Grup va prendre en consideració les opinions expressades en les respostes rebudes de...",,,,,
90393803,eliminacion_catalan,caracteres_problematicos: {'”'},"Tenint en compte la informació esmentada, el Govern de l'Aràbia Saudita no considera que el seu arre...",,,,,
90410257,eliminacion_catalan,"caracteres_problematicos: {'/', '·', '”', '“'}","Sobre aquest tema, permeti-se'm, en primer lloc, donar les gràcies al Secretari General de les Nacio...",,,,,
90447060,eliminacion_catalan,caracteres_problematicos: {'“'},“Destacant que l'existència de la pobresa extrema generalitzada inhibeix el gaudi ple i efectiu dels...,,,,,
90475006,eliminacion_catalan,"caracteres_problematicos: {'/', '·', '”', '“'}",Sol·licita al Director Executiu que li presenti en el seu 49è període de sessions un informe sobre e...,,,,,
90475332,eliminacion_catalan,caracteres_problematicos: {'/'},La Junta Executiva examinarà les formes de simplificar la informació requerida per determinar que un...,,,,,
90516816,eliminacion_catalan,caracteres_problematicos: {'•'},"• Instituir processos per definir les metes, i els indicadors de mesurament dels resultats en matèri...",,,,,
90533318,eliminacion_catalan,caracteres_problematicos: {'·'},"Dels 30 participants que van respondre, 4 van qualificar la reunió com a ""excel·lent"", 19 com a ""mol...",,,,,
90551917,eliminacion_catalan,"caracteres_problematicos: {'”', '“'}","a) La paraula “Estat”, que figura en la primera oració de la recomanació 206 (variant B) s'entendrà ...",,,,,
90553395,eliminacion_catalan,caracteres_problematicos: {'/'},La plantilla es basa en les directrius per a la preparació de les comunicacions nacionals de les Par...,,,,,
90621202,eliminacion_catalan,caracteres_problematicos: {'/'},"Les Parts també hauran d'assegurar i/o facilitar l'accés a tecnologies pertinents, inclosa la biotec...",,,,,
90630741,eliminacion_catalan,caracteres_problematicos: {'°'},"Aprova, amb efecte a partir del 1° de gener de 2008, com recomana la Comissió en el paràgraf 30 del ...",,,,,
90755267,eliminacion_catalan,"caracteres_problematicos: {'”', '“'}","Les seves paraules han estat “No hi ha una solució simple, sens dubte no és una solució militar.”.",,,,,
90763376,eliminacion_catalan,"caracteres_problematicos: {'”', '“'}",“L'assoliment de la pau i l'aplicació de la demarcació de la frontera comuna entre els dos països és...,,,,,
90771126,eliminacion_catalan,caracteres_problematicos: {'/'},"Observant amb gran preocupació que, segons el Programa Conjunt de les Nacions Unides sobre el VIH/SI...",,,,,
90825036,eliminacion_catalan,caracteres_problematicos: {'·'},"El GTPB establirà grups d'acció, que són acords de col·laboració entre entitats, com organitzacions ...",,,,,
90879536,eliminacion_catalan,"caracteres_problematicos: {'”', '“'}","La regla 106.3 de la Reglamentació Financera Detallada de les Nacions Unides estableix que, “excepte...",,,,,
90899756,eliminacion_catalan,"caracteres_problematicos: {'”', '“'}",El primer d'ells es titula “Convenció sobre la Prohibició de la Utilització d'Armes Nuclears” i ha e...,,,,,
90901132,eliminacion_catalan,caracteres_problematicos: {'—'},Han parlat dels atemptats contra les ambaixades dels Estats Units a Kenya i Tanzània i els africans ...,,,,,
90949943,eliminacion_catalan,caracteres_problematicos: {'·'},"El Govern d'Uganda va continuar oferint assistència, orientació i suport polític valuosos a l'Instit...",,,,,
91018303,eliminacion_catalan,caracteres_problematicos: {'·'},Al començament del nou mil·lenni es presenten diversos objectius a la comunitat internacional com a ...,,,,,
91091386,eliminacion_catalan,caracteres_problematicos: {'/'},"En la mateixa sessió, la Comissió va aprovar el projecte de resolució A/C.5/54/L.74 sense procedir a...",,,,,
91101267,eliminacion_catalan,caracteres_problematicos: {'·'},Egipte creu que els resultats d'aquestes dues conferències ofereixen una base sòlida per a combatre ...,,,,,
91242199,eliminacion_catalan,"caracteres_problematicos: {'%', '•'}","• Malalties coronàries 9,4%",,,,,
91242360,eliminacion_catalan,caracteres_problematicos: {'•'},• Aconseguir que els mitjans i tècniques de la difusió de la Convenció deixin de ser simples instrum...,,,,,
91273745,eliminacion_catalan,caracteres_problematicos: {'/'},Vegeu la decisió 2000/271 del Consell.,,,,,
91281876,eliminacion_catalan,"caracteres_problematicos: {']', '['}","A l'efecte de l'aplicació de l'article 3 del Protocol de Kyoto, la definició de bosc és: terres on l...",,,,,
91405437,eliminacion_catalan,caracteres_problematicos: {'/'},"En el paràgraf 5 de la seva resolució 60/22, de 23 de novembre de 2005, l'Assemblea General va fer s...",,,,,
91412872,eliminacion_catalan,caracteres_problematicos: {'+'},"Quant als terminis, observem que ja s'han acordat les 1+4 esferes prioritàries de la Visió Conjunta.",,,,,
91450844,eliminacion_catalan,"caracteres_problematicos: {'·', '“'}",“El Consell encoratja al Secretari General i a la Unió Europea al fet que continuïn col·laborant amb...,,,,,
91472855,eliminacion_catalan,caracteres_problematicos: {'·'},"Per la seva banda, el moviment internacional en pro de l'alleujament del deute ha promogut la idea d...",,,,,
91511311,eliminacion_catalan,caracteres_problematicos: {'/'},"Els Acords internacionals derivats de la IV Conferència celebrada a Beijing el 1995, van significar ...",,,,,
91517170,eliminacion_catalan,caracteres_problematicos: {'·'},"La pau i la tranquil·litat és una realitat, però, com hem afirmat reiteradament, la situació continu...",,,,,
91638031,eliminacion_catalan,caracteres_problematicos: {'/'},"En la seva resolució 18/11, la Comissió d'Assentaments Humans va reconèixer que el principi de subsi...",,,,,
91665310,eliminacion_catalan,caracteres_problematicos: {'”'},Recorda als Estats que no ho hagin fet encara que poden en qualsevol moment fer una declaració en vi...,,,,,
91908717,eliminacion_catalan,caracteres_problematicos: {'·'},Voldria donar altres dades tràgiques per a il·lustrar la vida a Gaza.,,,,,
92052561,eliminacion_catalan,"caracteres_problematicos: {'”', '“'}","En la seva tercera sessió plenària, celebrada el 21 de setembre de 2007, l'Assemblea General, atesa ...",,,,,
92077530,eliminacion_catalan,"caracteres_problematicos: {'·', '”', '“'}",Rojo (Espanya): És per a mi un gran honor respondre a la seva invitació per a acudir a aquest debat ...,,,,,
92106300,eliminacion_catalan,caracteres_problematicos: {'·'},"d) El proveïdor o contractista, abans de presentar la seva oferta, podrà sol·licitar de l'entitat ad...",,,,,
92130896,eliminacion_catalan,caracteres_problematicos: {'/'},"Comunicació N.o 441/1990, Casanovas c. França, par.",,,,,
92143539,eliminacion_catalan,"caracteres_problematicos: {'”', '“'}",La Declaració defineix també el terme “estranger” sustentada en el criteri de la nacionalitat.,,,,,
92154260,eliminacion_catalan,"caracteres_problematicos: {'”', '“'}",La qüestió es va continuar analitzant durant la Conferència complementària titulada “Drets humans i ...,,,,,
92157966,eliminacion_catalan,"caracteres_problematicos: {'”', '“'}","La Divisió de la Qüestió de Xipre, que tracta concretament tots els assumptes relatius a la “Qüestió...",,,,,
92207724,eliminacion_catalan,"caracteres_problematicos: {'”', '“'}","S'espera que l'assignació de fons suplementaris per a projectes en el sector públic, de conformitat ...",,,,,
92210097,eliminacion_catalan,caracteres_problematicos: {'/'},"Per invitació del President, el President de la Junta Executiva del MDL, Sr. José Domingos González ...",,,,,
92212652,eliminacion_catalan,"caracteres_problematicos: {'”', '“'}",La Sra. Belmihoub-Zerdani diu que és necessari explicar amb més claredat el paràgraf 24 de les respo...,,,,,
92227002,eliminacion_catalan,caracteres_problematicos: {'/'},j) Informe del Grup de Treball VI (Garanties Reals) sobre la labor del seu tercer període de session...,,,,,
92265946,eliminacion_catalan,caracteres_problematicos: {'•'},"• Cada projecte executat pel UNITAR té un mecanisme d'avaluació realista, capaç de definir les metes...",,,,,
92310348,eliminacion_catalan,caracteres_problematicos: {'·'},"Finalment, voldria retre homenatge al meu col·lega d'Àustria, el mandat del qual com a representant ...",,,,,
92327497,eliminacion_catalan,"caracteres_problematicos: {'/', '”', '“'}","b) Una conferència sobre “La helioesfera i el seu medi ambient”, que se celebrarà al juny de 2008 a ...",,,,,
92366406,eliminacion_catalan,caracteres_problematicos: {'·'},"En primer lloc, vull sumar-me als membres del Consell per a agrair al Representant Especial del Secr...",,,,,
92374320,eliminacion_catalan,caracteres_problematicos: {'”'},"4, ha d'entendre's com qualsevol mesura que obligui a estrangers, com a grup, a sortir d'un país, ex...",,,,,
92380789,eliminacion_catalan,caracteres_problematicos: {'/'},"A/51/218, annex; vegeu també Legality of the Threat or Usi of Nuclear Weapons, Advisory Opinion, I.C...",,,,,
92462929,eliminacion_catalan,"caracteres_problematicos: {'“', '”', '[', '/', ']'}",Conferència de les Parts de l'Any 2000 encarregada de l'examen del Tractat sobre la no proliferació ...,,,,,
92631621,eliminacion_catalan,caracteres_problematicos: {'%'},"De fet, el 27% del Parlament Nacional de Timor-Leste està integrat per dones, amb la qual cosa gaire...",,,,,
92639166,eliminacion_catalan,caracteres_problematicos: {'/'},"La Comissió de Drets Humans, en la seva decisió 2000/108, va decidir demanar a la Subcomissió que de...",,,,,
92641657,eliminacion_catalan,"caracteres_problematicos: {'”', '“'}",Es va suggerir a més suprimir en el paràgraf c) la paraula “aprovat” referida al pla.,,,,,
92652334,eliminacion_catalan,caracteres_problematicos: {'·'},La meva delegació vol assenyalar que les drogues il·lícites constitueixen una de les principals font...,,,,,
92694586,eliminacion_catalan,caracteres_problematicos: {'&'},"L'Al-Hani Construction & Trading Bureau, Khalid Yousef Al Mutawa & Partners W.L.L. van concertar un ...",,,,,
92695408,eliminacion_catalan,"caracteres_problematicos: {'•', '/'}","• Així mateix, segons disposicions legislatives aprovades recentment, a saber, l'article 18 de la Ll...",,,,,
92733185,eliminacion_catalan,caracteres_problematicos: {'%'},Els càrrecs per concepte de suport als programes s'estimen en 11.152.500 dòlars per al bienni 2004-2...,,,,,
92743604,eliminacion_catalan,caracteres_problematicos: {'/'},"Va haver-hi objeccions respecte a aquesta regla, pel fet que aquesta extensió, intrínsecament ex pos...",,,,,
92744708,eliminacion_catalan,caracteres_problematicos: {'/'},El President de la Comissió Consultiva en Assumptes Administratius i de Pressupost presenta l'inform...,,,,,
92846148,eliminacion_catalan,caracteres_problematicos: {'/'},"Els Estats haurien d'adoptar, implementar i finançar com cal programes d'ensenyament i prevenció apr...",,,,,
92865271,eliminacion_catalan,caracteres_problematicos: {'/'},Subratlla que els informes que es presenten sobre els temes del programa de les Comissions Segona i ...,,,,,
92943794,eliminacion_catalan,caracteres_problematicos: {'#'},L'imperi en guerra #25.,,,,,
93065575,eliminacion_catalan,"caracteres_problematicos: {'”', '“'}","El 31 de Maig, 12.30-12.55 hores: Conferència “Tèxtils estrets innovadors, fabricats en màquines de ...",,,,,
93119133,eliminacion_catalan,caracteres_problematicos: {'/'},"21-28 pollastres (1,6 kg/3,5 lb)",,,,,
93121870,eliminacion_catalan,caracteres_problematicos: {'·'},La ciutat sembla tenir 2 emblemes que desafortunades no són oficials. El primer és una terminal plen...,,,,,
93129405,eliminacion_catalan,caracteres_problematicos: {'·'},"La vila Encore Vila 0200 ofereix les habitacions amb televisió per satèl·lit, climatització, una cai...",,,,,
93136204,eliminacion_catalan,caracteres_problematicos: {'/'},La companyia d'Oregon CZTRADE PLC LLC va ser qualificada amb 3.2/5 estrelles del 5 (nombre de votant...,,,,,
93154014,eliminacion_catalan,caracteres_problematicos: {'+'},+ Afegir pregunta,,,,,
93185564,eliminacion_catalan,caracteres_problematicos: {'/'},8. Productes / serveis prohibits,,,,,
93189727,eliminacion_catalan,caracteres_problematicos: {'©'},© 2018 CSGOBET EQUIP. Tots els drets reservats.,,,,,
93233647,eliminacion_catalan,caracteres_problematicos: {'•'},• Atenció sanitària,,,,,
93253371,eliminacion_catalan,caracteres_problematicos: {'·'},"Estat-of-the-art DSP - La nostra propietària de 56 bits del processador de senyal Digitial, el SA601...",,,,,
93344654,eliminacion_catalan,caracteres_problematicos: {'@'},Si vols que es deixin de processar les teves dades d'acord amb el que s'estipula als propòsits C-F i...,,,,,
93355760,eliminacion_catalan,caracteres_problematicos: {'·'},"Si la llei del vostre país ens permet imposar un càrrec per accedir-hi, us ho comunicarem en respost...",,,,,
93363209,eliminacion_catalan,"caracteres_problematicos: {'–', '”', '“'}","– “per a l'oncle, per a la tia, per a la mamà, papa...”",,,,,
93393273,eliminacion_catalan,caracteres_problematicos: {'·'},"9. Fora de la pantalla, l'actor en 2014 col·laborat amb l'artista visual Tacita Dean per a la Bienna...",,,,,
93398089,eliminacion_catalan,caracteres_problematicos: {'–'},"Niels Jacob diu De maig 9, 2013 en 2:23 am Moltes gràcies – He utilitzat la seva última proposta, i ...",,,,,
93416640,eliminacion_catalan,caracteres_problematicos: {'°'},la data ja se sap que el llançament oficial de la nova plataforma de DTH (lloc) Eutelsat 9B (9° E),,,,,
93491115,eliminacion_catalan,"caracteres_problematicos: {']', '['}",Llegiu la nostra revisió imparcial sobre el Compost Comerciant estafa abans de colpejar el botó verd...,,,,,
93545279,eliminacion_catalan,caracteres_problematicos: {'·'},Súper Comboy cartutxos solts presos de la meva col·lecció personal.,,,,,
93553130,eliminacion_catalan,caracteres_problematicos: {'*'},* Aquesta gràfica mostra la dinàmica del tipus de canvi mitjà BCH a Adv Cash EUR conversió durant el...,,,,,
93646866,eliminacion_catalan,caracteres_problematicos: {'$'},Reserva ara De US$ 525,,,,,
93654957,eliminacion_catalan,"caracteres_problematicos: {'/', '”', '“'}",Honda John Deere va néixer amb la intenció precisa de “correguda”?? la velocitat boja 60 km / h a le...,,,,,
93742676,eliminacion_catalan,caracteres_problematicos: {'+'},5 Rial qatarià (QAR) a Sierra Leoneona (SLL) - Darrers preus actualitzats (06:32 GMT+1),,,,,
93755911,eliminacion_catalan,"caracteres_problematicos: {'>', '<'}",<unk> Rams de Preus Fins USD 50 amb lliurament a domicili _ ENVIAR FLORS A DOMICILI A OMAN - LA SEVA...,,,,,
