linea,tipo,razon,texto_original,porcentaje_automatico,detalles_base,detalles_avanzados,texto_catalan,texto_chino
87935604,eliminacion_catalan,caracteres_problematicos: {'%'},Tot material nuclear que contingui més del 20% de plutoni constitueix material d'ús directe per a ar...,,,,,
87959301,eliminacion_catalan,"caracteres_problematicos: {'[', ']'}",[Pregunta núm. 16.] En l'informe es destaca l'aprovació a finals de 2008 del projecte de llei A.S. 1...,,,,,
87975025,eliminacion_catalan,"caracteres_problematicos: {'/', '%'}","80. Entre els ocupants dels habitatges socials en règim de protecció figuren també, a més de les per...",,,,,
88116825,eliminacion_catalan,caracteres_problematicos: {'/'},La decisió de l'Assemblea relativa a les credencials figura en el document ISBA/17/A/7.,,,,,
88131971,eliminacion_catalan,caracteres_problematicos: {'/'},Altres assumptes b) Memoràndum del Secretari General (A/66/571/Rev.1),,,,,
88138754,eliminacion_catalan,caracteres_problematicos: {'·'},Es desconeix el parador dels altres tres i es preveu que seran jutjats en rebel·lia.,,,,,
88279202,eliminacion_catalan,caracteres_problematicos: {'·'},"A més, el UNICRI ha establert un projecte de col·laboració entre els sectors públic i privat per a r...",,,,,
88303311,eliminacion_catalan,caracteres_problematicos: {'/'},b) Informe de la Representant Especial del Secretari General per a la qüestió dels nens i els confli...,,,,,
88328111,eliminacion_catalan,caracteres_problematicos: {'/'},L'últim informe anual presentat pel Secretari General sobre el suport del sistema de les Nacions Uni...,,,,,
88347741,eliminacion_catalan,caracteres_problematicos: {'/'},Si bé en el butlletí del Secretari General sobre el manteniment de registres i la gestió d'arxius (S...,,,,,
88405959,eliminacion_catalan,caracteres_problematicos: {'/'},Encara que pel que sembla aquestes propostes tenien inicialment per objecte formar part de mesures p...,,,,,
88494092,eliminacion_catalan,caracteres_problematicos: {'·'},El seu Govern està adaptant a les normes del dret internacional humanitari la seva política relativa...,,,,,
88514899,eliminacion_catalan,caracteres_problematicos: {'/'},Les qüestions processals incloses en el tercer informe del Relator Especial (A/CN.4/646) van donar l...,,,,,
88522714,eliminacion_catalan,caracteres_problematicos: {'·'},"Renovem la nostra promesa de lliurar al món del flagel de la fabricació, la transferència i la circu...",,,,,
88658255,eliminacion_catalan,caracteres_problematicos: {'%'},"D'acord amb la revisió realitzada per la ACPEM, les reformes legislatives referents a VCM suggerides...",,,,,
88676791,eliminacion_catalan,caracteres_problematicos: {'/'},51. El Comitè convida a l'Estat parteix a atenir-se a les directrius harmonitzades per a la presenta...,,,,,
88739560,eliminacion_catalan,caracteres_problematicos: {'·'},El Fòrum Permanent acull amb satisfacció la cooperació amb el Comitè del Patrimoni Mundial i recoman...,,,,,
88739664,eliminacion_catalan,caracteres_problematicos: {'/'},Informe del Secretari General sobre la creació d'una base de coneixements per a la informació geoesp...,,,,,
88805268,eliminacion_catalan,caracteres_problematicos: {'%'},"A causa de la desforestació, el Níger i el Perú han sofert pèrdues de béns i serveis proporcionats p...",,,,,
88882839,eliminacion_catalan,caracteres_problematicos: {'·'},"De conformitat amb l'article 13 de l'Estatut, el 8 de juny de 2012 els magistrats del Mecanisme van ...",,,,,
88890125,eliminacion_catalan,caracteres_problematicos: {'·'},El suport en la construcció d'instal·lacions;.,,,,,
88941463,eliminacion_catalan,caracteres_problematicos: {'/'},"En un estudi de la dieta de pollastres i galls dindis, es va determinar una LC50 de 20 mg de Halowax...",,,,,
89026615,eliminacion_catalan,caracteres_problematicos: {'%'},"El 2011, només el 28% dels nens menors de 14 anys que havien de rebre tractament van rebre aquests m...",,,,,
89044308,eliminacion_catalan,caracteres_problematicos: {'·'},"D'acord amb el mandat de l'Oficina, la col·laboració amb aquestes organitzacions ha donat lloc a: a)...",,,,,
89090936,eliminacion_catalan,caracteres_problematicos: {'/'},Reconeixent la importància del Pla d'Acció Mundial de les Nacions Unides per Combatre el Tràfic de P...,,,,,
89148454,eliminacion_catalan,caracteres_problematicos: {'%'},"Per 2100, el 70% dels corals d'aigües fredes, que ofereixen hàbitat i zona d'aliment i cria per a mo...",,,,,
89160462,eliminacion_catalan,caracteres_problematicos: {'/'},Resolució 24/11.Promoció del desenvolupament urbà sostenible mitjançant la creació de millors oportu...,,,,,
89169672,eliminacion_catalan,caracteres_problematicos: {'·'},2. sol·licita a la Potència administradora que ajudi al Territori facilitant la seva labor relativa ...,,,,,
89216035,eliminacion_catalan,caracteres_problematicos: {'·'},"La col·laboració i el respecte mutu entre proveïdors i beneficiaris són essencials, al mateix temps ...",,,,,
89224933,eliminacion_catalan,caracteres_problematicos: {'·'},51.- L'article VI de la Convenció de Nova York estableix que un tribunal davant el qual s'hagi deman...,,,,,
89348027,eliminacion_catalan,caracteres_problematicos: {'·'},Conveni sobre el dret de sindicació i de negociació col·lectiva (1949),,,,,
89363804,eliminacion_catalan,caracteres_problematicos: {'%'},De les 5.363.688 persones estrangeres amb certificat de registre o targeta de residència en vigor a ...,,,,,
89464113,eliminacion_catalan,caracteres_problematicos: {'·'},L'organització va col·laborar periòdicament amb l'Organització Internacional del Treball (OIT) duran...,,,,,
89550593,eliminacion_catalan,caracteres_problematicos: {'/'},Les condicions de la proposta de Nautilus es consignen en un projecte de principi de contracte que f...,,,,,
89644513,eliminacion_catalan,caracteres_problematicos: {'/'},"Una vegada que la reunió va haver examinat l'informe, Austràlia i els Estats Units d'Amèrica van pro...",,,,,
89648040,eliminacion_catalan,caracteres_problematicos: {'/'},C. Finançament de plantes de producció d'hidroclorofluorocarbonis (informe de la 24a Reunió de les P...,,,,,
89873412,eliminacion_catalan,caracteres_problematicos: {'·'},"Acollint amb beneplàcit els informes de la primera, segona, tercera, quarta i cinquena reunions bien...",,,,,
89895366,eliminacion_catalan,caracteres_problematicos: {'/'},"Atès que la qüestió de la discapacitat està vinculada al desenvolupament i els drets humans, els pat...",,,,,
89902859,eliminacion_catalan,caracteres_problematicos: {'·'},"El Sr. Díaz Bartolomé (Argentina) diu que les Illes Malvines, Geòrgia del Sud i Sandwich del Sud i e...",,,,,
89908474,eliminacion_catalan,caracteres_problematicos: {'/'},Conseqüències per al pressupost per programes del projecte de resolució A/69/L.3: Programa d'activit...,,,,,
89924841,eliminacion_catalan,caracteres_problematicos: {'·'},"L'argument al·legat pels representants estrangers que el Comissionat, en haver interposat una demand...",,,,,
90083947,eliminacion_catalan,caracteres_problematicos: {'%'},Més del 52% de les ajudes mèdiques incloses en la llista d'ajudes mèdiques pagades totalment o parci...,,,,,
90162335,eliminacion_catalan,caracteres_problematicos: {'/'},"92. En la novena sessió, el President va recordar que el OSACT havia remès un projecte de decisió a ...",,,,,
90192108,eliminacion_catalan,"caracteres_problematicos: {'/', '[', ']'}","58a sessió plenària Notificació feta pel Secretari General en virtut de l'Article 12, paràgraf 2, de...",,,,,
90289898,eliminacion_catalan,caracteres_problematicos: {'%'},"La quantia total dels recursos disponibles ascendia a 165,5 milions de dòlars, la qual cosa represen...",,,,,
90327226,eliminacion_catalan,"caracteres_problematicos: {'/', '*'}","En votació registrada de 150 vots contra 1 i 1 abstenció, queda aprovat el projecte de resolució A/C...",,,,,
90346822,eliminacion_catalan,caracteres_problematicos: {'/'},"En la mateixa sessió, es va aprovar sense votació el programa que figura en el document E/CN.4/Sub.2...",,,,,
90382976,eliminacion_catalan,caracteres_problematicos: {'/'},També va esmentar el paper de la ONUDD referent a la prestació d'assistència jurídica i tècnica per ...,,,,,
90403558,eliminacion_catalan,caracteres_problematicos: {'/'},El Departament d'Operacions de Manteniment de la Pau els va informar la setmana passada sobre el pla...,,,,,
90435085,eliminacion_catalan,caracteres_problematicos: {'•'},• El finançament de recerques científiques i iniciatives comunitàries en pro del desenvolupament sos...,,,,,
90438782,eliminacion_catalan,"caracteres_problematicos: {'”', '“'}","Demana també al Secretari General que, en l'informe que li presenti en relació amb el tema titulat “...",,,,,
90447234,eliminacion_catalan,caracteres_problematicos: {'·'},"a) Augmenti la seva col·laboració amb tots els òrgans competents de les Nacions Unides, inclosos l'A...",,,,,
90502980,eliminacion_catalan,"caracteres_problematicos: {'”', '“', '·'}","En l'Estatut no s'esmenta el terme “parella de fet”, per la qual cosa la Secretaria hauria d'haver d...",,,,,
90522726,eliminacion_catalan,caracteres_problematicos: {'·'},Les polítiques laborals poden servir per a pal·liar períodes d'escassetat de personal qualificat i r...,,,,,
90533124,eliminacion_catalan,caracteres_problematicos: {'/'},El President diu que creu entendre que el Comitè Especial desitja aprovar el projecte de resolució A...,,,,,
90600708,eliminacion_catalan,"caracteres_problematicos: {'/', '°'}","En la seva segona sessió, celebrada l'11 de juny de 2007, el Comitè va examinar l'informe de l'Ofici...",,,,,
90610290,eliminacion_catalan,caracteres_problematicos: {'°'},Finançament del Tribunal Penal Internacional per a l'enjudiciament dels presumptes responsables de g...,,,,,
90635265,eliminacion_catalan,caracteres_problematicos: {'·'},En les recomanacions per orientar els contractistes pel que fa a la determinació de les possibles re...,,,,,
90668997,eliminacion_catalan,caracteres_problematicos: {'·'},"En 2005, el PMA i el FIDA van col·laborar en la realització de nou projectes en vuit països, princip...",,,,,
90669730,eliminacion_catalan,"caracteres_problematicos: {'”', '“'}","d) Hauria de suprimir-se l'article 99, tenint en compte que l'aplicació del denominat “procediment d...",,,,,
90688333,eliminacion_catalan,caracteres_problematicos: {'—'},Obtindrem un benefici real per a la pau si fem de l'espai ultraterrestre un escenari de cooperació e...,,,,,
90723242,eliminacion_catalan,caracteres_problematicos: {'/'},"Calcular el valor econòmic total dels serveis proporcionats pels ecosistemes, que inclou el valor d'...",,,,,
90739766,eliminacion_catalan,caracteres_problematicos: {'·'},"En aquesta situació, els Governs dels dos Estats han acordat presentar una proposta conjunta sol·lic...",,,,,
90745590,eliminacion_catalan,"caracteres_problematicos: {'/', '·'}","En la seva resolució 61/66, de 6 de desembre de 2006, relativa al tràfic il·lícit d'armes petites i ...",,,,,
90804903,eliminacion_catalan,"caracteres_problematicos: {'”', '“'}","En l'àmbit de l'educació, voldria esmentar que l'any 1996, el Ministeri d'Educació i Cultura va publ...",,,,,
90841752,eliminacion_catalan,caracteres_problematicos: {'·'},Convida als països donants al fet que cooperin amb els països en desenvolupament per a assegurar la ...,,,,,
90928998,eliminacion_catalan,caracteres_problematicos: {'/'},"- Llei de procediment civil no contenciós (Ur. l. SRS, 30/86; 20/88);",,,,,
90929753,eliminacion_catalan,caracteres_problematicos: {'/'},"En la seva 23a sessió, celebrada el 12 d'agost de 2004, el Sr. Guissé va presentar el projecte de re...",,,,,
90946403,eliminacion_catalan,caracteres_problematicos: {'/'},"b) En ""Projectes verificats per tercers"" (també denominats ""projectes del segon nivell""), les Parts ...",,,,,
91051221,eliminacion_catalan,"caracteres_problematicos: {'”', '“', '·'}","“c) La Sala de Qüestions Preliminars designarà un assessor expert que col·labori en l'anàlisi, deter...",,,,,
91051642,eliminacion_catalan,"caracteres_problematicos: {'/', '”', '“'}","Lin Kuo-chung (Secretari de la Comissió) (parla en anglès): El projecte de resolució A/C.1/55/L.33, ...",,,,,
91064811,eliminacion_catalan,caracteres_problematicos: {'/'},"Informe del Secretari General en què figura el pla rector per a millores de capital, amb inclusió d'...",,,,,
91110495,eliminacion_catalan,caracteres_problematicos: {'·'},La meva delegació se suma en gran manera al que van dir els nostres Caps d'Estat o de Govern durant ...,,,,,
91124821,eliminacion_catalan,caracteres_problematicos: {'%'},El 90% dels negocis subjectes als nous gravàmens han estat contractats per la UNTAET.,,,,,
91139160,eliminacion_catalan,caracteres_problematicos: {'/'},"La UNCTAD aplicarà totalment l'estratègia del Programa de Centres de Comerç, de conformitat amb la p...",,,,,
91169394,eliminacion_catalan,"caracteres_problematicos: {'”', '“', '·'}",En atenció a la sol·licitud formulada en el primer període de sessions del Comitè Preparatori sobre ...,,,,,
91204823,eliminacion_catalan,caracteres_problematicos: {'·'},"Les contribucions rebudes de les organitzacions no governamentals (Amnistia Internacional, Secretari...",,,,,
91220263,eliminacion_catalan,caracteres_problematicos: {'/'},"Per a dirigir la nostra labor durant aquest període de sessions, disposem de les resolució 54/56 A d...",,,,,
91356586,eliminacion_catalan,caracteres_problematicos: {'·'},"Per exemple, l'informe de la Comissió d'Assumptes Jurídics i Drets Humans de l'Assemblea Parlamentàr...",,,,,
91440214,eliminacion_catalan,"caracteres_problematicos: {'”', '“'}",Això es deu al fet que la Secretaria de les Nacions Unides defineix el concepte de relació òptima co...,,,,,
91455032,eliminacion_catalan,caracteres_problematicos: {'·'},"Al mateix temps, les accions il·legals d'Israel han compromès seriosament la seva credibilitat com a...",,,,,
91461068,eliminacion_catalan,"caracteres_problematicos: {'”', '“', '·'}",L'oficina del UNFPA en la República de Moldova col·laborarà també amb la OIM en una iniciativa conju...,,,,,
91470828,eliminacion_catalan,"caracteres_problematicos: {'[', ']'}","""Encara que va reconèixer ""l'efectivitat o unitat del comandament de l'OTAN en qüestions operacional...",,,,,
91520112,eliminacion_catalan,caracteres_problematicos: {'·'},"A l'efecte de facilitar l'accés a mètodes moderns de reconeixement, en particular a la tecnologia de...",,,,,
91618763,eliminacion_catalan,"caracteres_problematicos: {'—', '·'}","L'avanç dels judicis des de la meva sol·licitud de 9 de juliol de 2001, em permet presentar al Conse...",,,,,
91639385,eliminacion_catalan,"caracteres_problematicos: {'%', '±'}",Dissenyats de conformitat amb les especificacions del fabricador o optimitzats per a produir unes di...,,,,,
91645943,eliminacion_catalan,caracteres_problematicos: {'/'},Queda aprovat el projecte de decisió A/C.2/56/L.6.,,,,,
91654808,eliminacion_catalan,caracteres_problematicos: {'/'},"Haurien de consultar-se molt diverses fonts, no sols els governs, sinó també les organitzacions inte...",,,,,
91709232,eliminacion_catalan,caracteres_problematicos: {'['},"[Adoptada en espanyol, francès i anglès, sent l'original la versió anglesa.",,,,,
91746451,eliminacion_catalan,caracteres_problematicos: {'/'},"No obstant això, els atacs continuen augmentant en proporcions cada vegada més inquietants, motiu qu...",,,,,
91762386,eliminacion_catalan,"caracteres_problematicos: {'/', '”', '“'}","“... celebrar, com a qüestió d'urgència, un període extraordinari de sessions de l'Assemblea General...",,,,,
91885594,eliminacion_catalan,caracteres_problematicos: {'/'},Les disposicions que hagin de mantenir-se es promulgaran per mitjà de textos administratius de confo...,,,,,
91892830,eliminacion_catalan,"caracteres_problematicos: {'”', '“'}",El projecte de resolució es titula “Cooperació internacional contra el problema mundial de les drogu...,,,,,
91892898,eliminacion_catalan,"caracteres_problematicos: {'”', '“'}","Passarem en primer lloc el projecte de resolució II, titulat “La realització universal del dret dels...",,,,,
91942550,eliminacion_catalan,caracteres_problematicos: {'/'},Cobra importància l'existència d'un alt contingent de dones que per la falta d'oportunitats i per la...,,,,,
92043496,eliminacion_catalan,caracteres_problematicos: {'/'},"Segons el quart informe periòdic, la Llei d'Igualtat d'Oportunitats de la Dona i l'Home prohibeix to...",,,,,
92088224,eliminacion_catalan,caracteres_problematicos: {'/'},"En aplicació de la Convenció de la Nacions Unides, de 28 de juliol de 1951, completada mitjançant el...",,,,,
92144517,eliminacion_catalan,"caracteres_problematicos: {'”', '`'}",El Comitè d'Experts va proposar la inclusió d'una clàusula en la virtut de la qual `es prohibiria al...,,,,,
92236189,eliminacion_catalan,caracteres_problematicos: {'·'},"Lucia Mortgage and Finance Company Ltd, va proporcionar les dades sol·licitades, segons figuren a co...",,,,,
92241061,eliminacion_catalan,caracteres_problematicos: {'·'},Demana al Secretari General que continuï proporcionant a la Divisió els recursos necessaris i assegu...,,,,,
92248272,eliminacion_catalan,caracteres_problematicos: {'·'},La Cimera va demanar als dos països que cessessin immediatament les campanyes informatives que obsta...,,,,,
92262077,eliminacion_catalan,"caracteres_problematicos: {'/', '”', '“'}",Els termes “pren nota de” i “observa” són neutres i no comporten aprovació ni desaprovació (decisió ...,,,,,
92273019,eliminacion_catalan,"caracteres_problematicos: {'”', '“', '·'}","Aquests elements es desenvolupen més en el capítol IV, sota l'epígraf “Principals característiques”,...",,,,,
92274739,eliminacion_catalan,"caracteres_problematicos: {'/', '”', '“'}","Recordant també la decisió 2001/103 de la Comissió de Drets Humans, de 25 d'abril de 2001, per la qu...",,,,,
92332650,eliminacion_catalan,caracteres_problematicos: {'·'},"Demana també a l'Oficina de les Nacions Unides contra la Droga i el Delicte que, dins dels límits de...",,,,,
92341231,eliminacion_catalan,caracteres_problematicos: {'/'},L'Índia continua opinant que es pot arribar a un acord sobre el projecte de conveni general sobre el...,,,,,
92359802,eliminacion_catalan,caracteres_problematicos: {'•'},• Recomanem que les Nacions Unides i els seus organismes desenvolupin estratègies perquè el ciutadà ...,,,,,
92379042,eliminacion_catalan,caracteres_problematicos: {'·'},Demana al Relator Especial que en l'acompliment del seu mandat sol·liciti l'assessorament i la coope...,,,,,
92406620,eliminacion_catalan,caracteres_problematicos: {'/'},"En la mateixa sessió, el representant del Pakistan va presentar el projecte de resolució E/CN.4/2002...",,,,,
92505720,eliminacion_catalan,caracteres_problematicos: {'•'},• L'Organització vetlli perquè el seu programa d'estadístiques compti amb un volum apropiat de recur...,,,,,
92533753,eliminacion_catalan,"caracteres_problematicos: {'[', ']', '·'}","En les sessions 656a i []a, celebrades els dies 2 i [] d'abril, el President va informar la Subcomis...",,,,,
92580469,eliminacion_catalan,caracteres_problematicos: {'/'},"En la mateixa sessió, la Comissió va aprovar el programa provisional distribuït com a document TD/B/...",,,,,
92585433,eliminacion_catalan,caracteres_problematicos: {'/'},La Junta va fer seves les recomanacions convingudes del Grup de Treball que figuraven en el document...,,,,,
92647868,eliminacion_catalan,"caracteres_problematicos: {'/', '”', '“'}","En el paràgraf 7 de la seva resolució 57/241, l'Assemblea General va expressar preocupació perquè l'...",,,,,
92689337,eliminacion_catalan,caracteres_problematicos: {'❑'},❑ Existeixen mecanismes institucionals per a aplicar aquests apartats?,,,,,
92773121,eliminacion_catalan,caracteres_problematicos: {'·'},El Comitè va acollir de grat el fet que la Junta dels caps executius se centrés en l'elaboració de p...,,,,,
92778069,eliminacion_catalan,"caracteres_problematicos: {'”', '“', '·'}",Després del concert d'octubre de 2001 dedicat a la lluita contra la proliferació d'armes petites i a...,,,,,
92809755,eliminacion_catalan,"caracteres_problematicos: {'”', '“'}","Inspirant-se en els suggeriments del paràgraf 85 de l'informe, Guatemala recomana agregar un tercer ...",,,,,
92861153,eliminacion_catalan,caracteres_problematicos: {'•'},"• Cambodja. En el decenni de 1990, la comunitat internacional va mostrar la seva preocupació per la ...",,,,,
92861560,eliminacion_catalan,"caracteres_problematicos: {'[', ']'}",5) En el règim general de la insolvència ha de precisar-se en quins casos les disposicions d'aquest ...,,,,,
92913483,eliminacion_catalan,caracteres_problematicos: {'%'},"No obstant això, en un 100% en el diagnòstic de confiar que no val la pena.",,,,,
92943331,eliminacion_catalan,caracteres_problematicos: {'®'},Registre - Corretges per a rellotges d'alta qualitat - WatchStyle®,,,,,
92991875,eliminacion_catalan,caracteres_problematicos: {'/'},"Aquesta habitació quàdruple disposa de pati, zona de menjador i terra de rajola/marbre.",,,,,
93107290,eliminacion_catalan,"caracteres_problematicos: {'%', '+'}",La recomanació d'avui del nostre sistema és la POSICIÓ LLARGA. L'anterior recomanació de COMPRA es v...,,,,,
93118877,eliminacion_catalan,caracteres_problematicos: {'+'},"Pujada: juliol 23, 2016 a 12:58AM GMT + 00",,,,,
93188758,eliminacion_catalan,caracteres_problematicos: {'*'},Nivell d'estudis* Estudiant de primer any d'universitat Transferència d'universitat Graduat universi...,,,,,
93207505,eliminacion_catalan,"caracteres_problematicos: {'®', '·'}",El gimnàs està equipat amb l'últim en tecnologia: màquines d'entrenament cardiovascular i amb peses ...,,,,,
93252403,eliminacion_catalan,caracteres_problematicos: {'%'},Què podria ser millor que descobrir el món? Recorri paisatges fantàstics i ciutats emocionants amb u...,,,,,
93264197,eliminacion_catalan,"caracteres_problematicos: {'/', '·'}",· Trasllat a l'aeroport/estació (càrrec addicional),,,,,
93304126,eliminacion_catalan,"caracteres_problematicos: {'#', '*'}",És amb gran orgull que l'Hotel * Coco Restaurant Gourmet Majunga Lodge dóna la benvinguda a xef Mill...,,,,,
93405481,eliminacion_catalan,caracteres_problematicos: {'·'},"Les habitacions de l'Ashiana Hotel inclouen Wi-Fi gratuïta, televisió per satèl·lit, calefacció, una...",,,,,
93538203,eliminacion_catalan,"caracteres_problematicos: {'·', '←'}",← pel·lícules protectores Xqisit per Samsung Galaxy SIII - Mòbils (Next post),,,,,
93552527,eliminacion_catalan,caracteres_problematicos: {'*'},* Aquesta gràfica mostra la dinàmica de la reserva total disponible de LTC en convertir FasaPay IDR ...,,,,,
93579758,eliminacion_catalan,caracteres_problematicos: {'/'},Participants de BubbleTone ICO podran adquirir tokens UMT després de dipositar fons en els seus comp...,,,,,
93647447,eliminacion_catalan,caracteres_problematicos: {'·'},Alguna vegada va veure una noia que s'ha comentat del seu amic Facebook foto? Facebook pot ser en re...,,,,,
93676246,eliminacion_catalan,caracteres_problematicos: {'/'},Aprox. 40 min / 690 iens,,,,,
93701419,eliminacion_catalan,"caracteres_problematicos: {'[', ']'}","Weather Atlas: Esquel, Argentina - Previsió meteorològica detallada, previsió a llarg plaça mensual ...",,,,,
93713302,eliminacion_catalan,"caracteres_problematicos: {'/', '›', '@', '&'}",Fotos dels: Harry / Ootist / Dins Info / axioma / Ersatz & Les persones allotjades per la Renovació ...,,,,,
93809160,eliminacion_catalan,caracteres_problematicos: {'+'},200 Rupia indonèsia (IDR) a Rial iranià (IRR) - Darrers preus actualitzats (00:44 GMT+1),,,,,
93834511,eliminacion_catalan,caracteres_problematicos: {'»'},» Comptabilitat » Reclutadors: Els desafiaments dels caçadors principals executius,,,,,
93836040,eliminacion_catalan,caracteres_problematicos: {'/'},Sóc plenament conscient que www.chat.fan transmet contingut d'entreteniment per a adults als seus co...,,,,,
93918870,eliminacion_catalan,"caracteres_problematicos: {'/', '·'}","Les habitacions de categories Superior Apartment, Family Room, Comfort Apartment i Economy Twin Room...",,,,,
93927033,eliminacion_catalan,caracteres_problematicos: {'·'},emissions de prova van començar al canal de televisió per satèl·lit HD Puls.,,,,,
93934700,eliminacion_catalan,caracteres_problematicos: {'·'},"La investigació realitzada en col·laboració amb Avanade, soci Platinum de Sitecore, analitza els imp...",,,,,
93953804,eliminacion_catalan,caracteres_problematicos: {'·'},Telecom 2.0: Blockchain substitueix per complet l'antiquada i costosa tecnologia d'itinerància mitja...,,,,,
94006956,eliminacion_catalan,caracteres_problematicos: {'%'},Aconsegueix un 46% addicional en tota la web de CitizenVPN.,,,,,
94008170,eliminacion_catalan,caracteres_problematicos: {'·'},"Dipòsit d'equipatges, un estacionament gratuït i també habitacions aptes per a al·lèrgics juntament ...",,,,,
94023570,eliminacion_catalan,caracteres_problematicos: {'/'},"Si us plau, tingues en compte que www.cams.girlsandnylons.com es reserva el dret d'arrodonir pagamen...",,,,,
94049111,eliminacion_catalan,caracteres_problematicos: {'✔'},✔ Lluita contra clans rivals en les guerres de clans èpiques,,,,,
94097554,eliminacion_catalan,"caracteres_problematicos: {'>', '<'}",<unk> Sobre nosaltres _ ENVIAR FLORS A DOMICILI A WICHITA - LA SEVA FORISTERIA DE WICHITA,,,,,
94121628,eliminacion_catalan,caracteres_problematicos: {'€'},"Cuneo Sabates italianes per a dona en camussa botes de vaquer Cuneo en ant rosat 89,34 €",,,,,
