linea,tipo,razon,texto_original,porcentaje_automatico,detalles_base,detalles_avanzados,texto_catalan,texto_chino
87285709,eliminacion_catalan,caracteres_problematicos: {'/'},Informe del Secretari General sobre l'assistència en l'aplicació dels convenis i protocols universal...,,,,,
87387044,eliminacion_catalan,caracteres_problematicos: {'/'},El present informe abasta els principals esdeveniments ocorreguts des de la publicació del meu infor...,,,,,
87399984,eliminacion_catalan,caracteres_problematicos: {'·'},També desitjo assenyalar que Israel ha sol·licitat la convocació immediata de la Comissió Trilateral...,,,,,
87465989,eliminacion_catalan,caracteres_problematicos: {'/'},En el paràgraf 2 de la decisió XXI/7 la Reunió de les Parts va demanar al Grup d'Avaluació Tecnològi...,,,,,
87601919,eliminacion_catalan,caracteres_problematicos: {'·'},":: Capacitació de 36 funcionaris de la Comissió de Drets Humans de Sierra Leone, en col·laboració am...",,,,,
87613986,eliminacion_catalan,caracteres_problematicos: {'·'},"8. De conformitat amb l'article 2, paràgraf 3 a), del Pacte, l'Estat part té l'obligació de proporci...",,,,,
87704683,eliminacion_catalan,caracteres_problematicos: {'·'},"En el seu lloc, el que va seguir va ser una sensació de traïció i desil·lusió, a mesura que el món e...",,,,,
87715992,eliminacion_catalan,caracteres_problematicos: {'%'},Aproximadament el 50% d'ells amb beques del pressupost federal.,,,,,
87728270,eliminacion_catalan,caracteres_problematicos: {'·'},"Ens encoratja veure la quantitat de sol·licituds d'informació que s'han rebut fins a la data i, sens...",,,,,
87771775,eliminacion_catalan,caracteres_problematicos: {'%'},"D'acord amb estadístiques recents de la Unió Internacional de Telecomunicacions (UIT), el 70% de la ...",,,,,
87786929,eliminacion_catalan,caracteres_problematicos: {'·'},Elements del fet internacionalment il·lícit d'una organització internacional,,,,,
87818032,eliminacion_catalan,caracteres_problematicos: {'/'},b) Una recopilació preparada per l'Oficina de l'Alt Comissionat per als Drets Humans (ACNUDH) de con...,,,,,
87827754,eliminacion_catalan,caracteres_problematicos: {'·'},"Viet Nam, que ocupava la presidència rotatòria de l'Associació de Nacions d'Àsia Sud-oriental (ASEAN...",,,,,
87839190,eliminacion_catalan,caracteres_problematicos: {'/'},"L'informe abasta les activitats realitzades per la Relatora Especial en 2010, de conformitat amb la ...",,,,,
87933352,eliminacion_catalan,caracteres_problematicos: {'/'},A continuació voldria formular els següents comentaris relatius al punt de vista de l'Índia sobre el...,,,,,
87944547,eliminacion_catalan,caracteres_problematicos: {'·'},79. Està previst realitzar un estudi sobre la prevalença de la violència contra la dona en tot el te...,,,,,
87947122,eliminacion_catalan,caracteres_problematicos: {'%'},"14. Les dones representen el 50,4% de la població, i viuen principalment a les zones rurals (72,1%).",,,,,
87995256,eliminacion_catalan,caracteres_problematicos: {'·'},"No obstant això, abans d'aconseguir l'edat que dóna dret a la pensió de jubilació, pot sol·licitar-s...",,,,,
88002528,eliminacion_catalan,caracteres_problematicos: {'·'},Erradicació de la pobresa i assoliment dels objectius de desenvolupament convinguts internacionalmen...,,,,,
88081772,eliminacion_catalan,caracteres_problematicos: {'/'},"L'informe, contingut en el document FCCC/ARR/2010/BGR i Corrent 1, es va publicar i transmetre al gr...",,,,,
88125303,eliminacion_catalan,caracteres_problematicos: {'/'},Adopció de mesures sobre el projecte de resolució A/C.66/66/L.7,,,,,
88156678,eliminacion_catalan,caracteres_problematicos: {'/'},"En resposta a això, les Forces Armades del Sudan van desplegar immediatament una brigada d'infanteri...",,,,,
88167315,eliminacion_catalan,caracteres_problematicos: {'/'},L'informe abasta els principals esdeveniments ocorreguts des que vaig presentar el meu informe de 17...,,,,,
88241792,eliminacion_catalan,"caracteres_problematicos: {']', '['}",Auxiliar d'Equip Especial (contractació local) [par. 185 e)],,,,,
88287442,eliminacion_catalan,caracteres_problematicos: {'/'},22. Decideix també prorratejar entre els Estats Membres la suma de 196.463.350 dòlars per al període...,,,,,
88405011,eliminacion_catalan,caracteres_problematicos: {'·'},En l'informe es descriuen les mesures adoptades pel Departament de Seguretat i el sistema de gestió ...,,,,,
88442804,eliminacion_catalan,caracteres_problematicos: {'/'},d) Estimacions revisades resultants de les resolucions i decisions aprovades pel Consell de Drets Hu...,,,,,
88455950,eliminacion_catalan,caracteres_problematicos: {'·'},La reunió es va celebrar paral·lelament al Quart Fòrum d'Alt Nivell sobre l'Eficàcia de l'Ajuda que ...,,,,,
88489879,eliminacion_catalan,caracteres_problematicos: {'·'},16. Subratllem l'important paper de la Conferència dels Estats Part a l'hora de vigilar l'aplicació ...,,,,,
88597764,eliminacion_catalan,caracteres_problematicos: {'·'},26. La JS1 va demanar als Emirats que diligentment i imparcialment investiguessin totes les al·legac...,,,,,
88645577,eliminacion_catalan,caracteres_problematicos: {'·'},21. El Sr. Tim Caughley va exposar la història del projecte de tractat de cessació de la producció d...,,,,,
88671509,eliminacion_catalan,caracteres_problematicos: {'/'},Hi ha també proves que els proveïdors de serveis de salut de la província de Papua discriminen els p...,,,,,
88692367,eliminacion_catalan,"caracteres_problematicos: {'·', '/'}",c) Tenint en compte les Directrius sobre les modalitats alternatives de cura dels infants (annex de ...,,,,,
88824890,eliminacion_catalan,"caracteres_problematicos: {']', '@'}","Els qui desitgin més informació poden comunicar-se amb el Sr. Anthony Simpson, Missió Permanent de N...",,,,,
88941182,eliminacion_catalan,caracteres_problematicos: {'%'},"Els PCB comercials també contenien vestigis de naftalens clorats (0,01 - 0,09%: Falandysz, 1998, Kan...",,,,,
88952025,eliminacion_catalan,caracteres_problematicos: {'·'},:: La prima de reinstal·lació oferia flexibilitat en l'administració de les prestacions de transport...,,,,,
88980881,eliminacion_catalan,caracteres_problematicos: {'/'},Els recursos totals autoritzats per l'Assemblea General en la seva resolució 65/290 per al compte de...,,,,,
88992986,eliminacion_catalan,caracteres_problematicos: {'/'},"Informe de la Comissió sobre la Utilització de l'Espai Ultraterrestre amb Fins Pacífics, Suplement n...",,,,,
89037150,eliminacion_catalan,caracteres_problematicos: {'·'},b) Negociació i examen dels aspectes jurídics d'aproximadament 20 transaccions d'inversió privada di...,,,,,
89071355,eliminacion_catalan,caracteres_problematicos: {'·'},"2.14 El 29 de novembre de 2002, el Fiscal General Adjunt va respondre per escrit a les repetides que...",,,,,
89076501,eliminacion_catalan,caracteres_problematicos: {'·'},"2.6 En data no especificada, l'autora va sol·licitar a l'Oficina de Topografia, Cartografia i Cadast...",,,,,
89122923,eliminacion_catalan,caracteres_problematicos: {'/'},"En el paràgraf 10 f) de la resolució 24/4, el Consell de Drets Humans va decidir convocar una reunió...",,,,,
89157377,eliminacion_catalan,"caracteres_problematicos: {'%', '/'}",IX.21 El Secretari General proposa augmentar el nivell de recursos per a altres despeses de personal...,,,,,
89164229,eliminacion_catalan,caracteres_problematicos: {'/'},97. La Subcomissió d'Assumptes Jurídics va observar amb satisfacció que el Grup de Treball sobre la ...,,,,,
89320819,eliminacion_catalan,caracteres_problematicos: {'·'},Menys de la meitat dels països van confirmar específicament que podien aplicar els paràgrafs 9 a 29 ...,,,,,
89357616,eliminacion_catalan,caracteres_problematicos: {'·'},:: Desenvolupar les relacions amb els associats per al desenvolupament amb vista a la mobilització d...,,,,,
89376501,eliminacion_catalan,caracteres_problematicos: {'·'},"L'assegurat que compleix els requisits per a tenir dret a la pensió pot, en cas d'envelliment premat...",,,,,
89382501,eliminacion_catalan,caracteres_problematicos: {'%'},L'Enquesta demogràfica i de salut de les Illes Salomó de 2007 va comprovar que la taxa d'alfabetitza...,,,,,
89427307,eliminacion_catalan,caracteres_problematicos: {'/'},2013/20 Informe sobre les contribucions dels Estats membres i uns altres al UNFPA i projeccions d'in...,,,,,
89442153,eliminacion_catalan,caracteres_problematicos: {'·'},30. Convida a les organitzacions membres de l'Associació de Col·laboració en matèria de Boscos perti...,,,,,
89491965,eliminacion_catalan,caracteres_problematicos: {'·'},"El 2011, les despeses militars a nivell mundial van superar els 1,7 bilions de dòlars, xifra que equ...",,,,,
89553927,eliminacion_catalan,"caracteres_problematicos: {']', '/', '['}",[pic] 7.032 usuaris s'han subscrit ja al Diari. Aprofiti la nova subscripció electrònica i rebi el D...,,,,,
89616230,eliminacion_catalan,caracteres_problematicos: {'·'},:: S'estableixen requisits jurídics de notificació respecte a les activitats que es realitzin amb or...,,,,,
89642841,eliminacion_catalan,caracteres_problematicos: {'/'},Recordant les seves decisions 26/3 i 26/12 i altres decisions pertinents en matèria de productes quí...,,,,,
89650367,eliminacion_catalan,caracteres_problematicos: {'·'},1. Aprova el formulari de sol·licitud d'admissió en qualitat d'observador en les reunions de la Conf...,,,,,
89670051,eliminacion_catalan,caracteres_problematicos: {'%'},"Malgrat la lleugera disminució en els últims dos anys, la quantitat de personal finançat amb càrrec ...",,,,,
89676886,eliminacion_catalan,caracteres_problematicos: {'/'},En la secció III de l'informe es presenta un resum de les despeses totals incorregudes en l'exercici...,,,,,
89722668,eliminacion_catalan,caracteres_problematicos: {'·'},"Esforços similars es van realitzar en la preparació del tema prioritari de la Comissió en 2014, a sa...",,,,,
89740968,eliminacion_catalan,caracteres_problematicos: {'·'},35. En resposta a sol·licituds dels Estats que es determinessin amb major claredat les situacions en...,,,,,
89741848,eliminacion_catalan,caracteres_problematicos: {'·'},d) Reconèixer i reforçar les formes de governança i de representació pròpies dels pobles indígenes p...,,,,,
89840323,eliminacion_catalan,caracteres_problematicos: {'·'},Els participants també van examinar les mesures necessàries per a instal·lar un nou cable submarí en...,,,,,
89849516,eliminacion_catalan,caracteres_problematicos: {'%'},"A l'Àfrica, el 59% de les persones dedicades a la pesca (pesca marina i interior i aqüicultura) eren...",,,,,
89882068,eliminacion_catalan,caracteres_problematicos: {'·'},"Si una persona sosté que és obligada a casar-se, té la possibilitat de presentar una petició al trib...",,,,,
89960227,eliminacion_catalan,caracteres_problematicos: {'/'},a) Un informe nacional/exposició per escrit de conformitat amb el paràgraf 15 a) (A/HRC/WG.6/19/NIC/...,,,,,
89966554,eliminacion_catalan,caracteres_problematicos: {'/'},20. Recordant l'article 13 de la Declaració sobre la protecció de totes les persones contra les desa...,,,,,
90028457,eliminacion_catalan,caracteres_problematicos: {'·'},Conveni sobre el dret de sindicació i de negociació col·lectiva (1949),,,,,
90158676,eliminacion_catalan,caracteres_problematicos: {'·'},"Per exemple, a Lesotho l'UNICEF va col·laborar amb el Ministeri de Desenvolupament Social i la Unió ...",,,,,
90175653,eliminacion_catalan,caracteres_problematicos: {'·'},Això també ha permès a l'ONUHàbitat enfortir la col·laboració en projectes relacionats amb la respon...,,,,,
90193393,eliminacion_catalan,caracteres_problematicos: {'/'},Adopció de mesures en relació amb els projectes de resolució A/C.2/69/L.34 i A/C.2/69/L.63,,,,,
90279917,eliminacion_catalan,caracteres_problematicos: {'%'},"3. El valor de les exportacions mundials transfrontereres dels SSI va assolir la xifra d'1,4 bilions...",,,,,
90289749,eliminacion_catalan,caracteres_problematicos: {'/'},Un altre representant va reconèixer la importància del projecte de resolució i va afirmar la seva vo...,,,,,
90309872,eliminacion_catalan,caracteres_problematicos: {'·'},A Àfrica i en altres continents hi ha països que fins a un cert punt poden considerar-se països pobr...,,,,,
90310941,eliminacion_catalan,"caracteres_problematicos: {'“', '·', '”'}",Respecte al tema 4 f) (“Increment de la seguretat i noves instal·lacions proposades per a conferènci...,,,,,
90319115,eliminacion_catalan,caracteres_problematicos: {'°'},"La classificació actualitzada es coneixerà com CIUO-08 i haurà d'estar llesta per a finals de 2007, ...",,,,,
90329183,eliminacion_catalan,"caracteres_problematicos: {'“', '”'}",Decideix incloure en el programa provisional del seu seixantè període de sessions el tema titulat “I...,,,,,
90347157,eliminacion_catalan,caracteres_problematicos: {'”'},"Si en un contracte s'estipula el transport futur de mercaderies per remeses successives, el present ...",,,,,
90347933,eliminacion_catalan,"caracteres_problematicos: {'“', '·', '”', '/'}","Posteriorment, el President i el Vicepresident, així com altres membres del SLM/A, van rebutjar el r...",,,,,
90401302,eliminacion_catalan,caracteres_problematicos: {'·'},"L'atac es va produir ahir, dimecres 17 d'agost de 2005, en la Ribera Occidental septentrional, prop ...",,,,,
90442645,eliminacion_catalan,caracteres_problematicos: {'·'},"Fontanet Maldonado (Col·legi d'Advocats de Puerto Rico) diu que, en el marc de la celebració del Seg...",,,,,
90448334,eliminacion_catalan,caracteres_problematicos: {'/'},Respecte a la pregunta de si havien pogut aplicar l'article 16 de la Convenció en cas de delictes co...,,,,,
90479745,eliminacion_catalan,"caracteres_problematicos: {']', '['}","En carta de data 8 d'abril de 2003, rebuda a la Secretaria l'11 d'abril, la República Francesa va de...",,,,,
90564224,eliminacion_catalan,caracteres_problematicos: {'·'},Ressaltar la importància de continuar esforçant-se per a suprimir els obstacles que entorpeixen la c...,,,,,
90582703,eliminacion_catalan,"caracteres_problematicos: {'“', '”'}","Juntament amb altres conflictes “congelats” a la regió circumdant, segueix sent un dels últims confl...",,,,,
90625648,eliminacion_catalan,"caracteres_problematicos: {'“', '”', '/'}",L'objectiu del quart projecte de resolució titulat “Arranjament pacífic de la qüestió de Palestina” ...,,,,,
90719312,eliminacion_catalan,caracteres_problematicos: {'/'},"En la primera sessió, celebrada el 26 de febrer de 2007, la reunió preparatòria intergovernamental v...",,,,,
90720767,eliminacion_catalan,caracteres_problematicos: {'/'},Escumes ignífugues Catifes Curtits/roba Tèxtils/tapissat Paper i embolcalls Revestiments i additius ...,,,,,
90766959,eliminacion_catalan,caracteres_problematicos: {'%'},Més del 20% dels nens d'entre 3 i 5 anys assisteixen a algun tipus de programa organitzat d'educació...,,,,,
90853044,eliminacion_catalan,"caracteres_problematicos: {'“', '”'}","Reafirmant el document final del seu període extraordinari de sessions sobre la infància, titulat “U...",,,,,
90855717,eliminacion_catalan,caracteres_problematicos: {'·'},Sri Lanka també va formular una declaració segons la qual el Govern de la República Socialista Democ...,,,,,
90876709,eliminacion_catalan,"caracteres_problematicos: {'·', '—'}",La Sra. Thomas va contestar al·ludint a la resolució sobre la igualtat d'oportunitats i de tracte pe...,,,,,
90902174,eliminacion_catalan,caracteres_problematicos: {'/'},iii) Guia per a les deliberacions sobre els temes substantius inclosos en el programa provisional i ...,,,,,
90917766,eliminacion_catalan,caracteres_problematicos: {'/'},"Com se subratlla en la primera conclusió de l'informe final (E/CN.4/Sub.2/1999/20, par. 252) de l'es...",,,,,
90967056,eliminacion_catalan,"caracteres_problematicos: {'“', '”'}","L'associació està en procés de creació, amb el següent títol provisional: “e2e: Associació Mundial s...",,,,,
90985354,eliminacion_catalan,caracteres_problematicos: {'%'},"Durant el vint-i-unè període extraordinari de sessions de l'Assemblea General, celebrat en 1999, es ...",,,,,
91002729,eliminacion_catalan,caracteres_problematicos: {'$'},"Es dedueixin de les quotes dels Estats Membres, de conformitat amb el disposat en la seva resolució ...",,,,,
91031241,eliminacion_catalan,caracteres_problematicos: {'%'},"L'alça impressionant registrada en 1999 (el 12,5%) s'atribuïa a les obres relativament extenses auto...",,,,,
91059953,eliminacion_catalan,"caracteres_problematicos: {'“', '”'}","Bacre Waly Ndiaye, Director de l'Oficina de Nova York de l'Oficina de l'Alt Comissionat de les Nacio...",,,,,
91068917,eliminacion_catalan,caracteres_problematicos: {'/'},"Documents oficials de l'Assemblea General, cinquanta-dosè període de sessions, Suplement núm. 47 (A/...",,,,,
91142477,eliminacion_catalan,"caracteres_problematicos: {'“', '”'}",Tal vegada el Grup de Treball desitja estudiar si aquest punt hauria d'aclarir-se amb la següent red...,,,,,
91274069,eliminacion_catalan,caracteres_problematicos: {'/'},"Com es dedueix de l'Informe del Secretari General (A/55/116), el tema dels míssils i la seva prolife...",,,,,
91321494,eliminacion_catalan,caracteres_problematicos: {'/'},En el document ICCD/COP(9)/6 figura més informació sobre l'enfocament de l'avaluació de l'acomplimen...,,,,,
91335678,eliminacion_catalan,caracteres_problematicos: {'·'},La Sra. Pimentel sol·licita informació sobre els principals continguts del projecte de llei sobre la...,,,,,
91351748,eliminacion_catalan,"caracteres_problematicos: {'“', '”'}","Conferència internacional titulada “Canvi mundial i recursos hídrics a l'Àfrica occidental”, celebra...",,,,,
91379574,eliminacion_catalan,"caracteres_problematicos: {'“', '”'}",El principal tema de la conferència va ser “Aplicació de l'objectiu 7 meta 11: Superar els reptes fi...,,,,,
91469974,eliminacion_catalan,"caracteres_problematicos: {'“', '”', '/'}","En el seu 39è període de sessions la Comissió va recomanar al Grup de Treball que, en actualitzar la...",,,,,
91630058,eliminacion_catalan,"caracteres_problematicos: {'“', '”', '/'}","Pel que fa al tema 115, titulat “Informes financers i estats financers comprovats i informes de la J...",,,,,
91630096,eliminacion_catalan,caracteres_problematicos: {'/'},"Permeti-se'm recordar a les delegacions que, a més, de conformitat amb la decisió 34/401 de l'Assemb...",,,,,
91650569,eliminacion_catalan,caracteres_problematicos: {'/'},"Com s'esmenta en el meu informe, un aspecte fonamental de l'estratègia de dotació de personal seria ...",,,,,
91756666,eliminacion_catalan,caracteres_problematicos: {'/'},També s'ha utilitzat per a promoure un major coneixement i una major sensibilització sobre les activ...,,,,,
91766553,eliminacion_catalan,caracteres_problematicos: {'”'},Els interessos es pagaran després del principal de la indemnització atorgada.”,,,,,
91800216,eliminacion_catalan,"caracteres_problematicos: {']', '['}",Aquesta exoneració deuria [ser completa i immediata quan el deutor sigui honest i no hagi realitzat ...,,,,,
91810045,eliminacion_catalan,caracteres_problematicos: {'/'},Dada' Seri Suleiman (Malàisia) (parla en anglès): La meva delegació felicita les Nacions Unides per ...,,,,,
91963346,eliminacion_catalan,caracteres_problematicos: {'%'},"La inversió d'aquests grups de països a l'estranger va ascendir a 193.000 milions de dòlars en 2006,...",,,,,
91988924,eliminacion_catalan,caracteres_problematicos: {'/'},"De conformitat amb el paràgraf 41 de l'annex de la seva resolució 5/1, el Consell va adoptar, el 27 ...",,,,,
91989673,eliminacion_catalan,"caracteres_problematicos: {']', '@'}","Albert Lee, Secció d'ONG del Departament d'Informació Pública (tel.:1 (212) 963-7709; adreça electrò...",,,,,
92030250,eliminacion_catalan,"caracteres_problematicos: {'“', '·', '”', '/'}","A més, en el text s'han introduït les següents revisions orals: les paraules “Recordant a més les re...",,,,,
92035029,eliminacion_catalan,caracteres_problematicos: {'/'},"En la seva resolució OM/1/3, aprovada pel Consell el 20 de juny de 2007 en la seva primera reunió d'...",,,,,
92091688,eliminacion_catalan,"caracteres_problematicos: {'“', '”'}",He emprat amb tota intenció l'expressió “tràgic conflicte” a causa del fet que aquesta peculiar expr...,,,,,
92144432,eliminacion_catalan,"caracteres_problematicos: {'“', '”'}","“En un dels casos de la Comissió de Reclamacions de Mèxic, l'àrbitre va exigir a l'Estat expulsor qu...",,,,,
92147202,eliminacion_catalan,"caracteres_problematicos: {']', '['}","Immigration and Naturalization Service v. St Cyr, Tribunal Suprem dels Estats Units, de juny de 2001...",,,,,
92187243,eliminacion_catalan,"caracteres_problematicos: {'“', '”'}","En les seves conclusions, l'equip encarregat de l'autoavaluació va afirmar que el Servei d'Auditoria...",,,,,
92213076,eliminacion_catalan,"caracteres_problematicos: {'“', '”'}","D'acord amb aquesta disposició, es considerarà que hi ha demora en el lliurament “quan les mercaderi...",,,,,
92227217,eliminacion_catalan,caracteres_problematicos: {'/'},"Vegeu Documents Oficials de l'Assemblea General, cinquantè novè període de sessions, Suplement núm. ...",,,,,
92247335,eliminacion_catalan,caracteres_problematicos: {'·'},"En aquest context, fa falta una major voluntat política per a trencar el vincle que existeix entre l...",,,,,
92320747,eliminacion_catalan,caracteres_problematicos: {'·'},L'exposició informativa que el Secretari General va formular ahir davant el Consell de Seguretat il·...,,,,,
92444249,eliminacion_catalan,"caracteres_problematicos: {'“', '”', '/'}",En el paràgraf 4 de la proposta que figura en l'annex del document PCNICC/2002/WGASP-PD/RT.2 s'assen...,,,,,
92454645,eliminacion_catalan,caracteres_problematicos: {'·'},Els ingressos del Tribunal corresponents a l'exercici econòmic de 2000 van ascendir en total a 7.898...,,,,,
92500159,eliminacion_catalan,"caracteres_problematicos: {'·', '/'}",La qüestió de la col·laboració amb les organitzacions de la societat civil ha estat abordada pel Com...,,,,,
92545002,eliminacion_catalan,caracteres_problematicos: {'·'},"En virtut de l'article 2, es considera extradibles als delictes que, al moment de la sol·licitud, en...",,,,,
92613131,eliminacion_catalan,caracteres_problematicos: {'/'},"En la seva 17a sessió, celebrada el 21 d'octubre, la Comissió va aprovar el projecte de resolució A/...",,,,,
92624525,eliminacion_catalan,caracteres_problematicos: {'•'},"• Els principals protagonistes, tant a Nova York com sobre el terreny, han de compartir un entenimen...",,,,,
92661258,eliminacion_catalan,"caracteres_problematicos: {'“', '”'}",El Sr. Suparat (Tailàndia) diu que l'enfocament del seu país cap al desenvolupament sostenible es ba...,,,,,
92703977,eliminacion_catalan,"caracteres_problematicos: {'“', '·', '”'}","D'altra banda, en la pràctica concreta de promoure la democràcia i enfortir l'imperi del dret i “el ...",,,,,
92721682,eliminacion_catalan,caracteres_problematicos: {'·'},Les recerques realitzades per grups de drets humans de les acusacions de violacions col·lectives per...,,,,,
92726142,eliminacion_catalan,caracteres_problematicos: {'·'},"Tercer, la trajectòria que segueix el mur revela clarament que Israel es proposa consolidar la seva ...",,,,,
92829061,eliminacion_catalan,caracteres_problematicos: {'/'},El President assenyala a l'atenció del Consell el text d'un projecte de resolució que figura en el d...,,,,,
92835598,eliminacion_catalan,caracteres_problematicos: {'°'},Dóna suport a la reelecció del Sr. Juan Somavía com a Director General de la OIT per un segon mandat...,,,,,
92847559,eliminacion_catalan,"caracteres_problematicos: {'·', '•'}",• Entre els exemples de l'eficàcia de les iniciatives d'observança pot esmentar-se les descripcions ...,,,,,
92849408,eliminacion_catalan,caracteres_problematicos: {'/'},Carta de data 29 d'agost de 2002 (S/2002/979) dirigida al President del Consell de Seguretat pel rep...,,,,,
92864462,eliminacion_catalan,caracteres_problematicos: {'·'},"Reafirma el dret dels Estats a mantenir les seves característiques religioses, socials i culturals, ...",,,,,
92950311,eliminacion_catalan,caracteres_problematicos: {'·'},Aquestes habitacions estan decorades amb colors brillants i obres d'art originals i disposen de cale...,,,,,
92975166,eliminacion_catalan,caracteres_problematicos: {'·'},"Com a part de la seva sol·licitud de naturalització o establiment Visa, Vostè està obligat a:",,,,,
92983947,eliminacion_catalan,"caracteres_problematicos: {'·', '–'}",Serveis i instal·lacions – Villa Bellevue Portoroz-Portorose _ Web Oficial _ Hotels a Portoroz,,,,,
93128518,eliminacion_catalan,caracteres_problematicos: {'·'},"A causa de que aquestes cookies estan marcades com a cookies de seguiment, li demanem el seu permís ...",,,,,
93152204,eliminacion_catalan,"caracteres_problematicos: {'>', '<'}",Educació superior Educació Pre-escolar Escoles superiors Educació secundària especialitzada ABTo<unk...,,,,,
93174977,eliminacion_catalan,caracteres_problematicos: {'@'},Si en el teu cas vols que es deixin de fer servir Cookies amb les finalitzats que es descriuen aquí ...,,,,,
93206013,eliminacion_catalan,"caracteres_problematicos: {'~', '%'}",Humitat relativa: 10~90% (sense condensació),,,,,
93226013,eliminacion_catalan,"caracteres_problematicos: {'—', '/'}",Generat el 12 de desembre de 2019 — Descarregat des de https://es.hdbuzz.net/090,,,,,
