linea,tipo,razon,texto_original,porcentaje_automatico,detalles_base,detalles_avanzados,texto_catalan,texto_chino
24566,eliminacion_catalan,caracteres_problematicos: {'—'},—Et retindré fins al vespre al Palau de Justícia.,,,,,
181162,eliminacion_catalan,caracteres_problematicos: {'‘'},"Al final del partit podríem dir: ‘D'acord, els dos equips s'ho mereixen'.",,,,,
246792,eliminacion_catalan,caracteres_problematicos: {'·'},"Funcionaris xinesos van dir que es van rebre gairebé 200 sol·licituds, però la majoria van ser retir...",,,,,
280388,eliminacion_catalan,caracteres_problematicos: {'·'},"Tampoc no ho són les substitucions perfectes, però l'ajuda de col·laboradors disposats podria conver...",,,,,
311319,eliminacion_catalan,"caracteres_problematicos: {'“', '”'}",Triem el nom “2peix” per la doble accepció.,,,,,
405570,eliminacion_catalan,caracteres_problematicos: {'/'},"No, la meva dona / el meu marit també és aquí.",,,,,
463404,eliminacion_catalan,caracteres_problematicos: {'«'},«Les empreses xineses respecten els empleats locals i els animen a adquirir més habilitats.,,,,,
475040,eliminacion_catalan,caracteres_problematicos: {'+'},"Google+ es pot assemblar molt a altres xarxes socials en què hem participat abans, però no és un pro...",,,,,
580227,eliminacion_catalan,caracteres_problematicos: {'“'},“Tot i que els inversors estrangers estan menys interessats en l'estat de Rakhine.,,,,,
593585,eliminacion_catalan,"caracteres_problematicos: {'“', '”'}","Van mesurar el sucre en sang de 602 persones, mentre que un grup de 60 assessors independents van es...",,,,,
775997,eliminacion_catalan,caracteres_problematicos: {'·'},Pregunteu als vostres amics i col·legues sobre els joves australians i l'alcohol i aposto que diran ...,,,,,
959856,eliminacion_catalan,caracteres_problematicos: {'%'},"Com a resultat, cal abordar un conjunt de factors de mercat i factors controlables per assolir un RO...",,,,,
1170816,eliminacion_catalan,caracteres_problematicos: {'“'},“Estàs partint per trobar noves terres i canviar la teva vida.,,,,,
1222083,eliminacion_catalan,caracteres_problematicos: {'”'},També vull justícia per a milers de pares que poden ser com nosaltres.”.,,,,,
1480671,eliminacion_catalan,caracteres_problematicos: {'“'},"“Per a molts, aconseguir ajuda comença amb una conversa.",,,,,
1834673,eliminacion_catalan,caracteres_problematicos: {'·'},"En el passat recent, hem gaudit de visites sabàtiques i de llarga durada d'aquests col·legues:",,,,,
1924305,eliminacion_catalan,caracteres_problematicos: {'·'},Però els seus líders són molt més intel·ligents que els nostres.,,,,,
2052609,eliminacion_catalan,"caracteres_problematicos: {'“', '·', '”'}","“Jo sóc un servent d'Al·là: Ell m'ha donat la revelació i m'ha fet profeta”, diu Jesús a les 19:30, ...",,,,,
2079959,eliminacion_catalan,caracteres_problematicos: {'%'},"Després de l'11-S, les denúncies de crims d'odi contra àrabs-americans, o els que es perceben, van a...",,,,,
2186771,eliminacion_catalan,caracteres_problematicos: {'“'},"“En conjunt, l'informe tendeix més cap al costat negatiu.",,,,,
2403761,eliminacion_catalan,caracteres_problematicos: {'='},"I és un ideal maximal, és a dir, per a qualsevol ideal propi J, si I està contingut en J llavors I =...",,,,,
2451117,eliminacion_catalan,"caracteres_problematicos: {'‘', '«'}",«Tot aquest argument es podria generalitzar de la manera següent: ‘hauria d'acceptar fer alguna cosa...,,,,,
2474004,eliminacion_catalan,caracteres_problematicos: {'–'},El Gran Canyó – Té poc més de 6.000 anys?,,,,,
2589403,eliminacion_catalan,caracteres_problematicos: {'“'},“Avui estic llegint sobre com millorar la teva salut.,,,,,
2624859,eliminacion_catalan,caracteres_problematicos: {'·'},L'ortodòxia dretana que domina el pensament a Brussel·les s'ha imposat als desventurats grecs.,,,,,
2706380,eliminacion_catalan,caracteres_problematicos: {'·'},"La recerca de l'enfocament duna persona no necessita ser massa intel·ligent, però el camí per sortir...",,,,,
2816564,eliminacion_catalan,"caracteres_problematicos: {'“', '”'}","“Task force Iraq” 15 i 20 unitats, planta mòbil d'aigua potable per osmosi inversa",,,,,
2840611,eliminacion_catalan,caracteres_problematicos: {'–'},"– Alteracions del son, com una festa al costat de casa meva.",,,,,
2841757,eliminacion_catalan,caracteres_problematicos: {'⁄'},Europa ja tenia assegurats els 14 1⁄2 punts que necessitava perquè tenien les meitats assegurades en...,,,,,
2868374,eliminacion_catalan,"caracteres_problematicos: {'“', '”'}",“Em sento trist” és un sentiment.,,,,,
2960530,eliminacion_catalan,caracteres_problematicos: {'·'},avaluació general: excel·lents instal·lacions nacionals i internacionals; sistema automàtic,,,,,
3075440,eliminacion_catalan,caracteres_problematicos: {'·'},Els sol·licitants que s'hagin donat de baixa prèviament del programa NROTC per raons disciplinàries ...,,,,,
3075903,eliminacion_catalan,caracteres_problematicos: {'»'},Estem decidits a impedir aquest terrible comerç que pot tenir un impacte tan destructiu en les vides...,,,,,
3083798,eliminacion_catalan,caracteres_problematicos: {'%'},Més del 60% dels cors i pulmons donats per a trasplantament es llencen a les escombraries perquè no ...,,,,,
3243958,eliminacion_catalan,caracteres_problematicos: {'”'},No tenim por.”.,,,,,
3373557,eliminacion_catalan,"caracteres_problematicos: {'“', '”'}",El “continent fosc” s'estava convertint en el “nou mercat”.,,,,,
3429083,eliminacion_catalan,"caracteres_problematicos: {'“', '”'}",Va dir que les reformes del govern “en realitat no han canviat res a nivell fonamental”.,,,,,
3456058,eliminacion_catalan,caracteres_problematicos: {'·'},"Quan, el 1993, els navegadors web van poder mostrar imatges per primera vegada, el meu col·lega Dan ...",,,,,
3514414,eliminacion_catalan,caracteres_problematicos: {'·'},"Com a resultat, la xarxa Glonass va experimentar múltiples disfuncions el 2019 quan només 21 disposi...",,,,,
3537334,eliminacion_catalan,caracteres_problematicos: {'—'},"—No corres cap perill, sempre que no toquis la màscara!",,,,,
3553770,eliminacion_catalan,caracteres_problematicos: {'·'},"La intel·ligència és el camí per guanyar, la mateixa investigació i desenvolupament, liderar és la m...",,,,,
3590703,eliminacion_catalan,"caracteres_problematicos: {'»', '«'}","«Sóc un d'ells, si realment veus el que la gent diu de mi.».",,,,,
3607002,eliminacion_catalan,"caracteres_problematicos: {'“', '”'}","“El projecte de llei,” va afegir, “és essencialment la part inicial d'una futura constitució”.",,,,,
3678543,eliminacion_catalan,caracteres_problematicos: {'·'},"Tot i això, diversos estudiants han informat de problemes en intentar descarregar i instal·lar la no...",,,,,
3808007,eliminacion_catalan,caracteres_problematicos: {'“'},"“La política, ja sigui revolucionària o contrarevolucionària, és la lluita de classe contra classe, ...",,,,,
3883547,eliminacion_catalan,caracteres_problematicos: {'“'},"“És l'hegemonia, o més aviat el resultat de l'hegemonia cultural en el treball, el que dóna a l'orie...",,,,,
3926417,eliminacion_catalan,caracteres_problematicos: {'·'},"Detroit i Buffalo, Nova York, també van ser considerats com a llocs per enviar migrants, però el sec...",,,,,
3929212,eliminacion_catalan,"caracteres_problematicos: {'‘', '·'}",El projecte inclou una revisió exhaustiva i una classificació de les iniciatives energètiques de les...,,,,,
3969372,eliminacion_catalan,"caracteres_problematicos: {'“', '”'}",“Aquests són símptomes d'un mercat que no ha donat suport als compradors per primera vegada i als qu...,,,,,
4036180,eliminacion_catalan,caracteres_problematicos: {'*'},"* Regressió i reducció de la independència (per limitacions físiques, etc.)",,,,,
4040435,eliminacion_catalan,caracteres_problematicos: {'·'},"L'any passat, la situació va ser different i molts productors van esperar massa temps per vendre, co...",,,,,
4094807,eliminacion_catalan,caracteres_problematicos: {'“'},"“No crec que m'hagués disgustat, però crec que m'hauria cansat d'això ràpidament.",,,,,
4196350,eliminacion_catalan,caracteres_problematicos: {'·'},L'acceptació de la FCC de SpaceX està condicionada al fet que la companyia sigui capaç d'iniciar la ...,,,,,
4306286,eliminacion_catalan,caracteres_problematicos: {'”'},"S'equivoquen, perquè el temps de les bombes nuclears s'ha acabat.”.",,,,,
4306488,eliminacion_catalan,caracteres_problematicos: {'%'},Els edificis representen el 40% de les emissions mundials de GEH i continuen sent obstinadament inef...,,,,,
4350634,eliminacion_catalan,caracteres_problematicos: {'·'},224. La llei també ha d'abstenir-se d'establir quin ha de ser el paper de la dona dins de la família...,,,,,
4399180,eliminacion_catalan,caracteres_problematicos: {'/'},"El que passa avui és que, amb l'onada populista que va inquietar l'establishment polític, la Veritat...",,,,,
4417434,eliminacion_catalan,caracteres_problematicos: {'%'},S'espera que el 60% del creixement de la població de Nova Zelanda fins al 2031 es produeixi a Auckla...,,,,,
4438104,eliminacion_catalan,caracteres_problematicos: {'['},"La nostra fracció de.538 es troba dins de l'interval [0,48, 0,54); per tant, el segon símbol del mis...",,,,,
4536756,eliminacion_catalan,"caracteres_problematicos: {'%', '·'}","L'octubre del 2000, la Xina havia desenvolupat i llançat 47 satèl·lits de diversos tipus, amb una ta...",,,,,
4571220,eliminacion_catalan,"caracteres_problematicos: {'“', '”'}","“A més, abans hi havia més d'un enfocament en les joves italianes prometedores en lloc de descobrir ...",,,,,
4575339,eliminacion_catalan,"caracteres_problematicos: {'“', '·'}",“La prosperitat col·lectiva i compartida garantirà que Malàisia pugui tornar a aixecar-se i converti...,,,,,
4618538,eliminacion_catalan,caracteres_problematicos: {'%'},Només les importacions de GNL han augmentat més del 50%.,,,,,
4622121,eliminacion_catalan,"caracteres_problematicos: {'»', '«'}","«Abans de les Olivetti, les màquines d'escriure tenien un aspecte antiquat», va dir Antonelli, «es p...",,,,,
4722306,eliminacion_catalan,"caracteres_problematicos: {'“', '”'}",“Potser en quinze anys podria presentar-se a la presidència?”.,,,,,
4759101,eliminacion_catalan,caracteres_problematicos: {'·'},"Mentrestant, Imola ha millorat les seves instal·lacions després de l'última vegada que va acollir la...",,,,,
4827464,eliminacion_catalan,"caracteres_problematicos: {'“', '”'}","Quan em pregunten “quin sistema operatiu he d'utilitzar, Windows, Unix o Mac?”, la meva resposta sol...",,,,,
4835600,eliminacion_catalan,caracteres_problematicos: {'·'},"Sí, però hauria de poder aportar proves sobre l'origen dels fons per demostrar que provenen de fonts...",,,,,
4915063,eliminacion_catalan,"caracteres_problematicos: {'·', ']', '['}",L'huracà va travessar l'àrea de responsabilitat del Centre d'Huracans del Pacífic Central el 24 de j...,,,,,
5017040,eliminacion_catalan,caracteres_problematicos: {'%'},El 46% de les famílies d'Anglaterra tenen un fill.,,,,,
5021783,eliminacion_catalan,caracteres_problematicos: {'+'},"Aquest estiu, l'embragatge gegant desenvolupat per R+W va ser acoblat a Klingenberg i lliurat amb un...",,,,,
5044443,eliminacion_catalan,caracteres_problematicos: {'»'},Hem de treballar junts per ampliar la seguretat alimentària a les agendes polítiques nacionals i int...,,,,,
5140191,eliminacion_catalan,caracteres_problematicos: {'·'},"La majoria de les indústries també es beneficiaran de les tecnologies genèriques, ja que les seves i...",,,,,
5201000,eliminacion_catalan,caracteres_problematicos: {'%'},"aquest és el valor històric més baix, i per a la predicció de la taxa de creixement dels diners, tot...",,,,,
5425083,eliminacion_catalan,caracteres_problematicos: {'·'},Ciutats intel·ligents emergents i els riscos associats,,,,,
5547193,eliminacion_catalan,"caracteres_problematicos: {'/', '–'}","Crec que la resolució de Tiananmen, d'una manera o altra, proporcionarà la clau per obrir l'espai po...",,,,,
5562900,eliminacion_catalan,caracteres_problematicos: {'“'},"“Per tant, oblidant coses com on has deixat les claus o on has aparcat el cotxe, o quin nom porta un...",,,,,
5591337,eliminacion_catalan,caracteres_problematicos: {'/'},Es demana als pares/cuidadors que ho comprovin setmanalment.,,,,,
5669098,eliminacion_catalan,caracteres_problematicos: {'$'},El projecte Atoll Phase One és un esquema de producció primerenc que involucra gairebé $1 mil milion...,,,,,
5688300,eliminacion_catalan,caracteres_problematicos: {'‘'},Google ha llançat aquesta setmana una ‘SOS Alert' per a les cerques relacionades amb el nou Coronavi...,,,,,
5736754,eliminacion_catalan,"caracteres_problematicos: {'“', '”'}","“La ciència ha fet molts avenços al llarg de la meva vida, però encara no s'ha inventat l'instrument...",,,,,
5770408,eliminacion_catalan,caracteres_problematicos: {'—'},"Per ajudar a entrenar la memòria de treball, CrushStations — que té lloc a l'oceà — requereix cada j...",,,,,
5814370,eliminacion_catalan,"caracteres_problematicos: {'“', '”'}",“Pots recuperar-te de la lesió però pots tenir una cicatriu.”.,,,,,
5881082,eliminacion_catalan,"caracteres_problematicos: {'“', '”'}",Michael Zahorik és fundador i CEO de Zahorik Professional Group (“ZPG”).,,,,,
5911203,eliminacion_catalan,caracteres_problematicos: {'·'},"En quart lloc, amb 12 milions de dòlars en vendes d'entrades, va ser una pel·lícula sense superheroi...",,,,,
6104246,eliminacion_catalan,caracteres_problematicos: {'/'},La certificació sota la norma ISO / IEC 17025:2005 assegura a l'usuari que la certificació del seu i...,,,,,
6154233,eliminacion_catalan,caracteres_problematicos: {'–'},Si la cultura popular ens posa a treballar fins i tot en el nostre temps lliure –si enlloc se'ns dón...,,,,,
6184650,eliminacion_catalan,caracteres_problematicos: {'«'},15) «La seguretat és sobretot una superstició.,,,,,
6226235,eliminacion_catalan,caracteres_problematicos: {'$'},"En l'anomenat front de no-grandfathering, Netflix va dir dilluns que més de la meitat dels seus memb...",,,,,
6250255,eliminacion_catalan,caracteres_problematicos: {'–'},"Vostè sempre podria fer-me sentir una mica vostè sap, tipus de, ja saps, tipus de manera feliç–vostè...",,,,,
6323732,eliminacion_catalan,"caracteres_problematicos: {'“', '”'}",“Has descobert alguna cosa que creus que val milions?”.,,,,,
6366289,eliminacion_catalan,caracteres_problematicos: {'&'},"Tot i això, la majoria de les obres d'art i peces tipogràfiques van ser creades per Tim & I.",,,,,
6391833,eliminacion_catalan,caracteres_problematicos: {'#'},"#SDT104IN - adoptar polítiques especialment fiscals, salarials i de protecció social i aconseguir pr...",,,,,
6392114,eliminacion_catalan,caracteres_problematicos: {'“'},"Alice Webb, directora de BBC Children's, va afegir: “La nostra audiència està canviant ràpidament i ...",,,,,
6459424,eliminacion_catalan,caracteres_problematicos: {'/'},Detalls del document de viatge anterior de Hong Kong que s'ha perdut/danyat/no està disponible (Form...,,,,,
6468860,eliminacion_catalan,caracteres_problematicos: {'“'},"“Ho fem perquè podem, ningú ens pot aturar i simplement ens agrada provocar el caos.",,,,,
6526567,eliminacion_catalan,caracteres_problematicos: {'·'},En les darreres dues setmanes s'han produït diverses col·lisions en què els estils de conducció no h...,,,,,
6555635,eliminacion_catalan,caracteres_problematicos: {'»'},Li desitjo el millor i espero que tothom s'asseguri que votin el dimarts.».,,,,,
6637199,eliminacion_catalan,caracteres_problematicos: {'%'},"A les normes nacionals i industrials actuals de la Xina, les normes de la indústria de fabricació d'...",,,,,
6640702,eliminacion_catalan,caracteres_problematicos: {'·'},"No obstant això, ha estat difícil per als astrònoms trobar exoplanetes dins dels discos dels sisteme...",,,,,
6713992,eliminacion_catalan,caracteres_problematicos: {'“'},“És un paper molt cuidat i tenen dades precioses.,,,,,
6721440,eliminacion_catalan,"caracteres_problematicos: {'“', '”'}","Trau i el seu grup han provat la seva metodologia en una varietat de càncers, però cap d'ells eren c...",,,,,
6810386,eliminacion_catalan,caracteres_problematicos: {'·'},"Ens encanta aferrar-nos a aquesta il·lusió, i pocs són profundament conscients que aquest esdevenir ...",,,,,
6909288,eliminacion_catalan,caracteres_problematicos: {'—'},"""Una cosa que estic segur és que hi ha gent en aquest país - hi ha una soca radical de l'Islam en aq...",,,,,
6940766,eliminacion_catalan,caracteres_problematicos: {'·'},Posseeix i opera l'emblemàtic Centre Mèdic Thomson i una xarxa de clíniques i instal·lacions mèdique...,,,,,
7141143,eliminacion_catalan,caracteres_problematicos: {'·'},"La càrrega útil de la Força Aèria, anomenada S5, està destinada a provar si els satèl·lits petits i ...",,,,,
7234059,eliminacion_catalan,caracteres_problematicos: {'–'},"Si ens preocupem pel futur, hem d'aprendre a comprometre'ns amb les anàlisis subjectives i l'actuali...",,,,,
7251488,eliminacion_catalan,caracteres_problematicos: {'“'},“No fan res als Estats Units.,,,,,
7310239,eliminacion_catalan,caracteres_problematicos: {'·'},"Tot i això, és difícil controlar el gruix de la pel·lícula en el procés de producció i és difícil ob...",,,,,
7329135,eliminacion_catalan,caracteres_problematicos: {'·'},"Com a tal, Cal EMA té una varietat de dades que ha de suportar i arxivar durant dècades, incloent in...",,,,,
7371427,eliminacion_catalan,"caracteres_problematicos: {'“', '”'}","Sota l'escala de qualificació de Moody's, Espanya ara té una qualificació de “A3,” que encara és gra...",,,,,
7623320,eliminacion_catalan,caracteres_problematicos: {'–'},Una cosa és clara: totes les empreses necessiten entendre completament el big data –què és per a ell...,,,,,
7722250,eliminacion_catalan,"caracteres_problematicos: {'“', '·', '”'}",Hi haurà un enfocament en la intel·ligència artificial que pot “personalitzar” l'experiència d'un us...,,,,,
7809453,eliminacion_catalan,caracteres_problematicos: {'%'},"Dins de dos o tres anys, el 90% dels nord-americans d'ascendència europea seran identificables a par...",,,,,
7823489,eliminacion_catalan,caracteres_problematicos: {'·'},"Al principi, aquesta col·laboració va ser més aviat un intercanvi mutu de coneixements, en què vaig ...",,,,,
7858146,eliminacion_catalan,caracteres_problematicos: {'“'},"“Quan tenia 12 o 13 anys me'n vaig anar de casa per continuar la meva carrera futbolística i, mentre...",,,,,
7883096,eliminacion_catalan,caracteres_problematicos: {'%'},L'escorça conté de 8 a 19% de taní i és molt utilitzada per adobar cuir i preservar xarxes de pesca.,,,,,
7988920,eliminacion_catalan,caracteres_problematicos: {'·'},"La revolució digital ens ha portat la tecnologia dels telèfons intel·ligents i, literalment, milers ...",,,,,
7990840,eliminacion_catalan,caracteres_problematicos: {'”'},"El minyó jurà que, cada cop que sentís l'alarma, faria cas del seu missatge.”.",,,,,
8093128,eliminacion_catalan,caracteres_problematicos: {'·'},"""La privació de la nacionalitat no ha de ser arbitrària, especialment per motius discriminatoris"", v...",,,,,
8129308,eliminacion_catalan,caracteres_problematicos: {'“'},Va dir: “En les properes setmanes passarem a una fase substantial de l'activitat operativa sobre el ...,,,,,
8170244,eliminacion_catalan,"caracteres_problematicos: {'“', '”'}","“Els conceptes es representen com a programes probabilístics simples, és a dir, models generatius pr...",,,,,
8175162,eliminacion_catalan,caracteres_problematicos: {'$'},Els Estats Units han gastat més de $100 mil milions en ajuda a l'Afganistan des de 2001 per entrenar...,,,,,
8225450,eliminacion_catalan,"caracteres_problematicos: {'$', '–', '£'}","A l'agost, una nova ronda de sancions va prohibir les exportacions incloent el carbó, costant a Core...",,,,,
8378686,eliminacion_catalan,caracteres_problematicos: {'»'},Next Post » Millorar-me a mi mateix farà que el meu xicot se senti més atret per mi?,,,,,
8403663,eliminacion_catalan,"caracteres_problematicos: {'“', '”'}",“Els lleons s'estan tornant vulnerables i volem prendre mesures que els sostinguin.”.,,,,,
8483024,eliminacion_catalan,caracteres_problematicos: {'–'},– L'aplicació FxFactory OS X també li permet utilitzar els productes gratuïts sense necessitat de co...,,,,,
8557885,eliminacion_catalan,"caracteres_problematicos: {'“', '”'}",La màxima popular àrab “Millor cent anys de tirania que un dia de caos” captura gran part de la por ...,,,,,
8571347,eliminacion_catalan,caracteres_problematicos: {'“'},“Ha estat deu anys al servei i ha fet una bona feina.,,,,,
8617786,eliminacion_catalan,caracteres_problematicos: {'·'},"Tot just unes hores abans de l'al·locució de Kennedy, la Junta de Caps d'Estat Major havia posat tot...",,,,,
8649716,eliminacion_catalan,caracteres_problematicos: {'•'},• No és massa tard per preparar-nos com a nació: sempre hi ha prou or per a un estàndard d'or si esp...,,,,,
8737415,eliminacion_catalan,"caracteres_problematicos: {'%', '·', '*'}","Al voltant del 7,8% dels participants van rebre un excel·lent*, per sota del 8,0% de l'any passat.",,,,,
8788880,eliminacion_catalan,caracteres_problematicos: {'“'},“Sabem l'important que és cada partit.,,,,,
8803599,eliminacion_catalan,"caracteres_problematicos: {'“', '”'}","“Fins i tot després d'afegir la missatgeria a l'estiu de 2009, vam mantenir la funcionalitat bàsica ...",,,,,
8972970,eliminacion_catalan,caracteres_problematicos: {'·'},"Em va encantar aquesta pel·lícula i també llegir les memòries de Katherine Graham, que va guanyar un...",,,,,
9065575,eliminacion_catalan,caracteres_problematicos: {'%'},Entre el 50 i el 60% de totes les dones que se sotmeten a una cirurgia que preserva la fertilitat po...,,,,,
9097849,eliminacion_catalan,"caracteres_problematicos: {'“', '”'}","“Jules Bianchi va ser una personalitat popular a la F1, posseint el millor de les qualitats humanes ...",,,,,
9100545,eliminacion_catalan,caracteres_problematicos: {'·'},"El 5G no és només una tecnologia o estàndard, sinó una constel·lació de diferents tecnologies.",,,,,
9140430,eliminacion_catalan,caracteres_problematicos: {'·'},Fins i tot no ho va fer quan el comitè que investiga l'empresa es va instal·lar a Washington al febr...,,,,,
9176674,eliminacion_catalan,caracteres_problematicos: {'%'},"Per example, per a un inversor amb dòlars de renda imposable, el venciment de la reducció d'impostos...",,,,,
9195689,eliminacion_catalan,caracteres_problematicos: {'”'},"Les regulacions no proporcionen totes les respostes morals a tots els dilemes morals, i això és el q...",,,,,
9304038,eliminacion_catalan,caracteres_problematicos: {'/'},"AC / DC va fer una declaració el mateix dia: ""Només ens hem adonat de l'arrest de Phil quan la notíc...",,,,,
9313366,eliminacion_catalan,caracteres_problematicos: {'“'},“Utilitzem 10 projectors que es projecten directament sobre una pantalla de projecció blanca a terra...,,,,,
9345547,eliminacion_catalan,caracteres_problematicos: {'·'},"Malauradament, algunes de les nostres cèl·lules normals també es divideixen ràpidament, causant múlt...",,,,,
9361178,eliminacion_catalan,caracteres_problematicos: {'/'},"Per tenir una connexió realment segura, no només podeu xifrar les vostres dades, sinó que també heu ...",,,,,
9373910,eliminacion_catalan,caracteres_problematicos: {'·'},5 missions paral·leles i activitats addicionals al món obert,,,,,
9393695,eliminacion_catalan,caracteres_problematicos: {'/'},"Tot i que James no estava disposada a compartir els preus, va prometre que el xip oferiria una relac...",,,,,
9409410,eliminacion_catalan,"caracteres_problematicos: {']', '['}",[14] La prevalença de la sida i la sífilis entre els homosexuals és entre 38 i 109 vegades superior ...,,,,,
9412825,eliminacion_catalan,caracteres_problematicos: {'“'},“Necessitaran més que un títol avançat en ciència o enginyeria per sobreviure a l'espai.,,,,,
9430963,eliminacion_catalan,caracteres_problematicos: {'·'},"Des de la seva perspectiva al públic, sembla gairebé ridícul que aquesta creença autoimposada, aques...",,,,,
9642923,eliminacion_catalan,"caracteres_problematicos: {'»', '«'}","«Així és com sabem què és l'amor», escriu Joan.",,,,,
9644291,eliminacion_catalan,caracteres_problematicos: {'·'},Estima els animals - Déu els ha donat un pensament simplificat i una alegria impol·luta.,,,,,
9662250,eliminacion_catalan,caracteres_problematicos: {'·'},"Van observar que el DHA formava partícules grans d'unes 3-4 micres de longitud, aproximadament de la...",,,,,
9685415,eliminacion_catalan,caracteres_problematicos: {'“'},“Aquest no és un problema que els estudiants puguin abordar.,,,,,
9759358,eliminacion_catalan,caracteres_problematicos: {'•'},• No matis animals no humans tret que siguis atacat o per la teva alimentació.,,,,,
9799563,eliminacion_catalan,caracteres_problematicos: {'$'},"Però al juliol, va rebre una carta amenaçadora de l'advocat del Dr. Mu assenyalant que no havia reen...",,,,,
9809058,eliminacion_catalan,caracteres_problematicos: {'·'},"Per fer-ho, heu d'emplenar un formulari de ""Sol·licitud d'estudi a Nova Zelanda"" INZ 1012 o un formu...",,,,,
9809485,eliminacion_catalan,caracteres_problematicos: {'$'},"Al setembre de 2015, FuelCell Energy va anunciar un projecte de US $23,7 milions de costos compartit...",,,,,
