linea,tipo,razon,texto_original,porcentaje_automatico,detalles_base,detalles_avanzados,texto_catalan,texto_chino
90324609,eliminacion_catalan,caracteres_problematicos: {'/'},"Disposicions pertinents: resolucions 1993/20, 2003/30, 2005/3, 2005/5 i 2005/64 de la Comissió.",,,,,
90339327,eliminacion_catalan,"caracteres_problematicos: {'“', '”', '/'}","Els Països Baixos estan d'acord amb el Grup d'alt nivell sobre les amenaces, els desafiaments i el c...",,,,,
90341293,eliminacion_catalan,caracteres_problematicos: {'·'},Reconeix que als països menys avançats i en diversos països d'ingressos baixos i mitjans els insoste...,,,,,
90364160,eliminacion_catalan,caracteres_problematicos: {'•'},• Crear capacitat en laboratoris locals per a l'avaluació de l'abast i impacte de la contaminació pe...,,,,,
90423008,eliminacion_catalan,caracteres_problematicos: {'•'},"• Beneficis tangibles per a les persones (noves oportunitats econòmiques, seguretat alimentària, etc...",,,,,
90477020,eliminacion_catalan,caracteres_problematicos: {'/'},En resposta al paràgraf 3 de la decisió INC-7/5 i tenint en compte les presentacions a què es fa ref...,,,,,
90485786,eliminacion_catalan,"caracteres_problematicos: {'“', '”'}","A més, el periodista azerbaidjanès Arif Yunusov va fer unes declaracions en què va manifestar claram...",,,,,
90501627,eliminacion_catalan,"caracteres_problematicos: {'“', '”'}","Paràgraf 121, línia 4: on diu “haurien de” ha de dir “podrien”.",,,,,
90519240,eliminacion_catalan,caracteres_problematicos: {'·'},"El Grup concedeix gran importància a la cooperació Sud-Sud, que ofereix als països en desenvolupamen...",,,,,
90540221,eliminacion_catalan,"caracteres_problematicos: {'“', '”', '/'}","Sareva (Secretari de la Comissió) (parla en anglès): El projecte de resolució A/C.1/62/L.23, titulat...",,,,,
90569320,eliminacion_catalan,"caracteres_problematicos: {'“', '”'}","Convenció i Estatut pels quals s'estableix la Unió Internacional de Socors, 1927, art. 2 (un dels pr...",,,,,
90624661,eliminacion_catalan,"caracteres_problematicos: {'/', '*'}","Comunicació N.o 1386/2005, Roussev c. Espanya* (Decisió adoptada el 24 de juliol de 2007, 90o períod...",,,,,
90642071,eliminacion_catalan,caracteres_problematicos: {'%'},La subregió d'Amèrica Llatina i el Carib va comunicar mesures considerablement millorades de fiscali...,,,,,
90656635,eliminacion_catalan,caracteres_problematicos: {'%'},"El 88,5% de les famílies són propietaris d'una casa particular, mentre que la resta, l'11,5%, viuen ...",,,,,
90676905,eliminacion_catalan,"caracteres_problematicos: {'“', '”'}",Decideix incloure en el programa provisional del seu seixantè tercer període de sessions el subtema ...,,,,,
90682990,eliminacion_catalan,caracteres_problematicos: {'·'},"En 2006, l'Assemblea General va dur a terme un examen ampli de meitat de període del Programa d'Acci...",,,,,
90699437,eliminacion_catalan,"caracteres_problematicos: {'“', '”'}",Suprimeixi's en el paràgraf 1 de l'article 83 el text “; o bé que sigui part en el Conveni de les Na...,,,,,
90761868,eliminacion_catalan,caracteres_problematicos: {'/'},"L'Assemblea General, en el paràgraf 2 de la seva resolució 58/110, de 9 de desembre de 2003, va cons...",,,,,
90773281,eliminacion_catalan,"caracteres_problematicos: {'“', '”'}",“La protecció jurídica dels adolescents acusats de cometre delictes”.,,,,,
90874476,eliminacion_catalan,caracteres_problematicos: {'/'},"En relació amb el tema 5, la Junta va tenir davant si un informe de la Secretaria sobre les activita...",,,,,
90876138,eliminacion_catalan,"caracteres_problematicos: {'[', ']', '/'}",A/59/L.45/Add.1 Tema 39 a) - Enfortiment de la coordinació de l'assistència humanitària i de socors ...,,,,,
90889156,eliminacion_catalan,caracteres_problematicos: {'·'},Dóna instruccions a la secretaria perquè sol·liciti a l'entitat responsable que va presentar la recl...,,,,,
90963613,eliminacion_catalan,caracteres_problematicos: {'/'},"Això està també d'acord amb el Consens de São Paulo (TD/410), en el qual es va instar a la secretari...",,,,,
90989247,eliminacion_catalan,caracteres_problematicos: {'·'},Demana a l'Oficina de les Nacions Unides contra la Droga i el Delicte que continuï prestant assistèn...,,,,,
91050475,eliminacion_catalan,caracteres_problematicos: {'·'},L'11 de setembre de 1999 es va nomenar un Coordinador d'Activitats Humanitàries per a la crisi de Ti...,,,,,
91077329,eliminacion_catalan,caracteres_problematicos: {'%'},"En termes globals, en 1999 el 40% de totes les activitats van estar dedicades a aquests països.",,,,,
91086681,eliminacion_catalan,caracteres_problematicos: {'%'},En 1999 el cultiu total del cascall a Àsia sud-oriental (a la zona coneguda com el Triangle d'Or) va...,,,,,
91110572,eliminacion_catalan,caracteres_problematicos: {'·'},"Gatilov (Federació de Rússia) (parla en rus): La Federació de Rússia recorda amb satisfacció que, du...",,,,,
91136477,eliminacion_catalan,caracteres_problematicos: {'·'},La Comissió entén que el sistema actual sol provocar tardança en la contractació del personal sobre ...,,,,,
91172921,eliminacion_catalan,caracteres_problematicos: {'·'},Sr. Nesho (Albània) (parla en anglès): Sr. President: Desitjo donar-li les gràcies per la seva excel...,,,,,
91208083,eliminacion_catalan,"caracteres_problematicos: {'“', '”'}","“Quan el mateix projecte de resolució s'examini en una Comissió Principal i en sessió plenària, les ...",,,,,
91226029,eliminacion_catalan,"caracteres_problematicos: {'[', ']'}",Tot membre podrà retirar-se del present [Conveni] en qualsevol moment després de la seva entrada en ...,,,,,
91357299,eliminacion_catalan,"caracteres_problematicos: {'“', '”'}","La Legió de la Bona Voluntat executa en diverses regions el programa “Ronda de caritat”, mitjançant ...",,,,,
91386749,eliminacion_catalan,"caracteres_problematicos: {'“', '”'}","A més, va seguir celebrant reunions setmanals amb el President i el Primer Ministre. Així mateix, va...",,,,,
91395744,eliminacion_catalan,"caracteres_problematicos: {'“', '”', '/', '·'}",En la seva decisió 7/1 aprovada després de l'estudi que va realitzar en 1999 sobre el tema sectorial...,,,,,
91467442,eliminacion_catalan,caracteres_problematicos: {'/'},f) Informe del Secretari General sobre les opcions normatives i possibles mesures per a accelerar el...,,,,,
91498332,eliminacion_catalan,caracteres_problematicos: {'·'},"Si bé aquest procediment dificulta l'aprovació, pot justificar-se pel fet que protegeix el caràcter ...",,,,,
91502686,eliminacion_catalan,"caracteres_problematicos: {'“', '”', '/'}","Recordant així mateix les seves resolucions 32/135, de 16 de desembre de 1977, i 36/17, de 9 de nove...",,,,,
91548398,eliminacion_catalan,caracteres_problematicos: {'•'},"• Al maig de 2001, es va crear un fòrum organitzador d'ONG mexicanes, compost per sis xarxes de la s...",,,,,
91561798,eliminacion_catalan,caracteres_problematicos: {'—'},"Enfront d'aquesta realitat, el tema que la Comissió de Desarmament ha triat per als seus debats —Mes...",,,,,
91599221,eliminacion_catalan,caracteres_problematicos: {'•'},• tota persona necessitada amb residència permanent al territori de Grècia té dret a l'assistència s...,,,,,
91625776,eliminacion_catalan,"caracteres_problematicos: {'“', '”', '·'}","El 17 de març de 2001, els investigadors de l'Equip de Tasques van prendre coneixement que tres func...",,,,,
91638628,eliminacion_catalan,caracteres_problematicos: {'“'},Proposta: “Acollim amb beneplàcit els progressos aconseguits recentment per a aconseguir la particip...,,,,,
91679804,eliminacion_catalan,"caracteres_problematicos: {'“', '”', '/'}",“Els que no compleixin aquests compromisos han de tenir en compte que tampoc estan complint la respo...,,,,,
91717637,eliminacion_catalan,caracteres_problematicos: {'/'},El Director General/Secretari va assenyalar que la major part de les despeses en tecnologia de la in...,,,,,
91726917,eliminacion_catalan,caracteres_problematicos: {'·'},"Es va organitzar una reunió per a representants d'Àfrica a Kampala, sobre el tràfic il·lícit d'armes...",,,,,
91770364,eliminacion_catalan,caracteres_problematicos: {'·'},"Gràcies a la Declaració sobre les ciutats i altres assentaments humans en el nou mil·lenni, aprovada...",,,,,
91852591,eliminacion_catalan,caracteres_problematicos: {'/'},"També en la 76a sessió, la Comissió va examinar el projecte de decisió 5, que la Subcomissió de Prom...",,,,,
91950988,eliminacion_catalan,caracteres_problematicos: {'·'},El Director General transmetrà la sol·licitud d'inspecció a l'Estat parteix inspeccionat almenys 12 ...,,,,,
91971645,eliminacion_catalan,"caracteres_problematicos: {'“', '”'}","Per a l'Estat sobirà dels segles XVII i XVIII, el monarca en la seva forma absoluta personificava a ...",,,,,
92041251,eliminacion_catalan,caracteres_problematicos: {'/'},Els oradors van expressar el seu reconeixement per les útils exposicions i l'examen del cas fictici ...,,,,,
92059598,eliminacion_catalan,caracteres_problematicos: {'/'},Examen del projecte de resolució A/C.4/63/L.3,,,,,
92075902,eliminacion_catalan,caracteres_problematicos: {'%'},Hi ha qui calcula que aquesta xifra a penes reflecteix el 10% de la quantitat real.,,,,,
92103555,eliminacion_catalan,caracteres_problematicos: {'•'},• Facilitar la tasca de la Comissió de Consolidació de la Pau.,,,,,
92163247,eliminacion_catalan,caracteres_problematicos: {'·'},"Promoure als països en què encara no s'ha fet la normativa, els procediments i mecanismes efectius d...",,,,,
92168856,eliminacion_catalan,"caracteres_problematicos: {'“', '”'}",L'informe indica que el Codi de la Nacionalitat Mauritana i els seus textos modificatius “garanteixe...,,,,,
92170268,eliminacion_catalan,"caracteres_problematicos: {'“', '”'}",Afegeixi's un nou indicador a) iii) que digui el següent: “Satisfacció de la Comissió de Dret Intern...,,,,,
92201457,eliminacion_catalan,"caracteres_problematicos: {'“', '”'}","En el primer semestre de 2006, es van registrar 11 delictes previstos en l'article 128 del Codi Pena...",,,,,
92227291,eliminacion_catalan,caracteres_problematicos: {'°'},Havent examinat l'informe del Comitè Mixt de Pensions del Personal de les Nacions Unides sobre el se...,,,,,
92240527,eliminacion_catalan,caracteres_problematicos: {'·'},El seu Govern assigna la màxima importància a la cooperació judicial internacional per combatre la d...,,,,,
92277507,eliminacion_catalan,caracteres_problematicos: {'+'},"Durant el 49è període de sessions, que va ser una avaluació del procés Beijing + 10, així com una et...",,,,,
92310200,eliminacion_catalan,caracteres_problematicos: {'—'},Permeti-se'm dir-ho més clarament: els veritables amics ajudaran el Govern —a qualsevol Govern— a co...,,,,,
92326821,eliminacion_catalan,caracteres_problematicos: {'―'},"Aquesta temptació és allí present, està afectant diversos Estats i, d'una manera o una altra, aquest...",,,,,
92340043,eliminacion_catalan,caracteres_problematicos: {'/'},Crear un fons de la Unió Africana per mitigar els efectes de l'augment dels preus del petroli als pa...,,,,,
92352163,eliminacion_catalan,caracteres_problematicos: {'/'},"Vegeu Documents Oficials del Consell Econòmic i Social, 2005, Suplement núm. 3 (E/2005/23), cap. II,...",,,,,
92462949,eliminacion_catalan,"caracteres_problematicos: {'“', '”'}","A fi de resoldre les qüestions proposades, proposa la formulació següent: “L'acord de transacció ha ...",,,,,
92467006,eliminacion_catalan,caracteres_problematicos: {'/'},Decideix que la realització de les activitats indicades en els paràgrafs 25 a 32 infra compti amb el...,,,,,
92514459,eliminacion_catalan,"caracteres_problematicos: {'“', '”'}","Com a part de les avaluacions posteriors al conflicte realitzades als Balcans, en 2000-2001 es va du...",,,,,
92555683,eliminacion_catalan,"caracteres_problematicos: {'“', '”'}","Segons es va desprendre del debat en el grup de treball oficiós, als països de parla espanyola el co...",,,,,
92620751,eliminacion_catalan,"caracteres_problematicos: {'“', '”'}","A continuació figura el text d'una declaració conjunta emesa pel “Quartet” (les Nacions Unides, la F...",,,,,
92678195,eliminacion_catalan,caracteres_problematicos: {'·'},Insta a les secretaries i les taules dels òrgans que utilitzen insuficientment els seus recursos de ...,,,,,
92684454,eliminacion_catalan,caracteres_problematicos: {'/'},"Prenent nota de la resolució 2003/28 de la Comissió de Drets Humans, de 22 d'abril de 2003 i totes l...",,,,,
92703903,eliminacion_catalan,"caracteres_problematicos: {'“', '”'}",Demana al Secretari General que convidi als Estats i a les organitzacions internacionals al fet que ...,,,,,
92715641,eliminacion_catalan,"caracteres_problematicos: {'”', '/', '[', '“', ']'}","En les seves sessions [], celebrades els dies [], el Comitè Especial va examinar un projecte de reso...",,,,,
92724731,eliminacion_catalan,"caracteres_problematicos: {'“', '”', '/', '·'}",En la seva resolució 2003/41 titulada “Mesures per a contrarestar la tendència a la legalització de ...,,,,,
92727494,eliminacion_catalan,"caracteres_problematicos: {'“', '”'}","“La salut dels boscos és una mesura de la seva capacitat per subministrar i distribuir aigua, nutrie...",,,,,
92785364,eliminacion_catalan,"caracteres_problematicos: {'“', '”'}","A més, en el Títol XIII, Capítol II del Codi Penal, “Delictes que comprometen la pau de la República...",,,,,
92826885,eliminacion_catalan,caracteres_problematicos: {'/'},El compliment de totes les disposicions de l'estatut i de les normes i els criteris interns; el Pres...,,,,,
92848790,eliminacion_catalan,caracteres_problematicos: {'%'},"La junta de l'associació de propietaris forestals és el soci principal (51%), la qual cosa fa que la...",,,,,
92923810,eliminacion_catalan,"caracteres_problematicos: {'©', '•'}",© 2019 Mucha Café Mencions legals • TERMES D'ÚS • Política de privacitat • Política de cookies,,,,,
93017939,eliminacion_catalan,caracteres_problematicos: {'='},"Gràcies per dedicar uns minuts de la meva ""humil"" comentaris. Bells tens el cabell i els somriures =...",,,,,
93045295,eliminacion_catalan,caracteres_problematicos: {'&'},Música & auditiu,,,,,
93067434,eliminacion_catalan,caracteres_problematicos: {'/'},Es tracta d'una solució còmoda i fiable. Es pot disposar sempre d'aquest producte en les millors con...,,,,,
93069934,eliminacion_catalan,caracteres_problematicos: {'©'},"Copyright © 2019, Tots els drets reservats, bUnited.com _ Està prohibida la reproducció en la seva t...",,,,,
93123835,eliminacion_catalan,caracteres_problematicos: {'/'},Seleccioneu la plataforma (IOS / Android),,,,,
93136461,eliminacion_catalan,caracteres_problematicos: {'»'},Vostè està aquí: casa » Sobre nosaltres » Cultura de l'empresa,,,,,
93151733,eliminacion_catalan,caracteres_problematicos: {'€'},€1.00 per referència,,,,,
93154760,eliminacion_catalan,"caracteres_problematicos: {'“', '”'}",“Possiblement has de reconsiderar les de colors brillants. Les ressenyes en línia són espantoses.”,,,,,
93178985,eliminacion_catalan,"caracteres_problematicos: {'»', '«'}",La informació sobre la votació estarà disponible per a les forquilles dels tokens «OOO» almenys 48 h...,,,,,
93307310,eliminacion_catalan,"caracteres_problematicos: {'\\', '=', '·'}",Advertència: Descàrrega o instal·lació en la unitat X:\ (X = unitat de descàrrega o d'instal·lació) ...,,,,,
93328088,eliminacion_catalan,caracteres_problematicos: {'»'},» Camió Transport de Càrrega » camions refrigerats,,,,,
93343043,eliminacion_catalan,caracteres_problematicos: {'@'},Si vols que es deixin de processar les teves dades d'acord amb el que s'estipula als propòsits C-F i...,,,,,
93387945,eliminacion_catalan,caracteres_problematicos: {'%'},L'Aplicació Anything crema el 20% de totes les monedes Any que rep com a comissió de la interacció e...,,,,,
93450116,eliminacion_catalan,caracteres_problematicos: {'£'},£ 200 ofertes de benvinguda al LucksCasino.com Crítica visita,,,,,
93470713,eliminacion_catalan,caracteres_problematicos: {'*'},* Aquesta gràfica mostra la dinàmica del tipus de canvi mitjà BTC a ETH conversió durant els últims ...,,,,,
93486114,eliminacion_catalan,caracteres_problematicos: {'–'},Jon Jaroker – Sèrie de Fibonacci de Genealogia – Estimació de generacions d'un arbre genealògic,,,,,
93527006,eliminacion_catalan,caracteres_problematicos: {'·'},- un accés il·limitat als 0 vídeos de JuicyBoobs,,,,,
93555894,eliminacion_catalan,caracteres_problematicos: {'/'},"El RAID per Programari és el que podem configurar gràcies a un programa, és a dir, un paquet de Prog...",,,,,
93664317,eliminacion_catalan,"caracteres_problematicos: {'·', '®'}","En els nostres més de 130 anys d'història, SC Johnson ha creat marques estimades com Raid®, Glade®, ...",,,,,
93722414,eliminacion_catalan,caracteres_problematicos: {'·'},Torneu a instal·lar l'arxiu i no us oblideu de reiniciar el sistema,,,,,
93910994,eliminacion_catalan,"caracteres_problematicos: {'/', '–'}",1. BinaryRoom365 – Acceptar USA/CA,,,,,
93967996,eliminacion_catalan,caracteres_problematicos: {'/'},Escales / Rampes,,,,,
94021822,eliminacion_catalan,caracteres_problematicos: {'%'},Aconsegueix un 67% addicional en tota la web de SaturnVPN.,,,,,
94025548,eliminacion_catalan,caracteres_problematicos: {'·'},"Instal·lacions de l'habitació : Aire condicionat, Assecador, Bany, Banyera, Barnús, Caixa forta, Cal...",,,,,
94042401,eliminacion_catalan,"caracteres_problematicos: {'<', '>', '·'}","<unk>ariphoto vol.6 seleccióTPPG · Any 2015 """,,,,,
94067059,eliminacion_catalan,caracteres_problematicos: {'/'},La unitat G-DRIVE TM mobile USB-C ofereix emmagatzematge portàtil amb un disseny elegant d'alumini p...,,,,,
94090862,eliminacion_catalan,caracteres_problematicos: {'/'},"Parat en forat del Fishin el ' l'altre dia, que passa ser una de les meves botigues preferides de la...",,,,,
94149905,eliminacion_catalan,"caracteres_problematicos: {'[', ']'}",Ciutat Vella [45],,,,,
94171738,eliminacion_catalan,"caracteres_problematicos: {'$', '/'}","ZorroVPN pot no ser un de les VPN més conegudes, però amb 77 servidors a tot el món, oferint 5 dispo...",,,,,
94184800,eliminacion_catalan,caracteres_problematicos: {'/'},GC.8/Dec.7 Credencials dels representants en el vuitè període de sessions de la 5 1 Conferència Gene...,,,,,
27660,eliminacion_chino,caracteres_no_chinos: {'-'},我们还注意到，早期采用者（2009-2012年的制造商）现在正在用更快，更便宜的3D打印机替换他们的机器。,,,,,
71354,eliminacion_chino,caracteres_no_chinos: {'.'},我们变成了资产，这就是日常生活金融化3.0。,,,,,
192619,eliminacion_chino,"caracteres_no_chinos: {""'""}",当他们第一次打电话给她时，她说，“我认为，作为一个16岁女孩的自然反应，就像'这是假的。,,,,,
812183,eliminacion_chino,caracteres_no_chinos: {'-'},我的血液仍然存在：接受它，但不要让我长久受苦“ - 玛丽安托瓦内特,,,,,
842507,eliminacion_chino,caracteres_no_chinos: {'-'},这是一个大房间，完全book-lined-I没有见过这样的一个房间因为我离开哈佛。,,,,,
937307,eliminacion_chino,"caracteres_no_chinos: {','}","“Amtrak 501,紧急紧急情况紧急情况，我们在地面，”他说，根据电话录音的说法。",,,,,
1029492,eliminacion_chino,caracteres_no_chinos: {'-'},-民主的未来与中产阶级陷阱,,,,,
1077210,eliminacion_chino,"caracteres_no_chinos: {""'""}",《年轻巨人的教育：中美儿童的所学（与所不学）》（Educating Young Giants： What Kids Learn （And Don't Learn） in China and Ameri...,,,,,
1212492,eliminacion_chino,caracteres_no_chinos: {'-'},Facebook的用户 - 以及让它可以自由获得如此超额利润的民主国家 - 显然值得拥有更多。,,,,,
1286386,eliminacion_chino,caracteres_no_chinos: {'-'},保持耐心 - 验证过程可能需要长达24小时。,,,,,
1303422,eliminacion_chino,caracteres_no_chinos: {'.'},a. 防止一切形式的暴力，促进正面的儿童抚养方式，在国家协调框架中应强调初级预防；,,,,,
1528166,eliminacion_chino,"caracteres_no_chinos: {','}","它是方便的如果我的约会能说明事情的真相，但我可以安全地猜测,6周后失踪的那个女人不知道她在第一周后想要什么。",,,,,
1917278,eliminacion_chino,caracteres_no_chinos: {'-'},更新 - 在这里您可以找到有关此产品是否是最新的信息。,,,,,
2203845,eliminacion_chino,"caracteres_no_chinos: {','}","GAO:437,000个驱逐案件积压，听证会推迟到2022年。",,,,,
2532868,eliminacion_chino,"caracteres_no_chinos: {','}","儿科炎症性肠病 （Inflammatory Bowel Disease， IBD） 中心： 每年约有 1,400 名患有 IBD 的儿童从世界各地来到 CHOP，他们在这里得到了我们多学科团队的最先进...",,,,,
3289122,eliminacion_chino,caracteres_no_chinos: {'-'},据认为，微笑 - 骗子的武器，即经常微笑的人肯定是在撒谎。,,,,,
3459194,eliminacion_chino,"caracteres_no_chinos: {','}","虽然环境平等方面的文献强调在现实情况下，需要有区别的责任14,但人均办法使我们能够探讨如果资源分配平等，可以普遍实现什么样的生活质量。",,,,,
3883110,eliminacion_chino,caracteres_no_chinos: {'-'},从那天早上7点30分起，四名朝鲜男子和两名女子 - 一名越南人和一名印度尼西亚人 - 一直在主要机场航站楼的一家餐馆等候。,,,,,
4026268,eliminacion_chino,"caracteres_no_chinos: {','}","在1996,他们开始了面包店培训计划，其中包括最近被监禁的人员。",,,,,
4086269,eliminacion_chino,caracteres_no_chinos: {'.'},当时我公司的名称是“健康报告”，这是我公司成立的一家纽约公司Multimedia Solutions Inc.的一项服务，但由于后来的残疾不得不停止。,,,,,
4352155,eliminacion_chino,caracteres_no_chinos: {'-'},“考虑到所有这些因素，我们必须扪心自问，使用kratom - 是为了娱乐，疼痛或其他原因 - 是否会扩大阿片类药物的流行，”Gottlieb写道。”,,,,,
4368033,eliminacion_chino,"caracteres_no_chinos: {',', '.'}","1. TW1,设计容量为1.28Tbps",,,,,
4421844,eliminacion_chino,caracteres_no_chinos: {'.'},2. 摆脱危机的方法将以主要经济角色的激烈斗争为标志，每个人都寻求把危机的后果转嫁给他人。,,,,,
4474114,eliminacion_chino,caracteres_no_chinos: {'-'},虽然人们已经回到新奥尔良几个星期了，但周三是这个城市允许所有地区的人们除了一个人之外的第一天 - 受到重创的第九区。,,,,,
4904387,eliminacion_chino,caracteres_no_chinos: {'.'},我吃健康的饮食，不要喝太多，也不要超重（我的身体质量指数相对健康，为23.6）。,,,,,
5009193,eliminacion_chino,caracteres_no_chinos: {'-'},不完整的数据销毁 - 从硬盘或其他存储介质中删除数据时，可能会留下可能导致未经授权的人员恢复该信息的痕迹。,,,,,
5021589,eliminacion_chino,caracteres_no_chinos: {'-'},关于我们所有 USB-C 产品的更多资讯和详细资料，请按一下这里。,,,,,
5143972,eliminacion_chino,"caracteres_no_chinos: {','}","您可以购买完整版的 Windows 10,但首先应确定电脑可以执行此版本。",,,,,
5255719,eliminacion_chino,caracteres_no_chinos: {'-'},她总是对我说：-小，把这颗宝石保存好。,,,,,
5828680,eliminacion_chino,caracteres_no_chinos: {'&'},OneTrueFan到达二垒新网站&坏。,,,,,
5927137,eliminacion_chino,"caracteres_no_chinos: {','}","CNCERT每周发布一份针对中国网络攻击的报告称，美国4,062台计算机服务器在中国劫持了291万台大型计算机。",,,,,
6227424,eliminacion_chino,caracteres_no_chinos: {'-'},Hatusa是世界上最早的和平条约 - 加沙条约的所在地。,,,,,
6237994,eliminacion_chino,caracteres_no_chinos: {'-'},将来，该企业将成为B-2的主要开发者，并成为苏联工业的人车制造商,,,,,
6410652,eliminacion_chino,caracteres_no_chinos: {'-'},“纳米颗粒像出租车一样装载两个重要乘客，”Satchi-Fainaro教授补充道。,,,,,
6413405,eliminacion_chino,caracteres_no_chinos: {'*'},*****当游客们围着菲利斯和树，詹姆斯的急切地通过他们带的包，直到他找到他想要的。,,,,,
6806757,eliminacion_chino,caracteres_no_chinos: {'.'},JSCD 项目协调员希娜.法鲁克 （Hina Farooq） 从 2010 年 9 月就开始参与过渡性学校项目。,,,,,
6832787,eliminacion_chino,caracteres_no_chinos: {'-'},前总统比尔克林顿在推特上写道：“41和芭芭拉 - 都在想你们俩，并寄希望于早日康复。,,,,,
6910060,eliminacion_chino,caracteres_no_chinos: {'-'},伦敦（路透社） - 在一项分析引发了关于盐的健康影响的激烈辩论，研究人员周三表示，他们没有发现任何证据表明盐摄入的小幅减少会降低患心脏病或过早死亡的风险。,,,,,
6917262,eliminacion_chino,caracteres_no_chinos: {'-'},各省市根据当地实际情况，自行设定合格标准，每年的标准并非固定，具体要看当地当年的合格标准通知，一般在考后2-4个月左右公布，届时可以查问或咨询。,,,,,
6946092,eliminacion_chino,"caracteres_no_chinos: {""'""}",“因为代理人正在获得所有这些矛盾的信号，下一步是编制信息，问我'在我收到这些混合信号的情况下，我有多大可能犯错？'”,,,,,
