linea,tipo,razon,texto_original,porcentaje_automatico,detalles_base,detalles_avanzados,texto_catalan,texto_chino
89278139,eliminacion_catalan,"caracteres_problematicos: {'”', '“'}","L'establiment d'una plataforma denominada “Societat inclusiva”, en la qual figuren les organitzacion...",,,,,
89306905,eliminacion_catalan,caracteres_problematicos: {'·'},"106. En 2012, al marge de les reunions dels Comitès Permanents, celebrades al maig, i de la REP12, c...",,,,,
89325495,eliminacion_catalan,caracteres_problematicos: {'·'},En la secció 12 de la Llei d'extradició s'estableixen garanties més concretes (possibilitat que la p...,,,,,
89337586,eliminacion_catalan,caracteres_problematicos: {'/'},"Comunicacions Ens 1917/2009, 1918/2009, 1925/2009 i 1953/2010",,,,,
89337986,eliminacion_catalan,caracteres_problematicos: {'·'},"7.7 A la llum del que antecedeix, i prenent en consideració les seves presentacions inicials, l'auto...",,,,,
89385890,eliminacion_catalan,caracteres_problematicos: {'·'},"En 2013, la Comissió d'Assumptes Religiosos, en col·laboració amb l'organització no governamental Ge...",,,,,
89493808,eliminacion_catalan,caracteres_problematicos: {'/'},Les nenes que arriben a l'edat adulta sense el nivell mínim d'alfabetització i aritmètica són més vu...,,,,,
89630404,eliminacion_catalan,caracteres_problematicos: {'%'},"Als dos anys de la implantació dels incentius fiscals, la despesa en recerca i desenvolupament a Sud...",,,,,
89692088,eliminacion_catalan,caracteres_problematicos: {'·'},- Al mateix temps que afirmem la nostra decisió d'aplicar la present declaració per a intensificar l...,,,,,
89764226,eliminacion_catalan,"caracteres_problematicos: {'·', '/'}","Atenent al sol·licitat per l'Assemblea General en la seva resolució 65/259, es va contractar a un co...",,,,,
89789630,eliminacion_catalan,caracteres_problematicos: {'/'},Vegeu la informació bàsica que figura en A/65/40.,,,,,
89847908,eliminacion_catalan,caracteres_problematicos: {'·'},a) La funció de centre de coordinació en la Secretaria de les Nacions Unides per al seguiment genera...,,,,,
89873378,eliminacion_catalan,caracteres_problematicos: {'*'},Indonèsia*: projecte de resolució,,,,,
89984555,eliminacion_catalan,caracteres_problematicos: {'·'},"Va recomanar que els sol·licitants d'asil, els beneficiaris de protecció subsidiària i els refugiats...",,,,,
90037033,eliminacion_catalan,caracteres_problematicos: {'%'},"Quant a la taxa d'activitat, es va registrar un augment en el cas de les dones, en passar del 75,7% ...",,,,,
90083377,eliminacion_catalan,"caracteres_problematicos: {'·', '%'}",Aquests documents asseguren una actuació planificada en el marc del sistema de protecció social i aj...,,,,,
90138338,eliminacion_catalan,"caracteres_problematicos: {'·', '/'}",La Comissió va examinar l'informe del Grup d'Experts sobre la Integració de la Informació Estadístic...,,,,,
90199490,eliminacion_catalan,caracteres_problematicos: {'·'},"El Grup d'Estats No Alineats Parts en el Tractat recorda a més que la Conferència d'Examen de 2010, ...",,,,,
90216116,eliminacion_catalan,caracteres_problematicos: {'/'},"Havent examinat l'informe del Secretari General de 10 d'abril de 2014 (S/2014/258),",,,,,
90238055,eliminacion_catalan,caracteres_problematicos: {'·'},3. la interpretació del Pacte de la Lliga i els protocols que la complementen o els acords concertat...,,,,,
90312545,eliminacion_catalan,caracteres_problematicos: {'/'},"A fi de permetre la comparació tant a nivell de programes com de partides de despeses, els nivells d...",,,,,
90312609,eliminacion_catalan,caracteres_problematicos: {'·'},"L'any 2000, l'Assemblea General de les Nacions Unides va aprovar la Declaració del Mil·lenni, en la ...",,,,,
90340935,eliminacion_catalan,caracteres_problematicos: {'·'},Potser vol considerar el Grup de Treball si aquest últim verb estableix una obligació més neutra res...,,,,,
90345430,eliminacion_catalan,caracteres_problematicos: {'°'},Fa seva la recomanació de la Comissió que el simposi per a enfortir l'aliança amb la indústria s'org...,,,,,
90347114,eliminacion_catalan,caracteres_problematicos: {'/'},La present nota conté el text d'aquestes disposicions reformulades pel grup de redacció conforme pot...,,,,,
90360603,eliminacion_catalan,caracteres_problematicos: {'°'},Pren nota de l'informe del Secretari General sobre l'execució financera de la Missió d'Observadors c...,,,,,
90362475,eliminacion_catalan,caracteres_problematicos: {'/'},"Comunicació núm. 536/93, Perera c. Austràlia, i comunicació núm. 534/1993, HTB c. Canadà.",,,,,
90403650,eliminacion_catalan,caracteres_problematicos: {'·'},"Demana al Secretari General que li presenti, en el seu seixantè segon període de sessions, un inform...",,,,,
90457571,eliminacion_catalan,caracteres_problematicos: {'/'},"El Grup de Treball va prendre nota que la Comissió, en el seu 38è període de sessions (Viena, 4 a 15...",,,,,
90488414,eliminacion_catalan,caracteres_problematicos: {'·'},"No obstant això, si bé el mur és il·legal, el Govern d'Israel va decidir fa pocs dies continuar la s...",,,,,
90506177,eliminacion_catalan,caracteres_problematicos: {'/'},"Pel que fa als projectes d'article sobre la responsabilitat de les organitzacions internacionals, la...",,,,,
90508551,eliminacion_catalan,"caracteres_problematicos: {'”', ']', '“', '['}","Cort Internacional de Justícia, opinió consultiva de 28 de maig de 1951, Rec. 1951, pàg. 21: “cap de...",,,,,
90578552,eliminacion_catalan,caracteres_problematicos: {'/'},"Resolucions de l'Assemblea General 50/227, paràgrafs 1, 4 i 12 de l'annex I, i 52/203, quart paràgra...",,,,,
90616319,eliminacion_catalan,caracteres_problematicos: {'%'},"El desplaçament a través de Rafah va millorar, ja que l'encreuament va romandre obert el 42% del tem...",,,,,
90630769,eliminacion_catalan,caracteres_problematicos: {'/'},Demana al Secretari General que asseguri l'empleno ple de les disposicions pertinents de les seves r...,,,,,
90656215,eliminacion_catalan,"caracteres_problematicos: {'”', ']', '“', '['}","Es va convenir que en el paràgraf 4) del projecte d'article: i) el text deixés clar que, pel que fa ...",,,,,
90667205,eliminacion_catalan,caracteres_problematicos: {'/'},El Sr. Zmeyevski (Federació de Rússia) diu que la resolució 59/250 de l'Assemblea General continua s...,,,,,
90670661,eliminacion_catalan,caracteres_problematicos: {'/'},De conformitat amb els criteris de selecció aprovats per l'Assemblea General en la seva resolució 46...,,,,,
90688149,eliminacion_catalan,caracteres_problematicos: {'·'},"El Sr. Soejarwo (Indonèsia) diu que el Govern ha pres nota que, si bé la major part dels qui ensenye...",,,,,
90696342,eliminacion_catalan,"caracteres_problematicos: {'·', '/'}","Així mateix, l'instrument hauria d'estar encaminat a prevenir, combatre i erradicar la intermediació...",,,,,
90706735,eliminacion_catalan,caracteres_problematicos: {'/'},"Vegeu el document CCNM/GF/COMP/WD(2003)42, Competition policy in small economies, presentat per M. G...",,,,,
90737657,eliminacion_catalan,"caracteres_problematicos: {'”', '·', '“'}",Els resultats de l'informe de l'ONUDD titulat “Afganistan Opium Survey 2006” mostren un augment en e...,,,,,
90771445,eliminacion_catalan,"caracteres_problematicos: {'”', '“'}",a) Suprimeixi's la frase “a les necessitats de protecció dels grups vulnerables i”;,,,,,
90790990,eliminacion_catalan,"caracteres_problematicos: {'”', '“'}",També s'havia d'aplicar el principi de “conèixer el seu client”.,,,,,
90808330,eliminacion_catalan,"caracteres_problematicos: {'”', '/', '•', '“'}",• Resolució 58/68 “El risc de proliferació nuclear a l'Orient Mitjà”.,,,,,
90847961,eliminacion_catalan,caracteres_problematicos: {'·'},El millorament de la qualitat de les activitats de cooperació tècnica de l'Organització no és cap as...,,,,,
90897948,eliminacion_catalan,caracteres_problematicos: {'*'},** El presenta informe es publica després del termini establert a causa de la presentació tardana de...,,,,,
90924286,eliminacion_catalan,caracteres_problematicos: {'/'},"En 1998/99, el Subcomitè d'Educació Pública sobre el Maltractament Infantil (vegeu el paràgraf 274 s...",,,,,
90971621,eliminacion_catalan,"caracteres_problematicos: {'”', '“'}",El President (parla en francès): El projecte de resolució VII es titula “Les persones desaparegudes”...,,,,,
91055133,eliminacion_catalan,caracteres_problematicos: {'/'},"No obstant això, les proporcions desastroses que està aconseguint la pandèmia del VIH/SIDA no han de...",,,,,
91069797,eliminacion_catalan,caracteres_problematicos: {'%'},"En aquest sentit, el Govern togolès va adoptar una mesura valenta amb la promulgació de la llei de 1...",,,,,
91089468,eliminacion_catalan,"caracteres_problematicos: {'”', '“'}","En l'apartat e), després de la paraula “produir” afegeixi's “i analitzar”.",,,,,
91116722,eliminacion_catalan,"caracteres_problematicos: {'·', '/', '[', ']'}",[42. [La CP/RP] [L'òrgan d'apel·lació] [] podrà elaborar el procediment de treball per a les apel·la...,,,,,
91261548,eliminacion_catalan,caracteres_problematicos: {'/'},Enfortiment de la seguretat i la cooperació a la regió del Mediterrani: informe de la Primera Comiss...,,,,,
91299750,eliminacion_catalan,caracteres_problematicos: {'/'},Informe anual del Director General sobre les activitats de l'Organització corresponent a 2008 (conti...,,,,,
91358385,eliminacion_catalan,caracteres_problematicos: {'/'},"oo) Declaració presentada per World Population Foundation, organització no governamental reconeguda ...",,,,,
91428688,eliminacion_catalan,caracteres_problematicos: {'·'},"Demana al Secretari General que publiqui el text de la Guia de pràctiques, inclusivament electrònica...",,,,,
91499641,eliminacion_catalan,"caracteres_problematicos: {'°', '/'}","En la seva resolució 55/235, paràgraf 16, l'Assemblea General va decidir que l'estructura dels nivel...",,,,,
91506798,eliminacion_catalan,"caracteres_problematicos: {']', '['}","[A més, indicarà les mesures adoptades per a cooperar amb altres Parts a fi de fomentar l'eficàcia i...",,,,,
91513912,eliminacion_catalan,"caracteres_problematicos: {'”', '“'}",Diversos dels formularis inclouen seccions de “Informació complementària” perquè els Estats Parts pu...,,,,,
91797712,eliminacion_catalan,caracteres_problematicos: {'/'},En la seva sessió d'obertura la Junta va aprovar el programa provisional del període de sessions que...,,,,,
91839700,eliminacion_catalan,caracteres_problematicos: {'%'},"13.2 L'ingrés net s'assignarà, en cada exercici, a un compte de la Reserva General fins que els comp...",,,,,
91938721,eliminacion_catalan,caracteres_problematicos: {'%'},"El percentatge de dones contractades com a consultores va augmentar del 26,6% el 2005 al 28% el 2006...",,,,,
91941257,eliminacion_catalan,caracteres_problematicos: {'/'},"Reafirma el que es disposa en la secció XX de la seva resolució 61/276, i encoratja al Secretari Gen...",,,,,
91978487,eliminacion_catalan,caracteres_problematicos: {'“'},- “Suport a l'Enfortiment de l'Institut Nacional de les Dones-Uruguai (executat per UNIFEM Brasil i ...,,,,,
92020148,eliminacion_catalan,caracteres_problematicos: {'/'},"La Llei d'igualtat de gènere de Kosovo, Llei No 2004/2, promulgada pel Reglament No 2004/18, de 7 de...",,,,,
92061407,eliminacion_catalan,caracteres_problematicos: {'—'},És un càncer aterridor que cal combatre aviat amb mitjans eficaços perquè els estupefaents —que mai ...,,,,,
92143831,eliminacion_catalan,"caracteres_problematicos: {']', '“', '['}","“[] la notificació de l'ordre d'expulsió s'enviarà directament, abans de la seva execució, a les aut...",,,,,
92169501,eliminacion_catalan,caracteres_problematicos: {'•'},• Formació de les forces de l'ordre i els organismes de seguretat en les tècniques més modernes d'in...,,,,,
92278448,eliminacion_catalan,caracteres_problematicos: {'·'},"La nova estació, Miraya (""Mirall"") FM, transmet de manera ininterrompuda i difon noticiaris en anglè...",,,,,
92322638,eliminacion_catalan,caracteres_problematicos: {'·'},Preparat per les delegacions de Rússia i la Xina davant la Conferència de Desarmament sobre la base ...,,,,,
92373619,eliminacion_catalan,caracteres_problematicos: {'/'},Reunió de delegacions interessades sobre el projecte de proposta A/C.2/57/L.45 (tema 87 a)) (Decenni...,,,,,
92407346,eliminacion_catalan,caracteres_problematicos: {'/'},"En relació amb el projecte de programa per a l'Índia (DP/FPA/CPO/IND/6), les delegacions van fer les...",,,,,
92446751,eliminacion_catalan,caracteres_problematicos: {'/'},L'Òrgan Subsidiari d'Assessorament Científic i Tecnològic (OSACT) va decidir recomanar a la Conferèn...,,,,,
92454896,eliminacion_catalan,caracteres_problematicos: {'/'},Carta de data de 21 de desembre de 2001 dirigida al Secretari General de les Nacions Unides pel Secr...,,,,,
92491098,eliminacion_catalan,caracteres_problematicos: {'/'},La majoria dels països desenvolupats (i diversos altres països) participen en alguna d'aquestes acti...,,,,,
92642587,eliminacion_catalan,caracteres_problematicos: {'·'},"Ara bé, es requeriran diferents estratègies per a assegurar la promoció dels objectius de desenvolup...",,,,,
92675507,eliminacion_catalan,caracteres_problematicos: {'/'},"De conformitat amb el que es disposa en la decisió 25/COP.5, i en l'article 3 del reglament de la Co...",,,,,
92725813,eliminacion_catalan,caracteres_problematicos: {'•'},"• Tres missions (a l'Enviat Especial del Secretari General a Myanmar, el Procés de pau centreamericà...",,,,,
92794847,eliminacion_catalan,caracteres_problematicos: {'—'},Ens complauen en particular les disposicions sobre el foment de la capacitat contemplades en els pro...,,,,,
92904096,eliminacion_catalan,caracteres_problematicos: {'·'},- - Navigate to... - - IniciQuè Oferim?Esdeveniments i PromocionsHistòriaClients Il·lustresGaleriaCo...,,,,,
92918656,eliminacion_catalan,caracteres_problematicos: {'='},piscina com natural=water,,,,,
92923773,eliminacion_catalan,caracteres_problematicos: {'·'},Trucar al 1-800-455-4MTE Contactenos MTE Sol·licitar Cotització,,,,,
92993700,eliminacion_catalan,"caracteres_problematicos: {'>', '$', '/', '<'}","// No se sabria per on prové $username, però se sap que <unk>SESSION és",,,,,
93033097,eliminacion_catalan,caracteres_problematicos: {'%'},Espera! Nord ofereix 75% de descompte en la seva VPN,,,,,
93089523,eliminacion_catalan,"caracteres_problematicos: {'”', '“'}",Sobretot la gent em pregunta pel missatge que “Com descarregar les seves eines” fins i tot la seva m...,,,,,
93095485,eliminacion_catalan,caracteres_problematicos: {'/'},"1 South Terrace, 5000, Adelaide(Adelaida), Centre de negocis d'Adelaide, Austràlia Language/Idioma:",,,,,
93100580,eliminacion_catalan,caracteres_problematicos: {'•'},"• Si el compte d'efectiu per a la renovació no és suficient, la subscripció de dos mapes (principal ...",,,,,
93107353,eliminacion_catalan,caracteres_problematicos: {'/'},Afegeix document / Ajuda TeamWox,,,,,
93144709,eliminacion_catalan,caracteres_problematicos: {'$'},Les tarifes es basen en ocupació senzilla o doble. Hi ha un recàrrec de $ 15 per persona extra,,,,,
93177903,eliminacion_catalan,caracteres_problematicos: {'/'},"maig 23, 2018 /by Impacte NW",,,,,
93217983,eliminacion_catalan,caracteres_problematicos: {'/'},Inici / Entra en acció / Converteix-te en líder / Líder de la comunitat,,,,,
93218419,eliminacion_catalan,caracteres_problematicos: {'/'},"Cuina petita amb un bullidor elèctric, un fogó, una cafetera / tetera, una nevera i un rentavaixella...",,,,,
93236391,eliminacion_catalan,caracteres_problematicos: {'&'},"A més, és compatible amb els proveïdors com Sprint, T-Mobile, Verizon, i en&T.",,,,,
93265663,eliminacion_catalan,caracteres_problematicos: {'/'},L'hotel és a 10 minuts a peu de l'estació de metro de Potsdamer Platz i a 10 minuts a peu de l'estac...,,,,,
93287621,eliminacion_catalan,"caracteres_problematicos: {'&', '+'}","20++ tipus de blocs amb diferents formes, propietats & comportaments diferents i únics",,,,,
93321432,eliminacion_catalan,caracteres_problematicos: {'@'},Si vols que es deixin de processar les teves dades d'acord amb el que s'estipula als propòsits C-F i...,,,,,
93336968,eliminacion_catalan,caracteres_problematicos: {'·'},"Durant quatre nits al voltant del Dia de la Independència, l'Orquestra Simfònica de Detroit realitza...",,,,,
93374213,eliminacion_catalan,caracteres_problematicos: {'%'},Percentatge de snare reduït d'un 70% a 60%,,,,,
93375636,eliminacion_catalan,"caracteres_problematicos: {'®', '—'}","Les publicacions abasten totes les categories del negoci de sanitat animal de Chr. Hansen —porcí, av...",,,,,
93419038,eliminacion_catalan,caracteres_problematicos: {'%'},Realitza el seguiment del desplaçament a la pàgina usant amp-analytics. En l'exemple següent s'utili...,,,,,
93421353,eliminacion_catalan,caracteres_problematicos: {'—'},Contrasenya — contrasenya per al perfil especificat.,,,,,
93461729,eliminacion_catalan,caracteres_problematicos: {'·'},Hotels de 5 estrelles Oregon Hotels a Oregon Tots els hotels de 5 estrelles a Oregon: obtenir la mil...,,,,,
93473553,eliminacion_catalan,caracteres_problematicos: {'+'},"Dòlar neozelandès (NZD) taula de resum de preus avui Dijous, 17 d'octubre 2019 - (10:03 GMT+1)",,,,,
93488734,eliminacion_catalan,caracteres_problematicos: {'·'},"Aquesta espectacular instal·lació de marques de luxe, situat a Riad, compta amb la solució NEO del f...",,,,,
93493106,eliminacion_catalan,caracteres_problematicos: {'·'},"Creus que la producció de jocs mòbils és difícil? No necessita cap coneixement, tecnologia o equip, ...",,,,,
93509964,eliminacion_catalan,caracteres_problematicos: {'%'},"Qualsevol comerciants o persones estan interessades en la 60% teclat o DIY kits personalitzats, pot ...",,,,,
93523580,eliminacion_catalan,"caracteres_problematicos: {'>', '<'}","Mundial d'hoquei sistema és un sistema de capes amb tres <unk>B<unk>oHaMи, en cada un d'ells és la s...",,,,,
93587211,eliminacion_catalan,caracteres_problematicos: {'·'},la sistema ucraïnès de l'educació proporciona una excel·lent qualitat i està ben desenvolupada. Una ...,,,,,
93603317,eliminacion_catalan,caracteres_problematicos: {'·'},"En aquest post veurem que usant corbes el·líptiques podem obtenir un tipus de HH limitat, però sufic...",,,,,
93603860,eliminacion_catalan,caracteres_problematicos: {'–'},En cada gràfic es troba una icona – un triangle gris que per defecte se situa a la cantonada inferio...,,,,,
93620735,eliminacion_catalan,caracteres_problematicos: {'€'},A partir de 59 €,,,,,
93640831,eliminacion_catalan,caracteres_problematicos: {'/'},"Dóna'ns un ""m'agrada"" a Facebook a https://www.facebook.com/uber",,,,,
93644763,eliminacion_catalan,"caracteres_problematicos: {'”', '“'}",Introdueixi el nom de la seva companyia dins del creador de logos i pressioni “mostrar els meus diss...,,,,,
93670607,eliminacion_catalan,caracteres_problematicos: {'%'},10% de descompte en la primera subscripció a Vimeo,,,,,
93936309,eliminacion_catalan,"caracteres_problematicos: {'”', '/', '“'}",Canal de televisió “Payame Aramesh TV d'alta definició” Va aparèixer a 12322 (H) 27500 3/4. MPEG-4. ...,,,,,
94061511,eliminacion_catalan,caracteres_problematicos: {'&'},El W5 Grill & Bar serveix un menú deliciós amb plats a la brasa elaborats amb productes d'origen loc...,,,,,
94073500,eliminacion_catalan,caracteres_problematicos: {'$'},Preu: ($694) $596,,,,,
94075115,eliminacion_catalan,"caracteres_problematicos: {'>', '<'}",<unk> Accedir _ ENVIAR FLORS A DOMICILI A NICOSIA - LA SEVA FORISTERIA DE NICOSIA,,,,,
94090665,eliminacion_catalan,caracteres_problematicos: {'/'},11/22/2017 169.9600 Al 99.19,,,,,
94092451,eliminacion_catalan,caracteres_problematicos: {'%'},95%15:39fa 11 mesos,,,,,
94110653,eliminacion_catalan,caracteres_problematicos: {'/'},casa / Xefs i caps de cuina Descripció del treball / Plantilla de la rendició de comptes i rols,,,,,
94129584,eliminacion_catalan,caracteres_problematicos: {'$'},Xile Pesos 3.725.962.740 CL$,,,,,
931193,eliminacion_chino,caracteres_no_chinos: {'-'},同时，美国专家们在想：F-22真的能够对F-4伊朗空军保持隐身，直到近距离接近吗？,,,,,
1490365,eliminacion_chino,"caracteres_no_chinos: {""'""}",'这个教练组，ESTA组织认为在他身上。,,,,,
1548516,eliminacion_chino,caracteres_no_chinos: {'-'},小鸡fil-A旨在执行 “圣经价值”，并支持2000s中的反同性恋群体。,,,,,
2264596,eliminacion_chino,"caracteres_no_chinos: {','}","新的拥有14,000个座位的路易斯阿姆斯特朗体育场没有空调系统，但依赖于独特的自然通风系统，这将严格受到考验。",,,,,
2715239,eliminacion_chino,caracteres_no_chinos: {'・'},1864年，乔治・帕金斯・马什出版了《人与自然》一书。,,,,,
2924604,eliminacion_chino,caracteres_no_chinos: {'-'},Panther Plast是沃丁堡的另一家大公司-这里生产的塑料产品是为该行业生产的。,,,,,
3575011,eliminacion_chino,"caracteres_no_chinos: {','}","然后他们打电话给所有人说，我们实际上会做两个更短的,13集的季节，这真的是我们认为我们总是这个数字应该做得最好。”",,,,,
3897030,eliminacion_chino,caracteres_no_chinos: {'-'},因此，当你看到竞争对手可能使用自动化并且你弄清楚缺点是什么 - 所以也许精神或产科病房不是在看月球周期，而你确实如此，这是一个竞争优势。,,,,,
3904864,eliminacion_chino,"caracteres_no_chinos: {""'""}",康奈尔的3D打印项目PAN是2x'3U'。,,,,,
4177530,eliminacion_chino,caracteres_no_chinos: {'.'},PowerPoint 无法打开所代表的文件类型.。,,,,,
4220671,eliminacion_chino,caracteres_no_chinos: {'-'},这是一个艰难的会议，它结束，我告诉阿拉法特将结束会谈，说他拒绝谈判，除非他给我东西带回到巴拉克，他从墙上取下来，因为本-阿米和谢尔已经到他们什么也没得到回报。,,,,,
4272466,eliminacion_chino,"caracteres_no_chinos: {','}","每个八位组一共有 256 字节，但是它们并不能提供 256 个主机地址，因为第一个和最后一个值，也就是 0 和 255,是被保留的。",,,,,
4582016,eliminacion_chino,caracteres_no_chinos: {'-'},可能最有争议的理论是，麦田怪圈是来自其他星球的游客的作品 - 有点像外星人的名片。,,,,,
4610623,eliminacion_chino,caracteres_no_chinos: {'-'},在新探索者上最有趣的功能是福特Co-Pilot 360套房，它可以帮助您在路上始终保持安全。,,,,,
4740676,eliminacion_chino,caracteres_no_chinos: {'.'},13.（甲）今天很多娱乐怎样助长罪恶？（乙）不良的娱乐可以对人有什么坏影响？,,,,,
4827283,eliminacion_chino,caracteres_no_chinos: {'-'},“第一夫人和Zanu-PF妇女事务秘书向总统提出挑战，要求其继任者说这是其他国家的趋势，”ZBC网上说。,,,,,
4961476,eliminacion_chino,caracteres_no_chinos: {'.'},14.总结某特定行业的十大谜团。,,,,,
5050821,eliminacion_chino,"caracteres_no_chinos: {""'""}",这是美国宇航局说'你也可以参与太空探索'“。”,,,,,
5217682,eliminacion_chino,"caracteres_no_chinos: {""'""}",“有人问你，美国面临的最大地缘政治威胁是什么？你说，'俄罗斯'。”,,,,,
5308486,eliminacion_chino,caracteres_no_chinos: {'・'},Twitter的数据保护官达米安・基兰（Damien Kieran）将敦促开发“一个强大的隐私框架，以期保护用户个人权利……与此同时也能留有创新的自由”。,,,,,
5321440,eliminacion_chino,caracteres_no_chinos: {'-'},因为软饮料的主要原料material-cornsweetener-was现在这么便宜，为什么不让人们多付几便士一个大大大瓶吗？,,,,,
5504960,eliminacion_chino,caracteres_no_chinos: {'.'},它由有色人种领导的环境正义组织和诸如Sierra Club，Greenpeace和350.org等组织（通常是白人组织）划分。,,,,,
5653022,eliminacion_chino,"caracteres_no_chinos: {""'""}",我们这种'高估和低估一样糟糕'的方法也许会让一些股东失望。,,,,,
5904244,eliminacion_chino,caracteres_no_chinos: {'-'},这就是为什么我们致力于保护 - 从地方乃至全球。,,,,,
5939926,eliminacion_chino,"caracteres_no_chinos: {','}","十八名其他行政人员 – 三名副总监，五名高级执行董事，七名执行董事，一名副执行董事，一名总法律顾问和一名总监 – 所有基本工资至少达到130,000美元，所有费用都超过了雇用超过20万美元，并将所有福...",,,,,
6085167,eliminacion_chino,caracteres_no_chinos: {'-'},如果这对2019-nCoV同样适用，则其传播可能会在几个月内在北半球放缓。,,,,,
6291347,eliminacion_chino,caracteres_no_chinos: {'.'},如果您有涉及“福斯润滑油（中国）有限公司（FUCHS LUBRICANTS CHINA LTD.）数据隐私保护”的其它问题，请联系我们。,,,,,
6379760,eliminacion_chino,caracteres_no_chinos: {'-'},- 成长中的市场 - 迪拜的进口自1989年以来翻了一番多，区域经济增长和自由化设置为刺激需求；。,,,,,
6408025,eliminacion_chino,caracteres_no_chinos: {'+'},事实上，时候要到，凡杀你们的，都自以为是敬奉上帝+。,,,,,
6462156,eliminacion_chino,caracteres_no_chinos: {'-'},在周二发布的一篇博客中，希卡姆证实了Twitter的争吵，但他说他与Naomi的实习被撤销无关 - 甚至声称他“竭尽所能”为她提供航空航天业的机会“这将比她失去的那个更好。,,,,,
