linea,tipo,razon,texto_original,porcentaje_automatico,detalles_base,detalles_avanzados,texto_catalan,texto_chino
87307036,eliminacion_catalan,"caracteres_problematicos: {'·', '/'}",Falten menys de cinc anys perquè la comunitat internacional compleixi amb la promesa expressada en l...,,,,,
87346598,eliminacion_catalan,caracteres_problematicos: {'/'},Recomanació Referència PBC.24/3,,,,,
87687638,eliminacion_catalan,caracteres_problematicos: {'·'},Les finestres també tindran dues capes de vidre laminat i una pel·lícula resistent a les explosions.,,,,,
87713409,eliminacion_catalan,caracteres_problematicos: {'·'},President: Tinc el plaer de felicitar-lo per la seva elecció com a President de l'Assemblea General ...,,,,,
87720659,eliminacion_catalan,caracteres_problematicos: {'·'},Tota cèdula de votació en la qual s'indiqui més d'un nom serà declarada nul·la.,,,,,
87791448,eliminacion_catalan,caracteres_problematicos: {'/'},"En el marc general proposat per a l'examen per la Comissió del tema "" L'obligació d'extradir o jutja...",,,,,
87882576,eliminacion_catalan,caracteres_problematicos: {'/'},103. Com a conseqüència de la creixent vulnerabilitat resultant del ràpid creixement demogràfic i de...,,,,,
87899360,eliminacion_catalan,caracteres_problematicos: {'·'},Les dues zones contenen suposadament 103 mines antipersones col·locades en 6 pistes.,,,,,
87907063,eliminacion_catalan,caracteres_problematicos: {'/'},"Recordant les seves resolucions 61/240, de 22 de desembre de 2006, 62/241, de 22 de desembre de 2007...",,,,,
87958919,eliminacion_catalan,"caracteres_problematicos: {'“', '”'}",El Comitè pren nota de les mesures adoptades pel Govern de l'Estat parteix per millorar les inspecci...,,,,,
88006251,eliminacion_catalan,caracteres_problematicos: {'/'},La Junta Executiva va aprovar els següents 22 programes per països conformement al procediment de no...,,,,,
88006500,eliminacion_catalan,caracteres_problematicos: {'/'},Projecte de document del programa per a Kirguizistan (DP/FPA/DCP/KGZ/3);,,,,,
88023165,eliminacion_catalan,caracteres_problematicos: {'/'},"Recordant la seva resolució 51/14, de 14 de març de 2008, relativa a la promoció de la coordinació i...",,,,,
88034050,eliminacion_catalan,caracteres_problematicos: {'/'},Documentació examinada pel Consell Econòmic i Social en relació amb l'avançament de la dona (E/2011/...,,,,,
88039294,eliminacion_catalan,caracteres_problematicos: {'%'},Els Objectius se centren en l'eradicació de la pobresa i en l'apoderament del 50% de la població (do...,,,,,
88065334,eliminacion_catalan,caracteres_problematicos: {'%'},"Segons l'Organització Internacional del Treball, els ingressos de tan sols l'1% de la població mundi...",,,,,
88085144,eliminacion_catalan,caracteres_problematicos: {'/'},Segons el que es disposa en la decisió 9/CMP.6.,,,,,
88104313,eliminacion_catalan,caracteres_problematicos: {'%'},"La proporció d'homes i dones era d'un 84,2% d'homes enfront d'un 15,2% de dones (12 experts no van f...",,,,,
88223393,eliminacion_catalan,caracteres_problematicos: {'/'},"Intern; fons per a viatges del personal (50.000 dòlars), consultor (35.000 dòlars), projectes experi...",,,,,
88241692,eliminacion_catalan,"caracteres_problematicos: {'·', '/'}","A aquest respecte, la Comissió recorda la seva observació sobre la necessitat d'aclarir en major mes...",,,,,
88269797,eliminacion_catalan,caracteres_problematicos: {'/'},"Referent a això, es recorda que en el context del pressupost per programes, l'Assemblea General, en ...",,,,,
88369799,eliminacion_catalan,caracteres_problematicos: {'·'},j) Abordar pragmàticament les limitacions dels drets de propietat intel·lectual per a la transferènc...,,,,,
88386430,eliminacion_catalan,caracteres_problematicos: {']'},"Es publica també en àrab, xinès i rus com a part del present informe.]",,,,,
88387514,eliminacion_catalan,caracteres_problematicos: {'/'},1) El Comitè va examinar el cinquè informe periòdic de la República Dominicana (CCPR/C/DOM/5) en les...,,,,,
88459183,eliminacion_catalan,"caracteres_problematicos: {'·', '+'}",L'assignació tàctica d'actius oscil·lava entre +-10 punts percentuals respecte de la situació estrat...,,,,,
88512337,eliminacion_catalan,caracteres_problematicos: {'/'},"Com a primera mesura, seria important concordar en un conjunt de subtemes per al seu examen, selecci...",,,,,
88529427,eliminacion_catalan,caracteres_problematicos: {'/'},"426. Respecte de les 46 recomanacions esmentades (vegeu també el document A/HRC/17/9/Add.1), Myanmar...",,,,,
88608049,eliminacion_catalan,caracteres_problematicos: {'·'},"Segons la font, el 22 de juliol de 2008 l'advocat del Sr Turgunov va sol·licitar a la Fiscalia Gener...",,,,,
88687565,eliminacion_catalan,caracteres_problematicos: {'/'},"60.Tenint en compte la seva Observació general N.o 4 (2003) sobre la salut dels adolescents, el Comi...",,,,,
88747427,eliminacion_catalan,caracteres_problematicos: {'·'},"Durant el període sobre el qual s'informa, l'organització va recolzar els Objectius de Desenvolupame...",,,,,
88801536,eliminacion_catalan,caracteres_problematicos: {'·'},"A més de l'idioma serbi i l'alfabet ciríl·lic, en determinades administracions locals de la Repúblic...",,,,,
88805082,eliminacion_catalan,caracteres_problematicos: {'/'},"14. El document ICCD/CST(S-3)/3 inclou una visió general, i les conclusions, de dos documents substa...",,,,,
88807013,eliminacion_catalan,caracteres_problematicos: {'%'},"Les despeses corresponents a l'exercici de 2011 van ascendir a 3.179.406 euros, que van representar ...",,,,,
88966576,eliminacion_catalan,caracteres_problematicos: {'/'},El programa informàtic del sistema electrònic de gestió del combustible no va poder implantar-se en ...,,,,,
89009887,eliminacion_catalan,caracteres_problematicos: {'%'},"Per exemple, per al decenni de 2030 a l'Àfrica subsahariana les sequeres i la calor impedirien conre...",,,,,
89024152,eliminacion_catalan,caracteres_problematicos: {'/'},"En 2012, el Consell de Drets Humans va demanar al Grup de Treball sobre la Detenció Arbitrària que p...",,,,,
89027588,eliminacion_catalan,caracteres_problematicos: {'%'},"Segons investigacions publicades per EU Kids Online el 2013, la pornografia (22%) i la violència (18...",,,,,
89075534,eliminacion_catalan,caracteres_problematicos: {'·'},13.7 El Comitè observa que les referències dels autors als articles 6 i 7 del Pacte (vegeu el paràgr...,,,,,
89167309,eliminacion_catalan,caracteres_problematicos: {'·'},3. Un òrgan internacional ha d'encarregar-se de l'acreditació i homologació de les dades obtingudes ...,,,,,
89227863,eliminacion_catalan,"caracteres_problematicos: {'[', '·', ']'}",[Paraules clau: assistència; centre dels principals interessos; centre dels principals interessos --...,,,,,
89359225,eliminacion_catalan,caracteres_problematicos: {'/'},Les dades sobre l'any acadèmic 2008/09 mostren que va haver-hi 22.182 nens que van assistir durant a...,,,,,
89460857,eliminacion_catalan,caracteres_problematicos: {'·'},"Quan les experiències són exitoses, passen a formar part dels coneixements col·lectius.",,,,,
89461401,eliminacion_catalan,caracteres_problematicos: {'°'},"En el seu 10° període de sessions, celebrat en 2011, el Fòrum Permanent va confirmar la intenció de ...",,,,,
89470035,eliminacion_catalan,caracteres_problematicos: {'/'},Nota de la Secretaria sobre la labor del Grup de treball intergovernamental permanent de composició ...,,,,,
89671852,eliminacion_catalan,caracteres_problematicos: {'/'},"En el paràgraf 224 de l'informe (A/67/5 (Vol. II)), l'Administració va acceptar la recomanació de la...",,,,,
89674756,eliminacion_catalan,caracteres_problematicos: {'%'},"Les despeses relacionades amb llocs van augmentar un 7,9%, de 20.908.500 dòlars a 22.555.600 dòlars,...",,,,,
89676925,eliminacion_catalan,caracteres_problematicos: {'·'},"En conseqüència, la Comissió recomana que l'Assemblea General sol·liciti al Secretari General que co...",,,,,
89715566,eliminacion_catalan,caracteres_problematicos: {'%'},"Durant el període comprès entre 2005 i 2010, els 75 països amb una fecunditat per sota del nivell de...",,,,,
89768864,eliminacion_catalan,caracteres_problematicos: {'·'},"a) Adquisició d'instal·lacions prefabricades, equip d'allotjament i refrigeració que abasta la subst...",,,,,
89834075,eliminacion_catalan,caracteres_problematicos: {'%'},En 26 països de baixos i mitjans ingressos el nombre de noves infeccions anuals pel VIH va decréixer...,,,,,
90012531,eliminacion_catalan,caracteres_problematicos: {'·'},"40. En el marc del Programa Mundial contra el Blanqueig de Diners, l'Ocultació del Producte del Deli...",,,,,
90014144,eliminacion_catalan,caracteres_problematicos: {'·'},39. El Comitè rebutja la imposició de sancions addicionals i severes als reclusos que compleixen cad...,,,,,
90043055,eliminacion_catalan,caracteres_problematicos: {'·'},"Amb la finalitat de millorar la remuneració dels empleats dels àmbits de l'educació, la cura de la s...",,,,,
90070119,eliminacion_catalan,caracteres_problematicos: {'/'},"91. A més, el Comitè convida a l'Estat parteix al fet que presenti un document bàsic actualitzat que...",,,,,
90119250,eliminacion_catalan,caracteres_problematicos: {'/'},El Comitè va fer seves les quatre recomanacions formulades per la OSSI en la seva avaluació (E/AC.51...,,,,,
90184656,eliminacion_catalan,caracteres_problematicos: {'·'},"De conformitat amb l'article 26, paràgraf 1 del Reglament sobre Prospecció i Exploració de Nòduls Po...",,,,,
90317685,eliminacion_catalan,"caracteres_problematicos: {'“', '”'}","b) En el sisè paràgraf del preàmbul, inserir les paraules “de les Nacions Unides” després de les par...",,,,,
90359228,eliminacion_catalan,caracteres_problematicos: {'·'},"Igual que el nostre col·lega grec, a nosaltres també ens sembla evident que amb la decisió de remetr...",,,,,
90371558,eliminacion_catalan,"caracteres_problematicos: {'“', '”'}","Definició g), “Sistema automatitzat de missatges”",,,,,
90386871,eliminacion_catalan,caracteres_problematicos: {'/'},"També va voler observar que alguns drets no podien derogar-se mai, independentment de la naturalesa ...",,,,,
90441916,eliminacion_catalan,caracteres_problematicos: {'”'},b) Quan li consti que l'Estat ha pres les mesures necessàries per protegir el caràcter confidencial ...,,,,,
90467043,eliminacion_catalan,"caracteres_problematicos: {'“', '”'}",En tots dos casos s'ha assenyalat com a pretext de tan insòlites decisions que les Conferències Mund...,,,,,
90487146,eliminacion_catalan,caracteres_problematicos: {'/'},"En la seva 2865a sessió, el 4 d'agost de 2005, la Comissió va decidir que el tema ""L'obligació d'ext...",,,,,
90510520,eliminacion_catalan,caracteres_problematicos: {'°'},Si bé el principi no havia estat impugnat en el debat en sessió plenària en 1965 (però ho havia esta...,,,,,
90511191,eliminacion_catalan,"caracteres_problematicos: {'“', '”'}","El President interí (parla en anglès): Ara passarem al projecte de decisió, titulat “Augment del nom...",,,,,
90614444,eliminacion_catalan,caracteres_problematicos: {'•'},• La pau i la reconciliació socials han facilitat de forma notòria l'estabilitat i el retorn dels de...,,,,,
90785907,eliminacion_catalan,"caracteres_problematicos: {'“', '”'}","Aclareix que els principals autors del projecte, a saber: Austràlia, el Canadà i Nova Zelanda, han r...",,,,,
90806938,eliminacion_catalan,"caracteres_problematicos: {'·', '/'}","D'aquesta quantitat, 7.711.800 dòlars estan assignats al projecte de construcció del CEP, de conform...",,,,,
90806961,eliminacion_catalan,caracteres_problematicos: {'/'},Acollint amb satisfacció les importants contribucions realitzades fins al moment pel Fòrum Permanent...,,,,,
90832156,eliminacion_catalan,caracteres_problematicos: {'·'},L'informe sobre la FPNUL descriu les activitats de remoció de mines que s'estan duent a terme per a ...,,,,,
90859567,eliminacion_catalan,"caracteres_problematicos: {'“', '”'}",El Consell de Seguretat va rebre l'informe del Secretari General en el qual lamentava la tenaç negat...,,,,,
90899242,eliminacion_catalan,"caracteres_problematicos: {'[', ']'}",[Hauria de proporcionar] una opinió independent mitjançant una inspecció i una avaluació encaminades...,,,,,
90926823,eliminacion_catalan,caracteres_problematicos: {'·'},La iniciativa Ciutats sense barris de tuguris per a l'Àfrica oriental i meridional va permetre avalu...,,,,,
90966703,eliminacion_catalan,caracteres_problematicos: {'·'},"El Comitè contra la Tortura, actuant conformement al paràgraf 7 de l'article 22 de la Convenció cont...",,,,,
90976743,eliminacion_catalan,"caracteres_problematicos: {'“', '”', '/'}",El 9 de maig de 2002 l'Autoritat Monetària de Macau va emetre la circular Núm. 072/B/2002-DSB/AMCM e...,,,,,
90980264,eliminacion_catalan,"caracteres_problematicos: {'“', '”'}","Z.13 També es va aprovar i ratificar el “Protocol per Prevenir, Reprimir i Sancionar el Tràfic de Pe...",,,,,
90990441,eliminacion_catalan,caracteres_problematicos: {'/'},"Conforme al criteri seguit en altres articles de la Llei Model (per exemple, en el paràgraf 2) de l'...",,,,,
91139198,eliminacion_catalan,caracteres_problematicos: {'/'},"La Conferència va aprovar la petició de Lituània i Uzbekistan, continguda en el document TD(X)/CRP.1...",,,,,
91161338,eliminacion_catalan,caracteres_problematicos: {'/'},"Efectes de mercat: canvis en l'equilibri oferta/demanda i/o preus del mercat, dels inputs i/o produc...",,,,,
91162370,eliminacion_catalan,"caracteres_problematicos: {'“', '/', '”'}","“Durant el debat general que s'iniciarà en l'Assemblea General la setmana vinent, aprofundirem una m...",,,,,
91244930,eliminacion_catalan,caracteres_problematicos: {'°'},"Després de la celebració de les consultes habituals, tinc intenció de designar al General de Brigada...",,,,,
91318722,eliminacion_catalan,caracteres_problematicos: {'·'},Com a part de les activitats de difusió internacional de la informació obtinguda pels satèl·lits CBE...,,,,,
91339600,eliminacion_catalan,"caracteres_problematicos: {'“', '/', '”'}","La Comissió tindrà davant si, per a la seva informació, l'edició més recent de la publicació titulad...",,,,,
91387174,eliminacion_catalan,"caracteres_problematicos: {'[', ']'}","7 ter. En el tercer període de compromís quantificat de reducció de les emissions, de [2018 a 2022] ...",,,,,
91418010,eliminacion_catalan,caracteres_problematicos: {'/'},"En el lloc web del Programa (www.unoosa.org/oosa/en/sapidx.html), el públic pot consultar informació...",,,,,
91420696,eliminacion_catalan,caracteres_problematicos: {'/'},Aquesta estructura d'organització proposada s'ha preparat seguint les recomanacions de la resolució ...,,,,,
91441424,eliminacion_catalan,caracteres_problematicos: {'•'},• A continuar l'aplicació del pla nacional d'acció sobre la protecció dels drets humans per a 2006-2...,,,,,
91446981,eliminacion_catalan,"caracteres_problematicos: {'=', '±', '%'}",El 2 de maig de 2005 la lliura xipriota es va integrar en el mecanisme de tipus de canvi 2 amb la pa...,,,,,
91586700,eliminacion_catalan,caracteres_problematicos: {'/'},"Respecte al VIH/SIDA, vull assenyalar a l'atenció dels membres la pròxima reunió ministerial sobre e...",,,,,
91628947,eliminacion_catalan,caracteres_problematicos: {'%'},"Ja sigui que la taxa de prorrateig màxima sigui d'un 22% o un 25%, la quota de diversos països desen...",,,,,
91656184,eliminacion_catalan,caracteres_problematicos: {'/'},Conseqüències per al pressupost per programes del projecte de resolució A/C.4/55/L.23: Examen ampli ...,,,,,
91656706,eliminacion_catalan,"caracteres_problematicos: {'·', '%'}","Per a les instal·lacions de nivell I, es rebutjaran el 25% superior i el 25% inferior i la mitjana d...",,,,,
91687825,eliminacion_catalan,caracteres_problematicos: {'/'},Examen del problema del virus de la immunodeficiència humana/síndrome d'immunodeficiència adquirida ...,,,,,
91707384,eliminacion_catalan,caracteres_problematicos: {'·'},"En atenció a la sol·licitud de l'Assemblea General, al desembre de 2000 la Secretaria va presentar u...",,,,,
91729966,eliminacion_catalan,"caracteres_problematicos: {'·', '/'}",De conformitat amb el que es disposa en l'apartat a) del paràgraf 32 de la resolució 1996/31 del Con...,,,,,
91732689,eliminacion_catalan,"caracteres_problematicos: {'“', '”'}",Coincidim amb la del Comitè del Premi Nobel en què: “l'únic camí negociable cap a la pau i la cooper...,,,,,
91741623,eliminacion_catalan,caracteres_problematicos: {'°'},"La Cinquena Comissió va reprendre el seu examen del tema en les seves sessions 58°, 61a i 67a, celeb...",,,,,
91860158,eliminacion_catalan,caracteres_problematicos: {'%'},"El 1975 la taxa d'alfabetització de Jamaica era del 59,9% de la població de 15 anys o més.",,,,,
91900096,eliminacion_catalan,caracteres_problematicos: {'·'},"A la República Dominicana, el PNUFID va continuar impartint capacitació judicial i donant suport dir...",,,,,
91978979,eliminacion_catalan,caracteres_problematicos: {'/'},La Divisió de Població manté també un lloc web (http://www.unmigration.org) que serveix de portal pe...,,,,,
92008253,eliminacion_catalan,caracteres_problematicos: {'/'},"Montes (Cap de la Subdivisió d'Anàlisi i Formulació de Polítiques, Departament d'Assumptes Econòmics...",,,,,
92046423,eliminacion_catalan,caracteres_problematicos: {'/'},Recordant que havia aprovat les definicions i recomanacions del capítol relatiu a la insolvència (qu...,,,,,
92061484,eliminacion_catalan,"caracteres_problematicos: {'“', '”'}",b) La declaració de Moscou de 8 de desembre de 2006 (“La Federació de Rússia reafirma el seu comprom...,,,,,
92073576,eliminacion_catalan,"caracteres_problematicos: {'·', '“', '”'}","Així, en la causa Kadic v. Karadzic, de 1995, el tribunal d'apel·lació de districte va observar que ...",,,,,
92115235,eliminacion_catalan,"caracteres_problematicos: {'“', '”'}","En la sessió celebrada el 24 d'abril de 2002, el Consell de Seguretat de les Nacions Unides va donar...",,,,,
92119580,eliminacion_catalan,caracteres_problematicos: {'/'},Recordant també les decisions 2/6 i 3/4 adoptades per la Conferència en els seus períodes de session...,,,,,
92122483,eliminacion_catalan,caracteres_problematicos: {'/'},L'aprovació del projecte de resolució A/C.1/63/L.39 i l'establiment del grup de treball de composici...,,,,,
92125600,eliminacion_catalan,caracteres_problematicos: {'/'},1/... Integració dels drets humans de la dona en tot el sistema de les Nacions Unides,,,,,
92137564,eliminacion_catalan,"caracteres_problematicos: {'“', '”'}","Considera que la definició inclosa en el paràgraf 4 del projecte d'article 4 és suficient, i aprova ...",,,,,
92210920,eliminacion_catalan,caracteres_problematicos: {'/'},L'organització participa activament en el Decenni Internacional d'una cultura de pau i no violència ...,,,,,
92297337,eliminacion_catalan,caracteres_problematicos: {'—'},"Mentre prossegueix la construcció d'aquest mur gegantesc, Israel —la Potència ocupant— segueix, entr...",,,,,
92369368,eliminacion_catalan,caracteres_problematicos: {'/'},"Per a concloure, Uganda encomia al Consell de Seguretat per la seva declaració de la Presidència (S/...",,,,,
92373331,eliminacion_catalan,caracteres_problematicos: {'/'},Carta de data 11 de març (S/2002/254) dirigida al President del Consell de Seguretat pel representan...,,,,,
92378988,eliminacion_catalan,caracteres_problematicos: {'•'},• Un informe sobre la seva promulgació i aplicació.,,,,,
92410409,eliminacion_catalan,caracteres_problematicos: {'/'},"En la seva 925a sessió plenària, celebrada el 12 d'octubre de 2001, la Junta va prendre nota dels in...",,,,,
92415978,eliminacion_catalan,caracteres_problematicos: {'/'},"En conseqüència, considerant les opinions expressades per diversos Estats membres del Consell d'Admi...",,,,,
92425853,eliminacion_catalan,caracteres_problematicos: {'·'},"Observant amb profunda preocupació el ràpid i generalitzat augment de la producció, el tràfic il·líc...",,,,,
92445836,eliminacion_catalan,"caracteres_problematicos: {'[', ']', '/'}",A/C.2/57/L.25 Tema 88 - Activitats operacionals per al desenvolupament - Veneçuela: projecte de reso...,,,,,
92480069,eliminacion_catalan,"caracteres_problematicos: {'“', '”'}","En la primera oració, substituir les paraules “la posició econòmica i social dels pobres” per les pa...",,,,,
92559613,eliminacion_catalan,caracteres_problematicos: {'/'},La Comissió observa que el nombre d'accessos al lloc en la Web registrat en 2001 va ser de 1.120 mil...,,,,,
92594724,eliminacion_catalan,caracteres_problematicos: {'/'},Sr. Gatilov (Federació de Rússia) (parla en rus): Nosaltres també estem agraïts al Secretari General...,,,,,
92602695,eliminacion_catalan,caracteres_problematicos: {'/'},"El text de la decisió figura en el capítol II, secció B, decisió 2002/118.",,,,,
92637654,eliminacion_catalan,caracteres_problematicos: {'·'},"L'Equip d'Acció sobre els sistemes mundials de satèl·lits de navegació, si bé reconeixia la necessit...",,,,,
92670229,eliminacion_catalan,caracteres_problematicos: {'•'},• L'organització donarà suport a les comunicacions entre membres de diferents creences i religions e...,,,,,
92712094,eliminacion_catalan,"caracteres_problematicos: {'“', '/', '”'}","Ens sorprèn que el Secretari General, si bé considera el Projecte d'Acord “un avanç important”, no h...",,,,,
92775611,eliminacion_catalan,caracteres_problematicos: {'£'},El Grup recomana que es pagui una indemnització de 383.618 £ i 38.719 ID per concepte de retencions ...,,,,,
92782304,eliminacion_catalan,"caracteres_problematicos: {'“', '”'}",Decideix incloure al programa provisional del seu cinquantè novè període de sessions un tema titulat...,,,,,
92792228,eliminacion_catalan,caracteres_problematicos: {'·'},Malawi ha recolzat totes les mesures destinades a crear un millor entorn perquè els nostres nens rea...,,,,,
92797349,eliminacion_catalan,caracteres_problematicos: {'/'},Pèrdues mercantils individuals de les categories D8/D9: existències 54 - 55 14,,,,,
92818109,eliminacion_catalan,caracteres_problematicos: {'/'},"Aprova l'alliberament de la suma de 250.000 dòlars dels Estats Units que, de conformitat amb la deci...",,,,,
92853941,eliminacion_catalan,"caracteres_problematicos: {'“', '”', '/'}","Acollint amb beneplàcit la resolució 57/299 de l'Assemblea General, de 20 de desembre de 2002, titul...",,,,,
93013519,eliminacion_catalan,caracteres_problematicos: {'·'},"Si vostè necessita cancel·lar la seva reserva, si us plau envieu-nos un correu electrònic almenys 24...",,,,,
93019454,eliminacion_catalan,caracteres_problematicos: {'–'},"Les classes són de dilluns – divendres, 8:30 a – 5:00 hores, amb la majoria de les classes al matí.",,,,,
93070375,eliminacion_catalan,caracteres_problematicos: {'·'},1. Instal·la l'ASF Wallet (des de Play Store o Aptoide) al teu dispositiu Android i realitza els aju...,,,,,
93087297,eliminacion_catalan,caracteres_problematicos: {'©'},© 2019 www.gayprivates.com - Tots els Drets Reservats! Ajuda Termes i Condicions Declaració de Dret ...,,,,,
93136479,eliminacion_catalan,caracteres_problematicos: {'•'},• Ja utilitza un calendari de formació Greatist? RunKeeper té els que són massa!,,,,,
93192297,eliminacion_catalan,caracteres_problematicos: {'%'},"6, la humitat del medi ambient: 10% -60%;",,,,,
93253872,eliminacion_catalan,caracteres_problematicos: {'@'},Si en el teu cas vols que es deixin de fer servir Cookies amb les finalitzats que es descriuen aquí ...,,,,,
93268000,eliminacion_catalan,caracteres_problematicos: {'@'},Si vols que es deixin de processar les teves dades d'acord amb el que s'estipula als propòsits C-F i...,,,,,
93289379,eliminacion_catalan,caracteres_problematicos: {'@'},Si vols que es deixin de processar les teves dades d'acord amb el que s'estipula als propòsits C-F i...,,,,,
93291227,eliminacion_catalan,"caracteres_problematicos: {'“', '”'}","En 2017, va llançar la seva sola pista “Bebé me creas”, seguit per “Oh I Do” amb 7 milions de visite...",,,,,
93396268,eliminacion_catalan,caracteres_problematicos: {'%'},Comissions recurrents del 10% sobre el preu pagat pel client referit. Cada vegada que el client comp...,,,,,
93561339,eliminacion_catalan,caracteres_problematicos: {'*'},* Aquesta gràfica mostra la dinàmica de la reserva total disponible de BCH en convertir Adv Cash USD...,,,,,
93623651,eliminacion_catalan,caracteres_problematicos: {'+'},Posta de sol: 18:12 +07,,,,,
93710153,eliminacion_catalan,"caracteres_problematicos: {'·', '@'}","Per a qualsevol informació, sol·licitud o aclariment relatives a la privacitat dels usuaris, així co...",,,,,
93770411,eliminacion_catalan,"caracteres_problematicos: {'“', '”'}","Pas 1. Si us plau, obre AVG i desactivi de forma temporal o definitivament la seva protecció: feu cl...",,,,,
93793709,eliminacion_catalan,caracteres_problematicos: {'&'},Calibratge & reparació,,,,,
93821928,eliminacion_catalan,"caracteres_problematicos: {'·', '̈', '+', '°'}",Les noves estacions s'estendran una oferta de canals HD en persa en un satèl·lit Eutelsat 7B (7° E)....,,,,,
93938108,eliminacion_catalan,caracteres_problematicos: {'/'},Casa / Marques de fàbrica / Vins clàssics de Califòrnia / Totes les marques de vi / Monasteriolo / E...,,,,,
93986729,eliminacion_catalan,caracteres_problematicos: {'£'},4.9.1. £5.000 per al participant o equip; i,,,,,
93993671,eliminacion_catalan,caracteres_problematicos: {'€'},"fins 300 € 0,30800",,,,,
