linea,tipo,razon,texto_original,porcentaje_automatico,detalles_base,detalles_avanzados,texto_catalan,texto_chino
85692222,eliminacion_catalan,caracteres_problematicos: {'/'},"La relació noies/nois difereix de la de l'indicador de ODM perquè, per als ODM, la definició d'escol...",,,,,
85802374,eliminacion_catalan,caracteres_problematicos: {'·'},Aquest grup inclou una dependència de desenvolupament de productes encarregada de la direcció creati...,,,,,
85847712,eliminacion_catalan,caracteres_problematicos: {'·'},D'aquesta manera hi hauria menys instal·lacions -només les necessàries- i l'OIEA podria exercir mill...,,,,,
85902131,eliminacion_catalan,caracteres_problematicos: {'/'},Prenent nota de l'informe del Grup d'Experts de les Nacions Unides sobre Libèria de data 16 de desem...,,,,,
85961382,eliminacion_catalan,caracteres_problematicos: {'/'},La Comissió Consultiva en Assumptes Administratius i de Pressupost va compartir la preocupació de la...,,,,,
85967424,eliminacion_catalan,caracteres_problematicos: {'%'},"La Divisió d'Auditoria Interna va formular 636 recomanacions, de les quals se'n van acceptar 561, és...",,,,,
86047057,eliminacion_catalan,caracteres_problematicos: {'%'},L'accés a l'escola primària per al 15% restant dels nens segueix obstaculitzat per disparitats persi...,,,,,
86142775,eliminacion_catalan,caracteres_problematicos: {'°'},Finançament del Tribunal Penal Internacional per a l'enjudiciament dels presumptes responsables de g...,,,,,
86372536,eliminacion_catalan,"caracteres_problematicos: {']', '['}","BARTH EIDE (Noruega) [parla en anglès]: Senyor President, és un immens plaer per a mi dirigir-me a l...",,,,,
86394690,eliminacion_catalan,caracteres_problematicos: {'°'},Des de l'1° de gener de 2009 les possibles víctimes que entren als Països Baixos a través de l'aerop...,,,,,
86412020,eliminacion_catalan,caracteres_problematicos: {'·'},68) El Comitè lamenta que l'Estat parteix no hagi ratificat la Convenció sobre l'Estatut dels Refugi...,,,,,
86523829,eliminacion_catalan,caracteres_problematicos: {'/'},"8/CP.14 Qüestions administratives, financeres i institucionals",,,,,
86570223,eliminacion_catalan,"caracteres_problematicos: {'/', ']', '–', '['}",A/64/3 Tema 44 del programa provisional – Informe del Consell Econòmic i Social – Informe del Consel...,,,,,
86595725,eliminacion_catalan,caracteres_problematicos: {'·'},A principis d'abril de 2008 es van celebrar vistes per a interrogar a perits mèdics i escoltar al·le...,,,,,
86668177,eliminacion_catalan,caracteres_problematicos: {']'},"3. La Secretaria i tots els organismes sota el present Protocol coordinaran, cooperaran i es comunic...",,,,,
86739024,eliminacion_catalan,caracteres_problematicos: {'/'},Informe de la Segona Comissió (A/64/424/Add.2),,,,,
86803591,eliminacion_catalan,caracteres_problematicos: {'/'},"Els ajustos s'efectuen incorporant (o ""consolidant"") un percentatge determinat de l'ajust per lloc d...",,,,,
86820666,eliminacion_catalan,caracteres_problematicos: {'/'},"El present informe s'ha preparat de conformitat amb la resolució 64/251 de l'Assemblea General, en l...",,,,,
86842213,eliminacion_catalan,caracteres_problematicos: {'/'},"En la 25a sessió, celebrada el 21 d'octubre, la Representant Especial per a la situació dels defenso...",,,,,
86869468,eliminacion_catalan,caracteres_problematicos: {'%'},"La Junta va observar una lleu millora en el ritme d'aplicació de les recomanacions, que va ser de 49...",,,,,
86871544,eliminacion_catalan,caracteres_problematicos: {'%'},"Al 31 de desembre de 2009, els dipòsits a la vista i a termini de la UNODC van ascendir a 29,57 mili...",,,,,
86886403,eliminacion_catalan,caracteres_problematicos: {'/'},El coordinador del grup de treball oficiós sobre el volum de treball de la Comissió establert en la ...,,,,,
86914324,eliminacion_catalan,caracteres_problematicos: {'·'},Granada se suma a la sol·licitud de la Comunitat del Carib en el sentit que tan aviat com sigui poss...,,,,,
87074355,eliminacion_catalan,caracteres_problematicos: {'/'},El present informe va ser elaborat per la Missió de determinació de fets establerta pel Consell de D...,,,,,
87112161,eliminacion_catalan,caracteres_problematicos: {'/'},"Com solament es recopila la informació continguda en els documents oficials de les Nacions Unides, l...",,,,,
87216127,eliminacion_catalan,caracteres_problematicos: {'·'},"e) Demanar assessorament a funcionaris superiors, fiscals o jutges d'instrucció, segons correspongui...",,,,,
87216810,eliminacion_catalan,caracteres_problematicos: {'/'},"Per al seu examen del tema, el Grup de treball va tenir davant si un document d'antecedents preparat...",,,,,
87358005,eliminacion_catalan,"caracteres_problematicos: {'“', '”'}",Reunió informativa sobre el document de la Conferència de les Nacions Unides sobre Comerç i Desenvol...,,,,,
87477689,eliminacion_catalan,caracteres_problematicos: {'”'},Porti'm una carta del President i decidirem al seu favor”.,,,,,
87484321,eliminacion_catalan,caracteres_problematicos: {'·'},"La Junta no va trobar cap objecció a aquesta modificació, presentada per l'Administració com una ""mi...",,,,,
87500180,eliminacion_catalan,caracteres_problematicos: {'/'},"Redistribució d'un lloc de Conseller del Personal a l'Oficina del Cap de Serveis Administratius, a u...",,,,,
87612397,eliminacion_catalan,caracteres_problematicos: {'/'},"En la seva 49a sessió, celebrada el 28 de juliol, el Consell va tenir davant si un projecte de resol...",,,,,
87728229,eliminacion_catalan,caracteres_problematicos: {'/'},"Per a concloure, m'agradaria dir que el Grup dels Estats d'Àfrica secunda fermament l'aprovació per ...",,,,,
87731477,eliminacion_catalan,caracteres_problematicos: {'·'},Presenciem aquí a Nova York un esdeveniment històric quan el President del Comitè Executiu de l'Orga...,,,,,
87755313,eliminacion_catalan,caracteres_problematicos: {'/'},Fa cinc anys la Primera Comissió va emprendre el camí cap a l'elaboració d'un tractat sobre el comer...,,,,,
87764821,eliminacion_catalan,caracteres_problematicos: {'/'},Els patrocinadors acullen amb satisfacció l'informe recent del Secretari General sobre arranjaments ...,,,,,
87777797,eliminacion_catalan,caracteres_problematicos: {'/'},"Diverses delegacions van considerar que les propostes relacionades amb les ordres interlocutòries, q...",,,,,
87799101,eliminacion_catalan,"caracteres_problematicos: {']', '['}","[Paraules clau: sentències arbitrals, sentència arbitral, sentència arbitral (reconeixement i execuc...",,,,,
87830989,eliminacion_catalan,caracteres_problematicos: {'·'},22. El Subcomitè d'Acreditació ha formulat recomanacions específiques per a cada institució a partir...,,,,,
87870448,eliminacion_catalan,caracteres_problematicos: {'·'},"Per això, tota persona ha de tenir la possibilitat de sol·licitar-ho per escrit, oralment, per telèf...",,,,,
87874725,eliminacion_catalan,caracteres_problematicos: {'/'},"En el seu 16è període de sessions, el Consell de Drets Humans va aprovar sense votació la resolució ...",,,,,
87877978,eliminacion_catalan,caracteres_problematicos: {'·'},"34. La Sra. Alma Sacalxot, Directora de Projectes de Pobles Indígenes de l'Ambaixada d'Espanya a Gua...",,,,,
87981716,eliminacion_catalan,caracteres_problematicos: {'/'},"Referent a això, el Comitè recorda les resolucions de l'Assemblea General 61/148, de 19 de desembre ...",,,,,
87983058,eliminacion_catalan,caracteres_problematicos: {'/'},22. El Comitè recomana a l'Estat part que organitzi i doni a conèixer suficientment un programa d'ac...,,,,,
88130568,eliminacion_catalan,caracteres_problematicos: {'/'},Adopció de mesures respecte dels projectes de resolució A/C.2/66/L.24 i A/C.2/66/L.71,,,,,
88222523,eliminacion_catalan,caracteres_problematicos: {'/'},"A més, mitjançant la decisió RC-4/11 sobre l'augment de la cooperació i la coordinació entre els con...",,,,,
88257166,eliminacion_catalan,caracteres_problematicos: {'/'},En l'informe que va presentar al Consell de Seguretat amb data 28 de gener de 2011 el Secretari Gene...,,,,,
88358125,eliminacion_catalan,caracteres_problematicos: {'·'},Llavors els oficials de dotació de personal formularien recomanacions preliminars a la junta de la x...,,,,,
88377827,eliminacion_catalan,"caracteres_problematicos: {'/', '·'}","j) Sol·licitar al Govern de Turquia, en relació amb la comunicació núm. 28/2010, que facilités la ve...",,,,,
88379543,eliminacion_catalan,caracteres_problematicos: {'/'},u) Carta de data 29 de juny de 2012 dirigida al President del Consell Econòmic i Social per la Repre...,,,,,
88403271,eliminacion_catalan,caracteres_problematicos: {'·'},35. Sol·licita a l'Oficina de les Nacions Unides contra la Droga i el Delicte que continuï proporcio...,,,,,
88411658,eliminacion_catalan,caracteres_problematicos: {'/'},"Recordant la declaració de la Presidència PRST/9/2, de 24 de setembre de 2008, en la qual es va fixa...",,,,,
88440548,eliminacion_catalan,caracteres_problematicos: {'·'},"Es van distribuir 597 mosquiteres, 1.940 repel·lents i 1.220 caixes de medicaments per a la prevenci...",,,,,
88471605,eliminacion_catalan,"caracteres_problematicos: {'/', ']', '['}",Comitè Especial establert en virtut de la resolució 51/210 de l'Assemblea General [resolucions de l'...,,,,,
88483688,eliminacion_catalan,caracteres_problematicos: {'/'},"b) Desenvolupament social, incloses les qüestions relatives a la situació social en el món i als jov...",,,,,
88520987,eliminacion_catalan,caracteres_problematicos: {'·'},"Admetent que el sol·licitant era un representant estranger a l'efecte de la sol·licitud, el tribunal...",,,,,
88714175,eliminacion_catalan,caracteres_problematicos: {'%'},Es preveu que en 2012 la despesa pública als països del Consell de Cooperació del Golf es desacceler...,,,,,
88753412,eliminacion_catalan,caracteres_problematicos: {'°'},"Durant el 36° període de sessions de la Comissió d'Estadístiques, el Grup de Voorburg va presentar u...",,,,,
88777693,eliminacion_catalan,"caracteres_problematicos: {'/', ']', '['}",[sobre la base d'una proposta examinada en sessió plenària (E/2012/L.16)],,,,,
88811940,eliminacion_catalan,caracteres_problematicos: {'·'},"Sobre la base d'aquestes dades, el sol·licitant va elaborar mapes de l'abundància i la Llei per a es...",,,,,
88818506,eliminacion_catalan,caracteres_problematicos: {'/'},La informació bàsica i documentació relativa a la labor de la Segona Comissió poden consultar-se en ...,,,,,
88844321,eliminacion_catalan,caracteres_problematicos: {'·'},"En conseqüència, des del punt de vista de l'eficiència organitzativa seria preferible que l'eventual...",,,,,
88877189,eliminacion_catalan,caracteres_problematicos: {'·'},"El 2 de juliol, les autoritats del Servei Nacional d'Intel·ligència i Seguretat a Mukhjar (110 km al...",,,,,
88927216,eliminacion_catalan,caracteres_problematicos: {'/'},"Els dos presidents havien preparat un esquema del document, que havien presentat al Comitè d'Examen ...",,,,,
89012343,eliminacion_catalan,"caracteres_problematicos: {']', '['}","En el grup principal de persones originàries de Iugoslàvia, no obstant això, es percep un problema m...",,,,,
89018403,eliminacion_catalan,caracteres_problematicos: {'·'},53. Destaca que l'objectiu central dels serveis de notícies que presta el Departament d'Informació P...,,,,,
89129269,eliminacion_catalan,caracteres_problematicos: {'/'},b) Les bestretes en efectiu efectuades pels Estats Membres al Fons d'Operacions per al bienni 2012-2...,,,,,
89253508,eliminacion_catalan,caracteres_problematicos: {'·'},92.98 Considerar la possibilitat d'aplicar efectivament les disposicions de la Convenció sobre l'Est...,,,,,
89277556,eliminacion_catalan,caracteres_problematicos: {'%'},"Alberta, per exemple, està decidida a eradicar la pobresa infantil i Ontario, segons la seva Llei de...",,,,,
89307907,eliminacion_catalan,caracteres_problematicos: {'·'},"Presentació oficiosa de les sol·licituds presentades en virtut de l'article 5, i de l'anàlisi d'aque...",,,,,
89312339,eliminacion_catalan,caracteres_problematicos: {'/'},Recordant que en el paràgraf 13 de la seva resolució 67/190 va decidir que es determinessin les moda...,,,,,
89445680,eliminacion_catalan,caracteres_problematicos: {'/'},Els Estats membres han demanat constantment la cooperació contínua entre els òrgans finançats conjun...,,,,,
89525538,eliminacion_catalan,caracteres_problematicos: {'·'},77. La Llei de la Falekaupule de 1997 també reconeix la gestió pública tradicional (caps i persones ...,,,,,
89532031,eliminacion_catalan,caracteres_problematicos: {'·'},La secretaria també ha col·laborat amb OSC acreditades d'Europa Central i Oriental per a promoure la...,,,,,
89554938,eliminacion_catalan,"caracteres_problematicos: {'/', '“', '”'}","Consultes oficioses oficioses sobre el projecte de resolució A/C.3/68/L.18, titulat “Enfortiment del...",,,,,
89578704,eliminacion_catalan,caracteres_problematicos: {'·'},"8. Sol·licita al Secretari General que continuï treballant per conducte de la UNIOGBIS, en coordinac...",,,,,
89599707,eliminacion_catalan,caracteres_problematicos: {'/'},"Al febrer de 2012, l'Assemblea General va condemnar "" les violacions generalitzades i sistemàtiques ...",,,,,
89650502,eliminacion_catalan,caracteres_problematicos: {'/'},UNEP/POPS/COP.6/INF/32 Informe de la reunió del grup de coordinació mundial i els grups d'organitzac...,,,,,
89677630,eliminacion_catalan,caracteres_problematicos: {'/'},"Posteriorment, en el paràgraf 105 de la seua resolució 66/246, l'Assemblea va fer seua la proposta d...",,,,,
89704376,eliminacion_catalan,caracteres_problematicos: {'·'},Els instruments i les possibilitats que es contemplen en el Document de Viena de 2011 es van utilitz...,,,,,
89725057,eliminacion_catalan,caracteres_problematicos: {'·'},El Comitè sol·licita a l'Estat part que proporcioni informació sobre els casos en què la Convenció h...,,,,,
89755452,eliminacion_catalan,caracteres_problematicos: {'/'},La tecnologia i la innovació poden contribuir a fer front a molts problemes de desenvolupament; no o...,,,,,
89765836,eliminacion_catalan,caracteres_problematicos: {'·'},"Els recursos proposats per a 2015 per a l'Oficina de l'Enviat Especial per al Sudan i Sudan del Sud,...",,,,,
89800050,eliminacion_catalan,caracteres_problematicos: {'·'},Sol·licita al Secretari General que en el seu setantè període de sessions l'informi sobre l'aplicaci...,,,,,
89807065,eliminacion_catalan,caracteres_problematicos: {'·'},"L'Assemblea General, per recomanació de la Sisena Comissió, decideix ajornar fins al seu setantè per...",,,,,
89919328,eliminacion_catalan,caracteres_problematicos: {'/'},"71. El Grup de Treball va aprovar el contingut de l'article 8, que figurava en el paràgraf 7 del doc...",,,,,
90127976,eliminacion_catalan,caracteres_problematicos: {'·'},:: Col·laboració amb l'ACNUDH i el Comitè Especial encarregat d'investigar les pràctiques israeliane...,,,,,
90178584,eliminacion_catalan,caracteres_problematicos: {'/'},Aquest producte previst se centrarà en el constant perfeccionament i l'aplicació de l'estratègia de ...,,,,,
90182432,eliminacion_catalan,caracteres_problematicos: {'·'},La Comissió va observar que el programa de capacitació proposat per l'entitat sol·licitant comprenia...,,,,,
90216576,eliminacion_catalan,caracteres_problematicos: {'/'},"El 19 de febrer, tres persones van ser detingudes i les seves cases registrades sota la sospita que ...",,,,,
90288464,eliminacion_catalan,caracteres_problematicos: {'/'},Les qüestions relacionades amb l'article 9 del Conveni (Alliberaments) s'examinen en la nota de la s...,,,,,
90325193,eliminacion_catalan,caracteres_problematicos: {'/'},"El Grup de Treball va convenir que, sobre la base del document d'antecedents preparat per la Secreta...",,,,,
90325244,eliminacion_catalan,"caracteres_problematicos: {'•', '“'}","• A l'Assemblea General de la UUA, celebrada a la ciutat de Quebec (Canadà), la UU-UNO va organitzar...",,,,,
90326741,eliminacion_catalan,"caracteres_problematicos: {']', '['}",[] l'explicació de les Comunitats Europees del que podria considerar-se el seu mecanisme constitucio...,,,,,
90412453,eliminacion_catalan,caracteres_problematicos: {'/'},Suport Tècnic/Secció de Tecnologies de la Informació i les Comunicacions,,,,,
90417989,eliminacion_catalan,caracteres_problematicos: {'/'},"En aquest sentit, la Comissió reitera la seva opinió que la gestió eficaç d'una llista d'aquesta nat...",,,,,
90450731,eliminacion_catalan,caracteres_problematicos: {'%'},Segons les dades proporcionades per l'Oficina de l'Alt Comissionat de les Nacions Unides per als Ref...,,,,,
90465693,eliminacion_catalan,caracteres_problematicos: {'/'},Text enunciat en par. 5 de A/CN.9/WG.III.WP.39.,,,,,
90471654,eliminacion_catalan,"caracteres_problematicos: {'·', '°'}","Reafirma la sol·licitud feta a l'Alta Comissionada que, en integrar en la seva labor el dret al dese...",,,,,
90568397,eliminacion_catalan,"caracteres_problematicos: {'“', '”'}","L'any passat, la decisió del Tribunal Suprem en el cas sobre l'avortament per naixement parcial Gonz...",,,,,
90578277,eliminacion_catalan,caracteres_problematicos: {'°'},Reafirma la Declaració i la Plataforma d'Acció de Pequín aprovades en la Quarta Conferència Mundial ...,,,,,
90585577,eliminacion_catalan,caracteres_problematicos: {'/'},Cal recordar que de conformitat amb el procediment establert per l'Assemblea en les seves resolucion...,,,,,
90637457,eliminacion_catalan,caracteres_problematicos: {'/'},"En l'apartat d), substitueixi's ""exteriors"" per ""exteriors rígids"" i ""recipients interiors"" per ""emb...",,,,,
90640890,eliminacion_catalan,caracteres_problematicos: {'·'},"A més, i d'acord amb el criteri de la indivisibilitat dels drets humans, en l'article 17 del Pacte I...",,,,,
90642318,eliminacion_catalan,caracteres_problematicos: {'·'},Ashiki (Japó) diu que la discriminació per raons religioses és il·legal al seu país.,,,,,
90672792,eliminacion_catalan,"caracteres_problematicos: {'/', '·'}","Recordant també la Declaració del Mil·lenni de 2000, el Document Final del Cim Mundial 2005 i la sev...",,,,,
90686046,eliminacion_catalan,caracteres_problematicos: {'·'},La Sra. Pimentel sol·licita aclariments sobre la forma en què s'aborden les dificultats que planteja...,,,,,
90747369,eliminacion_catalan,caracteres_problematicos: {'/'},El cinquè informe periòdic incloïa informació sobre les taxes de mortalitat materna i infantil corre...,,,,,
90765990,eliminacion_catalan,"caracteres_problematicos: {'/', '·'}",Acull amb satisfacció el començament de les negociacions sobre un projecte de convenció per part del...,,,,,
90796114,eliminacion_catalan,caracteres_problematicos: {'·'},"Una dona també pot recórrer als tribunals sol·licitant fasaj o juluq, que té per conseqüència dissol...",,,,,
90805824,eliminacion_catalan,caracteres_problematicos: {'*'},"Eslovàquia, Dinamarca, Federació de Rússia, Grècia, el Japó, Mèxic, Noruega, Països Baixos, Qatar* i...",,,,,
90818217,eliminacion_catalan,"caracteres_problematicos: {'“', '”'}",Noruega celebra les iniciatives que s'han adoptat en els últims anys per a reforçar la capacitat de ...,,,,,
90871579,eliminacion_catalan,"caracteres_problematicos: {'“', '”'}",Esperem amb interès que en la sisena reunió del procés de consultes oficioses es debatin els temes a...,,,,,
90922124,eliminacion_catalan,"caracteres_problematicos: {'“', '”'}","Abans de 2002 els interessos reportats pels fons fiduciaris, el guany o pèrdua derivada de les fluct...",,,,,
90951525,eliminacion_catalan,"caracteres_problematicos: {'/', '“', '”'}","En la 21a sessió, celebrada el 5 de novembre, el representant d'Àustria, en nom de la Mesa, va prese...",,,,,
90956614,eliminacion_catalan,"caracteres_problematicos: {'“', '”'}","Des d'aquesta òptica, el lliscament cap al racisme i la xenofòbia ha resultat possible no tant proba...",,,,,
90960451,eliminacion_catalan,caracteres_problematicos: {'·'},A la pàgina 3 del tercer informe presentat per Indonèsia s'assenyala que el Govern ha establert una ...,,,,,
91033090,eliminacion_catalan,caracteres_problematicos: {'·'},La meva delegació també vol destacar especialment la crida que es formula en el cinquè paràgraf del ...,,,,,
91041800,eliminacion_catalan,caracteres_problematicos: {'/'},"Respecte al tema 5 del programa, relatiu a l'execució del paràgraf 166 del Pla d'Acció de la X UNCTA...",,,,,
91059638,eliminacion_catalan,caracteres_problematicos: {'%'},"A la data, el subsidi atorgat per l'Institut Mixt d'Ajuda Social (IMAS) és de 48.000 colons, abastan...",,,,,
91098851,eliminacion_catalan,"caracteres_problematicos: {']', '['}",g) Preparatius per a la [reunió] [el debat] [l'audiència]: una setmana.,,,,,
91122920,eliminacion_catalan,caracteres_problematicos: {'*'},PROJECTE DE DECISIÓ*,,,,,
91167920,eliminacion_catalan,caracteres_problematicos: {'·'},"Eritrea considera important, així mateix, que es compti amb directrius clares respecte de la interac...",,,,,
91249909,eliminacion_catalan,"caracteres_problematicos: {'•', '%'}",• Només l'1% té un nivell d'educació universitària i menys de l'1% té accés a Internet;,,,,,
91258807,eliminacion_catalan,"caracteres_problematicos: {'%', '—'}",Ja s'han convingut diverses metes respecte de l'assistència general per al desenvolupament que ha de...,,,,,
91260876,eliminacion_catalan,caracteres_problematicos: {'/'},b) Reclassificació de Sud-àfrica en el grup d'Estats membres indicat en l'apartat c) del paràgraf 3 ...,,,,,
91264934,eliminacion_catalan,caracteres_problematicos: {'“'},"“Per evitar la duplicació d'esforços, és essencial una clara divisió del treball entre l'UNITAR, la ...",,,,,
91324432,eliminacion_catalan,caracteres_problematicos: {'/'},: (212) 963-7181) i de la Dependència de Passes i Identificació (planta baixa de l'edifici de l'UNIT...,,,,,
91327604,eliminacion_catalan,caracteres_problematicos: {'·'},"A més, l'estratègia nacional assenyala diversos sectors vulnerables que requereixen un suport especí...",,,,,
91353670,eliminacion_catalan,caracteres_problematicos: {'+'},A Qatar hi ha 3 hores per davant de l'hora mitjana de Greenwich (GMT +03: 00).,,,,,
91366572,eliminacion_catalan,"caracteres_problematicos: {'“', '”'}",L'última reunió de facilitadors de la línia d'actuació relativa a la ciberciència es va consagrar al...,,,,,
91417988,eliminacion_catalan,caracteres_problematicos: {'/'},"En 2007, el Programa i la Comissió Nacional d'Activitats Espacials (CONAE) de l'Argentina van establ...",,,,,
91535431,eliminacion_catalan,"caracteres_problematicos: {'“', '”'}","En aquestes consultes, els membres del Consell es van ocupar de 24 temes del programa i van debatre,...",,,,,
91542250,eliminacion_catalan,caracteres_problematicos: {'/'},"La Quarta Comissió va examinar el tema en les seves sessions 18a a 20a, celebrades el 19 i el 20 de ...",,,,,
91605064,eliminacion_catalan,caracteres_problematicos: {'—'},A això jo agregaria també la importància de superar la mentalitat que considera la creença pròpia —j...,,,,,
91616877,eliminacion_catalan,"caracteres_problematicos: {'•', '“', '”'}",• Resolució 040-99 de la comissió nacional de valors “normes relatives a la transparència dels merca...,,,,,
91640828,eliminacion_catalan,caracteres_problematicos: {'%'},"D'acord amb una estimació del Banc Mundial, l'índex de pobresa arribaria al 31,8% a finals de desemb...",,,,,
91645858,eliminacion_catalan,caracteres_problematicos: {'·'},Crec que és apropiat haver començat aquest nou mil·lenni amb el compromís de buscar nous mitjans d'a...,,,,,
91652751,eliminacion_catalan,caracteres_problematicos: {'·'},"Es tracta d'un control eficaç, perquè totes les obligacions que ja no són vàlides es cancel·len imme...",,,,,
91690827,eliminacion_catalan,caracteres_problematicos: {'/'},d) Primer informe biennal del Director Executiu sobre l'aplicació dels resultats del vintè període e...,,,,,
91740734,eliminacion_catalan,caracteres_problematicos: {'•'},"• La Presidenta, el Vicepresident i els magistrats del Tribunal van participar en el seminari de mag...",,,,,
91791267,eliminacion_catalan,caracteres_problematicos: {'/'},El PNUD acull amb beneplàcit les conclusions de l'informe de l'equip d'Avaluació Independent sobre e...,,,,,
91994137,eliminacion_catalan,caracteres_problematicos: {'/'},Resolució 52/86 de l'Assemblea General.,,,,,
92013781,eliminacion_catalan,"caracteres_problematicos: {'“', '”'}",Procedirem ara a adoptar una decisió sobre el projecte de resolució titulat “Règim comú de les Nacio...,,,,,
92013905,eliminacion_catalan,caracteres_problematicos: {'/'},"De conformitat amb la decisió 1993/207 del Consell, la Comissió sobre el Desenvolupament Sostenible ...",,,,,
92058229,eliminacion_catalan,caracteres_problematicos: {'·'},"A més dels òrgans de les Nacions Unides (l'Assemblea General i el Consell de Seguretat, que estan fa...",,,,,
92059999,eliminacion_catalan,caracteres_problematicos: {'·'},El règim de la insolvència hauria d'establir requisits per a la notificació de les sol·licituds i el...,,,,,
92083543,eliminacion_catalan,caracteres_problematicos: {'·'},Quant a l'argument de l'autor que la sol·licitud d'asil de la Sra. es basava essencialment en la per...,,,,,
92086264,eliminacion_catalan,"caracteres_problematicos: {'“', '”'}","iii) En aquest context, Tailàndia ha formulat repetides protestes (el 10 d'abril de 2008, el 17 de m...",,,,,
92105242,eliminacion_catalan,"caracteres_problematicos: {']', '['}",Article [51 undecies]. Disposicions suplementàries relatives a la primera etapa d'un procés d'adjudi...,,,,,
