linea,tipo,razon,texto_original,porcentaje_automatico,detalles_base,detalles_avanzados,texto_catalan,texto_chino
86562400,eliminacion_catalan,caracteres_problematicos: {'·'},S'ha apreciat en gran manera l'excel·lent col·laboració facilitada per l'Administració de la ONUDI d...,,,,,
86568712,eliminacion_catalan,caracteres_problematicos: {'@'},Es prega a les delegacions que desitgin inscriure's en la llista que es comuniquin amb la secretaria...,,,,,
86572215,eliminacion_catalan,"caracteres_problematicos: {'–', '[', '/', ']'}",A/C.1/64/L.1/Rev.1 Tema 96 del programa – Desarmament general i complet – Canadà: projecte de resolu...,,,,,
86589084,eliminacion_catalan,caracteres_problematicos: {'·'},"Ha transcorregut gairebé un any des que Eritrea, en violació del dret internacional, va envair il·le...",,,,,
86663486,eliminacion_catalan,caracteres_problematicos: {'='},"No obstant això, l'eliminació és molt ràpida (CT50 = 2 dies), per la qual cosa se suposa que el risc...",,,,,
86663544,eliminacion_catalan,caracteres_problematicos: {'/'},Després d'assenyalar que el Consell/Fòrum examinaria el programa de treball i el pressupost del PNUM...,,,,,
86668461,eliminacion_catalan,caracteres_problematicos: {'='},"Usos analítics i de laboratori = 15,4 tones PAO.",,,,,
86671761,eliminacion_catalan,"caracteres_problematicos: {'[', ']'}",[Facilitador: Copresident del Grup d'Avaluació Tecnològica i Econòmica: Sr. Stephen Andersen],,,,,
86791331,eliminacion_catalan,caracteres_problematicos: {'·'},c) Consultes periòdiques amb la Dependència de Conducta i Disciplina del Departament de Suport a les...,,,,,
86821452,eliminacion_catalan,caracteres_problematicos: {'·'},"El Comitè sol·licita que continuï el programa, amb la necessària flexibilitat, si així ho justifique...",,,,,
86947938,eliminacion_catalan,caracteres_problematicos: {'·'},Servei internacional de sistemes mundials de navegació per satèl·lit,,,,,
86963859,eliminacion_catalan,caracteres_problematicos: {'·'},"Fins que aquesta zona s'estableixi, el Moviment exigeix que Israel s'adhereixi al TNP sense demores ...",,,,,
86976421,eliminacion_catalan,caracteres_problematicos: {'·'},"Nigèria, que forma part de la Convenció contra la Tortura i la Convenció sobre els Drets del Nen, té...",,,,,
87017801,eliminacion_catalan,caracteres_problematicos: {'·'},D. Disposició de la propietat intel·lectual gravada,,,,,
87028133,eliminacion_catalan,caracteres_problematicos: {'·'},L'Assemblea també va sol·licitar al Secretari General que presentés a la represa de la Conferència d...,,,,,
87221433,eliminacion_catalan,caracteres_problematicos: {'/'},"15. Recorda les seves decisions 2006/13 i 2008/13, i demana al UNFPA que en el futur complementi els...",,,,,
87257277,eliminacion_catalan,caracteres_problematicos: {'·'},El Comitè també observa amb preocupació la violència resultant del narcotràfic; el desplaçament inte...,,,,,
87334867,eliminacion_catalan,caracteres_problematicos: {'%'},"El Govern ha assignat uns 20.000 milions de dòlars, és a dir, el 14% del PIB, a l'execució del progr...",,,,,
87358835,eliminacion_catalan,"caracteres_problematicos: {'”', '“'}",Consultes oficioses sobre el projecte de resolució titulat “La globalització i les seves conseqüènci...,,,,,
87362083,eliminacion_catalan,caracteres_problematicos: {'/'},Esmena que figura en el document A/C.3/65/L.61,,,,,
87464413,eliminacion_catalan,caracteres_problematicos: {'·'},a) Tecnologies i instal·lacions connexes per a la destrucció de substàncies que esgoten l'ozó;,,,,,
87643578,eliminacion_catalan,caracteres_problematicos: {'/'},"Recordant les resolucions de l'Assemblea General 63/33, de 26 de novembre de 2008, 64/108, de 10 de ...",,,,,
87798917,eliminacion_catalan,caracteres_problematicos: {'/'},El demandant/comprador va encarregar bolets al demandat/venedor.,,,,,
87808822,eliminacion_catalan,caracteres_problematicos: {'·'},9. La font al·lega que els agents de policia de la comissaria d'Al-Agouza van maltractar el Sr. B de...,,,,,
88018833,eliminacion_catalan,caracteres_problematicos: {'·'},El PMA col·labora amb l'ACNUR en un programa de la iniciativa SAFE dirigit als desplaçats interns a ...,,,,,
88119853,eliminacion_catalan,caracteres_problematicos: {'·'},c) La capacitat financera i tècnica del sol·licitant per fer front a qualsevol incident o activitat ...,,,,,
88125997,eliminacion_catalan,"caracteres_problematicos: {'–', '[', '/', ']'}",A/C.5/66/5 Tema 115 c) del programa – Nomenaments per a omplir vacants en òrgans subsidiaris i altre...,,,,,
88130011,eliminacion_catalan,"caracteres_problematicos: {'–', '[', '/', ']'}","A/C.2/66/L.38/Rev.1 Tema 19 del programa – Desenvolupament sostenible – Austràlia, Cap Verd, Costa R...",,,,,
88180607,eliminacion_catalan,caracteres_problematicos: {'·'},En relació amb l'enviament del personal de policia idoni i especialitzat que es necessitava en les d...,,,,,
88267139,eliminacion_catalan,caracteres_problematicos: {'/'},Secretari/Empleat,,,,,
88272992,eliminacion_catalan,caracteres_problematicos: {'·'},Els tres Tècnics d'Enginyeria (Servei Mòbil) s'establiran en la Caserna General del Mecanisme; dos d...,,,,,
88277494,eliminacion_catalan,caracteres_problematicos: {'%'},"Per a 2030, s'hauran d'haver recuperat zones mortes oceàniques mitjançant la reducció dels vessament...",,,,,
88394689,eliminacion_catalan,"caracteres_problematicos: {'”', '“'}","b) Establir immediatament un registre central de totes les persones sota custòdia oficial, entre d'a...",,,,,
88443656,eliminacion_catalan,caracteres_problematicos: {'%'},"A causa de l'increment de l'adquisició de tecnologia, que ha registrat un augment del 43% durant els...",,,,,
88446021,eliminacion_catalan,caracteres_problematicos: {'·'},"Objectiu de l'Organització: Aconseguir un creixement dinàmic i un desenvolupament sostenible, incloe...",,,,,
88475774,eliminacion_catalan,"caracteres_problematicos: {'/', '·'}",Sol·licitud d'inclusió d'un tema addicional presentada pel Togo (A/66/232),,,,,
88509208,eliminacion_catalan,caracteres_problematicos: {'·'},Quant als drets processals dels estrangers que es troben il·legalment en el territori de l'Estat exp...,,,,,
88528397,eliminacion_catalan,caracteres_problematicos: {'/'},"Recordant les resolucions del Consell de Drets Humans 5/1, sobre la construcció institucional del Co...",,,,,
88609572,eliminacion_catalan,caracteres_problematicos: {'/'},"Tampoc es va acceptar, per considerar-ho irrellevant, el testimoniatge de la comptadora de RE/MAX, q...",,,,,
88618996,eliminacion_catalan,caracteres_problematicos: {'/'},"Reafirmant l'Estratègia Global de les Nacions Unides contra el Terrorisme, continguda en la seva res...",,,,,
88770484,eliminacion_catalan,caracteres_problematicos: {'/'},En aquesta activitat es van posar en relleu la importància de la Declaració de Viena sobre la delinq...,,,,,
88821360,eliminacion_catalan,"caracteres_problematicos: {'–', ']', '[', '—', '/'}",A/C.3/67/L.20 Tema 28 a) del programa –– Avançament de la dona –– Filipines: projecte de resolució —...,,,,,
88892721,eliminacion_catalan,caracteres_problematicos: {'/'},Es faciliten més detalls sobre aquest tema en el present informe (vegeu la secció III) i en la nota ...,,,,,
89041847,eliminacion_catalan,caracteres_problematicos: {'·'},"A més, la Secció va celebrar la seva primera reunió informativa, sota la direcció dels joves, titula...",,,,,
89062019,eliminacion_catalan,caracteres_problematicos: {'/'},"Proposta presentada per Cuba (A/60/37, annex III)",,,,,
89070887,eliminacion_catalan,"caracteres_problematicos: {'[', '·', ']'}",[D1]. No es facilita cap informació sobre els casos d'expulsió il·legal de sol·licitants d'asil afga...,,,,,
89087236,eliminacion_catalan,caracteres_problematicos: {'·'},"No obstant això, l'Estat parteix comprova amb sorpresa que l'autora va formular aquesta al·legació d...",,,,,
89120945,eliminacion_catalan,caracteres_problematicos: {'/'},Augment del nombre de departaments amb plans de resposta a les emergències i de reducció del risc de...,,,,,
89222017,eliminacion_catalan,"caracteres_problematicos: {'[', '*', ']', '#'}","Per a l'explicació dels termes "" examen "", "" avaluació "" i "" subhasta electrònica inversa com a mèto...",,,,,
89370088,eliminacion_catalan,caracteres_problematicos: {'·'},L'Oficina de Drets Humans va convocar en 2007 una licitació pública per a projectes d'associacions d...,,,,,
89423628,eliminacion_catalan,caracteres_problematicos: {'·'},"A Sierra Leone, el Govern ha iniciat oficialment l'estratègia de desenvolupament econòmic local intr...",,,,,
89460481,eliminacion_catalan,caracteres_problematicos: {'·'},Entre els exemples interessants d'iniciatives comunitàries cal esmentar l'ús de les observacions i e...,,,,,
89463900,eliminacion_catalan,caracteres_problematicos: {'·'},"L'associació, en col·laboració amb la International Union of Psychological Science, participa activa...",,,,,
89552969,eliminacion_catalan,"caracteres_problematicos: {'[', ']'}","Organització dels treballs, aprovació del programa i assignació de temas1 [tema 7]",,,,,
89554223,eliminacion_catalan,"caracteres_problematicos: {'[', ']'}",10.00 a 13.00 hores Desena sessió [pic] [webcast] Saló del Consell d'Administració Fiduciària,,,,,
89561252,eliminacion_catalan,"caracteres_problematicos: {'[', '/', ']'}",Examen de l'eficiència del funcionament administratiu i financer de les Nacions Unides: informe de l...,,,,,
89575469,eliminacion_catalan,caracteres_problematicos: {'·'},"28. Insta a tots els Estats, organismes competents de les Nacions Unides i altres organitzacions i p...",,,,,
89619747,eliminacion_catalan,caracteres_problematicos: {'·'},15. Insta les autoritats congoleses que assegurin que les eleccions provincials i locals se celebrin...,,,,,
89621978,eliminacion_catalan,caracteres_problematicos: {'·'},El Secretari General va informar la Reunió que l'Autoritat prosseguia els seus esforços encaminats a...,,,,,
89632365,eliminacion_catalan,"caracteres_problematicos: {'%', '·'}",Xina compta amb la major capacitat instal·lada acumulada de turbines eòliques a nivell mundial (el 2...,,,,,
89643544,eliminacion_catalan,caracteres_problematicos: {'/'},L'addició inclou un apèndix en el qual figura l'informe del PNUMA sobre l'aplicació de la resolució ...,,,,,
89655859,eliminacion_catalan,"caracteres_problematicos: {'”', '“'}","L'Institut Promundo va dur a terme al Brasil, Xile, l'Índia i Rwanda el programa “Participació dels ...",,,,,
89678310,eliminacion_catalan,caracteres_problematicos: {'/'},"En el seu informe sinòptic, el Secretari General descriu les mesures adoptades per a vetllar perquè ...",,,,,
89720146,eliminacion_catalan,caracteres_problematicos: {'/'},"En 2011, de conformitat amb la resolució 66/24 de l'Assemblea General, es va establir un grup d'expe...",,,,,
89750614,eliminacion_catalan,caracteres_problematicos: {'/'},"a) La decisió de l'Assemblea General, en el paràgraf 6 de la secció II de la seva resolució 65/250, ...",,,,,
89814787,eliminacion_catalan,caracteres_problematicos: {'/'},37. Les observacions finals sobre l'informe de l'Argentina (CED/C/ARG/CO/1) poden consultar-se en: h...,,,,,
89835185,eliminacion_catalan,"caracteres_problematicos: {'[', ']'}",El ràpid creixement demogràfic registrat al segle XX va donar lloc a la gran difusió d'inquietuds su...,,,,,
89916874,eliminacion_catalan,caracteres_problematicos: {'·'},Aquests procediments només determinen la forma en què les conferències dels Estats Parts adopten les...,,,,,
90025470,eliminacion_catalan,caracteres_problematicos: {'/'},"En el seu document de treball titulat "" Article VI del Tractat sobre la No Proliferació de les Armes...",,,,,
90061426,eliminacion_catalan,caracteres_problematicos: {'%'},La immensa majoria de les beques van destinades a cursos de diplomat i representen el 89% del total ...,,,,,
90135585,eliminacion_catalan,caracteres_problematicos: {'/'},"Després d'un breu procés de consultes oficioses, l'Assemblea va aprovar els Principis Fonamentals de...",,,,,
90154464,eliminacion_catalan,caracteres_problematicos: {'%'},"El consum de cànnabis durant l'any anterior es va estimar en un 1,2% i el consum de cocaïna durant l...",,,,,
90169184,eliminacion_catalan,caracteres_problematicos: {'%'},Educació: 630 milions de lliures (11% de l'AOD bilateral);,,,,,
90202421,eliminacion_catalan,caracteres_problematicos: {'·'},Es va enviar una carta al novembre de 2013 per a sol·licitar aquesta informació. Encara que es va ac...,,,,,
90270373,eliminacion_catalan,caracteres_problematicos: {'·'},La Cimera també va donar suport a la creació d'un Centre Àfrica-Estats Àrabs per a l'intercanvi d'in...,,,,,
90299784,eliminacion_catalan,caracteres_problematicos: {'·'},Altres dues Parts que no operen a l'empara del paràgraf 1 de l'article 5 del Protocol (Parts que no ...,,,,,
90375324,eliminacion_catalan,caracteres_problematicos: {'/'},Caldria realitzar les següents modificacions en el programa de treball proposat per al bienni 2006-2...,,,,,
90376518,eliminacion_catalan,"caracteres_problematicos: {'/', '°'}",Prestació de serveis substantius a reunions: reunions preparatòries del Comitè de Representants Perm...,,,,,
90377055,eliminacion_catalan,caracteres_problematicos: {'/'},"Ibíd., tercer període de sessions, la Haia, 6 a 10 de setembre de 2004 (ICC-ASP/3/25) part II, resol...",,,,,
90383826,eliminacion_catalan,"caracteres_problematicos: {'”', '“'}",Decideix incloure en el programa provisional del seu seixantè primer període de sessions el tema tit...,,,,,
90420252,eliminacion_catalan,caracteres_problematicos: {'·'},"L'apropiació de terres i la discriminació institucional, inclosa la prohibició a àrabs sirians de pe...",,,,,
90432456,eliminacion_catalan,caracteres_problematicos: {'/'},"En el seu segon període ordinari de sessions, la junta Executiva va aprovar un augment del límit màx...",,,,,
90433186,eliminacion_catalan,"caracteres_problematicos: {'”', '“'}","A part d'exercir les funcions que se li van assignar quan va ser creat, el Consell ha preparat un es...",,,,,
90452075,eliminacion_catalan,caracteres_problematicos: {'·'},La Comissió de Consolidació de la Pau que està examinant l'Assemblea General constitueix una excel·l...,,,,,
90493383,eliminacion_catalan,caracteres_problematicos: {'/'},"Recordant a més la seva resolució 59/238, de 22 de desembre de 2004, sobre l'assistència als països ...",,,,,
90529884,eliminacion_catalan,caracteres_problematicos: {'/'},"En la 56a sessió, el representant de Finlàndia va presentar el projecte de resolució E/CN.4/2005/L.3...",,,,,
90544571,eliminacion_catalan,caracteres_problematicos: {'—'},"Tenint present aquesta varietat de crims i delictes, el Relator coincideix amb les nombroses propost...",,,,,
90547991,eliminacion_catalan,caracteres_problematicos: {'/'},"Documents oficials de l'Assemblea General, seixantè segon període de sessions, suplement núm. 25 (A/...",,,,,
90560614,eliminacion_catalan,caracteres_problematicos: {'/'},Reafirma la seva resolució 1514 (XV) i totes les altres resolucions i decisions sobre descolonitzaci...,,,,,
90601801,eliminacion_catalan,"caracteres_problematicos: {'”', '·', '“'}",26.54 El subprograma serà executat per la Subdivisió de Promoció i Gestió de la Informació de Nova Y...,,,,,
90614974,eliminacion_catalan,caracteres_problematicos: {'·'},Tenint en compte que els països en desenvolupament es presten cada vegada més assistència entre si m...,,,,,
90657785,eliminacion_catalan,"caracteres_problematicos: {'”', '“'}",Aquesta proposta està basada en el text de l'apartat e) de l'article 14 de les RUU 600 (Regles i Uso...,,,,,
90664021,eliminacion_catalan,caracteres_problematicos: {'*'},** En nom dels Estats Membres de les Nacions Unides que integren la Unió Europea.,,,,,
90704573,eliminacion_catalan,caracteres_problematicos: {'—'},"Al mateix temps, reconec que la creació de dos llocs de Secretari General Adjunt —quan en l'actualit...",,,,,
90708962,eliminacion_catalan,caracteres_problematicos: {'·'},"Per a la determinació del període de responsabilitat, i sense perjudici del que disposa el paràgraf ...",,,,,
90754591,eliminacion_catalan,caracteres_problematicos: {'·'},"El Sr. Khan (Pakistan), parlant en nom de Grup dels 77 i la Xina, diu que, si bé l'alleujament del d...",,,,,
90832307,eliminacion_catalan,"caracteres_problematicos: {'/', '*'}","* De conformitat amb el paràgraf 8 de la resolució 53/208 B de l'Assemblea General, s'assenyala que ...",,,,,
90845591,eliminacion_catalan,"caracteres_problematicos: {'”', '“'}",Els resultats d'aquests cursets regionals van ser declaracions i plans d'acció regionals dedicats re...,,,,,
90894872,eliminacion_catalan,caracteres_problematicos: {'/'},b) En relació amb l'existència de normes de dret intern o internacional aplicables al pas d'objectes...,,,,,
90923318,eliminacion_catalan,caracteres_problematicos: {'—'},"Tercer, algunes d'aquestes qüestions —per exemple, la relativa a l'OIEA— no figuren en el programa d...",,,,,
90938726,eliminacion_catalan,"caracteres_problematicos: {'—', '·'}","En el cas del delicte de finançament al terrorisme, segons s'ha explicat en informes anteriors, de c...",,,,,
90941228,eliminacion_catalan,"caracteres_problematicos: {'”', '“'}",Modifiqui's l'objectiu perquè digui: “Facilitar la formulació de polítiques en les qüestions de fisc...,,,,,
91001052,eliminacion_catalan,"caracteres_problematicos: {'”', '“'}",El projecte de resolució es titula “Informe de la Dependència Comuna d'Inspecció sobre despeses de s...,,,,,
91068801,eliminacion_catalan,caracteres_problematicos: {'”'},b) Negocis i desenvolupament”,,,,,
91087941,eliminacion_catalan,caracteres_problematicos: {'%'},Les condicions del bescanvi per eurobons s'aproximen al descompte del 35% que era la norma en el Pla...,,,,,
91135639,eliminacion_catalan,"caracteres_problematicos: {'·', ']', '<', '[', '/'}",La CP/RP adoptarà una decisió definitiva a tot tardar [x] [mesos] [períodes de sessions] després de ...,,,,,
91142546,eliminacion_catalan,caracteres_problematicos: {'”'},"Els organismes de socors humanitari i la societat civil, incloses les organitzacions no governamenta...",,,,,
91168966,eliminacion_catalan,"caracteres_problematicos: {'”', '“'}","El Sr. Le Bret (França), parlant en nom dels patrocinadors originals, així com d'Austràlia, Xipre, E...",,,,,
91239828,eliminacion_catalan,caracteres_problematicos: {'·'},La pesca furtiva i la pesca il·legal per part de vaixells estrangers s'ha tornat rampant i amenaça l...,,,,,
91267791,eliminacion_catalan,caracteres_problematicos: {'/'},"En la seva novena sessió, celebrada el 18 de novembre, després d'examinar una proposta del President...",,,,,
91276860,eliminacion_catalan,"caracteres_problematicos: {'/', '—'}","Principalment gràcies a les bones condicions climàtiques, es preveu que en la temporada de 1999/2000...",,,,,
91291358,eliminacion_catalan,caracteres_problematicos: {'/'},"De conformitat amb les peticions de la Comissió, el Secretari General va assenyalar la resolució 200...",,,,,
91293828,eliminacion_catalan,caracteres_problematicos: {'·'},Instem que es dissenyin polítiques de promoció de les inversions que estiguin d'acord amb les priori...,,,,,
91296886,eliminacion_catalan,caracteres_problematicos: {'/'},"En la seva primera sessió, celebrada el 29 de març, el GTE-CLP va examinar una nota del Secretari Ex...",,,,,
91308066,eliminacion_catalan,caracteres_problematicos: {'·'},"""Només hi ha despeses, sense beneficis: de quina manera les normes de la propietat intel·lectual més...",,,,,
91316288,eliminacion_catalan,caracteres_problematicos: {'·'},Insta als Estats Part en la Convenció de les Nacions Unides contra el Tràfic Il·lícit d'Estupefaents...,,,,,
91333178,eliminacion_catalan,"caracteres_problematicos: {'”', '“'}","A l'efecte del Reglament, per “persona o entitat designada” s'entén una persona o entitat designada ...",,,,,
91354443,eliminacion_catalan,caracteres_problematicos: {'/'},"Decisió 15/CP.1, annex I.",,,,,
91422966,eliminacion_catalan,caracteres_problematicos: {'*'},"Belarús*, Cuba, Federació de Rússia, Sèrbia*, Uzbekistan*: projecte de resolució",,,,,
91495349,eliminacion_catalan,caracteres_problematicos: {'·'},Reitera la seva condemna de l'atac realitzat el 27 de març de 2001 contra les instal·lacions de Metg...,,,,,
91602103,eliminacion_catalan,caracteres_problematicos: {'/'},Informe del Secretari General sobre un nou projecte de pla de mitjà termini a nivell de tot el siste...,,,,,
91607635,eliminacion_catalan,"caracteres_problematicos: {'”', '“'}","També en commemoració del Dia Internacional, el dijous 6 de desembre de 2001, de les 13.15 a les 14....",,,,,
91657623,eliminacion_catalan,caracteres_problematicos: {'/'},"Proposta de Finlàndia (E/CN.15/2001/L.7, annex, par.",,,,,
91658760,eliminacion_catalan,caracteres_problematicos: {'·'},Instem les parts a aprofitar al màxim el potencial d'aquesta visita per a aconseguir avanços concret...,,,,,
91726267,eliminacion_catalan,caracteres_problematicos: {'%'},"A la fi de 2000 entre els pares desocupats que crien fills menors d'edat o fills invàlids, les dones...",,,,,
91748850,eliminacion_catalan,caracteres_problematicos: {'/'},Informe de la Comissió de Dret Internacional sobre la labor realitzada en el seu 51o període de sess...,,,,,
91778832,eliminacion_catalan,caracteres_problematicos: {'·'},"També voldria felicitar el seu predecessor, l'Ambaixador Reis de Colòmbia, i expressar l'agraïment d...",,,,,
91792986,eliminacion_catalan,caracteres_problematicos: {'*'},26.2 *Tubs vorticials,,,,,
91802371,eliminacion_catalan,caracteres_problematicos: {'°'},a) Informe del Comitè del Programa i de la Coordinació sobre el seu 41° període de sessions;,,,,,
91805253,eliminacion_catalan,caracteres_problematicos: {'•'},"• Quina opinió li mereix a l'organització la definició recollida a Viena, i en el Pacte de Drets Pol...",,,,,
91863175,eliminacion_catalan,caracteres_problematicos: {'/'},"27 Programa Conjunt de les Nacions Unides sobre el VIH/SIDA, Report on the global HIV/AIDS epidemic ...",,,,,
91878986,eliminacion_catalan,caracteres_problematicos: {'/'},"Comentaris d'Héctor Faúndez, Wenche Barth Eide, Uwe Kracht, Asbjørn Eide, Gerald Moore, Margret Vida...",,,,,
91915694,eliminacion_catalan,caracteres_problematicos: {'%'},"La gran majoria de les inversions en construcció són públiques, a causa de l'execució del programa d...",,,,,
91920184,eliminacion_catalan,caracteres_problematicos: {'%'},Pren nota de l'estat de les contribucions per a la Missió de les Nacions Unides per al Referèndum de...,,,,,
91936609,eliminacion_catalan,"caracteres_problematicos: {'”', '“'}","Es va opinar que s'hauria d'incorporar, en relació amb el tema 6 del programa, un nou subtema titula...",,,,,
91958783,eliminacion_catalan,"caracteres_problematicos: {'”', '“'}",Els “Esforços per a desenvolupar un model de servei de salut reproductiva i sexual per a estudiants ...,,,,,
91989343,eliminacion_catalan,"caracteres_problematicos: {'”', '[', ']'}","Segons el Grup d'Avaluació Tecnològica i Econòmica, ""les mesures al final de la vida útil [en tots e...",,,,,
91995273,eliminacion_catalan,caracteres_problematicos: {'·'},Les activitats i els recursos addicionals permetrien a) millorar l'anàlisi de gènere en el resum est...,,,,,
92023959,eliminacion_catalan,caracteres_problematicos: {'`'},Les següents organitzacions intergovernamentals van estar representades per observadors: Acord de Wa...,,,,,
92030207,eliminacion_catalan,caracteres_problematicos: {'·'},"p) Consultar amb els serveis d'intel·ligència i seguretat dels Estats membres, fins i tot per mitjà ...",,,,,
92034355,eliminacion_catalan,caracteres_problematicos: {'/'},"Considerant aquesta experiència, la Secretaria va proposar un pla de treball d'assistència tècnica p...",,,,,
92059811,eliminacion_catalan,caracteres_problematicos: {'·'},Es van realitzar les següents activitats de desenvolupament del projecte d'adquisició d'un satèl·lit...,,,,,
92064175,eliminacion_catalan,caracteres_problematicos: {'·'},S'han de desplegar esforços per a assegurar que els drets de propietat intel·lectual contribueixin a...,,,,,
92073869,eliminacion_catalan,"caracteres_problematicos: {'”', '“'}","Segons el Tribunal de Cassació de França, “... el costum internacional que s'oposa a l'enjudiciament...",,,,,
92106013,eliminacion_catalan,"caracteres_problematicos: {'”', '·', '“'}","La Conferència d'aquest any, el tema de la qual és “La reafirmació dels drets humans per a tothom: l...",,,,,
92106948,eliminacion_catalan,caracteres_problematicos: {'”'},d) Avaluació dels efectes per mitjà del seguiment i els indicadors.”.,,,,,
92142212,eliminacion_catalan,"caracteres_problematicos: {'”', '“'}",La decisió derivava d'un acord anterior sobre l'enfocament conegut com “Modern House of Tokelau” (ve...,,,,,
92241325,eliminacion_catalan,"caracteres_problematicos: {'”', '“'}",“La responsabilitat dels Estats ha d'avaluar-se en cada cas únicament sobre la base dels fets que co...,,,,,
92282854,eliminacion_catalan,"caracteres_problematicos: {'”', '“'}",El Ministeri de l'Interior d'un país ha iniciat un “diàleg de seguretat” entre les comunitats religi...,,,,,
92297359,eliminacion_catalan,caracteres_problematicos: {'“'},"No obstant això, amb anterioritat, en la seva declaració davant l'Assemblea General del 20 de setemb...",,,,,
92301905,eliminacion_catalan,"caracteres_problematicos: {'”', '“'}","Quant al projecte de principi 7, a l'expressió “determinades categories d'activitats perilloses” hau...",,,,,
