linea,tipo,razon,texto_original,porcentaje_automatico,detalles_base,detalles_avanzados,texto_catalan,texto_chino
86752235,eliminacion_catalan,caracteres_problematicos: {'/'},b) Informe del Secretari General sobre les despeses ocasionades i els reemborsaments rebuts per les ...,,,,,
86890040,eliminacion_catalan,caracteres_problematicos: {'/'},2009/29 Funció del Consell Econòmic i Social en l'aplicació i el seguiment integrats i coordinats de...,,,,,
86946280,eliminacion_catalan,caracteres_problematicos: {'·'},Va assenyalar també que l'interès pels asteroides es devia en gran manera al seu valor científic com...,,,,,
86957063,eliminacion_catalan,caracteres_problematicos: {'/'},"29. En concloure l'examen d'aquest subtema, es va aprovar el projecte de decisió sobre els pressupos...",,,,,
86973026,eliminacion_catalan,caracteres_problematicos: {'·'},"Les oportunitats perdudes en l'actualitat en aquesta esfera són sorprenents, ja que s'estima que un ...",,,,,
87004012,eliminacion_catalan,caracteres_problematicos: {'·'},Els Estats necessitarien una orientació per a saber com s'aplicarien les recomanacions de la Guia Le...,,,,,
87087791,eliminacion_catalan,caracteres_problematicos: {'/'},"30. En les seves observacions finals sobre l'informe de Colòmbia (I/C.12/COL/CO/5), el Comitè de Dre...",,,,,
87095964,eliminacion_catalan,caracteres_problematicos: {'·'},142. El 12 d'agost de 2008 Geòrgia va elevar una sol·licitud interestatal a la Cort Internacional de...,,,,,
87206828,eliminacion_catalan,caracteres_problematicos: {'·'},c) Col·labori amb les comunitats per fomentar la matriculació dels nens a les escoles de composició ...,,,,,
87231399,eliminacion_catalan,caracteres_problematicos: {'%'},III. Tendències i evolució econòmiques La taxa de creixement del PIB real a la regió de la CESPAO va...,,,,,
87242458,eliminacion_catalan,caracteres_problematicos: {'·'},Amb la finalitat d'avançar cap a l'assoliment dels Objectius de Desenvolupament del Mil·lenni relati...,,,,,
87253380,eliminacion_catalan,caracteres_problematicos: {'/'},Aquest va ser també el primer any complet d'aplicació de l'enfocament experimental de l'Oficina del ...,,,,,
87304461,eliminacion_catalan,"caracteres_problematicos: {'”', '“'}",C. L'informe Stiglitz i les iniciatives “més enllà del PIB”,,,,,
87314987,eliminacion_catalan,caracteres_problematicos: {'·'},E. Contribucions de la Comissió a l'examen del progrés aconseguit en la consecució dels Objectius de...,,,,,
87416181,eliminacion_catalan,caracteres_problematicos: {'·'},"El 6 d'octubre, en una altra iniciativa en pro de la reconciliació política al Sudan Meridional, el ...",,,,,
87447588,eliminacion_catalan,caracteres_problematicos: {'*'},Informes financers enviats als donants** 462 458,,,,,
87489633,eliminacion_catalan,"caracteres_problematicos: {'·', '/'}",El present informe respon a la sol·licitud que es presenti un informe sobre l'enfortiment de la capa...,,,,,
87499084,eliminacion_catalan,"caracteres_problematicos: {'%', '/'}",Aquesta reducció de les necessitats es contraresta en part amb l'aplicació d'una taxa de vacants del...,,,,,
87582204,eliminacion_catalan,caracteres_problematicos: {'/'},"De conformitat amb el document CD/1907, el tema 6 de l'agenda es va examinar en una sessió plenària ...",,,,,
87603239,eliminacion_catalan,caracteres_problematicos: {'·'},"En 2012 cal esperar que la UNAMI proporcioni suport tècnic i assessorament especialitzat, particular...",,,,,
87615258,eliminacion_catalan,caracteres_problematicos: {'·'},"L'autor afegeix que, com demostra el quadre persistent d'abusos en el sistema d'inscripció uzbek, és...",,,,,
87645033,eliminacion_catalan,caracteres_problematicos: {'/'},"L'Assemblea General, en la seva resolució 65/281, va demanar al Secretari General que presentés opci...",,,,,
87648706,eliminacion_catalan,caracteres_problematicos: {'·'},També es dóna lloc a unes necessitats addicionals de 575.500 dòlars en relació amb el seguiment de l...,,,,,
87653417,eliminacion_catalan,caracteres_problematicos: {'·'},Es va sol·licitar al Govern de l'Afganistan que distribuís al gener de 2012 un document conceptual e...,,,,,
87683164,eliminacion_catalan,caracteres_problematicos: {'/'},"3.1.1 Desarmament, desmobilització i prestació de suport de transició a 4.500 excombatents i membres...",,,,,
87739466,eliminacion_catalan,"caracteres_problematicos: {'·', '%'}","Segons l'informe econòmic anual del Territori, el 2009 es va produir una disminució de la construcci...",,,,,
87797726,eliminacion_catalan,caracteres_problematicos: {'·'},El Grup de Treball va sol·licitar també a la Secretaria que proporcionés informació sobre el cost d'...,,,,,
87842123,eliminacion_catalan,caracteres_problematicos: {'·'},23. Respecte a la invitació permanent als procediments especials del Consell de Drets Humans i la so...,,,,,
88087620,eliminacion_catalan,caracteres_problematicos: {'+'},"17. La ONUDI, juntament amb els seus associats en ONU-Energia i altres importants parts interessades...",,,,,
88109327,eliminacion_catalan,caracteres_problematicos: {'/'},Sobre la base de les recomanacions formulades en el CRIC 9 i dels intercanvis entre la secretaria de...,,,,,
88119072,eliminacion_catalan,caracteres_problematicos: {'·'},c) Assegura que les instal·lacions s'erigiran de manera que no causin interferència en la utilitzaci...,,,,,
88125240,eliminacion_catalan,caracteres_problematicos: {'/'},"Decisió: Per 15 vots contra cap i cap abstenció, queda aprovat per unanimitat el projecte de resoluc...",,,,,
88184874,eliminacion_catalan,"caracteres_problematicos: {'/', '°'}",A la vista de la gravetat de la situació a Líbia i de conformitat amb la Decisió d'Execució 2011/300...,,,,,
88225139,eliminacion_catalan,caracteres_problematicos: {'%'},"Escala amb un límit màxim de 22% i mínim de 0,010%",,,,,
88278534,eliminacion_catalan,caracteres_problematicos: {'·'},La Divisió de Recerques també continua col·laborant més estretament amb la Divisió d'Auditoria Inter...,,,,,
88304178,eliminacion_catalan,caracteres_problematicos: {'/'},Document: Nota del Secretari General per la qual es transmet l'informe del Secretari Executiu de la ...,,,,,
88417910,eliminacion_catalan,caracteres_problematicos: {'/'},2.2.3 Major nombre de participants en el Centre Regional de Capacitació i Conferències (2010/11: 2.0...,,,,,
88439073,eliminacion_catalan,caracteres_problematicos: {'/'},El Secretari General va presentar el seu informe anual al Comitè Especial d'Operacions de Mantenimen...,,,,,
88449474,eliminacion_catalan,caracteres_problematicos: {'·'},La contribució de la CESPAO va incloure experiències i informació regionals sobre prioritats econòmi...,,,,,
88497734,eliminacion_catalan,caracteres_problematicos: {'%'},"4. El OOPS va haver de proporcionar assistència humanitària especial a la Ribera Occidental i Gaza, ...",,,,,
88564129,eliminacion_catalan,caracteres_problematicos: {'·'},109.18 Acceptar la sol·licitud pendent i facilitar la visita del Relator Especial de les Nacions Uni...,,,,,
88654858,eliminacion_catalan,caracteres_problematicos: {'/'},"i) La posada en marxa de campanyes de sensibilització en gran escala per a la població en general, p...",,,,,
88685523,eliminacion_catalan,caracteres_problematicos: {'/'},320. La situació del VIH/SIDA en els nens està controlada en la RAE de Hong Kong.,,,,,
88717416,eliminacion_catalan,caracteres_problematicos: {'·'},32. Es va fer referència al major ús indegut de substàncies no sotmeses a fiscalització internaciona...,,,,,
88750666,eliminacion_catalan,caracteres_problematicos: {'·'},22. La creació de capacitat en les organitzacions sovint comença amb la resposta a les necessitats i...,,,,,
88780854,eliminacion_catalan,caracteres_problematicos: {'/'},"26. En la seva vuitena sessió, el 10 de desembre, el GTE-PK va tenir davant seu els documents FCCC/K...",,,,,
88822308,eliminacion_catalan,"caracteres_problematicos: {'[', '/', ']'}",Desenvolupament sostenible (A/67/341) [tema 20],,,,,
88933569,eliminacion_catalan,caracteres_problematicos: {'·'},El principal fruit de la conferència va ser la decisió d'iniciar un procés consultiu sobre un mecani...,,,,,
88961481,eliminacion_catalan,caracteres_problematicos: {'·'},La Comissió sol·licita a més que en les futures propostes pressupostàries per a les operacions de ma...,,,,,
88964353,eliminacion_catalan,caracteres_problematicos: {'·'},"Tots els productes de fotografia, vídeo, ràdio i publicacions es col·loquen al lloc web oficial de l...",,,,,
88974170,eliminacion_catalan,caracteres_problematicos: {'/'},En el seu informe sobre les operacions de les Nacions Unides per al manteniment de la pau el Secreta...,,,,,
88983064,eliminacion_catalan,caracteres_problematicos: {'”'},Això no només constitueix una violació de la sobirania i de la integritat territorial d'un Estat Mem...,,,,,
88993134,eliminacion_catalan,"caracteres_problematicos: {'/', '°'}","En el seu 21° període de sessions, el Consell de Drets Humans va prendre nota de l'informe del Grup ...",,,,,
89086443,eliminacion_catalan,"caracteres_problematicos: {'·', '/'}",1.2 Conformement al que es preveu en l'article 114 (antic article 108) del seu reglament (CAT/C/3/Re...,,,,,
89144500,eliminacion_catalan,caracteres_problematicos: {'·'},"El projecte serà executat per la CEPE, en col·laboració amb l'Oficina Regional per a Europa de l'OMS...",,,,,
89237692,eliminacion_catalan,caracteres_problematicos: {'/'},1. Es presenta aquest informe al Consell de Drets Humans en compliment de la seva resolució 19/19.,,,,,
89299079,eliminacion_catalan,caracteres_problematicos: {'·'},"La cooperació amb la societat civil, inclosa la col·laboració amb les ONG romanís, és una part impor...",,,,,
89330744,eliminacion_catalan,caracteres_problematicos: {'·'},2.5 Els autors de la queixa al·leguen que les autoritats d'asil suïsses no van considerar els seus t...,,,,,
89400341,eliminacion_catalan,caracteres_problematicos: {'·'},Al Comitè també el preocupa en gran manera l'ús de cel·les d'aïllament (kartcers) com a càstig a les...,,,,,
89483746,eliminacion_catalan,caracteres_problematicos: {'%'},"El 2012, 73,8 milions de joves (12,6%) seguien aturats.",,,,,
89591542,eliminacion_catalan,caracteres_problematicos: {'·'},Destacant la importància que es continuï procurant que la col·laboració entre els components militar...,,,,,
89707517,eliminacion_catalan,caracteres_problematicos: {'·'},"El Centre va treballar en estreta col·laboració amb organismes de les Nacions Unides, la Unió Africa...",,,,,
89751458,eliminacion_catalan,caracteres_problematicos: {'·'},"Al gener de 2013 es va anul·lar el passaport del dirigent gai bielorús Siarhiej Androsienka, la qual...",,,,,
89760209,eliminacion_catalan,caracteres_problematicos: {'/'},Font: Entitats de les Nacions Unides i dades de la JJE (vegeu CEB/2004/HLCM/27).,,,,,
89828220,eliminacion_catalan,caracteres_problematicos: {'/'},En el present informe s'avalua l'execució real comparant-la amb els marcs de pressupost basat en els...,,,,,
89856754,eliminacion_catalan,"caracteres_problematicos: {'%', '/'}","3,5/5,5/3,0 i un augment dels afiliats del 0,5% en 10 anys",,,,,
89881152,eliminacion_catalan,caracteres_problematicos: {'/'},Es procedeix a votació registrada sobre el projecte de resolució A/C.3/68/L.57.,,,,,
89892675,eliminacion_catalan,caracteres_problematicos: {'/'},"Tema 61 del programa: Informe de l'Alt Comissionat de les Nacions Unides per als Refugiats, qüestion...",,,,,
89925117,eliminacion_catalan,caracteres_problematicos: {'·'},Una societat russa va sol·licitar al tribunal judicial l'anul·lació d'un laude dictat pel Tribunal d...,,,,,
89957292,eliminacion_catalan,caracteres_problematicos: {'·'},"26. Finalment, Vanuatu havia creat en 2011 la Divisió de Tractats i Convencions en el Departament de...",,,,,
90013146,eliminacion_catalan,caracteres_problematicos: {'/'},"Com a punt de partida, el Grup de Treball tal vegada desitgi prendre nota de la resolució 5/4, en qu...",,,,,
90127379,eliminacion_catalan,caracteres_problematicos: {'%'},"La Fundació va contribuir a reduir la taxa de mortalitat, de 4,7% el 2009, a 4,5% el 2013; va propor...",,,,,
90147399,eliminacion_catalan,caracteres_problematicos: {'·'},"L'1 de juny, els participants van assistir a set grups de treball paral·lels diferents.",,,,,
90169869,eliminacion_catalan,caracteres_problematicos: {'·'},L'última instància d'apel·lació és el Comitè Judicial del Consell Privat de Londres.,,,,,
90188975,eliminacion_catalan,"caracteres_problematicos: {'[', '/', ']'}",3. Qüestions relatives a la informació (A/69/21 i A/69/310) [tema 54],,,,,
90194891,eliminacion_catalan,"caracteres_problematicos: {'[', '/', ']', '–'}",E/C.2/2015/2/Add.10 Informes quadriennals sobre el període 2010-2013 presentats per conducte del Sec...,,,,,
90357554,eliminacion_catalan,caracteres_problematicos: {'/'},"En la mateixa sessió, el representant del Canadà va presentar el projecte de resolució E/CN.4/2005/L...",,,,,
90380834,eliminacion_catalan,caracteres_problematicos: {'/'},Recordant l'opinió consultiva emesa per la Cort Internacional de Justícia el 9 de juliol de 2004 i l...,,,,,
90383655,eliminacion_catalan,caracteres_problematicos: {'/'},La ONUDD també va fer aportacions a la conceptualització i preparació de l'informe del Secretari Gen...,,,,,
90405230,eliminacion_catalan,"caracteres_problematicos: {'”', '“'}","“Els Estats membres podrien considerar la creació de comitès d'ètica independents, multidisciplinari...",,,,,
90406882,eliminacion_catalan,caracteres_problematicos: {'·'},És hora de tancar la clau al subministrament irresponsable d'armes i buidar l'arsenal d'armes il·líc...,,,,,
90454735,eliminacion_catalan,"caracteres_problematicos: {'[', '/', ']'}","[El programa de treball se centrarà en els aspectes científics, tècnics i socioeconòmics dels efecte...",,,,,
90466896,eliminacion_catalan,caracteres_problematicos: {'°'},"En conseqüència, resulta adequat que el primer dia de Grècia com a membre del Consell de Seguretat, ...",,,,,
90491477,eliminacion_catalan,caracteres_problematicos: {'—'},"En tot l'Afganistan, el Programa per a un nou Afganistan —el procés de desarmament, desmobilització ...",,,,,
90511853,eliminacion_catalan,"caracteres_problematicos: {'/', '”', '“'}","En la 42a sessió, celebrada el 17 de novembre, el representant de Jamaica, en nom dels Estats membre...",,,,,
90519421,eliminacion_catalan,"caracteres_problematicos: {'”', '“'}",El terme “validesa” podria fer que es prejutgessin les conseqüències jurídiques d'una reserva que in...,,,,,
90535995,eliminacion_catalan,caracteres_problematicos: {'/'},Decisió 15/COP.7,,,,,
90546328,eliminacion_catalan,caracteres_problematicos: {'•'},"• Sra. Evelyne Wayne, Subdirectora de Programes, Política Macroeconòmica i Comercial, CARICOM;",,,,,
90547302,eliminacion_catalan,caracteres_problematicos: {'—'},Volem avalar una fórmula que tingui en compte l'aspiració legítima i justificada del Grup d'Estats d...,,,,,
90610643,eliminacion_catalan,caracteres_problematicos: {'·'},Il·lustració 8-8: L'estafador promociona un programa d'inversions d'alt rendiment davant la possible...,,,,,
90668069,eliminacion_catalan,caracteres_problematicos: {'•'},• Presa de decisions relatives a les missions d'observació electoral en els Estats membres de la CEE...,,,,,
90781503,eliminacion_catalan,caracteres_problematicos: {'·'},Expressa el seu suport als esforços realitzats pels Estats membres per a enfortir la cooperació regi...,,,,,
90789471,eliminacion_catalan,"caracteres_problematicos: {'/', '”', '“'}","Austràlia, el Canadà i Nova Zelanda aproven l'enfocament del Secretari General per a portar a feliç ...",,,,,
90793365,eliminacion_catalan,caracteres_problematicos: {'·'},n) Considerar la possibilitat d'establir un mecanisme mutu de rendició de comptes entre els països m...,,,,,
90800388,eliminacion_catalan,caracteres_problematicos: {'/'},De conformitat amb l'acord al fet que va arribar la Subcomissió d'Assumptes Jurídics en el seu 42è p...,,,,,
90804168,eliminacion_catalan,caracteres_problematicos: {'/'},Carta de data 23 d'agost de 2004 dirigida al President del Consell de Seguretat pel President del Co...,,,,,
90829100,eliminacion_catalan,caracteres_problematicos: {'/'},"8 Vegeu ""Report on the Rio Trade Week Preparatory to UNCTAD XI"" (Rio de Janeiro, 7 a 12 de juny de 2...",,,,,
90839035,eliminacion_catalan,"caracteres_problematicos: {'”', '“'}",L'expressió “béns que estiguin vinculats a l'entitat” de l'apartat c) s'entendrà en un sentit més am...,,,,,
90849583,eliminacion_catalan,"caracteres_problematicos: {'”', '“'}","A més dels diàlegs, entre els quals es va incloure la reunió dedicada a la governança urbana sobre “...",,,,,
90860274,eliminacion_catalan,caracteres_problematicos: {'/'},"""Es remetrà als Recaptadors/Magistrats de Districte de la zona pertinent una declaració en la qual f...",,,,,
90882784,eliminacion_catalan,"caracteres_problematicos: {'·', '/'}","El OSACT va acollir amb beneplàcit els progressos fets per la secretaria, en col·laboració amb exper...",,,,,
90900728,eliminacion_catalan,caracteres_problematicos: {'·'},"f) Tinença: s'ha d'atorgar seguretat en la tinença als habitants d'assentaments de precaristes, per ...",,,,,
90958958,eliminacion_catalan,"caracteres_problematicos: {'”', '“'}",Aquest Centre ha aconseguit posar en pràctica diverses iniciatives encaminades a reduir els accident...,,,,,
90978610,eliminacion_catalan,"caracteres_problematicos: {'”', '“'}","“Implementing the 1982 UN Convention, the FAO Compliance Agreement and the UN Fish Stocks Agreement”...",,,,,
91040635,eliminacion_catalan,"caracteres_problematicos: {'”', '“'}","Segon, respecte de les expressions “salut sexual i reproductiva”, la Santa Seu considera que fan ref...",,,,,
91058560,eliminacion_catalan,caracteres_problematicos: {'·'},Aquestes declaracions semestrals són el mitjà principal perquè l'Iraq facilita informació sobre l'ús...,,,,,
91063312,eliminacion_catalan,caracteres_problematicos: {'/'},"Observant a més la preocupació perquè la mundialització sigui més eficient i equitativa, segons es d...",,,,,
91091270,eliminacion_catalan,caracteres_problematicos: {'/'},National Minorities in the Russian Federation: Issues and Perspectives on Equal Opportunities and So...,,,,,
91197433,eliminacion_catalan,"caracteres_problematicos: {'”', '“'}",El President (parla en anglès): Passarem ara al projecte de resolució II titulat “Situació dels dret...,,,,,
91273303,eliminacion_catalan,caracteres_problematicos: {'/'},Vegeu la decisió 2000/292 del Consell.,,,,,
91448271,eliminacion_catalan,caracteres_problematicos: {'%'},Molts països d'ingressos mitjans i baixos han registrat importants depreciacions de les seves monede...,,,,,
91534002,eliminacion_catalan,caracteres_problematicos: {'%'},"En el bienni 2000-2001 el pressupost de suport del FNUDC era de 13,6 milions de dòlars, és a dir, el...",,,,,
91640204,eliminacion_catalan,caracteres_problematicos: {'*'},Tema 89 del programa: Activitats econòmiques i d'altre tipus que afecten als interessos dels pobles ...,,,,,
91711163,eliminacion_catalan,caracteres_problematicos: {'/'},Tema 92 del programa: Qüestions de política macroeconòmica (continuació) (A/C.2/55/L.38 i L.64),,,,,
91739922,eliminacion_catalan,caracteres_problematicos: {'·'},La reunió va culminar en l'adopció de mesures ulteriors per a canalitzar la contribució de les dones...,,,,,
91752232,eliminacion_catalan,"caracteres_problematicos: {'”', '“'}","La Unió Internacional de Comunicacions (UIT) constitueix també un cas particular sobre aquest tema, ...",,,,,
91772979,eliminacion_catalan,caracteres_problematicos: {'“'},“Els criteris per a l'avaluació i comparació de les propostes tècniques han de referir-se a la idone...,,,,,
91798179,eliminacion_catalan,"caracteres_problematicos: {'”', '“'}","En la mateixa sessió, el President del Comitè I va presentar tres projectes de resolució titulats, r...",,,,,
91832870,eliminacion_catalan,caracteres_problematicos: {'·'},"Per consegüent, se sol·liciten dos nous llocs: un oficial de planificació de categoria P-4 i un lloc...",,,,,
91884258,eliminacion_catalan,caracteres_problematicos: {'·'},"L'objectiu del terrorisme és paralitzar la societat individual i col·lectivament, creant un clima d'...",,,,,
91897048,eliminacion_catalan,caracteres_problematicos: {'—'},S'ha afegit un nou component —el treball amb els mestres per avaluar l'aprenentatge.,,,,,
91927452,eliminacion_catalan,caracteres_problematicos: {'·'},"Recordant també la Declaració Universal de Drets Humans, que disposa que tota persona té dret a un n...",,,,,
91958212,eliminacion_catalan,caracteres_problematicos: {'/'},Opinió N.o 8/2007 (addició 1 al present informe).,,,,,
91958387,eliminacion_catalan,caracteres_problematicos: {'•'},• Van acordar estudiar modalitats de repartiment equitatiu dels costos a llarg termini derivats del ...,,,,,
92070789,eliminacion_catalan,caracteres_problematicos: {'/'},El Programa Internacional de Seguretat de les Substàncies Químiques (1966) admet una ingesta diària ...,,,,,
92114321,eliminacion_catalan,"caracteres_problematicos: {'”', '“'}","El Consell de Drets Humans, establert en 2006, va rebre de l'Assemblea General el mandat de realitza...",,,,,
92199025,eliminacion_catalan,caracteres_problematicos: {'·'},"Recordant la Declaració del Mil·lenni i el Document Final del Cim Mundial 2005, en què els Caps d'Es...",,,,,
92219553,eliminacion_catalan,caracteres_problematicos: {'/'},"El Comitè reconeix els esforços de l'Estat Part per atallar els abusos, el descuit i el maltractamen...",,,,,
92232800,eliminacion_catalan,caracteres_problematicos: {'•'},• Alimentació suplementària per a les embarassades i les mares lactants,,,,,
92270355,eliminacion_catalan,caracteres_problematicos: {'·'},La qualitat dels plans anuals de treball era escassa en 20 oficines; 12 oficines no havien avaluat d...,,,,,
92310557,eliminacion_catalan,caracteres_problematicos: {'•'},• La falta de criteris relacionats amb les activitats d'incorporació de la perspectiva de gènere i e...,,,,,
92353462,eliminacion_catalan,caracteres_problematicos: {'·'},La Comissió va observar que en l'actualitat es disposava de dades de diversos satèl·lits actius per ...,,,,,
92365054,eliminacion_catalan,caracteres_problematicos: {'·'},Instem la Secretaria que prepari un informe que contingui proposades sobre l'aplicació d'aquestes re...,,,,,
92418811,eliminacion_catalan,"caracteres_problematicos: {'·', '[', ']'}",f) Quan s'hagi publicat una invitació a un procediment de preselecció o una sol·licitud de propostes...,,,,,
92440934,eliminacion_catalan,caracteres_problematicos: {'/'},Proposta del Regne Unit relativa a la proposta revisada presentada per Alemanya i França en el docum...,,,,,
92451642,eliminacion_catalan,"caracteres_problematicos: {'”', '“'}",“L'atac del 22 de setembre de 1980 contra l'Iran no pot justificar-se conformement a la Carta de les...,,,,,
92475778,eliminacion_catalan,"caracteres_problematicos: {'”', '“'}",Decideix incloure “Les causes dels conflictes i la promoció de la pau duradora i el desenvolupament ...,,,,,
92575643,eliminacion_catalan,caracteres_problematicos: {'·'},"S'ha iniciat la cooperació amb la Federació de Rússia, que a finalitats de 2001 va llançar un petit ...",,,,,
92576426,eliminacion_catalan,caracteres_problematicos: {'/'},Queda aprovat el projecte de resolució II (resolució 57/249).,,,,,
92578107,eliminacion_catalan,caracteres_problematicos: {'·'},"En una visita realitzada a l'abril a Kailahun, els observadors de drets humans van trobar restes hum...",,,,,
92657646,eliminacion_catalan,caracteres_problematicos: {'·'},La UNESCO proporciona assessorament tècnic i coneixements especialitzats sobre el mètode i l'estratè...,,,,,
92677761,eliminacion_catalan,"caracteres_problematicos: {'”', '“'}","Referent a això, Algèria considera que les adaptacions que s'han d'introduir en la composició i en e...",,,,,
92695314,eliminacion_catalan,"caracteres_problematicos: {'”', '“'}","En la seva segona sessió plenària, celebrada el 19 de setembre de 2003, l'Assemblea General, per rec...",,,,,
92698991,eliminacion_catalan,caracteres_problematicos: {'*'},Agrairia que tingués la bondat de fer distribuir la declaració* i el memoràndum* com a documents ofi...,,,,,
92790698,eliminacion_catalan,caracteres_problematicos: {'/'},"Entre altres decisions, es va acordar refondre en un únic document les disposicions de naturalesa op...",,,,,
92803348,eliminacion_catalan,"caracteres_problematicos: {'[', '/', ']'}",A/58/7/Corr.1 Primer informe sobre el projecte de pressupost per programes per al bienni 2004-2005 -...,,,,,
92823047,eliminacion_catalan,caracteres_problematicos: {'/'},"Malgrat l'actitud positiva mostrada per la part abkhàzia, aquesta va continuar negant-se a rebre el ...",,,,,
92832155,eliminacion_catalan,"caracteres_problematicos: {'“', '”', '/'}","2.3 En el butlletí del Secretari General ST/SGB/253, titulat “Promoció de la igualtat de tracte per ...",,,,,
92913924,eliminacion_catalan,"caracteres_problematicos: {'*', '%'}",* Els preus cotitzats són tots impostos i 10% de càrrec de servei inclòs.,,,,,
93013401,eliminacion_catalan,caracteres_problematicos: {'/'},Min. Càrrega de ruptura: 5000lbs / 23 kN,,,,,
93154827,eliminacion_catalan,caracteres_problematicos: {'@'},Si en el teu cas vols que es deixin de fer servir Cookies amb les finalitzats que es descriuen aquí ...,,,,,
