linea,tipo,razon,texto_original,porcentaje_automatico,detalles_base,detalles_avanzados,texto_catalan,texto_chino
83265799,eliminacion_catalan,caracteres_problematicos: {'/'},Carta de data 19 de juliol de 2005 dirigida al President del Consell de Seguretat per l'Encarregat d...,,,,,
83360565,eliminacion_catalan,caracteres_problematicos: {'/'},La meva delegació acull amb satisfacció l'informe del Secretari General sobre la joventut mundial 20...,,,,,
83418582,eliminacion_catalan,caracteres_problematicos: {'/'},a) Globalització i interdependència (A/59/312),,,,,
83459119,eliminacion_catalan,caracteres_problematicos: {'·'},La seva delegació dóna suport a la prohibició de totes les formes de clonació basades en cèl·lules m...,,,,,
83535101,eliminacion_catalan,caracteres_problematicos: {'·'},"A l'efecte de la present Convenció, l'expressió ""discriminació contra la dona"" denotarà tota distinc...",,,,,
83595104,eliminacion_catalan,caracteres_problematicos: {'°'},La Comissió de Desenvolupament Social pren nota dels següents documents que va tenir davant si en el...,,,,,
83632482,eliminacion_catalan,"caracteres_problematicos: {'°', '*', '·'}",El Secretari General té l'honor de transmetre a la Comissió d'Estadística l'informe de l'Organitzaci...,,,,,
83651444,eliminacion_catalan,caracteres_problematicos: {'['},[Aprovat en votació nominal per 21 vots contra 1 i 2 abstencions.,,,,,
83718274,eliminacion_catalan,"caracteres_problematicos: {']', '['}","5 Qüestions relatives als drets humans, inclosos diferents criteris per a millorar el gaudi efectiu ...",,,,,
83729125,eliminacion_catalan,"caracteres_problematicos: {'/', '·'}","3. Com a resultat de la sol·licitud formulada per l'Assemblea General en la seva resolució 52/38 S, ...",,,,,
83872550,eliminacion_catalan,caracteres_problematicos: {'/'},Es proposa un lloc addicional del quadre de serveis generals (altres categories) en la Divisió de Se...,,,,,
83881711,eliminacion_catalan,caracteres_problematicos: {'·'},"Per això, la prevenció del crim ha de ser part integral de l'enfocament per a combatre el tràfic il·...",,,,,
83923496,eliminacion_catalan,caracteres_problematicos: {'°'},7. Programa provisional del 47° període de sessions.,,,,,
83932909,eliminacion_catalan,caracteres_problematicos: {'·'},Col·laboració amb el Departament d'Operacions de Manteniment de la Pau,,,,,
83935479,eliminacion_catalan,caracteres_problematicos: {'/'},L'Assemblea General tal vegada desitja així mateix reconsiderar les disposicions de la seva resoluci...,,,,,
83939592,eliminacion_catalan,caracteres_problematicos: {'%'},En les categories superiors del quadre orgànic no s'ha assolit la paritat: les dones constitueixen e...,,,,,
83958501,eliminacion_catalan,caracteres_problematicos: {'/'},"A més, a l'efecte d'aconseguir l'objectiu d'un arranjament pacífic, l'Assemblea, en la seva resoluci...",,,,,
84023956,eliminacion_catalan,"caracteres_problematicos: {'%', '*'}",Els resultats indicats es basen en l'execució del 99% dels 737 productes quantificables previstos*.,,,,,
84060000,eliminacion_catalan,caracteres_problematicos: {'/'},Vassilakis (Grècia) (parla en anglès): Amb gran honor i plaer presento avui a l'Assemblea General el...,,,,,
84096963,eliminacion_catalan,caracteres_problematicos: {'·'},"Tenim dos oradors convidats: el Sr. Roberto García Moritán, President del Grup d'experts governament...",,,,,
84373857,eliminacion_catalan,caracteres_problematicos: {'/'},L'OSE va demanar a la secretaria que prosseguís les consultes amb la intenció de determinar si la Co...,,,,,
84445372,eliminacion_catalan,caracteres_problematicos: {'·'},Tenint en compte que s'ha advertit de la possibilitat que els serveis paral·lels de transferència s'...,,,,,
84454160,eliminacion_catalan,caracteres_problematicos: {'/'},"Com s'assenyala en el document S/2006/204, les FANCI van presentar les seves llistes oficials a la O...",,,,,
84489994,eliminacion_catalan,caracteres_problematicos: {'%'},"En l'actualitat, més del 60% de les llars de la ciutat utilitzen GPL.",,,,,
84557923,eliminacion_catalan,caracteres_problematicos: {'/'},En l'informe sobre l'examen ampli de la governança i la supervisió en les Nacions Unides i els seus ...,,,,,
84561316,eliminacion_catalan,caracteres_problematicos: {'/'},"Capacitadors/assessors en matèria de VIH/SIDA en la caserna general de Kinshasa i en Goma, Bunia i B...",,,,,
84565393,eliminacion_catalan,caracteres_problematicos: {'·'},"El crèdit de 27.646.100 dòlars s'usarà per a sous, despeses comunes del personal i contribucions del...",,,,,
84669849,eliminacion_catalan,caracteres_problematicos: {'/'},Ucraïna: cinquè informe periòdic (CAT/C/81/Add.1),,,,,
84710598,eliminacion_catalan,caracteres_problematicos: {'·'},Relació amb el pla biennal per programes i les prioritats per al període 2008-2009 i amb els objecti...,,,,,
84712540,eliminacion_catalan,caracteres_problematicos: {'/'},9.18 Tenint present la resolució 50/227 de l'Assemblea General i la necessitat de donar una major co...,,,,,
84713605,eliminacion_catalan,caracteres_problematicos: {'/'},Algunes de les recomanacions del Grup revesteixen interès per al seguiment de la resolució 59/250 de...,,,,,
84778311,eliminacion_catalan,caracteres_problematicos: {'/'},El Regne Unit continua adoptant decisions unilaterals en qüestions com els drets de pesca i l'explot...,,,,,
84785845,eliminacion_catalan,caracteres_problematicos: {'%'},"Els Estats Units hauran destruït al voltant del 50% de les seves existències per a finals d'enguany,...",,,,,
84815573,eliminacion_catalan,caracteres_problematicos: {'/'},"14. A petició del representant dels Estats Units, es procedeix a una votació registrada sobre el pro...",,,,,
84820323,eliminacion_catalan,caracteres_problematicos: {'·'},"42. No obstant això, pel que respecta a l'últim paràgraf del preàmbul, creu fermament que caldria tr...",,,,,
84863167,eliminacion_catalan,caracteres_problematicos: {'/'},Weise (Observador de l'American Bar Association) suggereix inserir petits nombres romans en el paràg...,,,,,
84883030,eliminacion_catalan,caracteres_problematicos: {'·'},"Les garanties diplomàtiques no anul·len l'obligació de la no devolució, que exigeix als Estats que n...",,,,,
84902794,eliminacion_catalan,caracteres_problematicos: {'/'},1. La Conferència dels Estats Part en la Convenció de les Nacions Unides contra la Corrupció va apro...,,,,,
84924335,eliminacion_catalan,caracteres_problematicos: {'/'},El projecte de llei 2679/2003 (adjunt al projecte de llei 5268/2001) recull la proposta de legislaci...,,,,,
84941988,eliminacion_catalan,caracteres_problematicos: {'/'},L'informe indica que Moçambic afronta problemes d'exclusió social de les dones que treballen en l'ag...,,,,,
84943027,eliminacion_catalan,"caracteres_problematicos: {'%', '·'}",L'exigència continguda en l'article 21 de la Llei sobre la Igualtat de Gènere es va fer més estricta...,,,,,
84989252,eliminacion_catalan,"caracteres_problematicos: {'%', '*'}",*En 37 països en què s'executen programes almenys el 60% de les escoles secundàries inclouen la salu...,,,,,
84990238,eliminacion_catalan,caracteres_problematicos: {'·'},Les activitats de promoció del UNFPA van ajudar al fet que es reflectissin els objectius de la CIPD ...,,,,,
85022828,eliminacion_catalan,caracteres_problematicos: {'%'},"El 1999, la xifra de treballadors homes va ser del 62,3% de la força de treball del país.",,,,,
85180432,eliminacion_catalan,caracteres_problematicos: {'*'},"* L'ús més generalitzat d'instruments de gestió electrònica, el que ha permès a la majoria dels banc...",,,,,
85241924,eliminacion_catalan,caracteres_problematicos: {'/'},La reducció de les necessitats previstes es relaciona principalment amb el menor cost mitjà mensual ...,,,,,
85256656,eliminacion_catalan,caracteres_problematicos: {'°'},Informe de la Comissió de les Nacions Unides per al Dret Mercantil Internacional sobre la labor real...,,,,,
85472668,eliminacion_catalan,caracteres_problematicos: {'·'},136. La Subcomissió va observar que diversos marcs normatius nacionals presentats durant el present ...,,,,,
85485973,eliminacion_catalan,caracteres_problematicos: {'·'},També sol·licitem una seriosa anàlisi sobre la incorporació de les municions al Programa d'Acció i l...,,,,,
85514550,eliminacion_catalan,caracteres_problematicos: {'·'},44. Totes les instal·lacions mèdiques de les Nacions Unides de categories II i III han d'estar equip...,,,,,
85518021,eliminacion_catalan,caracteres_problematicos: {'/'},"Queda aprovat el projecte de resolució A/C.5/62/L.39, en la seva forma oralment esmenada.",,,,,
85592451,eliminacion_catalan,caracteres_problematicos: {'/'},"14. També segons el document COHRE/ERRC/PDF/LT, les vulneracions freqüents i sistemàtiques dels dret...",,,,,
85609164,eliminacion_catalan,caracteres_problematicos: {'/'},La discriminació i l'estigmatització també impedeixen a moltes persones que viuen amb el VIH/SIDA ac...,,,,,
85610192,eliminacion_catalan,caracteres_problematicos: {'/'},"Document sobre normes de conducta i moralitat de la policia adscrita al Ministeri de l'Interior, apr...",,,,,
85711747,eliminacion_catalan,"caracteres_problematicos: {'/', '·'}","A més, la Comissió observa que, prèvia sol·licitud de la Junta Executiva, se li podria proporcionar ...",,,,,
85715094,eliminacion_catalan,caracteres_problematicos: {'·'},"No hi ha dubte que ha sorgit un nou panorama de cooperació Sud-Sud, caracteritzat per la disponibili...",,,,,
85778208,eliminacion_catalan,caracteres_problematicos: {'·'},"Com a resultat d'això, la migració de les zones rurals a les urbanes, especialment dels joves, està ...",,,,,
85796948,eliminacion_catalan,caracteres_problematicos: {'°'},"La Mesa va recomanar que el Director de la Divisió de Població organitzés, aproximadament un mes aba...",,,,,
85849525,eliminacion_catalan,caracteres_problematicos: {'/'},"b) Dinamarca dóna suport a programes sobre la promoció de la dona, la reintegració dels refugiats qu...",,,,,
85914938,eliminacion_catalan,caracteres_problematicos: {'%'},Des de mitjan decenni de 1990 el major grau de sensibilitat de l'ocupació a les variacions de l'ingr...,,,,,
85939063,eliminacion_catalan,caracteres_problematicos: {'·'},"Quatre països (Equador, Madagascar, Tailàndia i la República Unida de Tanzània) han continuat partic...",,,,,
85954188,eliminacion_catalan,caracteres_problematicos: {'/'},En la decisió XVIII/11 es va demanar al Grup d'Avaluació Científica que actualitzés la informació ex...,,,,,
85955473,eliminacion_catalan,caracteres_problematicos: {'>'},"Es van registrar elevades RE d'alfa-HCH en el cervell dels corbs marins (> 3.6) (Iwata i altres, 199...",,,,,
85976058,eliminacion_catalan,caracteres_problematicos: {'%'},Els crèdits reflecteixen l'aplicació d'un factor de retard en el desplegament del 5% al càlcul de le...,,,,,
86027636,eliminacion_catalan,caracteres_problematicos: {'/'},Informe sinòptic anual de la Junta dels caps executius del sistema de les Nacions Unides per a la co...,,,,,
86123191,eliminacion_catalan,caracteres_problematicos: {'·'},"De resultes de les reunions primera i segona del procés de consultes, l'Assemblea General va demanar...",,,,,
86133634,eliminacion_catalan,caracteres_problematicos: {'·'},La disminució dels crèdits sol·licitats es deu a aquest efecte combinat de a) la proposta de reassig...,,,,,
86146210,eliminacion_catalan,caracteres_problematicos: {'/'},a. La dada sobre el nombre de llocs finançats amb càrrec als recursos extrapressupostaris modifica l...,,,,,
86295234,eliminacion_catalan,caracteres_problematicos: {'/'},"A més, el professor Abi-Saab va recordar que, en data més recent, la Comissió de Drets Humans, en la...",,,,,
86296415,eliminacion_catalan,caracteres_problematicos: {'/'},b) La recopilació preparada per l'Oficina de l'Alt Comissionat de les Nacions Unides per als Drets H...,,,,,
86354400,eliminacion_catalan,caracteres_problematicos: {'·'},"10. Presentació oficiosa de les sol·licituds presentades conformement a l'article 5, i de les anàlis...",,,,,
86377023,eliminacion_catalan,caracteres_problematicos: {'/'},La Comissió va observar a més que la Inspecció de Treball i Seguretat Social 2008-2010 havia prepara...,,,,,
86404313,eliminacion_catalan,caracteres_problematicos: {'/'},Tercer informe periòdic de Suïssa (continuació) (CEDAW/C/CHE/3; CEDAW/C/CHE/Q/3 i Add.1),,,,,
86439123,eliminacion_catalan,caracteres_problematicos: {'·'},Un altre orador va elogiar la col·laboració amb el Banc Mundial en matèria de salut de la mare i del...,,,,,
86453197,eliminacion_catalan,caracteres_problematicos: {'/'},"En les seves resolucions 51/3, sobre el matrimoni forçat de la nena, i 52/2, sobre l'erradicació de ...",,,,,
86458752,eliminacion_catalan,caracteres_problematicos: {'%'},"El restant 2% representa un important desafiament per al Govern, ja que correspon a un dels sectors ...",,,,,
86526946,eliminacion_catalan,caracteres_problematicos: {'['},[Opció 2 (factor(s) de descompte)),,,,,
86553012,eliminacion_catalan,caracteres_problematicos: {'/'},"Recordant la seva decisió 21/COP.2 sobre l'examen de l'article 47 del reglament,",,,,,
86577514,eliminacion_catalan,"caracteres_problematicos: {']', '/', '['}","3. Execució del Programa 21 i del Pla per a la seva ulterior execució, i aplicació dels resultats de...",,,,,
86579610,eliminacion_catalan,caracteres_problematicos: {'*'},Acta resumida (parcial)* de la 7a sessió**,,,,,
86672050,eliminacion_catalan,caracteres_problematicos: {'/'},Les dades biogràfiques de tots els membres designats després de la tercera reunió de la Conferència ...,,,,,
86673613,eliminacion_catalan,caracteres_problematicos: {'/'},"Per als països més petits, la "" distribució nacional entre els diferents sectors/nou marc d'assignac...",,,,,
86679132,eliminacion_catalan,caracteres_problematicos: {'·'},81. Se sol·liciten recursos addicionals per una suma de 451.200 dòlars per a personal temporal gener...,,,,,
86681731,eliminacion_catalan,caracteres_problematicos: {'·'},"A més, Israel considera que el comerç il·lícit en armes petites i armes lleugeres, en tots els seus ...",,,,,
86731112,eliminacion_catalan,caracteres_problematicos: {'·'},"Per descomptat, és responsabilitat de cada organització decidir sobre el seu règim especial de repre...",,,,,
86752131,eliminacion_catalan,caracteres_problematicos: {'/'},Informació sobre la tasca del Comitè Assessor del Consell de Drets Humans en relació amb el dret al ...,,,,,
86814142,eliminacion_catalan,caracteres_problematicos: {'/'},"El Secretari General, en el seu recent informe sobre l'execució del pla mestre de millores d'infraes...",,,,,
86814173,eliminacion_catalan,caracteres_problematicos: {'/'},"De conformitat amb els paràgrafs 8 i 9 de la resolució 14/1, el Consell de Drets Humans:",,,,,
86829907,eliminacion_catalan,caracteres_problematicos: {'/'},c) Informe de la Junta Internacional de Fiscalització d'Estupefaents corresponent a 2009 (E/INCB/200...,,,,,
86840663,eliminacion_catalan,caracteres_problematicos: {'·'},El 8 d'agost de 2005 la Comissió encarregada de la immigració i de l'estatut dels refugiats va exami...,,,,,
86939606,eliminacion_catalan,caracteres_problematicos: {'·'},La reunió ens ofereix una oportunitat única per enfortir la nostra associació i els esforços col·lec...,,,,,
86949829,eliminacion_catalan,"caracteres_problematicos: {'/', '·'}","L'Assemblea General, en el paràgraf 2 de la seva resolució 64/105, va considerar important prossegui...",,,,,
86998927,eliminacion_catalan,"caracteres_problematicos: {'”', '“'}",Es reconeix que un òrgan de vigilància de l'aplicació d'un tractat és competent “als efectes de comp...,,,,,
87021526,eliminacion_catalan,"caracteres_problematicos: {']', '['}",d) Els recursos contra una decisió de l'entitat adjudicadora [o de l'autoritat que va donar la seva ...,,,,,
87086903,eliminacion_catalan,caracteres_problematicos: {'/'},"Missió als Emirats Àrabs Units (A/HRC/14/43/Add.3), par. 63 a 79",,,,,
87120417,eliminacion_catalan,caracteres_problematicos: {'·'},54. En l'informe anual de 2008 del Coordinador Resident de les Nacions Unides es va indicar que el p...,,,,,
87143917,eliminacion_catalan,caracteres_problematicos: {'/'},"50. Finalment, en la seva reunió de 2007, les Altes Parts Contractants van adoptar altres decisions ...",,,,,
87285502,eliminacion_catalan,caracteres_problematicos: {'/'},e) Convidar als Estats membres a tenir en compte les mesures que figuren en la versió actualitzada d...,,,,,
87355462,eliminacion_catalan,caracteres_problematicos: {'%'},"Referent a això, el 9% dels qui van respondre a l'enquesta de la Dependència van assenyalar que no c...",,,,,
87359328,eliminacion_catalan,"caracteres_problematicos: {']', '/', '['}",Cultura de pau: projecte de resolució (A/65/L.5) [15],,,,,
87468942,eliminacion_catalan,"caracteres_problematicos: {']', '['}",El Brasil informa dels requisits per a l'etiquetatge de l'endosulfà amb informació específica sobre ...,,,,,
87474572,eliminacion_catalan,caracteres_problematicos: {'/'},"La ressenya de les deliberacions figura en les actes resumides corresponents (E/2010/SR.49, 50 i 52)...",,,,,
87483701,eliminacion_catalan,caracteres_problematicos: {'/'},4. Decisions adoptades sobre la base dels informes de la Segona Comisión65/525. Qüestions de polític...,,,,,
87685434,eliminacion_catalan,caracteres_problematicos: {'/'},"A més, la Comissió va assenyalar que el finançament per a les missions polítiques especials dependri...",,,,,
87774985,eliminacion_catalan,caracteres_problematicos: {'·'},S'ha agregat a l'edifici del jardí nord una nova instal·lació de subministrament permanent d'electri...,,,,,
87901520,eliminacion_catalan,caracteres_problematicos: {'·'},"2. Insta als Estats membres, i convida a les organitzacions internacionals, les organitzacions regio...",,,,,
87998766,eliminacion_catalan,"caracteres_problematicos: {'%', '·'}","Al 30 de juny de 2011, s'havien instal·lat 276 estacions (86%).",,,,,
88016293,eliminacion_catalan,"caracteres_problematicos: {'”', '“'}",Un expert de la Divisió d'Àsia Oriental (excepte Xina) va lamentar la descripció que figurava en l'i...,,,,,
88077729,eliminacion_catalan,caracteres_problematicos: {'·'},31. Davant el solapament de mandats en l'esfera de la planificació i l'execució de la labor d'adapta...,,,,,
88137961,eliminacion_catalan,caracteres_problematicos: {'·'},El Grup també desitja agrair la disposició a col·laborar de les parts en Côte d'Ivoire i a tots els ...,,,,,
88154749,eliminacion_catalan,caracteres_problematicos: {'·'},97. En els annexos 4.1.a i 4.1.b es descriuen de forma detallada un atac i un segrest (dels vaixells...,,,,,
88174364,eliminacion_catalan,caracteres_problematicos: {'·'},"Al principi, va al·legar que la intenció del 22è sector de les FARDC havia estat recuperar els deser...",,,,,
88280754,eliminacion_catalan,caracteres_problematicos: {'/'},Fem notar la conclusió del Secretari General en el seu informe de 2011 sobre la situació relativa al...,,,,,
88292379,eliminacion_catalan,caracteres_problematicos: {'·'},"Tenint present el nostre compromís expressat en la Declaració de Donar és Salam sobre la Pau, la Seg...",,,,,
88327767,eliminacion_catalan,caracteres_problematicos: {'·'},També es va destacar la necessitat d'encoratjar els esforços dirigits a controlar el comerç il·lícit...,,,,,
88335460,eliminacion_catalan,caracteres_problematicos: {'·'},"En el marc de l'estratègia definida en la iniciativa titulada "" La Ruta de l'Esclau: resistència, ll...",,,,,
88379345,eliminacion_catalan,caracteres_problematicos: {'·'},d) Establir aliances amb els col·legis d'advocats o les associacions jurídiques per assegurar la pre...,,,,,
88424973,eliminacion_catalan,caracteres_problematicos: {'%'},"De les 26 recomanacions formulades per al bienni 2008-2009, 16 (61%) es van aplicar plenament, 8 (31...",,,,,
88452520,eliminacion_catalan,caracteres_problematicos: {'·'},"A més, es va establir una estructura adequada de serveis d'ajuda, amb un número de telèfon i adreces...",,,,,
88517164,eliminacion_catalan,"caracteres_problematicos: {'”', '“', '·'}",Es tracta d'un projecte complementari de la Guia Legislativa de la CNUDMI sobre les Operacions Garan...,,,,,
88532451,eliminacion_catalan,caracteres_problematicos: {'/'},104.23 Vetllar perquè es compleixin plenament les recomanacions formulades per l'Alta Comissionada d...,,,,,
88546789,eliminacion_catalan,caracteres_problematicos: {'/'},26. Les dones i les nenes amb discapacitat també són especialment vulnerables a la violència durant ...,,,,,
88609558,eliminacion_catalan,caracteres_problematicos: {'·'},"12.- Mentrestant, Puracal es troba internat a la presó de màxima seguretat denominada Sistema Penite...",,,,,
88626482,eliminacion_catalan,caracteres_problematicos: {'·'},"Encara que Geòrgia no ha penalitzat de manera específica l'enriquiment il·lícit, es considera que aq...",,,,,
88634272,eliminacion_catalan,caracteres_problematicos: {'·'},"El 23 de desembre de 2009, en resposta a la sol·licitud presentada per un dels col·laboradors de l'a...",,,,,
88642743,eliminacion_catalan,caracteres_problematicos: {'/'},5. Quant al projecte de protocol sobre les municions en ram presentat pel President del Grup d'Exper...,,,,,
88665279,eliminacion_catalan,caracteres_problematicos: {'·'},La llista conté 299 tipus d'oficis i especialitats prohibides per a la dona en les indústries metal·...,,,,,
88697361,eliminacion_catalan,caracteres_problematicos: {'·'},"A tall d'exemple, els estudis anuals sobre la coca i l'opi que realitza la UNODC en virtut dels seus...",,,,,
88762548,eliminacion_catalan,caracteres_problematicos: {'·'},"A més, considerem que la prevenció i eliminació de totes les formes de violència contra la dona és u...",,,,,
88811657,eliminacion_catalan,caracteres_problematicos: {'·'},La sol·licitud es va presentar acompanyada dels documents tècnics i la informació que s'indiquen a c...,,,,,
88814235,eliminacion_catalan,caracteres_problematicos: {'*'},* Percentatge de representants.,,,,,
88861925,eliminacion_catalan,caracteres_problematicos: {'/'},Havent examinat l'informe del Secretari General sobre la Força de les Nacions Unides d'Observació de...,,,,,
88893645,eliminacion_catalan,caracteres_problematicos: {'·'},"Amb tan sols vuit anys més per a aconseguir la meta, formulada en el paràgraf 23 del Pla d'Aplicació...",,,,,
88902886,eliminacion_catalan,caracteres_problematicos: {'%'},"Una dona ocupa el càrrec de Vicepresident del Parlament federal del Sudan, i el 66% dels nostres fun...",,,,,
88954193,eliminacion_catalan,caracteres_problematicos: {'·'},26.4 L'Oficina ajuda l'Organització a obtenir millors resultats determinant els factors que afecten ...,,,,,
89030356,eliminacion_catalan,caracteres_problematicos: {'·'},El present informe descriu la manera en què les organitzacions de les Nacions Unides han utilitzat l...,,,,,
89136457,eliminacion_catalan,caracteres_problematicos: {'·'},Es prestarà especial atenció als Objectius de Desenvolupament del Mil·lenni convinguts internacional...,,,,,
89158833,eliminacion_catalan,caracteres_problematicos: {'/'},L'informe es presenta també en compliment del que disposen les resolucions de l'Assemblea General 67...,,,,,
89295609,eliminacion_catalan,caracteres_problematicos: {'%'},69.- En l'informe del ACNUDH de 2013 es va assenyalar que Xipre continuava tenint la proporció més e...,,,,,
89342012,eliminacion_catalan,caracteres_problematicos: {'·'},"Qüestions de fons: Dret a la vida, dret a la protecció contra els tractes o les penes cruels, inhuma...",,,,,
89389218,eliminacion_catalan,"caracteres_problematicos: {']', '[', '>'}",""" 2. Als efectes del paràgraf 1: [...] i) Per > s'entendrà l'aprehensió, la detenció o el segrest de...",,,,,
89487696,eliminacion_catalan,caracteres_problematicos: {'/'},El Consell Econòmic i Social va utilitzar el format de les conclusions convingudes en el resultat de...,,,,,
89525170,eliminacion_catalan,"caracteres_problematicos: {'%', '/'}","En 2008, la taxa de prevalença del VIH/SIDA a Sierra Leone es va mantenir en aproximadament el 1,6%.",,,,,
89608665,eliminacion_catalan,caracteres_problematicos: {'/'},"El 12 d'abril de 2013, el Grup d'Experts va presentar el seu informe final als membres del Comitè (S...",,,,,
89636942,eliminacion_catalan,caracteres_problematicos: {'/'},124. La Conferència de les Parts en el Conveni de Basilea va adoptar una versió revisada del project...,,,,,
89678424,eliminacion_catalan,"caracteres_problematicos: {'/', '·'}",La Comissió recomana a l'Assemblea General que sol·liciti al Secretari General que proporcioni més i...,,,,,
89713377,eliminacion_catalan,caracteres_problematicos: {'/'},"El Departament va dur a terme diversos desplegaments d'emergència en diversos països, com el Líban, ...",,,,,
89982499,eliminacion_catalan,caracteres_problematicos: {'·'},18. El SNU va reconèixer esforços per a l'avanç dels drets de les persones privades de llibertat mit...,,,,,
90131115,eliminacion_catalan,caracteres_problematicos: {'·'},h) Apliquin mesures per prevenir expressament la violència relacionada amb pràctiques il·lícites de ...,,,,,
90161694,eliminacion_catalan,caracteres_problematicos: {'/'},"136. En la mateixa sessió, es va adoptar la decisió 17/CP.19, titulada "" Programa de treball de Nair...",,,,,
90305158,eliminacion_catalan,caracteres_problematicos: {'·'},"En els casos en què existeixen sistemes judicials consuetudinaris, la seva aplicació paral·lela pot ...",,,,,
90353403,eliminacion_catalan,caracteres_problematicos: {'“'},“No perquè Haití sigui una nació petita permetrà un atropellament com aquest.,,,,,
