linea,tipo,razon,texto_original,porcentaje_automatico,detalles_base,detalles_avanzados,texto_catalan,texto_chino
88995742,eliminacion_catalan,caracteres_problematicos: {'/'},":: Llei 53/2007, de 28 de desembre, sobre el control del comerç exterior de material de defensa i de...",,,,,
89011523,eliminacion_catalan,caracteres_problematicos: {'/'},"6) El Comitè observa amb preocupació que, segons l'informe de l'Estat parteix (CERD/C/KGZ/5-7, par. ...",,,,,
89056837,eliminacion_catalan,"caracteres_problematicos: {'/', '·'}","De conformitat amb el sol·licitat per l'Assemblea General en el paràgraf 48 de la resolució 67/255, ...",,,,,
89063892,eliminacion_catalan,caracteres_problematicos: {'/'},Decisió 54/IX. Metodologia del procediment de seguiment de les observacions finals,,,,,
89097192,eliminacion_catalan,"caracteres_problematicos: {'/', '·'}","En la seva resolució 67/91, l'Assemblea General va reiterar la seva sol·licitud als Estats membres i...",,,,,
89100307,eliminacion_catalan,caracteres_problematicos: {'/'},Reafirmant també totes les resolucions anteriors del Consell de Drets Humans sobre els drets de les ...,,,,,
89137809,eliminacion_catalan,caracteres_problematicos: {'·'},Les activitats de desenvolupament de la capacitat consistiran en: a) serveis d'assessorament prestat...,,,,,
89188943,eliminacion_catalan,caracteres_problematicos: {'·'},"El Sr. Haniff (Malàisia) pregunta quines són les perspectives d'una solució biestatal, donat el nomb...",,,,,
89197473,eliminacion_catalan,caracteres_problematicos: {'/'},En resposta al recent augment del nombre d'actes d'intimidació contra la societat civil i els defens...,,,,,
89217043,eliminacion_catalan,"caracteres_problematicos: {']', '['}",La Comissió recomana les següents mesures pràctiques de foment de la confiança en l'esfera de les ar...,,,,,
89300328,eliminacion_catalan,caracteres_problematicos: {'%'},"Les infraestructures han experimentat una sensible millora: el 96,8% de les comunes tenen carreteres...",,,,,
89303022,eliminacion_catalan,caracteres_problematicos: {'/'},"Se li va mostrar una ordre de detenció de la Interpol (Notificació Roja N.o 100/01/2000, emesa el 19...",,,,,
89387506,eliminacion_catalan,caracteres_problematicos: {'/'},"Abans del part, s'imparteix orientació a totes les mares sobre el VIH/SIDA i se'ls encoratja al fet ...",,,,,
89415775,eliminacion_catalan,caracteres_problematicos: {'·'},Tots els agents han de treballar col·lectivament per promoure l'apoderament de les persones amb disc...,,,,,
89447555,eliminacion_catalan,caracteres_problematicos: {'%'},"Per exemple, la Reserva Federal ha estat més explícita pel que fa a les seves perspectives sobre la ...",,,,,
89470190,eliminacion_catalan,"caracteres_problematicos: {'/', '·'}","En la seva resolució 66/177, l'Assemblea General va disposar una sèrie de mesures encaminades a enfo...",,,,,
89495556,eliminacion_catalan,caracteres_problematicos: {'·'},5. De conformitat amb la sol·licitud de la Junta Internacional de Fiscalització d'Estupefaents que e...,,,,,
89555365,eliminacion_catalan,"caracteres_problematicos: {'/', '[', ']', '–'}",A/C.2/68/L.6 Tema 23 c) del programa – Eradicació de la pobresa i altres qüestions de desenvolupamen...,,,,,
89560044,eliminacion_catalan,caracteres_problematicos: {'/'},La Comissió aprova el projecte de resolució A/C.2/68/L.73 en la seva forma oralment corregida.,,,,,
89724127,eliminacion_catalan,caracteres_problematicos: {'%'},"Al 8 de juliol de 2014, un total de 162 països membres que representen 79,54% del total de les quote...",,,,,
89743731,eliminacion_catalan,caracteres_problematicos: {'/'},"La Biblioteca del Congrés, els Arxius Nacionals i altres institucions compten amb una gran varietat ...",,,,,
89900945,eliminacion_catalan,caracteres_problematicos: {'/'},Tema 50 del programa: Organisme d'Obres Públiques i Socors de les Nacions Unides per als Refugiats d...,,,,,
89907405,eliminacion_catalan,"caracteres_problematicos: {'%', '·'}","Finalment, en les consultes oficioses, el Grup demanarà aclariments respecte de diversos components ...",,,,,
90073494,eliminacion_catalan,caracteres_problematicos: {'/'},La Llei N.o 20.183 (D.O. 8/6/2007) que modifica la Llei N.o 18.700 Orgànica Constitucional sobre Vot...,,,,,
90075319,eliminacion_catalan,caracteres_problematicos: {'/'},El format i l'estructura de l'informe estan de conformitat amb les directrius publicades pel Comitè ...,,,,,
90106201,eliminacion_catalan,caracteres_problematicos: {'/'},El Comitè destaca la importància de l'eliminació gradual de les mesures de suport específiques per a...,,,,,
90170991,eliminacion_catalan,caracteres_problematicos: {'·'},Gàmbia va sol·licitar que es revisés la decisió.,,,,,
90217094,eliminacion_catalan,caracteres_problematicos: {'·'},Conforme a la resolució de la INTERPOL de 2010 sobre la cooperació en matèria de noves sol·licituds ...,,,,,
90222801,eliminacion_catalan,caracteres_problematicos: {'·'},"El Comitè Conjunt de Seguretat s'havia reunit a Khartum el 21 d'agost, presidit pels Caps d'Intel·li...",,,,,
90235274,eliminacion_catalan,caracteres_problematicos: {'·'},:: L'ACNUR va presentar una sol·licitud per a la importació d'articles des de l'Iraq que va ser apro...,,,,,
90288540,eliminacion_catalan,caracteres_problematicos: {'·'},Potser el Comitè també desitja sol·licitar a la secretaria que elabori documents addicionals relacio...,,,,,
90339231,eliminacion_catalan,"caracteres_problematicos: {'”', '“'}",El President (parla en anglès): Voldria ara assenyalar a l'atenció de l'Assemblea una qüestió relati...,,,,,
90401495,eliminacion_catalan,caracteres_problematicos: {'·'},De conformitat amb el paràgraf 6 de l'article 7 de la Convenció i en aplicació d'una recomanació de ...,,,,,
90486863,eliminacion_catalan,caracteres_problematicos: {'·'},"A més, el Relator Especial opinava que no era necessari ocupar-se de les conseqüències de la protecc...",,,,,
90500027,eliminacion_catalan,caracteres_problematicos: {'•'},"• El Centre de Serveis Financers de Malta, establert en virtut de la Llei de serveis financers, és u...",,,,,
90509712,eliminacion_catalan,caracteres_problematicos: {'·'},En el context de la col·laboració contínua i millorada amb els membres del Grup Consultiu sobre Rece...,,,,,
90550033,eliminacion_catalan,caracteres_problematicos: {'/'},(Nota: Cal definir el nombre de membres/la mida de l'òrgan rector.,,,,,
90591232,eliminacion_catalan,"caracteres_problematicos: {'/', '•'}","• El debat obert sobre les amenaces a la pau i la seguretat internacionals, celebrat el 8 de gener d...",,,,,
90613080,eliminacion_catalan,caracteres_problematicos: {'·'},"Per a concloure, desitgem assenyalar que donem suport al projecte de comunicat de premsa sobre Burun...",,,,,
90657302,eliminacion_catalan,caracteres_problematicos: {'%'},El nombre de transaccions en relació amb els diferents fons d'operacions de manteniment de la pau va...,,,,,
90677012,eliminacion_catalan,caracteres_problematicos: {'·'},El grup de treball brinda a més un fòrum per a l'intercanvi d'informació sobre els assumptes o casos...,,,,,
90740797,eliminacion_catalan,"caracteres_problematicos: {'”', '“', '·'}",d) Conferències anuals del Departament d'Informació Pública i les ONG: i) 56a (8 a 10 de setembre de...,,,,,
90771940,eliminacion_catalan,"caracteres_problematicos: {'”', '“'}","La recomanació “Käypä hoito” (“Tractament habitual”), que es va acabar de formular a finalitats de 2...",,,,,
90822226,eliminacion_catalan,caracteres_problematicos: {'·'},No hem d'oblidar que la família és un associat vital en els esforços per a aconseguir els Objectius ...,,,,,
90842685,eliminacion_catalan,"caracteres_problematicos: {'/', '”', '“'}","En la mateixa decisió, es va demanar al Director Executiu “que seguís promovent la coordinació de le...",,,,,
90873999,eliminacion_catalan,caracteres_problematicos: {'•'},• L'Informe mundial sobre el desenvolupament dels recursos hídrics.,,,,,
90890312,eliminacion_catalan,"caracteres_problematicos: {'/', ']'}","II, secc. A, resolución 2004/87, y cap.]",,,,,
90911885,eliminacion_catalan,caracteres_problematicos: {'·'},"Tots els òrgans de les Nacions Unides, els organismes, els programes i els Estats membres tenen la r...",,,,,
90918362,eliminacion_catalan,caracteres_problematicos: {'/'},Decideix que el contingut dels paràgrafs 1 a 4 de la decisió /CP.10 (Qüestions relacionades amb l'ex...,,,,,
90953219,eliminacion_catalan,caracteres_problematicos: {'·'},Resulta igualment imprescindible que el sistema de seguiment i informació es basi en dades fiables i...,,,,,
90964015,eliminacion_catalan,"caracteres_problematicos: {'/', '·'}","Observa amb reconeixement que, tal com va demanar en el paràgraf 14 de la seva resolució 58/133, el ...",,,,,
90993863,eliminacion_catalan,"caracteres_problematicos: {'”', '“', '—'}",El Relator utilitza la paraula “incorporació” per salvar la distància entre el que segons les seves ...,,,,,
91061823,eliminacion_catalan,caracteres_problematicos: {'/'},"En la 52a sessió, celebrada el 8 de novembre, la Secretària de la Comissió va donar lectura a una de...",,,,,
91069594,eliminacion_catalan,caracteres_problematicos: {'/'},És descoratjador observar que el VIH/SIDA ha deixat 11 milions d'orfes a tot el món.,,,,,
91083405,eliminacion_catalan,caracteres_problematicos: {'%'},"En 2000, les dones del meu país a penes superen el 20% en l'àmbit de l'adopció de decisions polítiqu...",,,,,
91089121,eliminacion_catalan,"caracteres_problematicos: {'”', '“'}","En l'última oració, després de les paraules “es contribuirà” afegeixin-se les paraules “al seguiment...",,,,,
91247597,eliminacion_catalan,caracteres_problematicos: {'·'},"El dia d'avui, primer Dia de la Industrialització d'Àfrica del nou mil·lenni, constitueix una fita p...",,,,,
91250606,eliminacion_catalan,caracteres_problematicos: {'/'},(El text complet del document S/PRST/2000/7 figura en l'apèndix VI.,,,,,
91386057,eliminacion_catalan,caracteres_problematicos: {'·'},Em sembla que s'ha pres una consciència clara de la magnitud de les qüestions que hem de tractar i d...,,,,,
91409418,eliminacion_catalan,caracteres_problematicos: {'/'},"Pel que fa a la legislació contra els actes de racisme, la COE/ECRI va acollir amb satisfacció la Ll...",,,,,
91424317,eliminacion_catalan,caracteres_problematicos: {'/'},"República de Corea (A/C.6/63/SR.19, par.",,,,,
91453554,eliminacion_catalan,"caracteres_problematicos: {'”', '“'}",La seva intenció és concloure aquesta anàlisi en la segona part del present informe i possibilitar a...,,,,,
91455804,eliminacion_catalan,caracteres_problematicos: {'/'},Cost estimat de l'equipament del saló/biblioteca,,,,,
91485815,eliminacion_catalan,caracteres_problematicos: {'/'},Les opinions dels representants que van intervenir durant l'examen del tema per la Comissió figuren ...,,,,,
91495198,eliminacion_catalan,caracteres_problematicos: {'%'},"La revisió de l'escala tampoc bastarà per a canviar substancialment la situació, atès que les econom...",,,,,
91496515,eliminacion_catalan,"caracteres_problematicos: {'/', '”', '“'}","El lloc del PNUFID en la Xarxa va continuar sent, principalment, un vehicle de promoció per a les ac...",,,,,
91500122,eliminacion_catalan,caracteres_problematicos: {'·'},"A més del Programa KOREASAT, la República de Corea ha realitzat recerques sobre les perspectives del...",,,,,
91509111,eliminacion_catalan,caracteres_problematicos: {'·'},Es crearà una Comissió de Conciliació a sol·licitud de qualsevol de les parts en la controvèrsia.,,,,,
91527196,eliminacion_catalan,caracteres_problematicos: {'/'},2001/Drets del nen,,,,,
91555777,eliminacion_catalan,caracteres_problematicos: {'·'},"Guéhenno, per la seva excel·lent intervenció. Reitero que Noruega fa costat totalment al Representan...",,,,,
91667960,eliminacion_catalan,caracteres_problematicos: {'/'},Tenim grans esperances xifrades en el compliment de la Declaració que haurem d'aprovar i en l'eficàc...,,,,,
91727355,eliminacion_catalan,caracteres_problematicos: {'·'},"Demana al Secretari General que, de conformitat amb la recomanació 4 de l'Oficina de Serveis de Supe...",,,,,
91734718,eliminacion_catalan,caracteres_problematicos: {'·'},"L'article 48, no obstant això, indica els límits dins dels quals un Estat diferent de l'Estat lesion...",,,,,
91784685,eliminacion_catalan,"caracteres_problematicos: {'”', '“'}",“La pau a Angola també tindrà importants conseqüències per a la República Democràtica del Congo i Si...,,,,,
91793134,eliminacion_catalan,caracteres_problematicos: {'%'},a) La variació de la tensió de la xarxa no serà superior a 0% de l'atenció normal;,,,,,
91817646,eliminacion_catalan,"caracteres_problematicos: {'/', '”', '“'}",El tema titulat “Convenció sobre prohibicions o restriccions de l'ús de certes armes convencionals q...,,,,,
91879783,eliminacion_catalan,caracteres_problematicos: {'/'},"i) El pressupost per al període comprès entre l'1 de juliol de 2001 i el 30 de juny de 2002, aprovat...",,,,,
91892236,eliminacion_catalan,"caracteres_problematicos: {'”', '“'}","Pel que fa a la proliferació d'armes químiques, biològiques i la seva possible utilització per grups...",,,,,
91897458,eliminacion_catalan,caracteres_problematicos: {'/'},"Amb el suport de la comunitat internacional, el Govern ha adoptat polítiques i programes en esferes ...",,,,,
91924213,eliminacion_catalan,caracteres_problematicos: {'/'},"L'opció 1 segueix el text de l'article 29 de la Llei Model en remetre a la regla de la majoria, però...",,,,,
91970319,eliminacion_catalan,caracteres_problematicos: {'·'},Reconeixent que l'ocupació plena i productiva i el treball decent per a tots són un dels elements cl...,,,,,
91990046,eliminacion_catalan,caracteres_problematicos: {'/'},"Informe de la Comissió de les Nacions Unides per al Dret Mercantil Internacional, 41è període de ses...",,,,,
91993121,eliminacion_catalan,caracteres_problematicos: {'/'},"No obstant això, reiterem que un dels principals objectius de la Comissió de Consolidació de la Pau,...",,,,,
92083282,eliminacion_catalan,caracteres_problematicos: {'/'},28) El Comitè convida a l'Estat part a presentar el seu document bàsic de conformitat amb els requis...,,,,,
92087829,eliminacion_catalan,caracteres_problematicos: {'/'},"Havent conclòs l'examen de la comunicació núm. 303/2006, presentada al Comitè contra la Tortura en n...",,,,,
92112537,eliminacion_catalan,caracteres_problematicos: {'·'},"En 2005, s'estimava que el valor total de la pesca il·legal, no declarada i no reglamentada anava de...",,,,,
92153841,eliminacion_catalan,caracteres_problematicos: {'/'},"Vegeu A/C.5/61/3, annex.",,,,,
92154513,eliminacion_catalan,caracteres_problematicos: {'•'},"• S'encoratja als governs, les federacions esportives, les organitzacions intergovernamentals, les o...",,,,,
92201339,eliminacion_catalan,caracteres_problematicos: {'·'},La UNCTAD va exercir un paper substantiu de gran importància en la Reunió Internacional de Maurici p...,,,,,
92207582,eliminacion_catalan,caracteres_problematicos: {'/'},"També té importància especial el règim d'aplicació de mesures de privació de la llibertat, aprovat p...",,,,,
92324905,eliminacion_catalan,caracteres_problematicos: {'•'},"• Com establim els nostres objectius prioritaris, adoptem decisions àrdues i assegurem la seva aplic...",,,,,
92431668,eliminacion_catalan,"caracteres_problematicos: {'”', '“'}",En el suplement de la present nota figura un avantprojecte de disposicions legals model (d'ara endav...,,,,,
92463294,eliminacion_catalan,caracteres_problematicos: {'%'},"També és fonamental que la PNC compti amb els recursos necessaris, per la qual cosa expresso la meva...",,,,,
92466478,eliminacion_catalan,caracteres_problematicos: {'/'},"ICCD/COP(1)/11/Add.1 i Corr.1, decisió 2/COP.1, annex, par.",,,,,
92469941,eliminacion_catalan,"caracteres_problematicos: {'”', '“'}","El Sr. Nino Gómez (Veneçuela), en nom del Grup dels 77 i la Xina, presenta el projecte de resolució ...",,,,,
92483540,eliminacion_catalan,caracteres_problematicos: {'“'},“Lamento el to i el contingut de la declaració que acaba de pronunciar l'Observador palestí.,,,,,
92511594,eliminacion_catalan,caracteres_problematicos: {'/'},La delegació de Sud-àfrica confirma les propostes (A/AC.261/L.23) que formulés durant el primer perí...,,,,,
92537256,eliminacion_catalan,caracteres_problematicos: {'/'},El OSACT va prendre nota en el seu 15è període de sessions dels experts nomenats per les Parts per a...,,,,,
92541886,eliminacion_catalan,caracteres_problematicos: {'/'},"Respecte de les activitats i temes especials en ocasió del Decenni, en la seva resolució 55/282, de ...",,,,,
92561295,eliminacion_catalan,"caracteres_problematicos: {'”', '“'}",La difusió de la importància de les comunitats i els ecosistemes de muntanya ha augmentat des de l'a...,,,,,
92617688,eliminacion_catalan,"caracteres_problematicos: {'”', '“'}","Quant a la redacció, es va suggerir que s'examinessin les versions del projecte d'article en tots el...",,,,,
92617985,eliminacion_catalan,"caracteres_problematicos: {'/', ']', '―', '['}",A/57/399/Corr.1 Tema 109 a) ― Qüestions relatives als drets humans: aplicació dels instruments de dr...,,,,,
92650893,eliminacion_catalan,"caracteres_problematicos: {'/', ']', '['}",b La variació es calcula com [(2000-1990)/1990]x100 o [(2010-1990)/1990]x100.,,,,,
92706437,eliminacion_catalan,caracteres_problematicos: {'•'},• Assignar consignacions i controlar l'execució del pressupost,,,,,
92729019,eliminacion_catalan,caracteres_problematicos: {'·'},"Després dels al·legats finals presentats per les parts el 27 i 28 de febrer de 2003, la Sala va dict...",,,,,
92832405,eliminacion_catalan,caracteres_problematicos: {'·'},"Els Estats han realitzat progressos, alguns d'ells en un grau considerable, quant a reduir els culti...",,,,,
92839235,eliminacion_catalan,caracteres_problematicos: {'•'},• Establir el límit d'or i divises disponible que les institucions autoritzades per al comerç de div...,,,,,
93024066,eliminacion_catalan,"caracteres_problematicos: {'–', '>', '<'}","Karaoke-restaurant ""Oficina 57"" – és genial solidesa a la llum els efectes de la, <unk>a<unk>o<unk>e...",,,,,
93029692,eliminacion_catalan,caracteres_problematicos: {'·'},0120-115-838(Negoci de la instal·lació),,,,,
93045602,eliminacion_catalan,caracteres_problematicos: {'/'},Els adults/nens més grans s'allotgen per TWD 700 per persona i nit en un llit supletori.,,,,,
93056688,eliminacion_catalan,caracteres_problematicos: {'©'},© 2018 www.campornochat.com - Tots els Drets Reservats! Ajuda Termes i Condicions Declaració de Dret...,,,,,
93063486,eliminacion_catalan,caracteres_problematicos: {'·'},Mostrant pàgina 1 de 11 - Hi ha 307 Col·legi universitari articles,,,,,
93063499,eliminacion_catalan,caracteres_problematicos: {'©'},© 2019 LivePrivates.com - Tots els Drets Reservats! Ajuda Termes i Condicions Declaració de Dret de ...,,,,,
93140370,eliminacion_catalan,caracteres_problematicos: {'/'},10/06/2019 per Aceris Ley LLC,,,,,
93347136,eliminacion_catalan,caracteres_problematicos: {'+'},"Comunicar-se per telèfon amb l'oficina d'aquesta oficina, truqui al +7-495-740-96-49 ells mateixos l...",,,,,
93370283,eliminacion_catalan,caracteres_problematicos: {'·'},Creem el nostre generador de codi d'activació Steep molt senzill d'utilitzar. Només ha de descarrega...,,,,,
93395317,eliminacion_catalan,caracteres_problematicos: {'·'},"TV Airtel: pel·lícules, sèries de TV, TV en directe",,,,,
93396397,eliminacion_catalan,"caracteres_problematicos: {'+', ']', '·', '['}",Excel·lent 4.5+ [743],,,,,
93494714,eliminacion_catalan,caracteres_problematicos: {'/'},"Àrees d'estar interiors, 492 m2 / 5.300 peus2",,,,,
93572124,eliminacion_catalan,caracteres_problematicos: {'·'},"Instal·lacions de l'habitació : Aire condicionat, Alarm clock, Assecador, Bany, Banyera, Caixa forta...",,,,,
93583436,eliminacion_catalan,caracteres_problematicos: {'»'},Socis » Partner Program » Soci de Servei Autoritzat (ASP) » Programa de Certificació,,,,,
93713890,eliminacion_catalan,"caracteres_problematicos: {']', '['}","V2.05: Documentació i admin-page pantalla canvia. No crític. [Agost 30, 2011]",,,,,
93747582,eliminacion_catalan,"caracteres_problematicos: {'%', '+', '$'}","BlackFriday Promocions, fins a 40% fora: Si vostè compra més de $275, utilitzeu el codi de cupó, gau...",,,,,
93786778,eliminacion_catalan,caracteres_problematicos: {'$'},RESERVA D'US$ 533,,,,,
93797188,eliminacion_catalan,caracteres_problematicos: {'/'},Com puc contactar amb el servei al client de http://www.flowers4san-antonio.com si tinc un problema?,,,,,
93914013,eliminacion_catalan,caracteres_problematicos: {'/'},"Jo sóc un/una man, 40 , buscant un/una woman des de 31 fins 40",,,,,
94030474,eliminacion_catalan,caracteres_problematicos: {'&'},Converteix MP4 a YouTube Gratis en Línia_ Media.io - Convertidor Gratuït de Vídeo & Àudio,,,,,
94079660,eliminacion_catalan,caracteres_problematicos: {'/'},02/06/2017 per Aceris Ley LLC,,,,,
94142230,eliminacion_catalan,caracteres_problematicos: {'%'},Dies amb beneficis: 51.44%,,,,,
288182,eliminacion_chino,"caracteres_no_chinos: {','}","然后,9个月后她就消失了，她发现了活着，令人惊讶的几乎每个人。",,,,,
792920,eliminacion_chino,caracteres_no_chinos: {'.'},6.土耳其奖学金为满足这些条件的所有国家公民开放。,,,,,
897469,eliminacion_chino,caracteres_no_chinos: {'-'},“你可以说她的风险非常非常低” - 甚至低于没有遗传改变的女性。,,,,,
1065625,eliminacion_chino,caracteres_no_chinos: {'-'},“亚马逊是如此重要 - 一个至关重要的世界 - 不仅仅是动物和植物以及居住在那里的人们，”她补充道。,,,,,
1150681,eliminacion_chino,"caracteres_no_chinos: {','}","她和他呆在一起，直到他去世后,1947年4月8日。",,,,,
1466556,eliminacion_chino,"caracteres_no_chinos: {','}","在过去的85年中，我们设计了超过6,400个项目。",,,,,
1479696,eliminacion_chino,"caracteres_no_chinos: {','}","5、大约50年后,1700种两栖动物、鸟类和哺乳动物将面临更高的灭绝风险，因为它们的自然栖息地正在缩小。",,,,,
1872300,eliminacion_chino,caracteres_no_chinos: {'-'},Bond-i项目将继续扩大和改进，并受益于基金会投资者和其他资本市场伙伴的投入和反馈。,,,,,
2331202,eliminacion_chino,caracteres_no_chinos: {'-'},练习模式-在这种无竞争的无竞争模式中自由地保存你的进步。,,,,,
2376946,eliminacion_chino,"caracteres_no_chinos: {','}","根据《全球烟草危害减少状况报告》,39个国家禁止销售电子烟或尼古丁液体。",,,,,
2822657,eliminacion_chino,caracteres_no_chinos: {'.'},6. 机器学习：理解数据的算法中的艺术和科学（Machine Learning： The Art and Science of Algorithms that Make Sense of Data）—...,,,,,
2867004,eliminacion_chino,caracteres_no_chinos: {'-'},支持生殖健康在整个生命周期中，在各种服务部门必须加强，从卫生和教育系统，甚至运输系统 - 这是需要确保卫生保健访问。,,,,,
2999720,eliminacion_chino,caracteres_no_chinos: {'-'},MAAS由15场景组成 - 包括“我几乎一被告知它，我就会忘记一个人的名字”，“我倾向于快速走路去我要去的地方而不注意我一路走来的经验“ - 从1-6的范围内回答，从”几乎总是“到”几乎从不“。”,,,,,
3106753,eliminacion_chino,caracteres_no_chinos: {'.'},约瑟夫·盖特 Joseph Gatt…….Science Officer 0718,,,,,
3206088,eliminacion_chino,caracteres_no_chinos: {'・'},“好，“她勉强承认，“简・安德鲁斯上周从西方回来了，她要嫁给温尼伯的百万富翁了。,,,,,
3209765,eliminacion_chino,caracteres_no_chinos: {'%'},“在印尼，虽然现金仍是王道，但我100%相信，未来我们终将会迈向一个无现金社会。”,,,,,
3525169,eliminacion_chino,caracteres_no_chinos: {'-'},这些描述同时准确而又不准确-人类生存的广阔空间。,,,,,
3779634,eliminacion_chino,caracteres_no_chinos: {'-'},C-Lines还为您的项目提供完整的开发目录，以满足用户和设备制造商的所有期望。,,,,,
3955528,eliminacion_chino,"caracteres_no_chinos: {""'""}",学生的影响都必须承诺我们的'英文'的政策。”,,,,,
4030190,eliminacion_chino,"caracteres_no_chinos: {""'""}",青少年足球教练威胁11岁球员：'闪电战'跑回直到他受伤,,,,,
4219274,eliminacion_chino,caracteres_no_chinos: {'.'},2.数据基于标准I2C协议的需要，没有在生产中测试。,,,,,
4235601,eliminacion_chino,caracteres_no_chinos: {'%'},自2010年初以来，这个比率一直介乎40%至60%，而这个范围被视为平衡局面。,,,,,
4421783,eliminacion_chino,caracteres_no_chinos: {'-'},Step 1 of 4 - 关于您的资料,,,,,
4522599,eliminacion_chino,caracteres_no_chinos: {'*'},* 1970年武装部队指挥官领导的军事政府 1970年10月6日 1970年10月7日 成员：,,,,,
4617829,eliminacion_chino,caracteres_no_chinos: {'-'},“我们在国内生产的石油比我们从世界其他国家购买的石油还多 - 这是近20年来第一次发生。,,,,,
4667593,eliminacion_chino,caracteres_no_chinos: {'-'},投票与丑闻 在1972-2009年期间，瑞士选民曾3次否决禁止武器出口的动议。,,,,,
4832405,eliminacion_chino,caracteres_no_chinos: {'-'},3000中引入了Austin-Healey 1959 Big Healey，取代了Austin-Healey 100-6。,,,,,
