linea,tipo,razon,texto_original,porcentaje_automatico,detalles_base,detalles_avanzados,texto_catalan,texto_chino
90409873,eliminacion_catalan,caracteres_problematicos: {'%'},Pren nota de l'estat de les contribucions per a la Missió de les Nacions Unides per al Referèndum de...,,,,,
90421363,eliminacion_catalan,caracteres_problematicos: {'·'},"Considerem que la qüestió de les armes petites i armes lleugeres, les veritables armes de destrucció...",,,,,
90467401,eliminacion_catalan,caracteres_problematicos: {'•'},• La Llei contra el bioterrorisme de 2002 (Llei No. 107-188) i els corresponents reglaments del Serv...,,,,,
90548584,eliminacion_catalan,caracteres_problematicos: {'/'},La Comissió reconeix que la inversió estrangera pot aportar una contribució important a les infraest...,,,,,
90587421,eliminacion_catalan,caracteres_problematicos: {'/'},"El Comitè recomana a l'Estat Part que, tenint en compte les seves Observacions generals N.o 3, relat...",,,,,
90622736,eliminacion_catalan,caracteres_problematicos: {'%'},Les despeses en excés de les consignacions van obeir a: a) l'escala de sous del personal de contract...,,,,,
90627926,eliminacion_catalan,caracteres_problematicos: {'/'},"Recordant la decisió IDB.31/Dec.3,",,,,,
90686867,eliminacion_catalan,caracteres_problematicos: {'·'},"El paràgraf 2 de l'article 40 de la Convenció conté una important llista de drets i garanties, que t...",,,,,
90710785,eliminacion_catalan,caracteres_problematicos: {'—'},"Molts d'aquests joves —soldats, policies i civils de les més diverses procedències— mai han prestat ...",,,,,
90756749,eliminacion_catalan,caracteres_problematicos: {'·'},No hi hauria millor manera d'il·lustrar amb quanta claredat les persones directament afectades recon...,,,,,
90783215,eliminacion_catalan,caracteres_problematicos: {'·'},Encareix que en aquest context es reconegui degudament el valor de la col·laboració entre els agents...,,,,,
90805154,eliminacion_catalan,"caracteres_problematicos: {'”', '“', '/'}","Com es recordarà, el Secretari General va presentar a l'Assemblea General en el seu cinquantè setè p...",,,,,
90816912,eliminacion_catalan,caracteres_problematicos: {'•'},"• Determinar responsabilitats i incoar, davant els tribunals nacionals i internacionals competents, ...",,,,,
90856665,eliminacion_catalan,caracteres_problematicos: {'·'},"Harris, la sentència finita simultània hauria estat de set anys i mig si el Tribunal d'Apel·lació no...",,,,,
90922959,eliminacion_catalan,"caracteres_problematicos: {'”', '“'}","En la nostra opinió, una campanya significativa i eficaç contra el terrorisme exigeix consens sobre ...",,,,,
90936211,eliminacion_catalan,caracteres_problematicos: {'·'},En el període examinat la secretaria va examinar una sol·licitud de correcció de reclamacions de la ...,,,,,
91029242,eliminacion_catalan,caracteres_problematicos: {'·'},Observo complagut que aquesta mesura ha facilitat granment l'aprovació o l'aixecament de les suspens...,,,,,
91055589,eliminacion_catalan,caracteres_problematicos: {'·'},"Segons el Marroc, s'hauria d'identificar a aquestes persones o, almenys, se'ls hauria de permetre l'...",,,,,
91217712,eliminacion_catalan,"caracteres_problematicos: {'”', '“', '/'}",A/C.1/55/L.14/Rev.2 - Projecte de resolució revisat titulat “Centre Regional de les Nacions Unides p...,,,,,
91227962,eliminacion_catalan,caracteres_problematicos: {'·'},Demano als nostres col·legues d'Etiòpia i Eritrea que permetin que aquesta ocasió constitueixi un no...,,,,,
91239481,eliminacion_catalan,caracteres_problematicos: {'·'},El Relator Especial reconeix l'excel·lent cooperació que va rebre del Govern del Sudan durant la sev...,,,,,
91399451,eliminacion_catalan,"caracteres_problematicos: {'”', '“'}",El President Regional per a l'Àfrica central i occidental del CIBS va participar en la taula rodona ...,,,,,
91408798,eliminacion_catalan,caracteres_problematicos: {'/'},"Convenció sobre els Drets de l'Infant, Observació general núm. 4; A/CONF.171/13, par.",,,,,
91442573,eliminacion_catalan,caracteres_problematicos: {'/'},"Per a facilitar la labor del Fòrum en el seu vuitè període de sessions, d'acord amb el que es dispos...",,,,,
91522255,eliminacion_catalan,caracteres_problematicos: {'/'},S'ha donat nova redacció al projecte preliminar d'instrument interpretatiu contingut en el paràgraf ...,,,,,
91545685,eliminacion_catalan,caracteres_problematicos: {'—'},"Avui mateix, en considerar el vertiginós avanç de la globalització i la forma com —gràcies a la més ...",,,,,
91734129,eliminacion_catalan,caracteres_problematicos: {'·'},"El dret a la negociació col·lectiva està emparat per l'article 3 de la Llei de convenis col·lectius,...",,,,,
91785078,eliminacion_catalan,"caracteres_problematicos: {'”', '“'}",Les sancions “aparents” només serveixen perquè el món sigui un lloc segur per als violadors i per pe...,,,,,
91793805,eliminacion_catalan,caracteres_problematicos: {'·'},La delegació índia espera que la Cimera de Johannesburg revitalitzi una col·laboració mundial que ti...,,,,,
91804223,eliminacion_catalan,caracteres_problematicos: {'·'},"Si bé la Secretaria no redacta oficialment textos per a l'adopció de mesures, pot fer-ho respecte a ...",,,,,
91846042,eliminacion_catalan,caracteres_problematicos: {'°'},En vista de les dates en què se celebrarà el 32° període de sessions de la Comissió d'Estadística (6...,,,,,
91880507,eliminacion_catalan,"caracteres_problematicos: {'”', '·', '“', '/'}","A més, en la seva resolució 1999/31 de 28 de juliol de 1999, el Consell Econòmic i Social, reconeixe...",,,,,
91886288,eliminacion_catalan,caracteres_problematicos: {'/'},"Els membres del Consell tenen davant si el document S/2001/157, que conté el text del projecte de re...",,,,,
91888389,eliminacion_catalan,caracteres_problematicos: {'/'},Tema 95 del programa: Qüestions de política macroeconòmica (continuació) (A/C.2/56/L.3 i L.52),,,,,
91889169,eliminacion_catalan,caracteres_problematicos: {'·'},En aquesta carta vam donar al Consell en detalls el nombre de visats que hem atorgat i el nombre de ...,,,,,
91912896,eliminacion_catalan,"caracteres_problematicos: {'”', '“', '/'}","Posteriorment, en la resolució 51/226, l'Assemblea va demanar al Secretari General que seguís “elabo...",,,,,
92017752,eliminacion_catalan,caracteres_problematicos: {'·'},Encoratja al Relator Especial i a l'Oficina de l'Alt Comissionat de les Nacions Unides per als Drets...,,,,,
92056766,eliminacion_catalan,"caracteres_problematicos: {'”', '“'}","A més, el 2006 es va iniciar la campanya “Víctimes contra la Violència”.",,,,,
92113024,eliminacion_catalan,caracteres_problematicos: {'%'},Pren nota de l'estat de les contribucions per a l'Operació de les Nacions Unides en Côte d'Ivoire al...,,,,,
92136758,eliminacion_catalan,caracteres_problematicos: {'/'},Mesures. Es convidarà al OSACT a examinar els dos informes de síntesi a què es fa referència en els ...,,,,,
92370457,eliminacion_catalan,caracteres_problematicos: {'/'},Els Estats membres de l'Acord de Schengen han d'observar el que es disposa en el Reglament (CE) Núm....,,,,,
92408806,eliminacion_catalan,caracteres_problematicos: {'·'},"En virtut de l'apartat 4 de l'article 6 de la Llei de Refugiats, es denegarà la sol·licitud d'asil a...",,,,,
92470127,eliminacion_catalan,caracteres_problematicos: {'/'},"""Informe i recomanacions formulades pel Grup de Comissionats en relació amb la primera sèrie de recl...",,,,,
92557498,eliminacion_catalan,caracteres_problematicos: {'·'},La recent reunió del Quartet a Nova York es va referir de manera correcta a la necessitat d'avançar ...,,,,,
92575762,eliminacion_catalan,caracteres_problematicos: {'·'},Van concloure les etapes d'instal·lació i assaig de l'estació terrestre receptora de dades de satèl·...,,,,,
92628243,eliminacion_catalan,"caracteres_problematicos: {'%', '”', '“'}","Les dones ocupen el 18,75% dels ministeris del Govern i l'11,3% dels anomenats “llocs polítics super...",,,,,
92667769,eliminacion_catalan,caracteres_problematicos: {'·'},"El 31 de gener de 2002, el Comitè va transmetre la queixa a l'Estat Part perquè formulés les seves o...",,,,,
92678671,eliminacion_catalan,caracteres_problematicos: {'/'},"Vegeu Documents Oficials del Consell Econòmic i Social, 2003, Suplement núm. 3 i correcció (E/2003/2...",,,,,
92708133,eliminacion_catalan,"caracteres_problematicos: {'·', '—'}","A més, l'experiència en esferes específiques adquirida amb el procés de pau del meu país, Angola —en...",,,,,
92717314,eliminacion_catalan,caracteres_problematicos: {'•'},• Tractats d'extradició entre el Govern de Saint Vincent i les Grenadines i el Govern de la Repúblic...,,,,,
92717353,eliminacion_catalan,caracteres_problematicos: {'%'},"Si es prenen en consideració els efectes de la inflació i de les variacions de les taxes de canvi, l...",,,,,
92724052,eliminacion_catalan,caracteres_problematicos: {'/'},Prenent nota amb profund reconeixement de l'informe del Grup de Treball sobre les Poblacions Indígen...,,,,,
92740774,eliminacion_catalan,"caracteres_problematicos: {'”', '“'}",Numeral 2: “Les persones naturals o jurídiques interessades a transferir diners o valors hauran de p...,,,,,
92743305,eliminacion_catalan,"caracteres_problematicos: {'·', '/'}","Com ho sol·licités la Comissió en la seva resolució 2002/20, el ACNUDH ha convingut en les condicion...",,,,,
92757575,eliminacion_catalan,"caracteres_problematicos: {'”', '“'}",En el Cim Mundial sobre l'Alimentació es va observar que “la fam és tant causa com efecte de la pobr...,,,,,
92763207,eliminacion_catalan,caracteres_problematicos: {'/'},"En la mateixa sessió, el Sr. Bernards Andrew Nyamwaya Mudho, expert independent encarregat d'examina...",,,,,
92782169,eliminacion_catalan,caracteres_problematicos: {'•'},• Els comptes havien de congelar-se immediatament sense que es permetessin remeses de fons amb càrre...,,,,,
92802143,eliminacion_catalan,"caracteres_problematicos: {'”', '“'}","Per tant, és important que el règim d'insolvència respecti la prelació de les garanties reals existe...",,,,,
92807739,eliminacion_catalan,caracteres_problematicos: {'/'},"Considerant que el Secretari General, en resposta a la resolució 55/33 A, amb l'assistència d'un gru...",,,,,
92824389,eliminacion_catalan,"caracteres_problematicos: {'”', '“'}","Recordant les Estratègies de Nairobi orientades cap al futur per a l'avançament de la dona, en parti...",,,,,
92831094,eliminacion_catalan,"caracteres_problematicos: {'”', '“'}","En una reunió celebrada el 20 de juny de 2003, el Consell de Ministres va aprovar un “programa per a...",,,,,
92849287,eliminacion_catalan,"caracteres_problematicos: {'%', '”', '“'}",El Banc Mundial classifica a El Salvador i Guatemala com “països de baixos ingressos menys endeutats...,,,,,
92856382,eliminacion_catalan,caracteres_problematicos: {'·'},És alarmant que a l'Àfrica occidental hi hagi en circulació 8 milions d'armes il·lícites.,,,,,
92893127,eliminacion_catalan,"caracteres_problematicos: {'/', '[', '*', '·', ']'}",[right] * Les fotos són per a fins il·lustratius. [/right],,,,,
92917270,eliminacion_catalan,caracteres_problematicos: {'・'},・ Disponible exclusivament per a hostes individuals.,,,,,
92932601,eliminacion_catalan,"caracteres_problematicos: {'[', ']'}",Envia les teves entregues a [email protected] abans del 31 de Març de 2017.,,,,,
92941437,eliminacion_catalan,caracteres_problematicos: {'◆'},◆ Hi ha aparcament?,,,,,
93036604,eliminacion_catalan,caracteres_problematicos: {'/'},"I Cròniques, capítol 13 / Traducció a l'espanyol / Bíblia en línia",,,,,
93048874,eliminacion_catalan,caracteres_problematicos: {'/'},"L'apartament disposa de forn de microones, bullidor elèctric, rentaplats, cafetera/tetera i nevera a...",,,,,
93104752,eliminacion_catalan,caracteres_problematicos: {'>'},> Procés productiu,,,,,
93162598,eliminacion_catalan,caracteres_problematicos: {'·'},En cas que el sol·licitant és un estudiant d'Universitat o col·legi.,,,,,
93186652,eliminacion_catalan,caracteres_problematicos: {'·'},La solució de robot col·laboratiu de FlexLink rep una bona acollida a la PPMA Total Show 2016.,,,,,
93265246,eliminacion_catalan,caracteres_problematicos: {'·'},El dispositiu intel·ligent es comercialitza i ven a individus i empreses. La tecnologia CNC s'implem...,,,,,
93283530,eliminacion_catalan,caracteres_problematicos: {'+'},Sales d'estar + College,,,,,
93336537,eliminacion_catalan,caracteres_problematicos: {'·'},"Si necessita una Postil·la, però ve d'un país que no és membre de la Convenció de la Haia, nosaltres...",,,,,
93344309,eliminacion_catalan,caracteres_problematicos: {'·'},VyprVPN ofereix apps excel·lents i fàcils d'usar per a diverses plataformes i dispositius que inclou...,,,,,
93417467,eliminacion_catalan,caracteres_problematicos: {'💪'},Gràcies pel préstec! Un dels pocs projectes que realment funciona bé! Felicitats 💪,,,,,
93487521,eliminacion_catalan,caracteres_problematicos: {'·'},Hotels de Bali: obtenir la millor oferta de l'hotel d'interès turístic a Bali. Sense despeses de res...,,,,,
93513488,eliminacion_catalan,caracteres_problematicos: {'–'},fruits secs – Modest restaurants,,,,,
93525626,eliminacion_catalan,caracteres_problematicos: {'·'},Llevat que desactiveu aquestes tecnologies mitjançant l'ús del nostre lloc web i els nostres serveis...,,,,,
93560879,eliminacion_catalan,caracteres_problematicos: {'·'},Com no preocupar-se per si no es presenta (quan els clients no apareixen a l'alberg) i les cancel·la...,,,,,
93573237,eliminacion_catalan,caracteres_problematicos: {'/'},"Es proporcionen tres ports serials EIA-232, un port USB estàndard-B, un port d'Ethernet 10/100BASE-T...",,,,,
93625236,eliminacion_catalan,caracteres_problematicos: {'/'},L'estació de tren de Martin-Gropius-Bau és a 20 minuts a peu i l'Hotel Sarotti-Hofe és a 15 km de l'...,,,,,
93660536,eliminacion_catalan,"caracteres_problematicos: {'·', '>'}",Inici > Iniciar sessió > Sol·licitar una nova contrasenya,,,,,
93684592,eliminacion_catalan,caracteres_problematicos: {'&'},Els clients poden esmorzar al vestíbul cada matí. La varietat del menjar irlandès se serveix al rest...,,,,,
93691528,eliminacion_catalan,caracteres_problematicos: {'@'},Els subscrits tenen l'opció de desinscriure's en qualsevol moment visitant el Servei d'Atenció al Cl...,,,,,
93730309,eliminacion_catalan,"caracteres_problematicos: {'·', '/'}",Habitacions/Instal·lacions adaptades per a les persones de mobilitat reduïda 43 hotels,,,,,
93773676,eliminacion_catalan,caracteres_problematicos: {'·'},"Una vegada que s'ha instal·lat el turbocompressor, les línies d'oli i aigua s'hagin connectat, i la ...",,,,,
93775006,eliminacion_catalan,caracteres_problematicos: {'·'},"A l'exterior, la coberta de teca és perfecta per prendre el sol sota el sol i la cabina central és i...",,,,,
93792140,eliminacion_catalan,caracteres_problematicos: {'*'},* Dropcharge - Accés instantani a una quantitat determinada de crèdits de Topsexmodels trucant a un ...,,,,,
93811603,eliminacion_catalan,caracteres_problematicos: {'/'},Main / Les millors destinacions de vacances / El transport per carretera en particular Hongria,,,,,
93858755,eliminacion_catalan,caracteres_problematicos: {'*'},OJOS ALMIZCLES ÁNGEL AHR * 331688 Bay 1985,,,,,
93980079,eliminacion_catalan,caracteres_problematicos: {'·'},"Troba pistes a la teva col·lecció en funció del teu estat d'ànim per ajudar-te a despertar-te, relax...",,,,,
94140918,eliminacion_catalan,caracteres_problematicos: {'·'},"Habitació Doble (Doble) Habitació d'estil contemporani amb zona d'estar, TV de pantalla plana amb ca...",,,,,
94174044,eliminacion_catalan,caracteres_problematicos: {'/'},Següent entrada EML a PST convertidor / Importació mode batch,,,,,
101762,eliminacion_chino,"caracteres_no_chinos: {""'""}",' 您可以从公司获得的唯一责任是经济补偿，也许是道歉。,,,,,
573097,eliminacion_chino,caracteres_no_chinos: {'・'},当弗兰克・雅克松被带到医院的时候，警方在他的口袋中发现一封“招供信”。,,,,,
826850,eliminacion_chino,caracteres_no_chinos: {'&'},Q&A：一所大学是如何利用UEM来管理五个校区的终,,,,,
1113242,eliminacion_chino,caracteres_no_chinos: {'-'},x-roads已经被出口到了国外，爱沙尼亚和芬兰都跨界在线数据共享。,,,,,
1384263,eliminacion_chino,caracteres_no_chinos: {'-'},通过发送一个 kill（不是 kill -9）到mysqld 服务器来关闭 mysqld 服务器。,,,,,
1388799,eliminacion_chino,caracteres_no_chinos: {'.'},每天都有数以百计的新设计，如果不是数以千计的话.不幸的是，并不是所有的设计都是伟大的！,,,,,
1732556,eliminacion_chino,caracteres_no_chinos: {'%'},"因为，虽然世界旅游组织称自己是""联合国负责促进负责任、可持续和普及旅游的机构""，但有近20%的会员国不是没有加入，就是退出。",,,,,
1738752,eliminacion_chino,"caracteres_no_chinos: {','}","36,000个小镇是大约400家医疗技术公司的所在地，提供了大量潜在的工人，特别是如果像Aesculap一样，你是镇上最大的玩家，那里有3,600名员工。",,,,,
1822447,eliminacion_chino,"caracteres_no_chinos: {','}","向量可以用多种方式编写，尽管对我们最有用的是它们被写为n元组的形式，如（1,4,6,9）。",,,,,
2098332,eliminacion_chino,caracteres_no_chinos: {'-'},此外，WASP-96b大气中的钠含量与我们太阳系中的钠含量相似。,,,,,
2118510,eliminacion_chino,"caracteres_no_chinos: {','}","此外,2016大气污染防治法规定，应减少氨和挥发性有机物的排放量，畜牧业公司应减少恶臭气体的排放。",,,,,
2186711,eliminacion_chino,caracteres_no_chinos: {'-'},他两年后去世，享年44岁，对公司负债累累 - 与他作为新加坡有远见的创始人的现代形象相去甚远。,,,,,
2216925,eliminacion_chino,"caracteres_no_chinos: {','}","但在人口较少的巴勒斯坦，增长转化为468,000新互联网用户，而利比亚的增长代表了80万人上网。",,,,,
2318445,eliminacion_chino,caracteres_no_chinos: {'.'},最近的一些努力，诸如 asm.js 只是锦上添花罢了。,,,,,
2684265,eliminacion_chino,caracteres_no_chinos: {'-'},SCP-3812:我只是……我看到的那些东西从不消失。,,,,,
2841582,eliminacion_chino,"caracteres_no_chinos: {','}","该研究预测，到2006年，将有超过5000万户家庭在线查看账单,5200万户家庭将在线支付至少一张账单。",,,,,
2902351,eliminacion_chino,caracteres_no_chinos: {'-'},有人说，我们的头脑并没有预测未来 - 气候威胁的未来和未来将会出现的更多形式的威胁。,,,,,
3215702,eliminacion_chino,"caracteres_no_chinos: {','}","从生物化学的观点看，两个必须的酶反应需要维生素B12（钴胺）（Katzung， 1989, Hardman， 2001）。",,,,,
3319174,eliminacion_chino,caracteres_no_chinos: {'-'},他在英国反腐败调查人员抱怨，谁有”白痴”几乎毁掉Al-Yamama处理沙特阿拉伯。,,,,,
3416718,eliminacion_chino,"caracteres_no_chinos: {','}","在使徒教会阶,26:“对于他对我们说，以前，当他在教学中：”这是弱，应通过保存，这是强大。",,,,,
3611025,eliminacion_chino,caracteres_no_chinos: {'.'},84. 项目为期六个月（2010年7月至12月），重点是四个领域，详细信息见附件：（1）文化教育；（2）视听资源；（3）图书馆；（4）现场文化表演。,,,,,
3676790,eliminacion_chino,caracteres_no_chinos: {'-'},但是英国脱欧和唐纳德特朗普 - 以不同但复杂的方式 - 激发了爱尔兰的美国，并重新激活了华盛顿的游说活动。,,,,,
3705731,eliminacion_chino,caracteres_no_chinos: {'-'},“我们很高兴腾讯，eBay和微软 - 所有创新强国 - 选择与我们合作开展他们的印度之旅，”Flipkart的创始人Sachin Bansal和Binny Bansal在一份声明中说。,,,,,
3723366,eliminacion_chino,"caracteres_no_chinos: {""'""}",乔治觉得奇怪地说，”年代'pose他们是一个狂欢节或马戏团进城来，或者一场球赛，或任何该死的东西。,,,,,
3752008,eliminacion_chino,caracteres_no_chinos: {'.'},至于其他两款 OLED 机型，分析师称，最新 5.8 英寸的 OLED“Porsche（保时捷）” 机型，与现有的 iPhone X 相比显然不会有太多“重大的设计变化”。,,,,,
3766296,eliminacion_chino,caracteres_no_chinos: {'-'},近年来，Ebusco实施了多项创新，使其成为欧洲增长最快，最畅销的E-bus公司。,,,,,
3840512,eliminacion_chino,caracteres_no_chinos: {'.'},2.我们的投资目标包括增加来自可靠和多样来源的运营现金流，以便为我们的股东提供安全和不断增加的每股分配。,,,,,
3919251,eliminacion_chino,caracteres_no_chinos: {'-'},取自书：几乎被遗忘的一天 - 马克芬利,,,,,
4052944,eliminacion_chino,"caracteres_no_chinos: {','}","该组织通过受感染的网站和电子邮件提供超过1,000次实时零日攻击，以及超过65,000种活跃且广泛的威胁，将每个安全解决方案纳入测试。",,,,,
4102493,eliminacion_chino,caracteres_no_chinos: {'%'},在这本书中，Toomey写了一篇关于他现在支持的另外两种税制：平税，这要求企业支付17%的收入税（从目前的35%减少）和“公平税”，“这将完全取消企业和所得税，有利于销售税。,,,,,
4152160,eliminacion_chino,caracteres_no_chinos: {'.'},紧急的工作，是可能的数千名志愿者和支持者的帮助.。,,,,,
4186747,eliminacion_chino,"caracteres_no_chinos: {','}","1944年，芬兰有43,000“木汽车”，其中30,000辆是公共汽车和卡车,7,000辆私人汽车,4,000辆拖拉机和600只船。",,,,,
4217972,eliminacion_chino,"caracteres_no_chinos: {""'""}",It's funny how things， they change这是有趣的事情，他们是如何改变,,,,,
4269740,eliminacion_chino,"caracteres_no_chinos: {','}","根据TSMC给出的指数,2纳米过程是一个重要的节点。",,,,,
4271479,eliminacion_chino,"caracteres_no_chinos: {""'""}",当她度过美好的一天时，我会说，'不是今天。”,,,,,
4313269,eliminacion_chino,caracteres_no_chinos: {'.'},过去24小时的交易量显示，BCH市场在本周末交易了6.41亿美元。,,,,,
4554416,eliminacion_chino,caracteres_no_chinos: {'-'},他不存在，但是，在保罗的最后一次访问（徒21:15-40）的时间。,,,,,
4648041,eliminacion_chino,"caracteres_no_chinos: {'.', '-'}",MHI Vestas首席技术官Torben Hvid Larsen表示：V164-10.0 风机是“我们不接受传统思维限制的最佳证据”。,,,,,
4926454,eliminacion_chino,caracteres_no_chinos: {'-'},自从它被引入以来对救济金的最大变化，保守党声称他们引入了该计划，作为让失业者获得福利和工作的一种方式 - 将六种旧福利合并为一种付款。,,,,,
4931938,eliminacion_chino,caracteres_no_chinos: {'-'},2019年将是欧洲转型的一年：将选出一个新的欧洲会议，一个新的欧洲委员会将任职，英国将于3月29日离开联盟，并且将通过关于欧盟新的多年度金融框架2021-2027的最终协议。,,,,,
5061406,eliminacion_chino,caracteres_no_chinos: {'.'},在Baliferry.com预订时这通常不是一个问题，但是我们建议最多带行李2件，总重量不超过20kg。,,,,,
5176049,eliminacion_chino,caracteres_no_chinos: {'-'},对南方天空最大最准确的无线电观测结果在10月由高分辨率银河系与河外星系全天默奇森广域阵列（Galactic and Extragalactic All-sky Murchison Widefield ...,,,,,
5344622,eliminacion_chino,"caracteres_no_chinos: {','}","“不过,2018年信托公司整体奖金都会下滑”。",,,,,
5468084,eliminacion_chino,"caracteres_no_chinos: {','}","在另一个重要的医疗保健领域,5G将带来许多创新，例如机器人远程手术和个性化医疗，它将与用户发送的健康追踪数据一起使用。",,,,,
5667508,eliminacion_chino,caracteres_no_chinos: {'🏆'},每个区块链都会以一个🏆 Genesis Block 作为开始。,,,,,
5732083,eliminacion_chino,caracteres_no_chinos: {'-'},在这些状况发生期间与Site-441人员进行了联系，并顺利地解决了这一系列事件，但无法成功地防止今后的类似事件发生。,,,,,
5871708,eliminacion_chino,caracteres_no_chinos: {'-'},附录 244-A 没错，我知道这个是一个不应该为一只有感情的狗所操纵的一万种不同玩意的糟糕混合体，但我真的不会取笑一个给我倒了一杯美味的冰啤酒的玩意。,,,,,
5899883,eliminacion_chino,"caracteres_no_chinos: {','}","因此，分析师预测明年中期将进一步降价,4月份价格最低。",,,,,
6026727,eliminacion_chino,caracteres_no_chinos: {'-'},Psy-Group 的雄心壮志是打入美国大选市场。,,,,,
6594194,eliminacion_chino,caracteres_no_chinos: {'.'},此奖项由艾利丹尼森（Avery Dennison）赞助，获得R. Stanton Avery终身成就奖的个人，必须为标签行业的推广和发展做出重大贡献，并至少为行业服务25年。,,,,,
6606429,eliminacion_chino,caracteres_no_chinos: {'-'},2019 年 7 月 20 日 至 9 月 15 日- 年暑假期间，拥有 3 至 11 岁儿童的家庭有机会更进一步了解荷兰黄金时代最著名的画家 - 伦勃朗。,,,,,
6985095,eliminacion_chino,caracteres_no_chinos: {'.'},C. 申请购买任何流动资产并带入新加坡。,,,,,
7038891,eliminacion_chino,caracteres_no_chinos: {'-'},XQ-58A女武神是武器携带者，例如GPS控制的JDAM炸弹或GBU-39制导炸弹。,,,,,
7245771,eliminacion_chino,caracteres_no_chinos: {'.'},Streams从2013年1月的每周1亿增长到现在的2.6亿。,,,,,
