linea,tipo,razon,texto_original,porcentaje_automatico,detalles_base,detalles_avanzados,texto_catalan,texto_chino
88367427,eliminacion_catalan,"caracteres_problematicos: {'·', '%'}","A més, el fons col·lectiu per a les eleccions administrat pel PNUD sufraga al voltant del 85% de les...",,,,,
88386538,eliminacion_catalan,caracteres_problematicos: {'·'},"Paral·lelament a aquestes actuacions, el febrer de 2006 els autors van presentar una sol·licitud d'a...",,,,,
88392869,eliminacion_catalan,caracteres_problematicos: {'/'},En les actes resumides corresponents figura una ressenya de les deliberacions de la Comissió sobre e...,,,,,
88426442,eliminacion_catalan,caracteres_problematicos: {'%'},"En comparació amb l'exercici econòmic anterior, els ingressos van créixer en un 28,4%, és a dir en 9...",,,,,
88464744,eliminacion_catalan,caracteres_problematicos: {'·'},Va augmentar la consciència sobre els beneficis socioeconòmics de les aplicacions de la tecnologia e...,,,,,
88593041,eliminacion_catalan,caracteres_problematicos: {'%'},"58. El CRC va expressar la seva preocupació per l'augment de la pobresa, que afectava al voltant del...",,,,,
88623862,eliminacion_catalan,caracteres_problematicos: {'·'},11.- La majoria dels Estats part podia denegar una sol·licitud d'extradició pels mateixos tipus de r...,,,,,
88629223,eliminacion_catalan,caracteres_problematicos: {'·'},"Segons aquest sistema, hi ha un òrgan central encarregat de rebre i processar les denúncies relacion...",,,,,
88689995,eliminacion_catalan,caracteres_problematicos: {'/'},"No obstant això, el Comitè remet a les seves observacions finals conformement a la Convenció (CRC/C/...",,,,,
88763289,eliminacion_catalan,caracteres_problematicos: {'%'},"Exploten l'economia informal (el 75% en el medi urbà i el 95% en el rural), en la qual les dones són...",,,,,
88826642,eliminacion_catalan,"caracteres_problematicos: {']', '[', '/'}",16. Informe del Consell Econòmic i Social: projecte de resolució (A/67/L.43) [tema 9],,,,,
89034000,eliminacion_catalan,caracteres_problematicos: {'·'},"Al Nepal, en relació amb la manifestació esmentada anteriorment, les autoritats van tallar les línie...",,,,,
89233286,eliminacion_catalan,caracteres_problematicos: {'/'},"34. En la tercera sessió, celebrada el 19 de juny de 2012, el Relator Especial sobre el dret de tota...",,,,,
89310787,eliminacion_catalan,caracteres_problematicos: {'·'},Posant en relleu que l'aigua és fonamental per al desenvolupament sostenible i l'erradicació de la p...,,,,,
89313955,eliminacion_catalan,caracteres_problematicos: {'·'},Apreciant els resultats positius de la segona reunió dels Estats parteixes en la Convenció sobre les...,,,,,
89408727,eliminacion_catalan,caracteres_problematicos: {'·'},54. Les mesures legislatives i d'una altra índole adoptades per assegurar l'accés de les persones am...,,,,,
89463801,eliminacion_catalan,caracteres_problematicos: {'·'},Reconeixent la necessitat de proporcionar la base d'informació per a donar forma a l'agenda de desen...,,,,,
89501678,eliminacion_catalan,caracteres_problematicos: {'/'},"Seguidament, el Relator va presentar el projecte d'informe de la Conferència (A/CONF.103/L.1).",,,,,
89515260,eliminacion_catalan,caracteres_problematicos: {'/'},a) Va recordar la resolució GC.14/Res.2 sobre l'establiment de xarxes de coneixements i l'intercanvi...,,,,,
89565402,eliminacion_catalan,caracteres_problematicos: {'%'},"Durant el període que s'informa, en el marc d'aquest programa es van revisar 1.237 casos i es va pos...",,,,,
89589981,eliminacion_catalan,caracteres_problematicos: {'/'},"El 22 d'octubre de 2012, després que entre 25 i 30 soldats del FPM/ADN llancessin un atac a la zona ...",,,,,
89591390,eliminacion_catalan,caracteres_problematicos: {'/'},"Contribuir a la promoció i protecció dels drets humans en Côte d'Ivoire, prestant especial atenció a...",,,,,
89680338,eliminacion_catalan,caracteres_problematicos: {'%'},:: L'informe Perspectives econòmiques mundials del Banc Mundial de gener de 2014 mostra una desaccel...,,,,,
89803707,eliminacion_catalan,caracteres_problematicos: {'`'},"12. Decideix incloure en el programa provisional del seu setantè període de sessions, en relació amb...",,,,,
89836301,eliminacion_catalan,"caracteres_problematicos: {'·', '/'}","L'indicador 56 està directament relacionat amb les mesures subjectes a terminis ja esmentades, de co...",,,,,
89839681,eliminacion_catalan,caracteres_problematicos: {'%'},Es va aplicar el 93% de les recomanacions relatives als aspectes militars.,,,,,
89854355,eliminacion_catalan,caracteres_problematicos: {'%'},"Les estimacions del model mundial de l'informe d'avaluació global indiquen, per exemple, que és prob...",,,,,
89921541,eliminacion_catalan,caracteres_problematicos: {'·'},"El tribunal va determinar que les al·legacions de presó falsa, trastorns emocionals provocats delibe...",,,,,
89972585,eliminacion_catalan,caracteres_problematicos: {'/'},127.76 Prosseguir les mesures aplicades per garantir el dret a l'aigua i el sanejament en el marc de...,,,,,
89982294,eliminacion_catalan,caracteres_problematicos: {'%'},44. Es va incrementar en un 176% els treballadors que es troben assegurats en el sistema de segureta...,,,,,
90154874,eliminacion_catalan,caracteres_problematicos: {'·'},"a) Davant l'amenaça per a la salut pública, el mal al medi ambient que causa el cultiu il·lícit, les...",,,,,
90187522,eliminacion_catalan,"caracteres_problematicos: {']', '[', '/', '–'}",A/69/135/Add.1 Tema 88 del programa provisional – Reducció dels pressupostos militars –Informació ob...,,,,,
90267758,eliminacion_catalan,caracteres_problematicos: {'`'},"Referent a això, acull amb beneplàcit la labor que continuen desenvolupant en coordinació el Consell...",,,,,
90380730,eliminacion_catalan,caracteres_problematicos: {'·'},5 del Banc Central i en l'article 9 de la Llei sobre la lluita contra la legalització d'ingressos il...,,,,,
90447054,eliminacion_catalan,"caracteres_problematicos: {'”', '/', '“'}","En la 40a sessió, celebrada el 15 de novembre, el representant del Iemen, en nom dels Estats Membres...",,,,,
90458791,eliminacion_catalan,caracteres_problematicos: {'/'},"La font primordial d'informació per a la preparació de la present avaluació va ser la proposta, pres...",,,,,
90533620,eliminacion_catalan,caracteres_problematicos: {'/'},Serveixin-se indicar si s'ha incorporat una perspectiva de gènere als programes vigents per a combat...,,,,,
90552313,eliminacion_catalan,"caracteres_problematicos: {'”', '“'}",L'Estat Part sosté que la reserva formulada en relació amb l'article 9 no es pot considerar “incompa...,,,,,
90564594,eliminacion_catalan,caracteres_problematicos: {'—'},"Per això, el mes de juliol, aquí en les Nacions Unides, el Primer Ministre del Regne Unit va fer una...",,,,,
90612379,eliminacion_catalan,caracteres_problematicos: {'%'},"e) Reunions intergovernamentals sobre el finançament per al desenvolupament, celebrades el 26 d'abri...",,,,,
90642451,eliminacion_catalan,caracteres_problematicos: {'•'},"• Formular un projecte de llei específic sobre el tràfic de persones, en particular de dones i nenes...",,,,,
90740933,eliminacion_catalan,caracteres_problematicos: {'/'},2007/23 Informe acumulatiu sobre el marc de finançament pluriennal del UNIFEM corresponent a 2004-20...,,,,,
90745692,eliminacion_catalan,caracteres_problematicos: {'%'},"Encara que l'economia de Kenya ha registrat una taxa de creixement sense precedents del 6,1% i ha au...",,,,,
90792218,eliminacion_catalan,caracteres_problematicos: {'·'},"Cal assenyalar que l'Oficina va procedir a un exercici de reestructuració, després de l'examen reali...",,,,,
90812734,eliminacion_catalan,"caracteres_problematicos: {'”', '“'}","Probablement, la part armènia tindrà moltes dificultats per explicar que diversos dies abans que oco...",,,,,
90818698,eliminacion_catalan,caracteres_problematicos: {'·'},"Encoratja, referent a això, als fons i programes de les Nacions Unides, als organismes especialitzat...",,,,,
90975832,eliminacion_catalan,caracteres_problematicos: {'•'},"• Gestió de comptes bancaris, d'estalvis i de valors;",,,,,
90992147,eliminacion_catalan,"caracteres_problematicos: {'”', '“'}","Decideix examinar la qüestió en el seu seixantè primer període de sessions, en relació amb el tema “...",,,,,
91033769,eliminacion_catalan,"caracteres_problematicos: {'”', '“'}","L'expressió “força de treball” inclou als treballadors per compte propi, els empleats i els aturats.",,,,,
91043028,eliminacion_catalan,caracteres_problematicos: {'·'},Altres propostes en aquesta direcció van ser la de realitzar campanyes de promoció mitjançant fullet...,,,,,
91064078,eliminacion_catalan,"caracteres_problematicos: {'”', '“'}","En la seva tercera sessió, celebrada el 25 d'agost, el Comitè va tenir davant sí un document de carà...",,,,,
91080704,eliminacion_catalan,"caracteres_problematicos: {'”', '/', '“'}","En el seu cinquantè tercer període de sessions, l'Assemblea General va aprovar la resolució 53/150, ...",,,,,
91135827,eliminacion_catalan,caracteres_problematicos: {'/'},Altres Parts no recolzen aquesta proposta i consideren que aquest apèndix no és necessari (vegeu el ...,,,,,
91177442,eliminacion_catalan,caracteres_problematicos: {'%'},"Segons s'estima, els programes educatius que reben suport extern (especialment en les zones rurals) ...",,,,,
91195587,eliminacion_catalan,caracteres_problematicos: {'·'},Els països que contestin a les sol·licituds podrien incloure les condicions a les quals puguin estar...,,,,,
91242302,eliminacion_catalan,caracteres_problematicos: {'•'},"• Sostenir el desenvolupament agrícola, racionalitzar la utilització de l'aigua i millorar la conser...",,,,,
91257612,eliminacion_catalan,caracteres_problematicos: {'·'},"Comet delicte en el sentit del present Conveni qualsevol persona que, pel mitjà que sigui, il·lícita...",,,,,
91380295,eliminacion_catalan,caracteres_problematicos: {'·'},"Insta a les organitzacions del sistema de les Nacions Unides, les institucions de Bretton Woods, els...",,,,,
91383117,eliminacion_catalan,caracteres_problematicos: {'·'},"En el cas de Gaza, continuem instant a totes les parts a actuar amb la màxima moderació per a evitar...",,,,,
91409268,eliminacion_catalan,caracteres_problematicos: {'”'},"La mercaderia no podrà contenir carn de la fruita, polpa o altres impureses”.",,,,,
91425626,eliminacion_catalan,"caracteres_problematicos: {'”', '“'}",i) En quina mesura afecta la “tercera alternativa” a les altres dues.,,,,,
91478499,eliminacion_catalan,"caracteres_problematicos: {'—', '·'}","Els nostres fills, per als qui ens disposàvem a treballar en el vint-i-setè període extraordinari de...",,,,,
91593196,eliminacion_catalan,caracteres_problematicos: {'/'},"Com s'indica en l'informe, el President del Consell de Seguretat va emetre una declaració (S/PRST/20...",,,,,
91666506,eliminacion_catalan,caracteres_problematicos: {'·'},"Com a nouvingut, confio a treballar estretament amb tots els distingits col·legues d'aquesta sala i,...",,,,,
91687207,eliminacion_catalan,caracteres_problematicos: {'·'},La Comissió va prendre nota amb reconeixement que el Grup de Treball sobre la utilització de fonts d...,,,,,
91761172,eliminacion_catalan,caracteres_problematicos: {'/'},"En la mateixa sessió, el Relator Especial sobre la situació dels drets humans a l'Afganistan, el Rel...",,,,,
91770713,eliminacion_catalan,caracteres_problematicos: {'/'},"El 18 de maig de 2000, el Govern va transmetre informació relativa a Luis Mario García Rodríguez, en...",,,,,
91807623,eliminacion_catalan,"caracteres_problematicos: {'”', '`', '“'}","Projecte d'Informe del President del Grup de Treball sobre el tema 9 del programa, “Examen del conce...",,,,,
91844771,eliminacion_catalan,caracteres_problematicos: {'—'},Espero que la presència d'aquests joves esperits —les senyoretes de jaquetes vermelles que es troben...,,,,,
91849107,eliminacion_catalan,caracteres_problematicos: {'”'},No afecta a aquesta conclusió el fet d'invocar addicionalment davant el Comitè l'article 23 del Pact...,,,,,
91917575,eliminacion_catalan,"caracteres_problematicos: {']', '[', '/'}","En la quarta sessió, celebrada l'11 d'abril de 2008, tenint present el paràgraf 7 de la resolució 62...",,,,,
91926495,eliminacion_catalan,"caracteres_problematicos: {'”', '“'}",El Govern assigna fons perquè tots els estudiants puguin completar els nivells “A” (nivells avançats...,,,,,
91970811,eliminacion_catalan,"caracteres_problematicos: {'”', '“'}",“Armes de foc” (preguntes 1 a 4),,,,,
91971447,eliminacion_catalan,caracteres_problematicos: {'%'},"Durant el període a què es refereix l'informe, la Missió va introduir mesures per augmentar l'eficiè...",,,,,
91981918,eliminacion_catalan,"caracteres_problematicos: {'”', '“'}",b) Per “sistema aqüífer” s'entendrà una sèrie de dos o més aqüífers que estiguin connectats hidràuli...,,,,,
92061162,eliminacion_catalan,"caracteres_problematicos: {'”', '“'}","També era important abordar qüestions “humanes”, entre elles, la manera d'assegurar que la persona m...",,,,,
92082330,eliminacion_catalan,"caracteres_problematicos: {'·', '/'}","L'Assemblea General ha declarat en nombroses ocasions, inclusivament en els principis rectors en la ...",,,,,
92092231,eliminacion_catalan,"caracteres_problematicos: {'”', '“'}","Els Caps d'Estat i de Govern dels països que conformen la Comunitat Iberoamericana de Nacions, reuni...",,,,,
92132794,eliminacion_catalan,caracteres_problematicos: {'“'},“El Consell de Seguretat condemna en els termes més enèrgics possibles l'atemptat contra la vida del...,,,,,
92135066,eliminacion_catalan,caracteres_problematicos: {'/'},"El 40è període de sessions del Comitè de Drets Econòmics, Socials i Culturals, establert de conformi...",,,,,
92142071,eliminacion_catalan,caracteres_problematicos: {'—'},"Baquero Navarro (Fundació Acció Democràtica Porto-riquenya) diu que la seva organització, que és no ...",,,,,
92200313,eliminacion_catalan,caracteres_problematicos: {'·'},El nostre respecte pels valors i principis democràtics ens obliga a respectar l'elecció democràtica ...,,,,,
92204611,eliminacion_catalan,caracteres_problematicos: {'/'},Aquesta declaració serà publicada com a document del Consell de Seguretat amb la signatura S/PRST/20...,,,,,
92242442,eliminacion_catalan,caracteres_problematicos: {'/'},Tema 8 d): Exempcions pluriennals per a l'ús del metilbromuro (decisió XVI/3),,,,,
92259124,eliminacion_catalan,caracteres_problematicos: {'/'},"Durant el primer període de sessions del GTE, el President de la CP 11 i la CP/RP 1 va entaular cons...",,,,,
92296076,eliminacion_catalan,"caracteres_problematicos: {'”', '“'}","Taiwan reconeix plenament el dret de tots els pobles del món a adherir-se a les Nacions Unides, com ...",,,,,
92361290,eliminacion_catalan,caracteres_problematicos: {'/'},Serveixin-se presentar els resultats de l'estudi de 2001 finançat pel Govern sobre la igualtat de re...,,,,,
92362916,eliminacion_catalan,caracteres_problematicos: {'/'},"Les activitats esmentades quedarien compreses en el subprograma 9, Ordenació sostenible dels boscos,...",,,,,
92374501,eliminacion_catalan,caracteres_problematicos: {'/'},Diversos participants van acollir de grat la refundició de les propostes presentades a la Reunió Pre...,,,,,
92443724,eliminacion_catalan,"caracteres_problematicos: {'”', '“'}","Recolzem tots els esforços que han realitzat els facilitadors, inclòs el “quartet” i els enviats del...",,,,,
92457220,eliminacion_catalan,caracteres_problematicos: {'”'},El present paràgraf serà aplicable a l'esmena de qualsevol annex del present Instrument tret que en ...,,,,,
92473917,eliminacion_catalan,"caracteres_problematicos: {'”', '“'}",“Demana al Secretari General que organitza la reunió del procés de consultes a Nova York del 2 al 6 ...,,,,,
92475876,eliminacion_catalan,caracteres_problematicos: {'/'},"a) Revisi les polítiques i les pràctiques vigents relatives als nens amb discapacitats, tenint degud...",,,,,
92553796,eliminacion_catalan,caracteres_problematicos: {'/'},9.099/95 va establir els tribunals penals especials amb la finalitat de facilitar l'accés a la justí...,,,,,
92633953,eliminacion_catalan,"caracteres_problematicos: {'”', '“'}",El paràgraf 5 diu que “tot tipus de participació forçosa del nen en el mercat de treball crea respon...,,,,,
92709006,eliminacion_catalan,caracteres_problematicos: {'/'},En l'informe de 2001 del Relator Especial sobre el dret a la llibertat d'opinió i d'expressió (I/CN....,,,,,
92768837,eliminacion_catalan,caracteres_problematicos: {'·'},"Fa una crida urgent a tots els Estats, al sistema de les Nacions Unides i a les organitzacions inter...",,,,,
92793906,eliminacion_catalan,"caracteres_problematicos: {'”', '“'}","154 i 155, les organitzacions internacionals “tenen personalitat internacional quan compleixen certe...",,,,,
92816217,eliminacion_catalan,"caracteres_problematicos: {']', '[', '”'}",[inserir tots els incisos de l'apartat 1] b] del projecte de disposició relativa a l'execució].”,,,,,
92827205,eliminacion_catalan,"caracteres_problematicos: {'”', '“'}",Una qüestió connexa amb l'anterior és la de determinar en quina mesura l'adreça des de la qual es va...,,,,,
92845192,eliminacion_catalan,"caracteres_problematicos: {'”', '“'}","En aquests moments, la ciutat es troba sota el control de les milícies oposades al Coronel “Shatigad...",,,,,
92856141,eliminacion_catalan,"caracteres_problematicos: {'”', '“'}",Es tracta de fet de mercenaris sense fronteres que l'únic que deixen al seu pas és destrucció i vexa...,,,,,
92945180,eliminacion_catalan,"caracteres_problematicos: {'$', '/'}",Preu inicial $ 4.99/mes $ 4.17/mes 121332/,,,,,
92965810,eliminacion_catalan,caracteres_problematicos: {'/'},Oasis Active _ Interessat/da en bernardar130868?,,,,,
92969979,eliminacion_catalan,"caracteres_problematicos: {'$', '%'}","Comprar cada 1 per 3,42 $ i guardar 47%",,,,,
93020351,eliminacion_catalan,"caracteres_problematicos: {'~', '/'}",1 ~ 6 persones 800 iens / hora / persona,,,,,
93044899,eliminacion_catalan,"caracteres_problematicos: {'+', '@'}",Més informació sobre perfils de clients amb nosaltres @ +91-7899887755 o sales@kapturecrm.com o regi...,,,,,
93045331,eliminacion_catalan,caracteres_problematicos: {'·'},Vostè em pot preguntar mitjans: És individual estaca o l'acció col·lectiva?,,,,,
93100887,eliminacion_catalan,caracteres_problematicos: {'/'},"/ 22-40 90Th Street, Nova York, Estats Units / contacti'ns",,,,,
93121549,eliminacion_catalan,caracteres_problematicos: {'–'},"Una altra petició – si us plau utilitzi el nostre trac (trac.transposh.org) presentar errors, això e...",,,,,
93126172,eliminacion_catalan,caracteres_problematicos: {'/'},"Integracions addicionals permeten l'expansió de serveis com: Plataformes de targetes, Processament d...",,,,,
93166402,eliminacion_catalan,caracteres_problematicos: {'@'},Si en el teu cas vols que es deixin de fer servir Cookies amb les finalitzats que es descriuen aquí ...,,,,,
93171206,eliminacion_catalan,caracteres_problematicos: {'•'},"Per REDACCIÓ • 30 Dec, 2014 • Secció: Cursos, classes, tallers, Esdeveniments",,,,,
93289646,eliminacion_catalan,caracteres_problematicos: {'·'},"3:6 vaig plantar, Apol·lo va regar, però Déu va proveir el creixement.",,,,,
93308345,eliminacion_catalan,caracteres_problematicos: {'↓'},Vaig rebre el premi Influence Awards al millor contingut de Infuencity. Agraïments i vídeo fent clic...,,,,,
93312688,eliminacion_catalan,caracteres_problematicos: {'@'},Si vols que es deixin de processar les teves dades d'acord amb el que s'estipula als propòsits C-F i...,,,,,
93336017,eliminacion_catalan,caracteres_problematicos: {'@'},Si vols que es deixin de processar les teves dades d'acord amb el que s'estipula als propòsits C-F i...,,,,,
93404246,eliminacion_catalan,caracteres_problematicos: {'–'},Avís sobre les cookies – Hotel Doña Lina _ Web Oficial _ Hotels a Sevilla,,,,,
93452437,eliminacion_catalan,caracteres_problematicos: {'&'},Terra d'ús agrícola (arable & cultius permanents),,,,,
93576312,eliminacion_catalan,"caracteres_problematicos: {'·', '–'}",Official Vulcain Watches website – The Watch for Presidents Inici Col·lecció Història Fabricació Dis...,,,,,
93594509,eliminacion_catalan,caracteres_problematicos: {'/'},Notícies / Notícies d'última hora,,,,,
93717214,eliminacion_catalan,caracteres_problematicos: {'@'},El The Hills Motel controla el processament de dades personals recopilades des de la pàgina web i a ...,,,,,
93747482,eliminacion_catalan,caracteres_problematicos: {'·'},"Comissariada pel guardonat dissenyador teatral Gino Gonzales, l'exposició de Filipines a l'Internati...",,,,,
93763858,eliminacion_catalan,caracteres_problematicos: {'/'},Si us plau poseu-vos en contacte amb el nostre Equip d'Atenció al Client. Els nostres operadors amis...,,,,,
93850521,eliminacion_catalan,caracteres_problematicos: {'·'},Ultratech Cement va anotar un 'hat-trick' en guanyar tres premis en els premis a l'Excel·lència en l...,,,,,
93864029,eliminacion_catalan,caracteres_problematicos: {'☆'},"Durant el lliurament del vídeo ha de ser de tir! I☆lluita de la ""versió completa"" de les històries d...",,,,,
93873244,eliminacion_catalan,caracteres_problematicos: {'©'},© Surrey Translation Bureau 2019. Tots els drets reservats,,,,,
93878770,eliminacion_catalan,caracteres_problematicos: {'%'},valor de descompte: 15% Descompte en la seva primera compra en aplicació.,,,,,
93974908,eliminacion_catalan,caracteres_problematicos: {'*'},*Els bitllets per a adults són aplicables per a visitants de 14 a 55 anys. Els nens d'1 a 13 anys ne...,,,,,
93983482,eliminacion_catalan,caracteres_problematicos: {'·'},Grup: Línies per a la fabricació de teula metàl·lica,,,,,
93991503,eliminacion_catalan,caracteres_problematicos: {'>'},posició actual:Amor verd suau > Android > Eines del sistema > SMS Android i MMS Mood Messenger v1.85...,,,,,
94010128,eliminacion_catalan,caracteres_problematicos: {'–'},"CENELEC EN 61326-1 – Aparells per al mesurament de, ús de laboratori i control – requisits generals",,,,,
94059730,eliminacion_catalan,"caracteres_problematicos: {']', '+', '['}",Tria un Color i explota 4 Gemmes d'aquest mateix Color. Causa [Màgia + 1] de dany a tots els Enemics...,,,,,
94075505,eliminacion_catalan,"caracteres_problematicos: {']', '['}","Aquesta [la llista negra, Temporada 1] de l'Escriptura. També es diu que serà l'inici de l'escena.",,,,,
94085317,eliminacion_catalan,caracteres_problematicos: {'%'},90%54:17fa 4 mesos,,,,,
94116953,eliminacion_catalan,caracteres_problematicos: {'/'},08/21/2019 4.9000 VENDA 320.57,,,,,
120547,eliminacion_chino,caracteres_no_chinos: {'.'},首页 〉外文书 〉人文 〉心理励志 〉Marry Him： The Case for Settling for Mr. Good Enough,,,,,
554465,eliminacion_chino,caracteres_no_chinos: {'.'},阶段3研究高估了 “真实世界的有效性”.。,,,,,
784519,eliminacion_chino,caracteres_no_chinos: {'/'},我们被告知俄罗斯互联网拖钓是自9/11以来最严重的外国攻击。,,,,,
802855,eliminacion_chino,caracteres_no_chinos: {'-'},好吧，安娜灰色运行SIP-I的意思是，灰色的出版。,,,,,
980653,eliminacion_chino,caracteres_no_chinos: {'-'},同样也请注意，对于一个双侧测试（two-sided test），alpha 值必须除以 2。,,,,,
1033599,eliminacion_chino,caracteres_no_chinos: {'.'},1. 动机和偏好问卷：学生将回答一些关于他们做什么和不喜欢的问题。,,,,,
1092714,eliminacion_chino,caracteres_no_chinos: {'-'},他们需要知道带隙是什么”，以便将2-D材料与器件中的其他材料和元件正确连接，Yao说。,,,,,
1275281,eliminacion_chino,caracteres_no_chinos: {'.'},但咱们依然抉择据守投资准则和纪律，放弃4.5亿美元的主基金规模不变。,,,,,
1307322,eliminacion_chino,caracteres_no_chinos: {'-'},在花卉黑猩猩，我们试图解开所有隐藏的鲜花真相，发现并最终为您带来一种完全不同的语言 - 绽放和鲜花。,,,,,
1458102,eliminacion_chino,caracteres_no_chinos: {'-'},海外大不列颠 - 百慕大 - 取消了不到一年前通过的关于同性恋婚姻的法律。,,,,,
1564358,eliminacion_chino,"caracteres_no_chinos: {','}","新的平台将是一个“高效率、虚拟化的”环境，带有""完全自动化的服务管理系统""，提供""高度可扩展""的存储服务——就像EC2,你就使用你所需要的存储。",,,,,
1626754,eliminacion_chino,caracteres_no_chinos: {'%'},这样的方案将降低51%攻击的可能性并提高网络的安全性，因为这样的验证器可能会在滥用的情况下失去投资。,,,,,
2407039,eliminacion_chino,"caracteres_no_chinos: {','}","于1913年制定了所得税,100年来，美国国税局完全按照预期运作，作为一个完全不受惩罚的控制代理人，甚至直到个人和团体的政治目标。",,,,,
2500209,eliminacion_chino,caracteres_no_chinos: {'.'},正当我在2012年2月完成本书第2版时，Xcode 4.3发布了（仅支持Lion）。,,,,,
2500874,eliminacion_chino,caracteres_no_chinos: {'.'},从2017年10月9日，到2018年5月13日，她说，林肯工作室的平均工作时间是38.4小时。,,,,,
2892256,eliminacion_chino,"caracteres_no_chinos: {','}","这些卡中超过一半的卡在结算前已经关闭，而另外25,500张卡仍未结清。",,,,,
